,number,value,datetime_start,datetime_complete,duration,params_max_depth,params_n_estimators,state,model,best_value,params_bagging_fraction,params_bagging_freq,params_feature_fraction,params_lambda_l1,params_lambda_l2,params_learning_rate,params_min_child_samples,params_num_leaves,params_alpha,params_booster,params_eta,params_gamma,params_grow_policy,params_lambda,params_normalize_type,params_rate_drop,params_sample_type,params_skip_drop,config_id,preprocessor,imputer,target_scaler
18,18,0.6047927269445216,2024-03-07 22:14:08.636057,2024-03-07 22:14:49.373984,0 days 00:00:40.737927,54,1300.0,COMPLETE,RandomForest,0.6209955491997573,,,,,,,,,,,,,,,,,,,5,BaselinePreprocessor,RevenueQuantileBucketImputer:3-buckets,DummyTargetScaler
19,19,0.596428582910627,2024-03-07 22:14:49.374914,2024-03-07 22:15:16.298972,0 days 00:00:26.924058,33,800.0,COMPLETE,RandomForest,0.6209955491997573,,,,,,,,,,,,,,,,,,,5,BaselinePreprocessor,RevenueQuantileBucketImputer:3-buckets,DummyTargetScaler
20,20,0.6035719766192499,2024-03-07 22:15:16.299751,2024-03-07 22:15:38.382402,0 days 00:00:22.082651,45,700.0,COMPLETE,RandomForest,0.6209955491997573,,,,,,,,,,,,,,,,,,,5,BaselinePreprocessor,RevenueQuantileBucketImputer:3-buckets,DummyTargetScaler
21,21,0.6104724747793319,2024-03-07 22:15:38.383221,2024-03-07 22:16:13.425399,0 days 00:00:35.042178,51,1100.0,COMPLETE,RandomForest,0.6209955491997573,,,,,,,,,,,,,,,,,,,5,BaselinePreprocessor,RevenueQuantileBucketImputer:3-buckets,DummyTargetScaler
22,22,0.5853774919504648,2024-03-07 22:16:13.426123,2024-03-07 22:16:16.196693,0 days 00:00:02.770570,15,100.0,COMPLETE,RandomForest,0.6209955491997573,,,,,,,,,,,,,,,,,,,5,BaselinePreprocessor,RevenueQuantileBucketImputer:3-buckets,DummyTargetScaler
23,23,0.6204439736632386,2024-03-07 22:16:16.197475,2024-03-07 22:16:43.753505,0 days 00:00:27.556030,24,900.0,COMPLETE,RandomForest,0.6209955491997573,,,,,,,,,,,,,,,,,,,5,BaselinePreprocessor,RevenueQuantileBucketImputer:3-buckets,DummyTargetScaler
24,24,0.6203939844763902,2024-03-07 22:16:43.754389,2024-03-07 22:17:14.523539,0 days 00:00:30.769150,24,1000.0,COMPLETE,RandomForest,0.6209955491997573,,,,,,,,,,,,,,,,,,,5,BaselinePreprocessor,RevenueQuantileBucketImputer:3-buckets,DummyTargetScaler
25,25,0.6044779358825769,2024-03-07 22:17:14.524182,2024-03-07 22:17:40.993793,0 days 00:00:26.469611,99,900.0,COMPLETE,RandomForest,0.6209955491997573,,,,,,,,,,,,,,,,,,,5,BaselinePreprocessor,RevenueQuantileBucketImputer:3-buckets,DummyTargetScaler
26,26,0.6103707938702218,2024-03-07 22:17:40.994808,2024-03-07 22:18:05.219562,0 days 00:00:24.224754,39,800.0,COMPLETE,RandomForest,0.6209955491997573,,,,,,,,,,,,,,,,,,,5,BaselinePreprocessor,RevenueQuantileBucketImputer:3-buckets,DummyTargetScaler
27,27,0.5851482293312726,2024-03-07 22:18:05.220291,2024-03-07 22:18:14.762118,0 days 00:00:09.541827,60,300.0,COMPLETE,RandomForest,0.6209955491997573,,,,,,,,,,,,,,,,,,,5,BaselinePreprocessor,RevenueQuantileBucketImputer:3-buckets,DummyTargetScaler
28,28,0.5989343544490087,2024-03-07 22:18:14.762957,2024-03-07 22:18:59.153318,0 days 00:00:44.390361,75,1400.0,COMPLETE,RandomForest,0.6209955491997573,,,,,,,,,,,,,,,,,,,5,BaselinePreprocessor,RevenueQuantileBucketImputer:3-buckets,DummyTargetScaler
29,29,0.6004318618029499,2024-03-07 22:18:59.154883,2024-03-07 22:19:16.904171,0 days 00:00:17.749288,90,600.0,COMPLETE,RandomForest,0.6209955491997573,,,,,,,,,,,,,,,,,,,5,BaselinePreprocessor,RevenueQuantileBucketImputer:3-buckets,DummyTargetScaler
30,30,0.594066804785463,2024-03-07 22:19:16.904996,2024-03-07 22:19:19.650712,0 days 00:00:02.745716,57,100.0,COMPLETE,RandomForest,0.6209955491997573,,,,,,,,,,,,,,,,,,,5,BaselinePreprocessor,RevenueQuantileBucketImputer:3-buckets,DummyTargetScaler
31,31,0.5896531020109053,2024-03-07 22:19:19.651522,2024-03-07 22:19:30.310318,0 days 00:00:10.658796,48,400.0,COMPLETE,RandomForest,0.6209955491997573,,,,,,,,,,,,,,,,,,,5,BaselinePreprocessor,RevenueQuantileBucketImputer:3-buckets,DummyTargetScaler
32,32,0.4777397497384205,2024-03-07 22:19:30.311209,2024-03-07 22:19:45.390983,0 days 00:00:15.079774,6,1100.0,COMPLETE,RandomForest,0.6209955491997573,,,,,,,,,,,,,,,,,,,5,BaselinePreprocessor,RevenueQuantileBucketImputer:3-buckets,DummyTargetScaler
33,33,0.4836070763356641,2024-03-07 22:19:45.391801,2024-03-07 22:19:56.889037,0 days 00:00:11.497236,6,800.0,COMPLETE,RandomForest,0.6209955491997573,,,,,,,,,,,,,,,,,,,5,BaselinePreprocessor,RevenueQuantileBucketImputer:3-buckets,DummyTargetScaler
34,34,0.6131320909204079,2024-03-07 22:19:56.889801,2024-03-07 22:20:31.251029,0 days 00:00:34.361228,24,1000.0,COMPLETE,RandomForest,0.6209955491997573,,,,,,,,,,,,,,,,,,,5,BaselinePreprocessor,RevenueQuantileBucketImputer:3-buckets,DummyTargetScaler
35,35,0.5980473563005119,2024-03-07 22:20:31.252936,2024-03-07 22:20:45.927652,0 days 00:00:14.674716,63,500.0,COMPLETE,RandomForest,0.6209955491997573,,,,,,,,,,,,,,,,,,,5,BaselinePreprocessor,RevenueQuantileBucketImputer:3-buckets,DummyTargetScaler
36,36,0.5931162200798906,2024-03-07 22:20:45.928298,2024-03-07 22:20:54.038790,0 days 00:00:08.110492,18,300.0,COMPLETE,RandomForest,0.6209955491997573,,,,,,,,,,,,,,,,,,,5,BaselinePreprocessor,RevenueQuantileBucketImputer:3-buckets,DummyTargetScaler
37,37,0.49421292035939296,2024-03-07 22:20:54.039686,2024-03-07 22:21:05.150182,0 days 00:00:11.110496,6,700.0,COMPLETE,RandomForest,0.6209955491997573,,,,,,,,,,,,,,,,,,,5,BaselinePreprocessor,RevenueQuantileBucketImputer:3-buckets,DummyTargetScaler
38,38,0.6108201904794935,2024-03-07 22:21:05.150891,2024-03-07 22:21:11.125527,0 days 00:00:05.974636,81,200.0,COMPLETE,RandomForest,0.6209955491997573,,,,,,,,,,,,,,,,,,,5,BaselinePreprocessor,RevenueQuantileBucketImputer:3-buckets,DummyTargetScaler
39,39,0.5881629770499712,2024-03-07 22:21:11.126412,2024-03-07 22:21:36.209914,0 days 00:00:25.083502,12,1000.0,COMPLETE,RandomForest,0.6209955491997573,,,,,,,,,,,,,,,,,,,5,BaselinePreprocessor,RevenueQuantileBucketImputer:3-buckets,DummyTargetScaler
0,0,0.649193634893824,2024-03-07 22:22:10.117485,2024-03-07 22:22:50.396583,0 days 00:00:40.279098,30,810.0,COMPLETE,LGBM,0.6524718871014079,0.5395214550536473,4.0,0.8030280380347221,0.17573031578702358,0.1962813702752446,0.0130652329196092,46.0,122.0,,,,,,,,,,,5,BaselinePreprocessor,RevenueQuantileBucketImputer:3-buckets,DummyTargetScaler
1,1,0.6318232990680711,2024-03-07 22:22:50.398214,2024-03-07 22:23:01.577200,0 days 00:00:11.178986,90,510.0,COMPLETE,LGBM,0.6524718871014079,0.9029589397891522,1.0,0.48910839015492796,0.28797509762271767,0.0041821135826359745,0.09408679205919061,37.0,104.0,,,,,,,,,,,5,BaselinePreprocessor,RevenueQuantileBucketImputer:3-buckets,DummyTargetScaler
2,2,0.6343168562522239,2024-03-07 22:23:01.579122,2024-03-07 22:23:24.418558,0 days 00:00:22.839436,48,310.0,COMPLETE,LGBM,0.6524718871014079,0.7409856838146578,7.0,0.8483832849088511,1.2491901777072251e-08,5.244667069948881e-07,0.14137863116055951,31.0,69.0,,,,,,,,,,,5,BaselinePreprocessor,RevenueQuantileBucketImputer:3-buckets,DummyTargetScaler
3,3,0.6517855176641804,2024-03-07 22:23:24.420027,2024-03-07 22:24:35.621187,0 days 00:01:11.201160,90,1410.0,COMPLETE,LGBM,0.6524718871014079,0.49218964578927926,2.0,0.7396186093360397,1.3458847911344668e-06,0.002109986561433402,0.03716379859237308,33.0,94.0,,,,,,,,,,,5,BaselinePreprocessor,RevenueQuantileBucketImputer:3-buckets,DummyTargetScaler
4,4,0.6311394901890365,2024-03-07 22:24:35.624825,2024-03-07 22:24:52.398296,0 days 00:00:16.773471,15,1410.0,COMPLETE,LGBM,0.6524718871014079,0.725029688392399,5.0,0.7117328302085981,8.971949405742975e-05,7.485983375287356e-07,0.2797128036437454,53.0,121.0,,,,,,,,,,,5,BaselinePreprocessor,RevenueQuantileBucketImputer:3-buckets,DummyTargetScaler
5,5,0.6519578791030114,2024-03-07 22:24:52.399961,2024-03-07 22:25:32.553958,0 days 00:00:40.153997,69,810.0,COMPLETE,LGBM,0.6524718871014079,0.6587421393326445,2.0,0.4406606144231647,1.4321463512771775e-07,1.4523108145881842e-05,0.0245855963856183,46.0,169.0,,,,,,,,,,,5,BaselinePreprocessor,RevenueQuantileBucketImputer:3-buckets,DummyTargetScaler
6,6,0.5992528047317901,2024-03-07 22:25:32.555205,2024-03-07 22:25:41.903857,0 days 00:00:09.348652,90,110.0,COMPLETE,LGBM,0.6524718871014079,0.7207663248996855,6.0,0.8408060772296169,3.2308889597600584e-05,1.9095180900899565e-08,0.02603104742945654,47.0,207.0,,,,,,,,,,,5,BaselinePreprocessor,RevenueQuantileBucketImputer:3-buckets,DummyTargetScaler
7,7,0.6332891917260091,2024-03-07 22:25:41.905427,2024-03-07 22:26:10.553934,0 days 00:00:28.648507,99,1210.0,COMPLETE,LGBM,0.6524718871014079,0.6885699888270755,7.0,0.8297725196565344,1.8919722031848945,0.3450858034292793,0.01964322684016742,55.0,7.0,,,,,,,,,,,5,BaselinePreprocessor,RevenueQuantileBucketImputer:3-buckets,DummyTargetScaler
8,8,0.6430298444325159,2024-03-07 22:26:10.555803,2024-03-07 22:26:54.355730,0 days 00:00:43.799927,72,1410.0,COMPLETE,LGBM,0.6524718871014079,0.666517272846888,7.0,0.7775346210584702,2.71019083893041e-07,0.04283779784586566,0.203413356817899,21.0,133.0,,,,,,,,,,,5,BaselinePreprocessor,RevenueQuantileBucketImputer:3-buckets,DummyTargetScaler
9,9,0.6295964175783848,2024-03-07 22:26:54.359314,2024-03-07 22:27:03.111849,0 days 00:00:08.752535,84,310.0,COMPLETE,LGBM,0.6524718871014079,0.580922531803494,6.0,0.7721427240087306,2.2798847383418863,1.7133216876763892e-06,0.07954672466466679,36.0,170.0,,,,,,,,,,,5,BaselinePreprocessor,RevenueQuantileBucketImputer:3-buckets,DummyTargetScaler
10,10,0.6429520234948747,2024-03-07 22:27:03.113143,2024-03-07 22:27:38.797829,0 days 00:00:35.684686,6,1210.0,COMPLETE,LGBM,0.6524718871014079,0.40328417248784976,5.0,0.8397737036330246,0.00037611341726862305,0.1477917376406889,0.10325827762490537,37.0,246.0,,,,,,,,,,,5,BaselinePreprocessor,RevenueQuantileBucketImputer:3-buckets,DummyTargetScaler
11,11,0.6262007715086575,2024-03-07 22:27:38.799130,2024-03-07 22:28:11.015826,0 days 00:00:32.216696,27,610.0,COMPLETE,LGBM,0.6524718871014079,0.9426883925115328,1.0,0.7576150212262076,0.000955560861228545,5.298315114716023,0.017696843389099954,55.0,101.0,,,,,,,,,,,5,BaselinePreprocessor,RevenueQuantileBucketImputer:3-buckets,DummyTargetScaler
12,12,0.6241215921376497,2024-03-07 22:28:11.017006,2024-03-07 22:28:19.094453,0 days 00:00:08.077447,66,610.0,COMPLETE,LGBM,0.6524718871014079,0.9743432749507998,4.0,0.5505064279288827,0.5429368522501613,4.309806957977234e-06,0.25346087780187715,85.0,159.0,,,,,,,,,,,5,BaselinePreprocessor,RevenueQuantileBucketImputer:3-buckets,DummyTargetScaler
13,13,0.6341255012072515,2024-03-07 22:28:19.096018,2024-03-07 22:28:56.334596,0 days 00:00:37.238578,99,610.0,COMPLETE,LGBM,0.6524718871014079,0.8424162247505669,3.0,0.5076526030323341,1.820207819987878e-05,6.997926084486644e-06,0.049414589972991675,40.0,134.0,,,,,,,,,,,5,BaselinePreprocessor,RevenueQuantileBucketImputer:3-buckets,DummyTargetScaler
14,14,0.5863548550296721,2024-03-07 22:28:56.337561,2024-03-07 22:28:57.196478,0 days 00:00:00.858917,60,10.0,COMPLETE,LGBM,0.6524718871014079,0.9531427026769682,5.0,0.7027719220382347,0.0012366738709937344,2.2440184935382636e-08,0.05149559197043955,46.0,256.0,,,,,,,,,,,5,BaselinePreprocessor,RevenueQuantileBucketImputer:3-buckets,DummyTargetScaler
15,15,0.5629131578148898,2024-03-07 22:28:57.197580,2024-03-07 22:28:57.594131,0 days 00:00:00.396551,6,10.0,COMPLETE,LGBM,0.6524718871014079,0.47623958342104117,4.0,0.6933545749289713,1.0380399468162698,4.108277497871447,0.1878874815342885,63.0,36.0,,,,,,,,,,,5,BaselinePreprocessor,RevenueQuantileBucketImputer:3-buckets,DummyTargetScaler
16,16,0.6379233794134399,2024-03-07 22:28:57.595286,2024-03-07 22:29:42.451135,0 days 00:00:44.855849,63,910.0,COMPLETE,LGBM,0.6524718871014079,0.6093038042562487,7.0,0.5244635115751769,0.0027343433289165188,2.9099837624328127e-08,0.01576889013919661,43.0,43.0,,,,,,,,,,,5,BaselinePreprocessor,RevenueQuantileBucketImputer:3-buckets,DummyTargetScaler
17,17,0.6438108634610221,2024-03-07 22:29:42.452497,2024-03-07 22:30:22.643156,0 days 00:00:40.190659,48,1010.0,COMPLETE,LGBM,0.6524718871014079,0.6119498115003253,5.0,0.48835897618698804,0.22156544210397813,0.00028121400408072036,0.01812771064342972,26.0,225.0,,,,,,,,,,,5,BaselinePreprocessor,RevenueQuantileBucketImputer:3-buckets,DummyTargetScaler
18,18,0.5990617195738285,2024-03-07 22:30:22.644531,2024-03-07 22:30:39.462908,0 days 00:00:16.818377,69,210.0,COMPLETE,LGBM,0.6524718871014079,0.8630193959094649,1.0,0.9090887105772726,0.09995847034327103,0.502315361759085,0.016557510241901816,91.0,64.0,,,,,,,,,,,5,BaselinePreprocessor,RevenueQuantileBucketImputer:3-buckets,DummyTargetScaler
19,19,0.6382484304567574,2024-03-07 22:30:39.467555,2024-03-07 22:32:02.965108,0 days 00:01:23.497553,96,1110.0,COMPLETE,LGBM,0.6524718871014079,0.5365492450922552,1.0,0.8517072775303984,3.897899222489331e-08,4.202583472009981e-08,0.03711903760171351,6.0,64.0,,,,,,,,,,,5,BaselinePreprocessor,RevenueQuantileBucketImputer:3-buckets,DummyTargetScaler
20,20,0.6035295115014181,2024-03-07 22:32:02.966486,2024-03-07 22:32:06.064082,0 days 00:00:03.097596,18,110.0,COMPLETE,LGBM,0.6524718871014079,0.7612356136955902,4.0,0.6578186825976486,0.010776278587611368,5.32221199855463e-07,0.07713062251902227,89.0,9.0,,,,,,,,,,,5,BaselinePreprocessor,RevenueQuantileBucketImputer:3-buckets,DummyTargetScaler
21,21,0.586302334365246,2024-03-07 22:32:06.065300,2024-03-07 22:32:11.702293,0 days 00:00:05.636993,12,110.0,COMPLETE,LGBM,0.6524718871014079,0.6423201423848808,5.0,0.9106615008040765,3.64994132432225e-05,6.629826416207716e-05,0.018890130022595885,89.0,193.0,,,,,,,,,,,5,BaselinePreprocessor,RevenueQuantileBucketImputer:3-buckets,DummyTargetScaler
22,22,0.6303854769649065,2024-03-07 22:32:11.703925,2024-03-07 22:32:27.328795,0 days 00:00:15.624870,51,1010.0,COMPLETE,LGBM,0.6524718871014079,0.4736495871154494,7.0,0.5748257900577901,1.935271541620972,5.975850783243653e-08,0.025093261477289686,78.0,52.0,,,,,,,,,,,5,BaselinePreprocessor,RevenueQuantileBucketImputer:3-buckets,DummyTargetScaler
23,23,0.6305724581704576,2024-03-07 22:32:27.329947,2024-03-07 22:32:55.140395,0 days 00:00:27.810448,24,1410.0,COMPLETE,LGBM,0.6524718871014079,0.5420229486962143,6.0,0.9142535711965938,4.3391000000243505,0.7974526320733412,0.029633802874395248,23.0,67.0,,,,,,,,,,,5,BaselinePreprocessor,RevenueQuantileBucketImputer:3-buckets,DummyTargetScaler
24,24,0.6442251285430711,2024-03-07 22:32:55.141595,2024-03-07 22:33:06.248692,0 days 00:00:11.107097,66,110.0,COMPLETE,LGBM,0.6524718871014079,0.6841366440844467,7.0,0.5096845281258306,0.0008179656528689475,0.0002416755263596453,0.06224737844723845,21.0,246.0,,,,,,,,,,,5,BaselinePreprocessor,RevenueQuantileBucketImputer:3-buckets,DummyTargetScaler
25,25,0.6385787294563434,2024-03-07 22:33:06.249960,2024-03-07 22:33:31.095028,0 days 00:00:24.845068,6,810.0,COMPLETE,LGBM,0.6524718871014079,0.6121777024123449,4.0,0.7543451227784701,3.866824110712982e-08,3.1194698082758635e-06,0.014068296010959306,97.0,113.0,,,,,,,,,,,5,BaselinePreprocessor,RevenueQuantileBucketImputer:3-buckets,DummyTargetScaler
26,26,0.6378193582655863,2024-03-07 22:33:31.096245,2024-03-07 22:34:03.439168,0 days 00:00:32.342923,39,510.0,COMPLETE,LGBM,0.6524718871014079,0.8688496667438177,6.0,0.8363459909416466,0.07210974802601251,0.00350390594760317,0.03585828135545088,30.0,18.0,,,,,,,,,,,5,BaselinePreprocessor,RevenueQuantileBucketImputer:3-buckets,DummyTargetScaler
27,27,0.6439682263728671,2024-03-07 22:34:03.440439,2024-03-07 22:34:27.965751,0 days 00:00:24.525312,60,710.0,COMPLETE,LGBM,0.6524718871014079,0.830856129598952,7.0,0.9786997623844367,0.00010744680859278852,9.456602708083366e-07,0.19482945998356638,32.0,30.0,,,,,,,,,,,5,BaselinePreprocessor,RevenueQuantileBucketImputer:3-buckets,DummyTargetScaler
28,28,0.6403486011228492,2024-03-07 22:34:27.970064,2024-03-07 22:34:46.438978,0 days 00:00:18.468914,39,610.0,COMPLETE,LGBM,0.6524718871014079,0.5561025494305906,7.0,0.8200334706009076,8.913762394182542e-08,0.0007745271100810476,0.1367158660045354,87.0,29.0,,,,,,,,,,,5,BaselinePreprocessor,RevenueQuantileBucketImputer:3-buckets,DummyTargetScaler
29,29,0.6288162092213233,2024-03-07 22:34:46.440175,2024-03-07 22:34:52.007719,0 days 00:00:05.567544,36,310.0,COMPLETE,LGBM,0.6524718871014079,0.41971094668457165,2.0,0.4245667725931773,0.0018055637057447233,9.632009290428766e-08,0.168380608123566,76.0,116.0,,,,,,,,,,,5,BaselinePreprocessor,RevenueQuantileBucketImputer:3-buckets,DummyTargetScaler
30,30,0.6454212728030304,2024-03-07 22:34:52.008586,2024-03-07 22:35:25.804892,0 days 00:00:33.796306,6,1410.0,COMPLETE,LGBM,0.6524718871014079,0.5546850882394603,2.0,0.7691998468199657,2.6796334786589228e-05,0.9326284748227438,0.08305463783171335,69.0,125.0,,,,,,,,,,,5,BaselinePreprocessor,RevenueQuantileBucketImputer:3-buckets,DummyTargetScaler
31,31,0.639284324797482,2024-03-07 22:35:25.806101,2024-03-07 22:35:47.955389,0 days 00:00:22.149288,54,910.0,COMPLETE,LGBM,0.6524718871014079,0.5958047028469969,1.0,0.685643109317245,0.1862705558706512,5.172906531851516e-05,0.05096149253042172,39.0,253.0,,,,,,,,,,,5,BaselinePreprocessor,RevenueQuantileBucketImputer:3-buckets,DummyTargetScaler
32,32,0.624210081136583,2024-03-07 22:35:47.956738,2024-03-07 22:36:25.027197,0 days 00:00:37.070459,45,610.0,COMPLETE,LGBM,0.6524718871014079,0.88707434267181,5.0,0.884492245072894,3.627253705988696e-08,2.272355572182389,0.012201340440556761,59.0,35.0,,,,,,,,,,,5,BaselinePreprocessor,RevenueQuantileBucketImputer:3-buckets,DummyTargetScaler
33,33,0.643326032695309,2024-03-07 22:36:25.029399,2024-03-07 22:37:26.612585,0 days 00:01:01.583186,51,910.0,COMPLETE,LGBM,0.6524718871014079,0.49678537498426945,6.0,0.7036733814008727,0.002549059858021772,4.135877192623126,0.015826696570086816,13.0,29.0,,,,,,,,,,,5,BaselinePreprocessor,RevenueQuantileBucketImputer:3-buckets,DummyTargetScaler
34,34,0.6524718871014079,2024-03-07 22:37:26.616051,2024-03-07 22:38:56.220028,0 days 00:01:29.603977,21,1210.0,COMPLETE,LGBM,0.6524718871014079,0.4607677474143096,3.0,0.8733832825966927,8.203084894141683e-06,0.0005342293842074067,0.02711882546731206,34.0,246.0,,,,,,,,,,,5,BaselinePreprocessor,RevenueQuantileBucketImputer:3-buckets,DummyTargetScaler
35,35,0.6430784875771154,2024-03-07 22:38:56.221902,2024-03-07 22:39:11.450326,0 days 00:00:15.228424,78,310.0,COMPLETE,LGBM,0.6524718871014079,0.6275713425410188,7.0,0.5917090386151921,0.0003167421340436169,2.512885714976817e-08,0.023585103751745176,56.0,75.0,,,,,,,,,,,5,BaselinePreprocessor,RevenueQuantileBucketImputer:3-buckets,DummyTargetScaler
36,36,0.6474509664970423,2024-03-07 22:39:11.452013,2024-03-07 22:39:29.115239,0 days 00:00:17.663226,90,1010.0,COMPLETE,LGBM,0.6524718871014079,0.8341878146039863,4.0,0.4942693715044171,0.003948097563671732,0.000527780350863128,0.10920981223045878,90.0,60.0,,,,,,,,,,,5,BaselinePreprocessor,RevenueQuantileBucketImputer:3-buckets,DummyTargetScaler
37,37,0.6325421688651982,2024-03-07 22:39:29.117227,2024-03-07 22:40:00.699206,0 days 00:00:31.581979,18,1410.0,COMPLETE,LGBM,0.6524718871014079,0.4358436026186961,2.0,0.7914720048151684,0.00018515929420996675,0.7354900778194938,0.11551022448588939,54.0,157.0,,,,,,,,,,,5,BaselinePreprocessor,RevenueQuantileBucketImputer:3-buckets,DummyTargetScaler
38,38,0.6355644521847252,2024-03-07 22:40:00.700878,2024-03-07 22:40:24.374320,0 days 00:00:23.673442,75,1410.0,COMPLETE,LGBM,0.6524718871014079,0.523650451091783,4.0,0.6469815882800363,3.028175618034442e-08,1.1834317214459111e-08,0.17456689671789574,56.0,145.0,,,,,,,,,,,5,BaselinePreprocessor,RevenueQuantileBucketImputer:3-buckets,DummyTargetScaler
39,39,0.6225341666551351,2024-03-07 22:40:24.375342,2024-03-07 22:40:41.102877,0 days 00:00:16.727535,21,410.0,COMPLETE,LGBM,0.6524718871014079,0.6854846014666474,1.0,0.7023246727614605,0.005093865786424695,0.3304575015157377,0.20522869498701793,100.0,221.0,,,,,,,,,,,5,BaselinePreprocessor,RevenueQuantileBucketImputer:3-buckets,DummyTargetScaler
0,0,0.5580396179673279,2024-03-07 22:42:03.035083,2024-03-07 22:42:33.870125,0 days 00:00:30.835042,3,,COMPLETE,XGB,0.6184139641399494,,,,,,,,,0.00018884861771232,dart,0.007151782425751394,6.643570349253695e-05,depthwise,1.2174483017582715e-08,forest,0.0031959412589510146,uniform,0.5178768449564825,5,BaselinePreprocessor,RevenueQuantileBucketImputer:3-buckets,DummyTargetScaler
1,1,0.5405067387913475,2024-03-07 22:42:33.871301,2024-03-07 22:43:15.822121,0 days 00:00:41.950820,4,,COMPLETE,XGB,0.6184139641399494,,,,,,,,,4.0404344418512533e-08,dart,4.475157281108722e-06,1.3476847065832808e-07,lossguide,2.6876618875996566e-06,forest,2.0958714228367703e-06,weighted,0.0006320770100967994,5,BaselinePreprocessor,RevenueQuantileBucketImputer:3-buckets,DummyTargetScaler
2,2,0.6184139641399494,2024-03-07 22:43:15.827821,2024-03-07 22:43:56.738771,0 days 00:00:40.910950,6,,COMPLETE,XGB,0.6184139641399494,,,,,,,,,1.7469748633976495e-05,dart,0.18418736095933436,0.00015851166831339168,depthwise,3.7049811795246385e-08,forest,1.581576734692189e-06,weighted,2.2468025461678493e-07,5,BaselinePreprocessor,RevenueQuantileBucketImputer:3-buckets,DummyTargetScaler
3,3,0.5394823840601687,2024-03-07 22:43:56.740112,2024-03-07 22:44:30.814137,0 days 00:00:34.074025,4,,COMPLETE,XGB,0.6184139641399494,,,,,,,,,2.3111347539717238e-06,dart,3.914266520182414e-05,2.4445594438524034e-08,lossguide,9.225953651917673e-07,tree,3.3633599045249305e-06,weighted,0.005678658054695018,5,BaselinePreprocessor,RevenueQuantileBucketImputer:3-buckets,DummyTargetScaler
4,4,0.5321387817475381,2024-03-07 22:44:30.815585,2024-03-07 22:45:00.019085,0 days 00:00:29.203500,2,,COMPLETE,XGB,0.6184139641399494,,,,,,,,,1.0883820859101083e-06,dart,1.625697216243915e-06,9.376870245513674e-05,lossguide,5.574175587923751e-05,forest,0.0024975942787710845,weighted,0.0003316857179911962,5,BaselinePreprocessor,RevenueQuantileBucketImputer:3-buckets,DummyTargetScaler
