,number,value,datetime_start,datetime_complete,duration,params_max_depth,params_n_estimators,state,model,best_value,params_bagging_fraction,params_bagging_freq,params_feature_fraction,params_lambda_l1,params_lambda_l2,params_learning_rate,params_min_child_samples,params_num_leaves,params_alpha,params_booster,params_eta,params_gamma,params_grow_policy,params_lambda,params_normalize_type,params_rate_drop,params_sample_type,params_skip_drop,config_id,preprocessor,imputer,target_scaler
12,12,0.6523781178202062,2024-03-07 19:17:13.310312,2024-03-07 19:18:29.261998,0 days 00:01:15.951686,39,1210.0,COMPLETE,LGBM,0.6580418421281218,0.8076358584850728,7.0,0.8553544197328375,2.960418171681097e-06,0.00020947241712868843,0.04628475413689063,15.0,100.0,,,,,,,,,,,2,BaselinePreprocessor,DummyImputer,DummyTargetScaler
13,13,0.6291380023673983,2024-03-07 19:18:29.263246,2024-03-07 19:18:39.022894,0 days 00:00:09.759648,15,210.0,COMPLETE,LGBM,0.6580418421281218,0.6239381876926651,4.0,0.45898847486847233,2.8096086560878718e-08,0.5004381357988907,0.16238812989891072,19.0,22.0,,,,,,,,,,,2,BaselinePreprocessor,DummyImputer,DummyTargetScaler
14,14,0.639290772335092,2024-03-07 19:18:39.023822,2024-03-07 19:19:20.764099,0 days 00:00:41.740277,99,810.0,COMPLETE,LGBM,0.6580418421281218,0.8072931793527731,2.0,0.424420788443091,0.00013541560056503868,1.5173843868022859e-06,0.019038898788560226,61.0,176.0,,,,,,,,,,,2,BaselinePreprocessor,DummyImputer,DummyTargetScaler
15,15,0.6462663899097958,2024-03-07 19:19:20.765845,2024-03-07 19:20:19.885262,0 days 00:00:59.119417,21,1110.0,COMPLETE,LGBM,0.6580418421281218,0.736827141219607,4.0,0.5905946153364778,0.00012205655860523577,2.5127395097874365e-05,0.04190349104639015,35.0,163.0,,,,,,,,,,,2,BaselinePreprocessor,DummyImputer,DummyTargetScaler
16,16,0.6317578991602897,2024-03-07 19:20:19.889106,2024-03-07 19:20:43.103644,0 days 00:00:23.214538,9,710.0,COMPLETE,LGBM,0.6580418421281218,0.42355536479577893,1.0,0.8112212030448009,0.024716970083730482,0.12185844029670104,0.03727239307681039,64.0,135.0,,,,,,,,,,,2,BaselinePreprocessor,DummyImputer,DummyTargetScaler
17,17,0.6325763196661591,2024-03-07 19:20:43.105000,2024-03-07 19:20:57.450118,0 days 00:00:14.345118,72,410.0,COMPLETE,LGBM,0.6580418421281218,0.5935352945117595,7.0,0.727464064245998,4.999030731107564e-06,1.6815853934868103e-05,0.06170090849285141,91.0,189.0,,,,,,,,,,,2,BaselinePreprocessor,DummyImputer,DummyTargetScaler
18,18,0.6360737792517728,2024-03-07 19:20:57.451300,2024-03-07 19:21:39.844566,0 days 00:00:42.393266,72,610.0,COMPLETE,LGBM,0.6580418421281218,0.4604287878331058,5.0,0.5663828168496589,1.2399435266664905e-06,1.2017254960621878e-08,0.035514277919166885,26.0,256.0,,,,,,,,,,,2,BaselinePreprocessor,DummyImputer,DummyTargetScaler
19,19,0.6114987318834402,2024-03-07 19:21:39.846028,2024-03-07 19:21:46.283363,0 days 00:00:06.437335,48,110.0,COMPLETE,LGBM,0.6580418421281218,0.6658551361468243,3.0,0.8713453111342914,0.26075697051833213,1.1274140401575439e-08,0.04067615689353899,32.0,14.0,,,,,,,,,,,2,BaselinePreprocessor,DummyImputer,DummyTargetScaler
20,20,0.624680484648683,2024-03-07 19:21:46.285200,2024-03-07 19:21:50.779205,0 days 00:00:04.494005,99,210.0,COMPLETE,LGBM,0.6580418421281218,0.5090179115878334,6.0,0.7029095040837208,8.713289563013974e-06,9.024551212852314,0.23712066230419424,91.0,173.0,,,,,,,,,,,2,BaselinePreprocessor,DummyImputer,DummyTargetScaler
21,21,0.6342801686850844,2024-03-07 19:21:50.780761,2024-03-07 19:21:57.307459,0 days 00:00:06.526698,99,510.0,COMPLETE,LGBM,0.6580418421281218,0.7905647077729472,6.0,0.40837879804620214,0.3082706957931303,3.3269982863496477e-07,0.24384777370651972,73.0,250.0,,,,,,,,,,,2,BaselinePreprocessor,DummyImputer,DummyTargetScaler
22,22,0.6476788163058377,2024-03-07 19:21:57.309024,2024-03-07 19:24:02.382430,0 days 00:02:05.073406,57,810.0,COMPLETE,LGBM,0.6580418421281218,0.8007981655083273,5.0,0.792899050894748,3.7217006767471273e-06,0.1829750422752344,0.011028704172256865,10.0,60.0,,,,,,,,,,,2,BaselinePreprocessor,DummyImputer,DummyTargetScaler
23,23,0.5971672444155962,2024-03-07 19:24:02.388269,2024-03-07 19:24:05.470648,0 days 00:00:03.082379,6,110.0,COMPLETE,LGBM,0.6580418421281218,0.7358033181781036,3.0,0.4077641597833015,3.020050916464145e-08,5.965218705758389e-06,0.1838138976090764,94.0,48.0,,,,,,,,,,,2,BaselinePreprocessor,DummyImputer,DummyTargetScaler
24,24,0.6206479813991578,2024-03-07 19:24:05.472951,2024-03-07 19:24:25.302870,0 days 00:00:19.829919,33,1110.0,COMPLETE,LGBM,0.6580418421281218,0.5608047549841144,7.0,0.4277104756728009,1.0757907999566688e-06,1.1596185244006349e-08,0.12600299478151242,75.0,60.0,,,,,,,,,,,2,BaselinePreprocessor,DummyImputer,DummyTargetScaler
25,25,0.6467113957949739,2024-03-07 19:24:25.304147,2024-03-07 19:24:40.648235,0 days 00:00:15.344088,75,710.0,COMPLETE,LGBM,0.6580418421281218,0.845405863851904,7.0,0.8378171879791239,0.0058856858772229825,0.003419176230701381,0.19230283028594614,29.0,35.0,,,,,,,,,,,2,BaselinePreprocessor,DummyImputer,DummyTargetScaler
26,26,0.6340301023113474,2024-03-07 19:24:40.649471,2024-03-07 19:25:03.415348,0 days 00:00:22.765877,18,210.0,COMPLETE,LGBM,0.6580418421281218,0.8055615666007726,2.0,0.9605655744194619,2.353413801615203e-08,0.038846990722268875,0.09017166801132018,53.0,172.0,,,,,,,,,,,2,BaselinePreprocessor,DummyImputer,DummyTargetScaler
27,27,0.639511558208417,2024-03-07 19:25:03.419913,2024-03-07 19:25:16.166812,0 days 00:00:12.746899,87,210.0,COMPLETE,LGBM,0.6580418421281218,0.8482293954751066,1.0,0.49753769769242306,4.392062602649203e-08,1.6354786215474305e-07,0.03217223936043619,78.0,207.0,,,,,,,,,,,2,BaselinePreprocessor,DummyImputer,DummyTargetScaler
28,28,0.619076859690613,2024-03-07 19:25:16.168149,2024-03-07 19:25:25.760754,0 days 00:00:09.592605,45,310.0,COMPLETE,LGBM,0.6580418421281218,0.43765663920912995,1.0,0.8616789001652048,8.341612371791574e-07,0.014217542394910418,0.06395347072995186,88.0,167.0,,,,,,,,,,,2,BaselinePreprocessor,DummyImputer,DummyTargetScaler
29,29,0.6348302474244628,2024-03-07 19:25:25.761888,2024-03-07 19:25:54.530935,0 days 00:00:28.769047,42,1310.0,COMPLETE,LGBM,0.6580418421281218,0.4602211222775877,3.0,0.5034644996057204,4.4075794974524675e-07,0.8962931739931127,0.01614870089414403,80.0,213.0,,,,,,,,,,,2,BaselinePreprocessor,DummyImputer,DummyTargetScaler
30,30,0.6580418421281218,2024-03-07 19:25:54.532874,2024-03-07 19:27:28.102095,0 days 00:01:33.569221,78,1310.0,COMPLETE,LGBM,0.6580418421281218,0.8325491927225241,4.0,0.6811384819407238,0.0013245562866173797,0.13222632477107962,0.014635389350904492,32.0,105.0,,,,,,,,,,,2,BaselinePreprocessor,DummyImputer,DummyTargetScaler
31,31,0.6385216584686406,2024-03-07 19:27:28.103522,2024-03-07 19:28:22.677385,0 days 00:00:54.573863,57,1310.0,COMPLETE,LGBM,0.6580418421281218,0.9992297798264409,2.0,0.583729885419171,0.1446401232223913,0.6808202348442952,0.012883473770712906,95.0,229.0,,,,,,,,,,,2,BaselinePreprocessor,DummyImputer,DummyTargetScaler
32,32,0.6400703547420326,2024-03-07 19:28:22.679010,2024-03-07 19:28:36.017328,0 days 00:00:13.338318,15,410.0,COMPLETE,LGBM,0.6580418421281218,0.9747633158785984,5.0,0.7469359854305871,0.013126169192453626,0.00039920389620823294,0.12430354196852306,93.0,228.0,,,,,,,,,,,2,BaselinePreprocessor,DummyImputer,DummyTargetScaler
33,33,0.6436015963080767,2024-03-07 19:28:36.018934,2024-03-07 19:29:28.880119,0 days 00:00:52.861185,21,1210.0,COMPLETE,LGBM,0.6580418421281218,0.7480945754720253,5.0,0.5396704553922128,0.08096307546607812,0.39624255214744675,0.038764297021628195,8.0,146.0,,,,,,,,,,,2,BaselinePreprocessor,DummyImputer,DummyTargetScaler
34,34,0.6291871086826212,2024-03-07 19:29:28.890121,2024-03-07 19:29:50.195250,0 days 00:00:21.305129,57,510.0,COMPLETE,LGBM,0.6580418421281218,0.8118425292182945,2.0,0.7306259959535157,1.9148363556080845,0.0003865923432490408,0.026385056997789955,57.0,84.0,,,,,,,,,,,2,BaselinePreprocessor,DummyImputer,DummyTargetScaler
35,35,0.6411854639105129,2024-03-07 19:29:50.197557,2024-03-07 19:30:37.698064,0 days 00:00:47.500507,57,910.0,COMPLETE,LGBM,0.6580418421281218,0.9388871298579595,7.0,0.6303338675198943,0.00012617007322719527,0.027579179890422845,0.040772169290467036,88.0,242.0,,,,,,,,,,,2,BaselinePreprocessor,DummyImputer,DummyTargetScaler
36,36,0.6247413014586278,2024-03-07 19:30:37.699408,2024-03-07 19:30:56.741711,0 days 00:00:19.042303,90,1110.0,COMPLETE,LGBM,0.6580418421281218,0.7158165267692513,6.0,0.7420678412072399,1.186113417377969,4.090128146849371e-07,0.09500139734320673,5.0,198.0,,,,,,,,,,,2,BaselinePreprocessor,DummyImputer,DummyTargetScaler
37,37,0.6304536893376315,2024-03-07 19:30:56.743962,2024-03-07 19:31:27.420984,0 days 00:00:30.677022,72,1410.0,COMPLETE,LGBM,0.6580418421281218,0.6186782809110603,7.0,0.547009377866117,3.738317992495058e-06,1.682538224656669e-07,0.13212290615394037,53.0,39.0,,,,,,,,,,,2,BaselinePreprocessor,DummyImputer,DummyTargetScaler
38,38,0.6356530081077069,2024-03-07 19:31:27.432322,2024-03-07 19:32:04.983791,0 days 00:00:37.551469,57,610.0,COMPLETE,LGBM,0.6580418421281218,0.7579264802695793,2.0,0.860333830799767,6.911200630868456e-08,0.00011116350461245705,0.06570138924385745,77.0,177.0,,,,,,,,,,,2,BaselinePreprocessor,DummyImputer,DummyTargetScaler
39,39,0.6305376917809313,2024-03-07 19:32:04.985720,2024-03-07 19:32:37.369007,0 days 00:00:32.383287,9,610.0,COMPLETE,LGBM,0.6580418421281218,0.5254741212272998,6.0,0.912836673798089,2.125491656935721e-06,0.0018654340894100774,0.014380975155967987,54.0,143.0,,,,,,,,,,,2,BaselinePreprocessor,DummyImputer,DummyTargetScaler
0,0,0.5754597355417811,2024-03-07 19:34:21.573256,2024-03-07 19:34:59.334886,0 days 00:00:37.761630,4,,COMPLETE,XGB,0.6342950436650778,,,,,,,,,0.07795003831278424,dart,1.9541087356774854e-06,0.16508250940254646,depthwise,7.861651645881488e-06,forest,3.945460200313028e-06,weighted,0.5716414933381094,2,BaselinePreprocessor,DummyImputer,DummyTargetScaler
1,1,0.5550421748505936,2024-03-07 19:34:59.336546,2024-03-07 19:35:59.600375,0 days 00:01:00.263829,9,,COMPLETE,XGB,0.6342950436650778,,,,,,,,,4.241295754331038e-06,dart,3.746017433566245e-05,0.275574672912841,depthwise,1.5019075974581084e-07,forest,2.0814380809855975e-07,weighted,2.0397022706821135e-07,2,BaselinePreprocessor,DummyImputer,DummyTargetScaler
2,2,0.5743358253259335,2024-03-07 19:35:59.603081,2024-03-07 19:36:38.385761,0 days 00:00:38.782680,5,,COMPLETE,XGB,0.6342950436650778,,,,,,,,,0.025760360600385366,dart,3.4862155014705124e-07,1.7840116909987868e-06,lossguide,0.009471779287609458,forest,2.4039619289970443e-07,uniform,0.48532776591064236,2,BaselinePreprocessor,DummyImputer,DummyTargetScaler
3,3,0.5681544068078962,2024-03-07 19:36:38.387175,2024-03-07 19:37:23.491868,0 days 00:00:45.104693,6,,COMPLETE,XGB,0.6342950436650778,,,,,,,,,0.029132083887393082,dart,4.6821466823519084e-08,1.4183816803234912e-07,depthwise,0.007171613162153783,tree,9.798145478113998e-05,uniform,4.962779157876702e-06,2,BaselinePreprocessor,DummyImputer,DummyTargetScaler
4,4,0.6053238105200216,2024-03-07 19:37:23.506524,2024-03-07 19:38:20.696762,0 days 00:00:57.190238,8,,COMPLETE,XGB,0.6342950436650778,,,,,,,,,1.0556320526500485e-05,dart,0.025013986385307857,0.3661240213594968,depthwise,0.0003621347033002982,forest,2.3088335542111027e-07,uniform,2.3263307372322057e-06,2,BaselinePreprocessor,DummyImputer,DummyTargetScaler
5,5,0.544819632987974,2024-03-07 19:38:20.699740,2024-03-07 19:39:17.324689,0 days 00:00:56.624949,8,,COMPLETE,XGB,0.6342950436650778,,,,,,,,,0.032458936235803225,dart,0.0013733310379395963,0.0007672270235972314,depthwise,2.8145817618557554e-05,tree,0.08708110882547335,uniform,0.02014390424305754,2,BaselinePreprocessor,DummyImputer,DummyTargetScaler
6,6,0.6231993713251095,2024-03-07 19:39:17.326031,2024-03-07 19:40:01.167883,0 days 00:00:43.841852,7,,COMPLETE,XGB,0.6342950436650778,,,,,,,,,0.047374771869823216,dart,0.323991927065831,1.6062967745670972e-06,lossguide,0.004244048352421846,forest,3.1651731255130185e-05,uniform,0.4244921531874077,2,BaselinePreprocessor,DummyImputer,DummyTargetScaler
7,7,0.5651713659225952,2024-03-07 19:40:01.174222,2024-03-07 19:40:46.993194,0 days 00:00:45.818972,6,,COMPLETE,XGB,0.6342950436650778,,,,,,,,,2.0044697021572123e-07,dart,0.001448452180413638,3.5749522403295005e-06,depthwise,0.017270347185506407,tree,1.1287579935290447e-07,uniform,8.14048363527718e-06,2,BaselinePreprocessor,DummyImputer,DummyTargetScaler
8,8,0.5229374616857045,2024-03-07 19:40:46.994429,2024-03-07 19:41:16.668894,0 days 00:00:29.674465,2,,COMPLETE,XGB,0.6342950436650778,,,,,,,,,0.012563844180600765,dart,0.00016998130123954433,0.21008963063490163,depthwise,2.3847182240532687e-08,forest,3.024607167497161e-08,uniform,1.6314354147021467e-08,2,BaselinePreprocessor,DummyImputer,DummyTargetScaler
9,9,0.5653350054915035,2024-03-07 19:41:16.670042,2024-03-07 19:41:54.312854,0 days 00:00:37.642812,3,,COMPLETE,XGB,0.6342950436650778,,,,,,,,,0.011327397724987377,dart,4.6225045052725526e-05,0.0002509664711871082,lossguide,8.961661471554047e-06,tree,0.00030531696009330014,uniform,0.12441962530464344,2,BaselinePreprocessor,DummyImputer,DummyTargetScaler
10,10,0.5229374616857045,2024-03-07 19:41:54.316841,2024-03-07 19:42:22.942143,0 days 00:00:28.625302,2,,COMPLETE,XGB,0.6342950436650778,,,,,,,,,3.14343424414598e-07,dart,4.496300117387773e-05,8.079856702266682e-06,lossguide,0.09032118386635235,forest,0.00039988233635854443,uniform,0.001130609430105927,2,BaselinePreprocessor,DummyImputer,DummyTargetScaler
11,11,0.5995910563376149,2024-03-07 19:42:22.943178,2024-03-07 19:42:44.248893,0 days 00:00:21.305715,2,,COMPLETE,XGB,0.6342950436650778,,,,,,,,,1.8836799113670146e-07,dart,0.7387459405846508,0.0007324036480223588,depthwise,0.9669373720859266,tree,0.7207852277719021,uniform,0.6245624872037376,2,BaselinePreprocessor,DummyImputer,DummyTargetScaler
12,12,0.5713192831866827,2024-03-07 19:42:44.249878,2024-03-07 19:43:32.168269,0 days 00:00:47.918391,5,,COMPLETE,XGB,0.6342950436650778,,,,,,,,,3.964769059263954e-05,dart,0.00569338434180846,6.919035565607116e-05,depthwise,3.1805557075327185e-07,forest,2.5845654190869197e-07,uniform,0.014291419138449217,2,BaselinePreprocessor,DummyImputer,DummyTargetScaler
13,13,0.5668415746913077,2024-03-07 19:43:32.170899,2024-03-07 19:44:07.041011,0 days 00:00:34.870112,4,,COMPLETE,XGB,0.6342950436650778,,,,,,,,,0.4018798450680124,dart,0.00020350955792549318,8.936557529690866e-07,lossguide,5.07195174055092e-08,tree,0.003068964575603836,uniform,6.812106364484344e-05,2,BaselinePreprocessor,DummyImputer,DummyTargetScaler
14,14,0.5637304005006997,2024-03-07 19:44:07.042516,2024-03-07 19:44:45.544465,0 days 00:00:38.501949,5,,COMPLETE,XGB,0.6342950436650778,,,,,,,,,0.0013464924378739146,dart,6.171568573036435e-08,0.0001619311895502026,depthwise,3.6943147704438404e-08,forest,9.941413373816692e-06,uniform,7.021561645733249e-08,2,BaselinePreprocessor,DummyImputer,DummyTargetScaler
15,15,0.5675792723613857,2024-03-07 19:44:45.545914,2024-03-07 19:45:27.465493,0 days 00:00:41.919579,4,,COMPLETE,XGB,0.6342950436650778,,,,,,,,,1.8842197881881918e-05,dart,5.369125472020412e-06,0.9189926846204437,depthwise,0.0827450686037372,tree,3.951440176622957e-05,uniform,1.4597820192722456e-06,2,BaselinePreprocessor,DummyImputer,DummyTargetScaler
16,16,0.5653350054915035,2024-03-07 19:45:27.469873,2024-03-07 19:46:00.247096,0 days 00:00:32.777223,3,,COMPLETE,XGB,0.6342950436650778,,,,,,,,,0.3666789308137959,dart,4.1290341933550114e-06,0.8526380424147041,depthwise,7.248079385174684e-06,forest,0.0002108396123438834,uniform,9.530461992882456e-05,2,BaselinePreprocessor,DummyImputer,DummyTargetScaler
17,17,0.5561702246853002,2024-03-07 19:46:00.248258,2024-03-07 19:46:28.929651,0 days 00:00:28.681393,4,,COMPLETE,XGB,0.6342950436650778,,,,,,,,,1.126430180883689e-06,dart,3.9918062599744094e-08,3.066775372293722e-05,depthwise,0.006954472993912447,forest,0.41958648921398256,weighted,2.2174204133905968e-07,2,BaselinePreprocessor,DummyImputer,DummyTargetScaler
18,18,0.6017164883766132,2024-03-07 19:46:28.931276,2024-03-07 19:47:32.032808,0 days 00:01:03.101532,8,,COMPLETE,XGB,0.6342950436650778,,,,,,,,,9.602326741482987e-06,dart,0.017215719534098207,0.005009027408207475,depthwise,2.654367145649318e-05,tree,2.6172941075675674e-07,uniform,0.01021353490380373,2,BaselinePreprocessor,DummyImputer,DummyTargetScaler
19,19,0.18245103312976615,2024-03-07 19:47:32.035781,2024-03-07 19:47:54.835595,0 days 00:00:22.799814,1,,COMPLETE,XGB,0.6342950436650778,,,,,,,,,3.7421582261697554e-08,dart,1.9872189157033696e-08,5.476607389245165e-07,depthwise,0.00013086044455111744,forest,2.3319829120844372e-08,uniform,0.7171186507690418,2,BaselinePreprocessor,DummyImputer,DummyTargetScaler
20,20,0.5649146090792994,2024-03-07 19:47:54.836678,2024-03-07 19:48:30.140676,0 days 00:00:35.303998,4,,COMPLETE,XGB,0.6342950436650778,,,,,,,,,0.5436929747304453,dart,6.891915049936898e-06,0.04767611663849647,lossguide,0.00014382786320560562,forest,3.162917692239402e-05,weighted,9.981811747277122e-07,2,BaselinePreprocessor,DummyImputer,DummyTargetScaler
21,21,0.5637398353800941,2024-03-07 19:48:30.142035,2024-03-07 19:49:33.196521,0 days 00:01:03.054486,9,,COMPLETE,XGB,0.6342950436650778,,,,,,,,,0.03253273259113591,dart,4.675285459297002e-08,9.850958634307934e-07,lossguide,0.0010331459364755842,tree,0.0008716924083716734,uniform,2.4050721960072916e-07,2,BaselinePreprocessor,DummyImputer,DummyTargetScaler
22,22,0.5804460251334883,2024-03-07 19:49:33.200456,2024-03-07 19:49:57.536771,0 days 00:00:24.336315,1,,COMPLETE,XGB,0.6342950436650778,,,,,,,,,0.0022668811416436626,dart,0.7651409639572551,0.0001405795645314528,depthwise,2.4840943501334955e-06,forest,0.005119455878838542,weighted,0.03380882059388189,2,BaselinePreprocessor,DummyImputer,DummyTargetScaler
23,23,0.5507059823548621,2024-03-07 19:49:57.538503,2024-03-07 19:50:52.730116,0 days 00:00:55.191613,8,,COMPLETE,XGB,0.6342950436650778,,,,,,,,,3.1874241730733515e-07,dart,6.729419880555384e-07,0.0005222170438423814,lossguide,1.481989755572821e-08,forest,0.2653563206547577,weighted,0.00011567981141475142,2,BaselinePreprocessor,DummyImputer,DummyTargetScaler
24,24,0.59073934453887,2024-03-07 19:50:52.731841,2024-03-07 19:51:52.766517,0 days 00:01:00.034676,9,,COMPLETE,XGB,0.6342950436650778,,,,,,,,,0.020633105642576303,dart,0.004002914190075049,1.4576523145598274e-06,lossguide,5.049108280849933e-07,forest,1.6615636690907908e-05,uniform,0.006631294481996839,2,BaselinePreprocessor,DummyImputer,DummyTargetScaler
25,25,0.5976582477309456,2024-03-07 19:51:52.767841,2024-03-07 19:52:51.673249,0 days 00:00:58.905408,9,,COMPLETE,XGB,0.6342950436650778,,,,,,,,,0.45200096659937306,dart,0.02940446468285352,0.0017903217101914702,depthwise,0.005066836428852407,tree,9.617255304801536e-08,uniform,1.536295235105119e-05,2,BaselinePreprocessor,DummyImputer,DummyTargetScaler
26,26,0.5372238465703997,2024-03-07 19:52:51.676048,2024-03-07 19:53:29.077480,0 days 00:00:37.401432,5,,COMPLETE,XGB,0.6342950436650778,,,,,,,,,9.612848032672033e-08,dart,1.5234682755123617e-08,4.1318492458485324e-07,lossguide,1.1522178128545838e-05,tree,0.0062319450581032314,uniform,0.0001283819239486159,2,BaselinePreprocessor,DummyImputer,DummyTargetScaler
27,27,0.5624796529607319,2024-03-07 19:53:29.078856,2024-03-07 19:54:13.833926,0 days 00:00:44.755070,6,,COMPLETE,XGB,0.6342950436650778,,,,,,,,,0.0825726951323919,dart,4.373437137143398e-08,1.0717882631164501e-07,lossguide,3.4616810228464715e-07,forest,0.2700790486484986,uniform,1.7240027348500425e-05,2,BaselinePreprocessor,DummyImputer,DummyTargetScaler
28,28,0.44473385168618473,2024-03-07 19:54:13.840124,2024-03-07 19:54:36.570529,0 days 00:00:22.730405,1,,COMPLETE,XGB,0.6342950436650778,,,,,,,,,0.019285308293427658,dart,0.00010901861482117623,0.00567179831230332,depthwise,0.0002081476327100545,tree,0.03772549826379948,uniform,8.863383059924257e-08,2,BaselinePreprocessor,DummyImputer,DummyTargetScaler
29,29,0.6342950436650778,2024-03-07 19:54:36.573125,2024-03-07 19:55:24.531746,0 days 00:00:47.958621,9,,COMPLETE,XGB,0.6342950436650778,,,,,,,,,6.570654693044942e-07,dart,0.2056982414244941,3.6043197345149066e-05,lossguide,1.3065436229421185e-06,forest,4.6564871830361224e-08,uniform,1.4428779668071841e-08,2,BaselinePreprocessor,DummyImputer,DummyTargetScaler
30,30,0.5569051182111423,2024-03-07 19:55:24.533497,2024-03-07 19:56:22.985076,0 days 00:00:58.451579,8,,COMPLETE,XGB,0.6342950436650778,,,,,,,,,2.907890532437013e-08,dart,2.352124571882534e-07,0.12465400304674037,lossguide,0.10609316541777025,tree,1.6926330040598833e-08,uniform,1.584210833540786e-07,2,BaselinePreprocessor,DummyImputer,DummyTargetScaler
31,31,0.5693072017913933,2024-03-07 19:56:22.988077,2024-03-07 19:56:48.352259,0 days 00:00:25.364182,2,,COMPLETE,XGB,0.6342950436650778,,,,,,,,,6.899863180450346e-08,dart,0.030233641395819202,1.873134143372716e-06,lossguide,0.012789348196741582,forest,0.029195374705605872,uniform,0.0012454364497181166,2,BaselinePreprocessor,DummyImputer,DummyTargetScaler
32,32,0.5830110830092151,2024-03-07 19:56:48.353642,2024-03-07 19:57:32.588117,0 days 00:00:44.234475,6,,COMPLETE,XGB,0.6342950436650778,,,,,,,,,7.278393028974784e-07,dart,0.007392330743157998,1.5486846929473147e-06,depthwise,1.0781131469301282e-08,forest,0.04174095775572638,uniform,0.07644346738430678,2,BaselinePreprocessor,DummyImputer,DummyTargetScaler
33,33,0.5563016732435784,2024-03-07 19:57:32.589817,2024-03-07 19:58:27.638539,0 days 00:00:55.048722,9,,COMPLETE,XGB,0.6342950436650778,,,,,,,,,0.003149023076405459,dart,0.02775077361556682,0.1042975688550231,lossguide,0.00015897114487358944,tree,0.5103374693794136,weighted,1.9733595239094734e-05,2,BaselinePreprocessor,DummyImputer,DummyTargetScaler
