,number,value,datetime_start,datetime_complete,duration,params_max_depth,params_n_estimators,state,model,best_value,params_bagging_fraction,params_bagging_freq,params_feature_fraction,params_lambda_l1,params_lambda_l2,params_learning_rate,params_min_child_samples,params_num_leaves,params_alpha,params_booster,params_eta,params_gamma,params_grow_policy,params_lambda,params_normalize_type,params_rate_drop,params_sample_type,params_skip_drop,config_id,preprocessor,imputer,target_scaler
10,10,0.6012864990112391,2024-03-08 07:13:21.492378,2024-03-08 07:13:53.564304,0 days 00:00:32.071926,84,1100.0,COMPLETE,RandomForest,0.6177307182999774,,,,,,,,,,,,,,,,,,,13,IIDPreprocessor,RevenueQuantileBucketImputer:3-buckets,ArcSinhTargetScaler
11,11,0.5995012414996929,2024-03-08 07:13:53.565144,2024-03-08 07:14:02.744711,0 days 00:00:09.179567,81,300.0,COMPLETE,RandomForest,0.6177307182999774,,,,,,,,,,,,,,,,,,,13,IIDPreprocessor,RevenueQuantileBucketImputer:3-buckets,ArcSinhTargetScaler
12,12,0.6039325504339824,2024-03-08 07:14:02.745644,2024-03-08 07:14:26.055105,0 days 00:00:23.309461,90,800.0,COMPLETE,RandomForest,0.6177307182999774,,,,,,,,,,,,,,,,,,,13,IIDPreprocessor,RevenueQuantileBucketImputer:3-buckets,ArcSinhTargetScaler
13,13,0.6082167238937102,2024-03-08 07:14:26.055759,2024-03-08 07:14:45.417682,0 days 00:00:19.361923,36,700.0,COMPLETE,RandomForest,0.6177307182999774,,,,,,,,,,,,,,,,,,,13,IIDPreprocessor,RevenueQuantileBucketImputer:3-buckets,ArcSinhTargetScaler
14,14,0.6018144616913182,2024-03-08 07:14:45.418294,2024-03-08 07:15:09.726293,0 days 00:00:24.307999,84,800.0,COMPLETE,RandomForest,0.6177307182999774,,,,,,,,,,,,,,,,,,,13,IIDPreprocessor,RevenueQuantileBucketImputer:3-buckets,ArcSinhTargetScaler
15,15,0.6148817739807639,2024-03-08 07:15:09.727185,2024-03-08 07:15:50.430392,0 days 00:00:40.703207,18,1400.0,COMPLETE,RandomForest,0.6177307182999774,,,,,,,,,,,,,,,,,,,13,IIDPreprocessor,RevenueQuantileBucketImputer:3-buckets,ArcSinhTargetScaler
16,16,0.598051624451114,2024-03-08 07:15:50.431239,2024-03-08 07:16:20.488532,0 days 00:00:30.057293,18,1100.0,COMPLETE,RandomForest,0.6177307182999774,,,,,,,,,,,,,,,,,,,13,IIDPreprocessor,RevenueQuantileBucketImputer:3-buckets,ArcSinhTargetScaler
17,17,0.5993191906263985,2024-03-08 07:16:20.489207,2024-03-08 07:16:34.262660,0 days 00:00:13.773453,36,500.0,COMPLETE,RandomForest,0.6177307182999774,,,,,,,,,,,,,,,,,,,13,IIDPreprocessor,RevenueQuantileBucketImputer:3-buckets,ArcSinhTargetScaler
18,18,0.6116284988513628,2024-03-08 07:16:34.263533,2024-03-08 07:17:14.746777,0 days 00:00:40.483244,39,1400.0,COMPLETE,RandomForest,0.6177307182999774,,,,,,,,,,,,,,,,,,,13,IIDPreprocessor,RevenueQuantileBucketImputer:3-buckets,ArcSinhTargetScaler
19,19,0.6102733708013014,2024-03-08 07:17:14.747561,2024-03-08 07:17:31.935584,0 days 00:00:17.188023,84,600.0,COMPLETE,RandomForest,0.6177307182999774,,,,,,,,,,,,,,,,,,,13,IIDPreprocessor,RevenueQuantileBucketImputer:3-buckets,ArcSinhTargetScaler
20,20,0.6015698490173155,2024-03-08 07:17:31.936231,2024-03-08 07:17:49.245340,0 days 00:00:17.309109,45,600.0,COMPLETE,RandomForest,0.6177307182999774,,,,,,,,,,,,,,,,,,,13,IIDPreprocessor,RevenueQuantileBucketImputer:3-buckets,ArcSinhTargetScaler
21,21,0.6102027656843788,2024-03-08 07:17:49.246199,2024-03-08 07:18:00.799356,0 days 00:00:11.553157,51,400.0,COMPLETE,RandomForest,0.6177307182999774,,,,,,,,,,,,,,,,,,,13,IIDPreprocessor,RevenueQuantileBucketImputer:3-buckets,ArcSinhTargetScaler
22,22,0.6153797095615056,2024-03-08 07:18:00.800279,2024-03-08 07:18:09.880154,0 days 00:00:09.079875,27,300.0,COMPLETE,RandomForest,0.6177307182999774,,,,,,,,,,,,,,,,,,,13,IIDPreprocessor,RevenueQuantileBucketImputer:3-buckets,ArcSinhTargetScaler
23,23,0.5980459454733639,2024-03-08 07:18:09.880988,2024-03-08 07:18:15.792836,0 days 00:00:05.911848,72,200.0,COMPLETE,RandomForest,0.6177307182999774,,,,,,,,,,,,,,,,,,,13,IIDPreprocessor,RevenueQuantileBucketImputer:3-buckets,ArcSinhTargetScaler
24,24,0.5808540842587847,2024-03-08 07:18:15.793785,2024-03-08 07:18:23.076994,0 days 00:00:07.283209,12,300.0,COMPLETE,RandomForest,0.6177307182999774,,,,,,,,,,,,,,,,,,,13,IIDPreprocessor,RevenueQuantileBucketImputer:3-buckets,ArcSinhTargetScaler
25,25,0.6068581282860983,2024-03-08 07:18:23.077698,2024-03-08 07:18:43.103513,0 days 00:00:20.025815,42,700.0,COMPLETE,RandomForest,0.6177307182999774,,,,,,,,,,,,,,,,,,,13,IIDPreprocessor,RevenueQuantileBucketImputer:3-buckets,ArcSinhTargetScaler
26,26,0.6057754723340433,2024-03-08 07:18:43.104456,2024-03-08 07:19:22.394291,0 days 00:00:39.289835,36,1300.0,COMPLETE,RandomForest,0.6177307182999774,,,,,,,,,,,,,,,,,,,13,IIDPreprocessor,RevenueQuantileBucketImputer:3-buckets,ArcSinhTargetScaler
27,27,0.3414839180691674,2024-03-08 07:19:22.394916,2024-03-08 07:19:28.754465,0 days 00:00:06.359549,3,700.0,COMPLETE,RandomForest,0.6177307182999774,,,,,,,,,,,,,,,,,,,13,IIDPreprocessor,RevenueQuantileBucketImputer:3-buckets,ArcSinhTargetScaler
28,28,0.6170205405539279,2024-03-08 07:19:28.755438,2024-03-08 07:19:54.813591,0 days 00:00:26.058153,24,900.0,COMPLETE,RandomForest,0.6177307182999774,,,,,,,,,,,,,,,,,,,13,IIDPreprocessor,RevenueQuantileBucketImputer:3-buckets,ArcSinhTargetScaler
29,29,0.6024813341042901,2024-03-08 07:19:54.814432,2024-03-08 07:20:38.177766,0 days 00:00:43.363334,45,1400.0,COMPLETE,RandomForest,0.6177307182999774,,,,,,,,,,,,,,,,,,,13,IIDPreprocessor,RevenueQuantileBucketImputer:3-buckets,ArcSinhTargetScaler
30,30,0.6037158761246822,2024-03-08 07:20:38.178539,2024-03-08 07:21:15.863479,0 days 00:00:37.684940,99,1300.0,COMPLETE,RandomForest,0.6177307182999774,,,,,,,,,,,,,,,,,,,13,IIDPreprocessor,RevenueQuantileBucketImputer:3-buckets,ArcSinhTargetScaler
31,31,0.5909924030291402,2024-03-08 07:21:15.864414,2024-03-08 07:21:18.584891,0 days 00:00:02.720477,54,100.0,COMPLETE,RandomForest,0.6177307182999774,,,,,,,,,,,,,,,,,,,13,IIDPreprocessor,RevenueQuantileBucketImputer:3-buckets,ArcSinhTargetScaler
32,32,0.6021033833416097,2024-03-08 07:21:18.585599,2024-03-08 07:22:02.379626,0 days 00:00:43.794027,75,1500.0,COMPLETE,RandomForest,0.6177307182999774,,,,,,,,,,,,,,,,,,,13,IIDPreprocessor,RevenueQuantileBucketImputer:3-buckets,ArcSinhTargetScaler
33,33,0.6005718497303945,2024-03-08 07:22:02.393760,2024-03-08 07:22:30.154170,0 days 00:00:27.760410,54,900.0,COMPLETE,RandomForest,0.6177307182999774,,,,,,,,,,,,,,,,,,,13,IIDPreprocessor,RevenueQuantileBucketImputer:3-buckets,ArcSinhTargetScaler
34,34,0.6060626438401859,2024-03-08 07:22:30.155138,2024-03-08 07:22:53.793952,0 days 00:00:23.638814,93,800.0,COMPLETE,RandomForest,0.6177307182999774,,,,,,,,,,,,,,,,,,,13,IIDPreprocessor,RevenueQuantileBucketImputer:3-buckets,ArcSinhTargetScaler
35,35,0.6031252118008227,2024-03-08 07:22:53.794881,2024-03-08 07:23:13.274147,0 days 00:00:19.479266,57,600.0,COMPLETE,RandomForest,0.6177307182999774,,,,,,,,,,,,,,,,,,,13,IIDPreprocessor,RevenueQuantileBucketImputer:3-buckets,ArcSinhTargetScaler
36,36,0.601691799479036,2024-03-08 07:23:13.274877,2024-03-08 07:23:22.648586,0 days 00:00:09.373709,66,300.0,COMPLETE,RandomForest,0.6177307182999774,,,,,,,,,,,,,,,,,,,13,IIDPreprocessor,RevenueQuantileBucketImputer:3-buckets,ArcSinhTargetScaler
37,37,0.6082257217753319,2024-03-08 07:23:22.649592,2024-03-08 07:23:43.760091,0 days 00:00:21.110499,81,700.0,COMPLETE,RandomForest,0.6177307182999774,,,,,,,,,,,,,,,,,,,13,IIDPreprocessor,RevenueQuantileBucketImputer:3-buckets,ArcSinhTargetScaler
38,38,0.6177307182999774,2024-03-08 07:23:43.760983,2024-03-08 07:24:07.655264,0 days 00:00:23.894281,81,800.0,COMPLETE,RandomForest,0.6177307182999774,,,,,,,,,,,,,,,,,,,13,IIDPreprocessor,RevenueQuantileBucketImputer:3-buckets,ArcSinhTargetScaler
39,39,0.6052838189771422,2024-03-08 07:24:07.656007,2024-03-08 07:24:50.529999,0 days 00:00:42.873992,99,1500.0,COMPLETE,RandomForest,0.6177307182999774,,,,,,,,,,,,,,,,,,,13,IIDPreprocessor,RevenueQuantileBucketImputer:3-buckets,ArcSinhTargetScaler
0,0,0.5657937342863126,2024-03-08 07:25:15.352293,2024-03-08 07:25:16.027741,0 days 00:00:00.675448,45,10.0,COMPLETE,LGBM,0.6527924927334469,0.6389837871510713,3.0,0.5016846984464647,2.992602007518683e-08,0.00026314325434845964,0.15394494738922532,37.0,73.0,,,,,,,,,,,13,IIDPreprocessor,RevenueQuantileBucketImputer:3-buckets,ArcSinhTargetScaler
1,1,0.5819915515771032,2024-03-08 07:25:16.029711,2024-03-08 07:25:16.572400,0 days 00:00:00.542689,90,10.0,COMPLETE,LGBM,0.6527924927334469,0.6063394131835657,5.0,0.7238957463094222,1.2735219701929898,0.0011069276590100526,0.08751186876751692,13.0,10.0,,,,,,,,,,,13,IIDPreprocessor,RevenueQuantileBucketImputer:3-buckets,ArcSinhTargetScaler
2,2,0.6244527003847007,2024-03-08 07:25:16.577032,2024-03-08 07:25:24.266547,0 days 00:00:07.689515,66,410.0,COMPLETE,LGBM,0.6527924927334469,0.5001592407714773,1.0,0.49701909451079757,2.431456198718986e-05,1.9027762446720733,0.07032394654134888,100.0,238.0,,,,,,,,,,,13,IIDPreprocessor,RevenueQuantileBucketImputer:3-buckets,ArcSinhTargetScaler
3,3,0.636929529305079,2024-03-08 07:25:24.267521,2024-03-08 07:25:40.529498,0 days 00:00:16.261977,99,1310.0,COMPLETE,LGBM,0.6527924927334469,0.7107481112340492,3.0,0.8033326329900984,0.06635333791140145,2.4567326565179006e-05,0.19211686679900894,100.0,171.0,,,,,,,,,,,13,IIDPreprocessor,RevenueQuantileBucketImputer:3-buckets,ArcSinhTargetScaler
4,4,0.6257228510193891,2024-03-08 07:25:40.530541,2024-03-08 07:26:03.356919,0 days 00:00:22.826378,75,510.0,COMPLETE,LGBM,0.6527924927334469,0.9483433963794692,5.0,0.47925303230766686,1.0010369129471207e-05,3.7202673524319843,0.1291101139631753,31.0,45.0,,,,,,,,,,,13,IIDPreprocessor,RevenueQuantileBucketImputer:3-buckets,ArcSinhTargetScaler
5,5,0.6376573245162332,2024-03-08 07:26:03.362465,2024-03-08 07:26:17.846658,0 days 00:00:14.484193,33,810.0,COMPLETE,LGBM,0.6527924927334469,0.8495233790625256,7.0,0.5277275241860618,4.1245103603761694e-05,1.7142530863071454e-07,0.19107151149431714,65.0,113.0,,,,,,,,,,,13,IIDPreprocessor,RevenueQuantileBucketImputer:3-buckets,ArcSinhTargetScaler
6,6,0.5474911796804174,2024-03-08 07:26:17.848207,2024-03-08 07:26:18.354417,0 days 00:00:00.506210,93,10.0,COMPLETE,LGBM,0.6527924927334469,0.9849998668108374,3.0,0.9693394072826603,7.910322681894678e-07,9.653839711072653,0.07474827329756072,68.0,84.0,,,,,,,,,,,13,IIDPreprocessor,RevenueQuantileBucketImputer:3-buckets,ArcSinhTargetScaler
7,7,0.63863604925716,2024-03-08 07:26:18.355661,2024-03-08 07:26:34.569532,0 days 00:00:16.213871,6,710.0,COMPLETE,LGBM,0.6527924927334469,0.7030300927529596,2.0,0.5763188672670575,0.05603015627440291,4.217651164805393,0.08154340213879183,74.0,103.0,,,,,,,,,,,13,IIDPreprocessor,RevenueQuantileBucketImputer:3-buckets,ArcSinhTargetScaler
8,8,0.6263491152054678,2024-03-08 07:26:34.570734,2024-03-08 07:26:56.466723,0 days 00:00:21.895989,18,510.0,COMPLETE,LGBM,0.6527924927334469,0.5821710532034889,4.0,0.9408640605302341,4.438185128049839e-07,4.295601900919198e-05,0.024608778502546152,72.0,12.0,,,,,,,,,,,13,IIDPreprocessor,RevenueQuantileBucketImputer:3-buckets,ArcSinhTargetScaler
9,9,0.6001732340219373,2024-03-08 07:26:56.468095,2024-03-08 07:26:58.507922,0 days 00:00:02.039827,54,10.0,COMPLETE,LGBM,0.6527924927334469,0.9071476619935123,3.0,0.8639563571234847,0.021957994335981043,7.777032395832839e-08,0.25943621566527064,14.0,94.0,,,,,,,,,,,13,IIDPreprocessor,RevenueQuantileBucketImputer:3-buckets,ArcSinhTargetScaler
10,10,0.6397897234911135,2024-03-08 07:26:58.510975,2024-03-08 07:27:22.838339,0 days 00:00:24.327364,27,810.0,COMPLETE,LGBM,0.6527924927334469,0.7329949182866811,4.0,0.6996270605026891,1.5741643849900336e-06,1.3814058123285963e-05,0.11902775773521866,69.0,104.0,,,,,,,,,,,13,IIDPreprocessor,RevenueQuantileBucketImputer:3-buckets,ArcSinhTargetScaler
11,11,0.635873489432591,2024-03-08 07:27:22.839660,2024-03-08 07:27:36.678832,0 days 00:00:13.839172,30,410.0,COMPLETE,LGBM,0.6527924927334469,0.7507932915223297,3.0,0.7411738756546262,0.0003420064670178946,3.091899392880356e-07,0.17783042177029743,95.0,146.0,,,,,,,,,,,13,IIDPreprocessor,RevenueQuantileBucketImputer:3-buckets,ArcSinhTargetScaler
12,12,0.6025373116486276,2024-03-08 07:27:36.680460,2024-03-08 07:27:50.110212,0 days 00:00:13.429752,72,910.0,COMPLETE,LGBM,0.6527924927334469,0.4044471246307088,7.0,0.8415818174490386,4.4925389698336256,3.593720981231771e-05,0.01667129288189978,100.0,198.0,,,,,,,,,,,13,IIDPreprocessor,RevenueQuantileBucketImputer:3-buckets,ArcSinhTargetScaler
13,13,0.6377490142214426,2024-03-08 07:27:50.111521,2024-03-08 07:28:12.598595,0 days 00:00:22.487074,90,910.0,COMPLETE,LGBM,0.6527924927334469,0.4084736059808661,2.0,0.9517743836061556,1.6084135951766695e-06,0.0001862156122154579,0.20658199441402944,24.0,106.0,,,,,,,,,,,13,IIDPreprocessor,RevenueQuantileBucketImputer:3-buckets,ArcSinhTargetScaler
14,14,0.633979518445856,2024-03-08 07:28:12.600248,2024-03-08 07:28:21.203944,0 days 00:00:08.603696,93,1010.0,COMPLETE,LGBM,0.6527924927334469,0.5259740505961961,6.0,0.5052140769460667,0.06538714617537715,2.7361134354503195e-05,0.2595513336275328,52.0,194.0,,,,,,,,,,,13,IIDPreprocessor,RevenueQuantileBucketImputer:3-buckets,ArcSinhTargetScaler
15,15,0.6110919130727076,2024-03-08 07:28:21.205482,2024-03-08 07:28:24.238962,0 days 00:00:03.033480,72,210.0,COMPLETE,LGBM,0.6527924927334469,0.5590676256961216,4.0,0.6175166647061203,3.964338664354527,1.5849085890600915e-07,0.11669316509118109,92.0,33.0,,,,,,,,,,,13,IIDPreprocessor,RevenueQuantileBucketImputer:3-buckets,ArcSinhTargetScaler
16,16,0.644473834646385,2024-03-08 07:28:24.240449,2024-03-08 07:28:40.680508,0 days 00:00:16.440059,60,610.0,COMPLETE,LGBM,0.6527924927334469,0.5248583451840209,3.0,0.6795245291811216,0.00032697158738873147,1.8125067220572346e-07,0.18387683898226806,7.0,170.0,,,,,,,,,,,13,IIDPreprocessor,RevenueQuantileBucketImputer:3-buckets,ArcSinhTargetScaler
17,17,0.6317457848702249,2024-03-08 07:28:40.681959,2024-03-08 07:28:52.228209,0 days 00:00:11.546250,54,1410.0,COMPLETE,LGBM,0.6527924927334469,0.9596311914283229,1.0,0.577115114526257,0.6258010805282543,0.030880517089813254,0.29282165560160295,51.0,111.0,,,,,,,,,,,13,IIDPreprocessor,RevenueQuantileBucketImputer:3-buckets,ArcSinhTargetScaler
18,18,0.6494611869297591,2024-03-08 07:28:52.229444,2024-03-08 07:29:11.208630,0 days 00:00:18.979186,45,510.0,COMPLETE,LGBM,0.6527924927334469,0.6351924292204679,5.0,0.8948817553165065,0.007199242503763486,1.5986322393958546e-08,0.12366745295466569,40.0,218.0,,,,,,,,,,,13,IIDPreprocessor,RevenueQuantileBucketImputer:3-buckets,ArcSinhTargetScaler
19,19,0.6458428816527543,2024-03-08 07:29:11.210039,2024-03-08 07:30:09.346754,0 days 00:00:58.136715,39,1110.0,COMPLETE,LGBM,0.6527924927334469,0.5426598395542814,4.0,0.8859850510094684,2.7794011980093595e-08,0.06003204919945421,0.012868524982045585,60.0,112.0,,,,,,,,,,,13,IIDPreprocessor,RevenueQuantileBucketImputer:3-buckets,ArcSinhTargetScaler
20,20,0.6121746643564464,2024-03-08 07:30:09.348544,2024-03-08 07:30:16.034769,0 days 00:00:06.686225,81,510.0,COMPLETE,LGBM,0.6527924927334469,0.8131986856774404,7.0,0.5765207101591164,1.2299340846597482,9.986911423026008e-08,0.20328095038026342,64.0,127.0,,,,,,,,,,,13,IIDPreprocessor,RevenueQuantileBucketImputer:3-buckets,ArcSinhTargetScaler
21,21,0.6280498822156882,2024-03-08 07:30:16.036101,2024-03-08 07:30:42.974588,0 days 00:00:26.938487,45,1010.0,COMPLETE,LGBM,0.6527924927334469,0.7495904408084002,3.0,0.7240336442698488,6.374129809389773e-07,3.1769130788053044,0.24464753420411323,85.0,244.0,,,,,,,,,,,13,IIDPreprocessor,RevenueQuantileBucketImputer:3-buckets,ArcSinhTargetScaler
22,22,0.649512767941797,2024-03-08 07:30:42.976252,2024-03-08 07:31:02.108913,0 days 00:00:19.132661,57,210.0,COMPLETE,LGBM,0.6527924927334469,0.7933503471438,3.0,0.9356925745679056,0.00035964430380676664,0.004884021748725206,0.058781777958390645,61.0,89.0,,,,,,,,,,,13,IIDPreprocessor,RevenueQuantileBucketImputer:3-buckets,ArcSinhTargetScaler
23,23,0.6419757717596747,2024-03-08 07:31:02.110672,2024-03-08 07:31:19.509230,0 days 00:00:17.398558,48,710.0,COMPLETE,LGBM,0.6527924927334469,0.887212999191611,2.0,0.42709601949700626,6.32582759834394e-06,0.013217343232219248,0.208302002518516,11.0,208.0,,,,,,,,,,,13,IIDPreprocessor,RevenueQuantileBucketImputer:3-buckets,ArcSinhTargetScaler
24,24,0.6151581064245754,2024-03-08 07:31:19.510569,2024-03-08 07:31:21.623898,0 days 00:00:02.113329,57,110.0,COMPLETE,LGBM,0.6527924927334469,0.5859423686296358,7.0,0.5021608661190337,1.734654087000681,4.098921526965941e-06,0.12559469455236455,86.0,104.0,,,,,,,,,,,13,IIDPreprocessor,RevenueQuantileBucketImputer:3-buckets,ArcSinhTargetScaler
25,25,0.6430987728194254,2024-03-08 07:31:21.625019,2024-03-08 07:31:36.592047,0 days 00:00:14.967028,21,510.0,COMPLETE,LGBM,0.6527924927334469,0.4077787941007829,1.0,0.6412598492697207,4.30877904535322e-07,0.002410818256301909,0.17438288900154472,24.0,123.0,,,,,,,,,,,13,IIDPreprocessor,RevenueQuantileBucketImputer:3-buckets,ArcSinhTargetScaler
26,26,0.6200021628726893,2024-03-08 07:31:36.595011,2024-03-08 07:31:56.926621,0 days 00:00:20.331610,18,1210.0,COMPLETE,LGBM,0.6527924927334469,0.48187964877579353,3.0,0.9353544819726334,2.017728112276067,8.768559260767823e-07,0.07189898575865275,31.0,244.0,,,,,,,,,,,13,IIDPreprocessor,RevenueQuantileBucketImputer:3-buckets,ArcSinhTargetScaler
27,27,0.6083277542651874,2024-03-08 07:31:56.927541,2024-03-08 07:32:17.816654,0 days 00:00:20.889113,54,810.0,COMPLETE,LGBM,0.6527924927334469,0.9837796065066067,4.0,0.6883229979930592,4.65610235581049,0.40694946195333487,0.01720305980204366,20.0,163.0,,,,,,,,,,,13,IIDPreprocessor,RevenueQuantileBucketImputer:3-buckets,ArcSinhTargetScaler
28,28,0.650256932951455,2024-03-08 07:32:17.817960,2024-03-08 07:32:55.359715,0 days 00:00:37.541755,48,1210.0,COMPLETE,LGBM,0.6527924927334469,0.5938297750334225,1.0,0.8150791278508893,0.07388052772234839,0.6097657859979935,0.03620111369070994,76.0,38.0,,,,,,,,,,,13,IIDPreprocessor,RevenueQuantileBucketImputer:3-buckets,ArcSinhTargetScaler
29,29,0.6321746730272464,2024-03-08 07:32:55.361250,2024-03-08 07:33:47.180769,0 days 00:00:51.819519,63,510.0,COMPLETE,LGBM,0.6527924927334469,0.9043479093704034,5.0,0.62440525581369,0.00011451060322331735,0.00013514922778317038,0.03427692231634999,19.0,127.0,,,,,,,,,,,13,IIDPreprocessor,RevenueQuantileBucketImputer:3-buckets,ArcSinhTargetScaler
30,30,0.638490877201232,2024-03-08 07:33:47.182444,2024-03-08 07:33:56.947847,0 days 00:00:09.765403,9,210.0,COMPLETE,LGBM,0.6527924927334469,0.7502033943773534,5.0,0.6964490660995477,2.4444346195783935e-08,3.261866346377709e-06,0.07477267021369156,84.0,170.0,,,,,,,,,,,13,IIDPreprocessor,RevenueQuantileBucketImputer:3-buckets,ArcSinhTargetScaler
31,31,0.6424980804611594,2024-03-08 07:33:56.949081,2024-03-08 07:34:27.339863,0 days 00:00:30.390782,66,1010.0,COMPLETE,LGBM,0.6527924927334469,0.6224235301213743,3.0,0.9236498259636882,3.2903901743420125e-08,4.085198311400567e-06,0.11347185101773026,80.0,26.0,,,,,,,,,,,13,IIDPreprocessor,RevenueQuantileBucketImputer:3-buckets,ArcSinhTargetScaler
32,32,0.6087085894172959,2024-03-08 07:34:27.341043,2024-03-08 07:34:35.336444,0 days 00:00:07.995401,6,310.0,COMPLETE,LGBM,0.6527924927334469,0.42406384496060834,5.0,0.699087856777839,0.00010701389561689393,4.108041007032109e-07,0.03343652989382297,70.0,216.0,,,,,,,,,,,13,IIDPreprocessor,RevenueQuantileBucketImputer:3-buckets,ArcSinhTargetScaler
33,33,0.6400798786380533,2024-03-08 07:34:35.337999,2024-03-08 07:35:42.107157,0 days 00:01:06.769158,54,810.0,COMPLETE,LGBM,0.6527924927334469,0.8474161633675561,5.0,0.9988537384098416,3.718369185925795e-06,0.00020702887631238222,0.03999104063964922,51.0,195.0,,,,,,,,,,,13,IIDPreprocessor,RevenueQuantileBucketImputer:3-buckets,ArcSinhTargetScaler
34,34,0.6527924927334469,2024-03-08 07:35:42.108302,2024-03-08 07:36:09.399810,0 days 00:00:27.291508,99,710.0,COMPLETE,LGBM,0.6527924927334469,0.884415446847383,1.0,0.6646423321215438,6.249191168415359e-08,0.0017509375914111264,0.11096592411240784,25.0,70.0,,,,,,,,,,,13,IIDPreprocessor,RevenueQuantileBucketImputer:3-buckets,ArcSinhTargetScaler
35,35,0.635088792638449,2024-03-08 07:36:09.401872,2024-03-08 07:36:59.692970,0 days 00:00:50.291098,57,810.0,COMPLETE,LGBM,0.6527924927334469,0.8709394238181001,7.0,0.7233028082501775,0.00012676228619656682,0.024357751022454313,0.06639858390037022,16.0,55.0,,,,,,,,,,,13,IIDPreprocessor,RevenueQuantileBucketImputer:3-buckets,ArcSinhTargetScaler
36,36,0.643169074685673,2024-03-08 07:36:59.694233,2024-03-08 07:37:13.996997,0 days 00:00:14.302764,96,1110.0,COMPLETE,LGBM,0.6527924927334469,0.4110677890543483,4.0,0.8767923563017116,0.7780908917700347,1.6329071477148001e-07,0.1536985131874682,54.0,145.0,,,,,,,,,,,13,IIDPreprocessor,RevenueQuantileBucketImputer:3-buckets,ArcSinhTargetScaler
37,37,0.5626684369335669,2024-03-08 07:37:13.998443,2024-03-08 07:37:14.524440,0 days 00:00:00.525997,87,10.0,COMPLETE,LGBM,0.6527924927334469,0.8422728499178072,7.0,0.8807575988723565,1.3940950513884403,0.001173464235522593,0.03460414491025896,63.0,196.0,,,,,,,,,,,13,IIDPreprocessor,RevenueQuantileBucketImputer:3-buckets,ArcSinhTargetScaler
38,38,0.6501601811008444,2024-03-08 07:37:14.525613,2024-03-08 07:38:26.735727,0 days 00:01:12.210114,36,1310.0,COMPLETE,LGBM,0.6527924927334469,0.723003095977718,1.0,0.6304166393896161,0.00033185093197609874,7.534876188648139e-06,0.017380492701042225,59.0,210.0,,,,,,,,,,,13,IIDPreprocessor,RevenueQuantileBucketImputer:3-buckets,ArcSinhTargetScaler
39,39,0.6194996359241386,2024-03-08 07:38:26.737255,2024-03-08 07:39:05.012411,0 days 00:00:38.275156,66,1010.0,COMPLETE,LGBM,0.6527924927334469,0.826825963315901,5.0,0.7453187568996968,0.005005294475869102,0.6297962045236527,0.27877813329441,22.0,32.0,,,,,,,,,,,13,IIDPreprocessor,RevenueQuantileBucketImputer:3-buckets,ArcSinhTargetScaler
