,number,value,datetime_start,datetime_complete,duration,params_max_depth,params_n_estimators,state,model,best_value,params_bagging_fraction,params_bagging_freq,params_feature_fraction,params_lambda_l1,params_lambda_l2,params_learning_rate,params_min_child_samples,params_num_leaves,params_alpha,params_booster,params_eta,params_gamma,params_grow_policy,params_lambda,params_normalize_type,params_rate_drop,params_sample_type,params_skip_drop,config_id,preprocessor,imputer,target_scaler
27,27,0.6144225446831194,2024-03-07 20:32:42.015344,2024-03-07 20:32:57.016786,0 days 00:00:15.001442,15,110.0,COMPLETE,LGBM,0.6502714122074738,0.7079939173234651,1.0,0.8372540009556391,0.0005544541129565818,1.0272336834841445e-07,0.053729014407913986,17.0,82.0,,,,,,,,,,,3,BaselinePreprocessor,RevenueQuantileBucketImputer:3-buckets,LogTargetScaler
28,28,0.6353101454220431,2024-03-07 20:32:57.018447,2024-03-07 20:33:14.876207,0 days 00:00:17.857760,33,710.0,COMPLETE,LGBM,0.6502714122074738,0.42177034311650774,5.0,0.5022049806004094,5.836884681841403e-07,0.08029190884532086,0.017730845802710178,62.0,97.0,,,,,,,,,,,3,BaselinePreprocessor,RevenueQuantileBucketImputer:3-buckets,LogTargetScaler
29,29,0.6348443642081715,2024-03-07 20:33:14.877837,2024-03-07 20:33:38.372206,0 days 00:00:23.494369,99,1310.0,COMPLETE,LGBM,0.6502714122074738,0.6203153572848555,6.0,0.4215723576214642,2.1065638747281988e-07,7.286787954876262e-05,0.010664453779829771,17.0,7.0,,,,,,,,,,,3,BaselinePreprocessor,RevenueQuantileBucketImputer:3-buckets,LogTargetScaler
30,30,0.6263376027161532,2024-03-07 20:33:38.373808,2024-03-07 20:34:17.045970,0 days 00:00:38.672162,96,1410.0,COMPLETE,LGBM,0.6502714122074738,0.8529674696365541,5.0,0.6244642549237098,1.1749174540424327e-08,9.963822640957266e-08,0.2266900147256981,28.0,57.0,,,,,,,,,,,3,BaselinePreprocessor,RevenueQuantileBucketImputer:3-buckets,LogTargetScaler
31,31,0.6432566196316627,2024-03-07 20:34:17.049490,2024-03-07 20:34:47.644964,0 days 00:00:30.595474,42,1210.0,COMPLETE,LGBM,0.6502714122074738,0.8311598053949998,3.0,0.7353433287984946,2.631268903337373e-05,0.0002248328265779156,0.1342267466700509,28.0,220.0,,,,,,,,,,,3,BaselinePreprocessor,RevenueQuantileBucketImputer:3-buckets,LogTargetScaler
32,32,0.6205072566785683,2024-03-07 20:34:47.646396,2024-03-07 20:35:05.412813,0 days 00:00:17.766417,87,410.0,COMPLETE,LGBM,0.6502714122074738,0.7731623680936839,3.0,0.9481483720370228,0.00668983400304473,0.05022892202045364,0.18151667342632402,62.0,26.0,,,,,,,,,,,3,BaselinePreprocessor,RevenueQuantileBucketImputer:3-buckets,LogTargetScaler
33,33,0.6379074394609962,2024-03-07 20:35:05.414307,2024-03-07 20:35:38.265078,0 days 00:00:32.850771,12,1210.0,COMPLETE,LGBM,0.6502714122074738,0.9136643754317388,6.0,0.43658889794035793,0.2613176772560155,2.2135949316536058e-08,0.020781077877668107,74.0,254.0,,,,,,,,,,,3,BaselinePreprocessor,RevenueQuantileBucketImputer:3-buckets,LogTargetScaler
34,34,0.6285548863326684,2024-03-07 20:35:38.266682,2024-03-07 20:36:09.029615,0 days 00:00:30.762933,42,1210.0,COMPLETE,LGBM,0.6502714122074738,0.8622597859573385,7.0,0.7782769441655757,2.9996093260559302,6.967430362994198e-06,0.033902416504953674,34.0,86.0,,,,,,,,,,,3,BaselinePreprocessor,RevenueQuantileBucketImputer:3-buckets,LogTargetScaler
35,35,0.5883005462497721,2024-03-07 20:36:09.032403,2024-03-07 20:36:09.694985,0 days 00:00:00.662582,96,10.0,COMPLETE,LGBM,0.6502714122074738,0.8983003473952103,2.0,0.609179446689475,0.006943246833811458,1.4335147654944782e-08,0.03589139698421686,65.0,70.0,,,,,,,,,,,3,BaselinePreprocessor,RevenueQuantileBucketImputer:3-buckets,LogTargetScaler
36,36,0.5742593629003764,2024-03-07 20:36:09.696296,2024-03-07 20:36:09.942367,0 days 00:00:00.246071,3,10.0,COMPLETE,LGBM,0.6502714122074738,0.48174026254398494,5.0,0.8805581420084672,4.1218609401322235,0.17130787760465604,0.07600491952112678,83.0,16.0,,,,,,,,,,,3,BaselinePreprocessor,RevenueQuantileBucketImputer:3-buckets,LogTargetScaler
37,37,0.6405435499374443,2024-03-07 20:36:09.943389,2024-03-07 20:36:41.252348,0 days 00:00:31.308959,99,1010.0,COMPLETE,LGBM,0.6502714122074738,0.6314270054340174,5.0,0.6055606862489157,0.01359360046418808,2.192449669043438e-06,0.022551065782688992,94.0,191.0,,,,,,,,,,,3,BaselinePreprocessor,RevenueQuantileBucketImputer:3-buckets,LogTargetScaler
38,38,0.04997257848712935,2024-03-07 20:36:41.253724,2024-03-07 20:36:51.768578,0 days 00:00:10.514854,39,810.0,COMPLETE,LGBM,0.6502714122074738,0.44573675735001544,7.0,0.8370857603597497,0.001612241890927733,4.465227881202418e-06,0.1984010742186193,26.0,33.0,,,,,,,,,,,3,BaselinePreprocessor,RevenueQuantileBucketImputer:3-buckets,LogTargetScaler
39,39,0.6429595136103046,2024-03-07 20:36:51.769777,2024-03-07 20:37:30.556392,0 days 00:00:38.786615,39,1210.0,COMPLETE,LGBM,0.6502714122074738,0.5264579900702598,3.0,0.7201457529815928,1.094223248335476e-06,0.0004850063865173561,0.027582368415198278,91.0,21.0,,,,,,,,,,,3,BaselinePreprocessor,RevenueQuantileBucketImputer:3-buckets,LogTargetScaler
0,0,0.5321553543208913,2024-03-07 20:38:58.833742,2024-03-07 20:39:28.530834,0 days 00:00:29.697092,2,,COMPLETE,XGB,0.6055989104594657,,,,,,,,,0.01595974826214573,dart,0.00033678135719018447,1.7616713118783436e-08,depthwise,1.0142385555770027e-05,forest,9.291186895299692e-07,uniform,2.3488634018670182e-05,3,BaselinePreprocessor,RevenueQuantileBucketImputer:3-buckets,LogTargetScaler
1,1,0.550866040525307,2024-03-07 20:39:28.532861,2024-03-07 20:40:17.072610,0 days 00:00:48.539749,4,,COMPLETE,XGB,0.6055989104594657,,,,,,,,,4.897519068750424e-06,dart,8.173566461452e-06,6.558881038911853e-06,lossguide,0.32149198117477673,tree,1.6447634131272987e-06,uniform,3.163327532168725e-05,3,BaselinePreprocessor,RevenueQuantileBucketImputer:3-buckets,LogTargetScaler
2,2,0.5494242196491721,2024-03-07 20:40:17.077296,2024-03-07 20:41:16.258887,0 days 00:00:59.181591,8,,COMPLETE,XGB,0.6055989104594657,,,,,,,,,1.2976825382715248e-05,dart,0.00012101407709379011,8.529457256215499e-06,depthwise,3.6527730860954206e-05,forest,0.009163174412542444,uniform,6.861415775256554e-08,3,BaselinePreprocessor,RevenueQuantileBucketImputer:3-buckets,LogTargetScaler
3,3,0.5347515379090221,2024-03-07 20:41:16.260142,2024-03-07 20:42:07.361755,0 days 00:00:51.101613,6,,COMPLETE,XGB,0.6055989104594657,,,,,,,,,5.751451228685324e-07,dart,2.3142867266244546e-06,0.0013236946582359651,depthwise,0.0007730294406206404,tree,1.4812344334100302e-06,weighted,0.000673280584444005,3,BaselinePreprocessor,RevenueQuantileBucketImputer:3-buckets,LogTargetScaler
4,4,0.481698917357296,2024-03-07 20:42:07.365534,2024-03-07 20:42:30.276123,0 days 00:00:22.910589,1,,COMPLETE,XGB,0.6055989104594657,,,,,,,,,0.7477360952656746,dart,0.005517439431920756,7.212135543889731e-06,depthwise,1.0697446968482359e-07,forest,4.1937903896432855e-08,weighted,3.1328665869636815e-06,3,BaselinePreprocessor,RevenueQuantileBucketImputer:3-buckets,LogTargetScaler
5,5,0.5331317191214079,2024-03-07 20:42:30.277674,2024-03-07 20:43:19.813183,0 days 00:00:49.535509,6,,COMPLETE,XGB,0.6055989104594657,,,,,,,,,0.005782654248839435,dart,8.412124255363706e-06,1.8232290325621038e-08,depthwise,1.8580344244229805e-06,forest,2.0517769672232377e-08,uniform,0.15923836511020212,3,BaselinePreprocessor,RevenueQuantileBucketImputer:3-buckets,LogTargetScaler
6,6,0.5800687099385625,2024-03-07 20:43:19.814887,2024-03-07 20:44:15.483578,0 days 00:00:55.668691,6,,COMPLETE,XGB,0.6055989104594657,,,,,,,,,0.048810295988783406,dart,0.012939359288281499,2.9603029117766487e-06,lossguide,8.958294882878874e-05,tree,0.0006984187117518145,uniform,4.684927740567073e-08,3,BaselinePreprocessor,RevenueQuantileBucketImputer:3-buckets,LogTargetScaler
7,7,0.5385427779003028,2024-03-07 20:44:15.486292,2024-03-07 20:44:35.586513,0 days 00:00:20.100221,4,,COMPLETE,XGB,0.6055989104594657,,,,,,,,,0.0004398067865264748,dart,1.8593811064577637e-07,1.776251654432609e-05,lossguide,0.0005129094859975475,forest,0.8679765871504199,uniform,2.6532158143133357e-05,3,BaselinePreprocessor,RevenueQuantileBucketImputer:3-buckets,LogTargetScaler
8,8,0.5728144656879045,2024-03-07 20:44:35.587756,2024-03-07 20:45:16.599708,0 days 00:00:41.011952,4,,COMPLETE,XGB,0.6055989104594657,,,,,,,,,3.1083959246875236e-08,dart,0.005237400323364114,0.0018694088061479866,lossguide,0.4784268184964932,forest,1.264234670920922e-05,uniform,0.0022828354151819183,3,BaselinePreprocessor,RevenueQuantileBucketImputer:3-buckets,LogTargetScaler
9,9,0.5403553268787036,2024-03-07 20:45:16.601267,2024-03-07 20:46:01.080514,0 days 00:00:44.479247,4,,COMPLETE,XGB,0.6055989104594657,,,,,,,,,0.001975823104366489,dart,1.8753607943505973e-05,0.45474315849852015,depthwise,0.0007718724973829699,tree,0.012215074899590164,uniform,2.834453622281129e-06,3,BaselinePreprocessor,RevenueQuantileBucketImputer:3-buckets,LogTargetScaler
10,10,0.46466950053266964,2024-03-07 20:46:01.084833,2024-03-07 20:46:25.441712,0 days 00:00:24.356879,1,,COMPLETE,XGB,0.6055989104594657,,,,,,,,,1.1163472352825684e-07,dart,1.9377397846339915e-06,0.017261428435366447,lossguide,7.275655357593792e-08,forest,1.368850230824034e-06,uniform,0.00017941229745814793,3,BaselinePreprocessor,RevenueQuantileBucketImputer:3-buckets,LogTargetScaler
11,11,0.47807646257078645,2024-03-07 20:46:25.442777,2024-03-07 20:46:50.164734,0 days 00:00:24.721957,1,,COMPLETE,XGB,0.6055989104594657,,,,,,,,,2.0575151194701915e-06,dart,0.0030579183511820094,6.068942628978356e-08,lossguide,0.0003727853073856684,forest,3.5206307191406587e-06,uniform,0.017345903734593535,3,BaselinePreprocessor,RevenueQuantileBucketImputer:3-buckets,LogTargetScaler
12,12,0.5490909659951851,2024-03-07 20:46:50.166402,2024-03-07 20:47:38.630702,0 days 00:00:48.464300,5,,COMPLETE,XGB,0.6055989104594657,,,,,,,,,0.28689266945392033,dart,1.6758707104341652e-07,4.0973335565308195e-05,lossguide,1.0534391605272803e-07,forest,2.5349454260707434e-08,uniform,1.4533024465683717e-05,3,BaselinePreprocessor,RevenueQuantileBucketImputer:3-buckets,LogTargetScaler
13,13,0.5358799893991179,2024-03-07 20:47:38.632917,2024-03-07 20:48:30.883780,0 days 00:00:52.250863,6,,COMPLETE,XGB,0.6055989104594657,,,,,,,,,5.517114093614848e-07,dart,2.0273341462938125e-06,0.04480902941955758,depthwise,7.24156897222423e-05,tree,0.000946303322361813,weighted,9.44412934777637e-08,3,BaselinePreprocessor,RevenueQuantileBucketImputer:3-buckets,LogTargetScaler
14,14,0.5321387817475381,2024-03-07 20:48:30.887400,2024-03-07 20:48:58.022528,0 days 00:00:27.135128,2,,COMPLETE,XGB,0.6055989104594657,,,,,,,,,0.014088484302494434,dart,4.411013583582114e-06,0.8094932904832097,lossguide,0.007398940020249473,forest,0.0004009729163909261,weighted,3.83566053727086e-07,3,BaselinePreprocessor,RevenueQuantileBucketImputer:3-buckets,LogTargetScaler
15,15,0.5564583986817886,2024-03-07 20:48:58.024652,2024-03-07 20:50:01.701165,0 days 00:01:03.676513,8,,COMPLETE,XGB,0.6055989104594657,,,,,,,,,0.0002250632134624198,dart,0.00047716302408726675,3.4093170587817905e-07,lossguide,0.0001363207554399239,tree,3.40185758694816e-07,weighted,0.002017117615225296,3,BaselinePreprocessor,RevenueQuantileBucketImputer:3-buckets,LogTargetScaler
16,16,0.491747917024562,2024-03-07 20:50:01.706285,2024-03-07 20:50:27.965783,0 days 00:00:26.259498,1,,COMPLETE,XGB,0.6055989104594657,,,,,,,,,0.003358637939863314,dart,0.009839840379447242,7.295262483829368e-05,lossguide,0.023626114534775117,forest,2.9140359979022637e-07,weighted,1.7095120442176238e-07,3,BaselinePreprocessor,RevenueQuantileBucketImputer:3-buckets,LogTargetScaler
17,17,0.5690708339951548,2024-03-07 20:50:27.967454,2024-03-07 20:51:26.225053,0 days 00:00:58.257599,7,,COMPLETE,XGB,0.6055989104594657,,,,,,,,,6.0343414704496075e-06,dart,0.004279896303611852,1.1221351035289657e-07,lossguide,0.0021020520504772427,forest,9.544585235186815e-06,weighted,1.1123799045815625e-06,3,BaselinePreprocessor,RevenueQuantileBucketImputer:3-buckets,LogTargetScaler
18,18,0.5446484695018516,2024-03-07 20:51:26.226531,2024-03-07 20:52:19.748431,0 days 00:00:53.521900,6,,COMPLETE,XGB,0.6055989104594657,,,,,,,,,2.999695086873446e-08,dart,0.00014676837875617687,2.778180402555981e-06,lossguide,3.70082941780544e-05,forest,1.1086763161654866e-08,weighted,3.3226601052942384e-08,3,BaselinePreprocessor,RevenueQuantileBucketImputer:3-buckets,LogTargetScaler
19,19,0.46466950053266964,2024-03-07 20:52:19.751443,2024-03-07 20:52:41.560266,0 days 00:00:21.808823,1,,COMPLETE,XGB,0.6055989104594657,,,,,,,,,0.06430430654206429,dart,9.973265472401217e-08,0.01639603287976119,depthwise,0.2686795991219042,forest,0.05858707770221837,uniform,6.738981231233094e-05,3,BaselinePreprocessor,RevenueQuantileBucketImputer:3-buckets,LogTargetScaler
20,20,0.5356368515298883,2024-03-07 20:52:41.561132,2024-03-07 20:53:16.647456,0 days 00:00:35.086324,6,,COMPLETE,XGB,0.6055989104594657,,,,,,,,,2.0003533342678163e-05,dart,6.198699950884506e-07,4.529637195300577e-05,depthwise,0.001086027972912828,forest,0.642395470919725,weighted,0.0007272711824580193,3,BaselinePreprocessor,RevenueQuantileBucketImputer:3-buckets,LogTargetScaler
21,21,0.5672723295440935,2024-03-07 20:53:16.648450,2024-03-07 20:53:47.387490,0 days 00:00:30.739040,3,,COMPLETE,XGB,0.6055989104594657,,,,,,,,,6.223999371456057e-06,dart,0.037848036830206266,0.1584594578614001,lossguide,4.023313546419541e-06,tree,6.304694885389105e-08,weighted,3.3298104575671423e-06,3,BaselinePreprocessor,RevenueQuantileBucketImputer:3-buckets,LogTargetScaler
22,22,0.5454630577896649,2024-03-07 20:53:47.388474,2024-03-07 20:54:26.422148,0 days 00:00:39.033674,3,,COMPLETE,XGB,0.6055989104594657,,,,,,,,,4.50799466322936e-07,dart,3.9331229373976096e-07,0.00021033344637990273,depthwise,1.1848094586165342e-06,tree,0.07678662849932012,uniform,0.015580808733311685,3,BaselinePreprocessor,RevenueQuantileBucketImputer:3-buckets,LogTargetScaler
23,23,0.563062578293978,2024-03-07 20:54:26.424414,2024-03-07 20:55:30.564007,0 days 00:01:04.139593,9,,COMPLETE,XGB,0.6055989104594657,,,,,,,,,1.0201818510440555e-05,dart,0.0031564365330078565,5.070243483212673e-05,lossguide,0.0009724635781651929,tree,6.408241744111102e-06,uniform,2.336292065755632e-07,3,BaselinePreprocessor,RevenueQuantileBucketImputer:3-buckets,LogTargetScaler
24,24,0.529448897975355,2024-03-07 20:55:30.565873,2024-03-07 20:56:12.291325,0 days 00:00:41.725452,8,,COMPLETE,XGB,0.6055989104594657,,,,,,,,,1.81202694701562e-06,dart,8.293403623878101e-08,4.108318494131991e-06,lossguide,9.717859763307387e-08,tree,0.896789284437628,uniform,8.7091339940213e-06,3,BaselinePreprocessor,RevenueQuantileBucketImputer:3-buckets,LogTargetScaler
25,25,0.5682669382610384,2024-03-07 20:56:12.292594,2024-03-07 20:57:25.657746,0 days 00:01:13.365152,9,,COMPLETE,XGB,0.6055989104594657,,,,,,,,,1.2511155791854826e-08,dart,0.0008500505958586511,2.7760541991891107e-06,depthwise,0.08710019065348477,forest,0.00020799983000391377,uniform,0.281315571404941,3,BaselinePreprocessor,RevenueQuantileBucketImputer:3-buckets,LogTargetScaler
26,26,0.5680401839216223,2024-03-07 20:57:25.659164,2024-03-07 20:58:31.624025,0 days 00:01:05.964861,8,,COMPLETE,XGB,0.6055989104594657,,,,,,,,,0.8502222987371352,dart,0.0001281417620395033,0.0036946115236990967,depthwise,0.008014888001185787,forest,0.3556156547769098,weighted,0.0007885476167916815,3,BaselinePreprocessor,RevenueQuantileBucketImputer:3-buckets,LogTargetScaler
27,27,0.6054577836434016,2024-03-07 20:58:31.626680,2024-03-07 20:59:22.544006,0 days 00:00:50.917326,7,,COMPLETE,XGB,0.6055989104594657,,,,,,,,,1.4668167628061914e-07,dart,0.08468970253745277,0.0024051523854096693,depthwise,0.016120502436602156,tree,1.8589931860008093e-08,weighted,4.428402017687387e-08,3,BaselinePreprocessor,RevenueQuantileBucketImputer:3-buckets,LogTargetScaler
28,28,0.558745797436345,2024-03-07 20:59:22.545729,2024-03-07 21:00:00.516923,0 days 00:00:37.971194,4,,COMPLETE,XGB,0.6055989104594657,,,,,,,,,1.4563849008860311e-07,dart,0.006318851231165005,0.10893960839325094,lossguide,0.007208516020260321,tree,3.131854223884239e-05,weighted,0.0006752161659270128,3,BaselinePreprocessor,RevenueQuantileBucketImputer:3-buckets,LogTargetScaler
29,29,0.561150362697196,2024-03-07 21:00:00.518577,2024-03-07 21:00:51.583841,0 days 00:00:51.065264,4,,COMPLETE,XGB,0.6055989104594657,,,,,,,,,0.04754440097079209,dart,0.0010258914846758985,3.417901685217894e-07,depthwise,2.7895312879583516e-07,tree,0.00973215186106957,uniform,0.0015921452894225084,3,BaselinePreprocessor,RevenueQuantileBucketImputer:3-buckets,LogTargetScaler
30,30,0.6044912291473722,2024-03-07 21:00:51.587466,2024-03-07 21:01:27.231558,0 days 00:00:35.644092,2,,COMPLETE,XGB,0.6055989104594657,,,,,,,,,0.007926492652279373,dart,0.8939935068878607,0.0006175384631080021,lossguide,7.047606107613565e-08,tree,5.132130372745712e-08,weighted,8.451534351875377e-08,3,BaselinePreprocessor,RevenueQuantileBucketImputer:3-buckets,LogTargetScaler
31,31,0.5385664323079861,2024-03-07 21:01:27.233227,2024-03-07 21:02:10.094198,0 days 00:00:42.860971,4,,COMPLETE,XGB,0.6055989104594657,,,,,,,,,4.2201005198771393e-07,dart,5.374293646332826e-05,5.279997811863429e-08,lossguide,3.346979657145585e-08,tree,0.010492909599695286,uniform,5.1919540982018e-08,3,BaselinePreprocessor,RevenueQuantileBucketImputer:3-buckets,LogTargetScaler
32,32,0.5334039306926108,2024-03-07 21:02:10.095684,2024-03-07 21:03:14.762299,0 days 00:01:04.666615,9,,COMPLETE,XGB,0.6055989104594657,,,,,,,,,0.0007215096626379627,dart,6.007056689705601e-08,3.264191518084149e-07,depthwise,4.4986322565016444e-08,tree,0.043773556870273234,weighted,0.04982566261758888,3,BaselinePreprocessor,RevenueQuantileBucketImputer:3-buckets,LogTargetScaler
33,33,0.6055989104594657,2024-03-07 21:03:14.766206,2024-03-07 21:03:56.655312,0 days 00:00:41.889106,6,,COMPLETE,XGB,0.6055989104594657,,,,,,,,,3.682385319342e-05,dart,0.23336583507721756,0.008081277356191054,lossguide,1.955139540910436e-08,tree,0.0089149879954719,uniform,0.0001394848036287129,3,BaselinePreprocessor,RevenueQuantileBucketImputer:3-buckets,LogTargetScaler
34,34,0.5552219310497182,2024-03-07 21:03:56.656627,2024-03-07 21:04:37.793695,0 days 00:00:41.137068,5,,COMPLETE,XGB,0.6055989104594657,,,,,,,,,0.9738942922076698,dart,0.009828500658460177,0.10500295909265533,depthwise,2.544033620083218e-06,forest,1.2435884032955976e-06,weighted,0.021854214313140795,3,BaselinePreprocessor,RevenueQuantileBucketImputer:3-buckets,LogTargetScaler
35,35,0.5514151876293074,2024-03-07 21:04:37.795743,2024-03-07 21:05:35.067643,0 days 00:00:57.271900,8,,COMPLETE,XGB,0.6055989104594657,,,,,,,,,7.781974831826236e-05,dart,0.003964002034167398,0.00579200804012746,depthwise,2.3245304248120685e-06,tree,3.7673949833334263e-06,uniform,0.05506797374726948,3,BaselinePreprocessor,RevenueQuantileBucketImputer:3-buckets,LogTargetScaler
36,36,0.34186852450293936,2024-03-07 21:05:35.068851,2024-03-07 21:06:03.704398,0 days 00:00:28.635547,2,,COMPLETE,XGB,0.6055989104594657,,,,,,,,,0.012165969655674397,dart,2.3511998596997045e-08,0.011999238270535187,depthwise,0.00595216956430462,tree,8.201623025835696e-08,weighted,2.6098582553353897e-05,3,BaselinePreprocessor,RevenueQuantileBucketImputer:3-buckets,LogTargetScaler
37,37,0.5403953766024464,2024-03-07 21:06:03.705736,2024-03-07 21:06:39.610875,0 days 00:00:35.905139,4,,COMPLETE,XGB,0.6055989104594657,,,,,,,,,1.245816235718172e-05,dart,1.0699670751879156e-06,2.8198451886381053e-05,lossguide,2.0998251659628967e-07,tree,0.028723919401672987,uniform,8.771449272403881e-06,3,BaselinePreprocessor,RevenueQuantileBucketImputer:3-buckets,LogTargetScaler
38,38,0.576268208578789,2024-03-07 21:06:39.612068,2024-03-07 21:07:40.747265,0 days 00:01:01.135197,7,,COMPLETE,XGB,0.6055989104594657,,,,,,,,,0.836679276854383,dart,0.0062277766802596385,8.59112878022198e-06,lossguide,2.628103189839879e-06,tree,5.428107479767834e-05,uniform,1.2870300451750334e-05,3,BaselinePreprocessor,RevenueQuantileBucketImputer:3-buckets,LogTargetScaler
39,39,0.5450068791264866,2024-03-07 21:07:40.750923,2024-03-07 21:08:25.623128,0 days 00:00:44.872205,5,,COMPLETE,XGB,0.6055989104594657,,,,,,,,,6.870410348279415e-08,dart,1.1013285921540527e-07,1.200512982854343e-07,lossguide,2.1892266113771938e-05,forest,4.785866158158906e-08,weighted,0.00011917092190724083,3,BaselinePreprocessor,RevenueQuantileBucketImputer:3-buckets,LogTargetScaler
0,0,0.48855735912722303,2024-03-07 21:09:52.490448,2024-03-07 21:09:56.820872,0 days 00:00:04.330424,6,300.0,COMPLETE,RandomForest,0.6244914028468803,,,,,,,,,,,,,,,,,,,4,BaselinePreprocessor,RevenueQuantileBucketImputer:3-buckets,ArcSinhTargetScaler
1,1,0.5992491029560495,2024-03-07 21:09:56.821919,2024-03-07 21:10:37.488135,0 days 00:00:40.666216,93,1400.0,COMPLETE,RandomForest,0.6244914028468803,,,,,,,,,,,,,,,,,,,4,BaselinePreprocessor,RevenueQuantileBucketImputer:3-buckets,ArcSinhTargetScaler
2,2,0.5881587192306238,2024-03-07 21:10:37.488776,2024-03-07 21:10:40.016326,0 days 00:00:02.527550,12,100.0,COMPLETE,RandomForest,0.6244914028468803,,,,,,,,,,,,,,,,,,,4,BaselinePreprocessor,RevenueQuantileBucketImputer:3-buckets,ArcSinhTargetScaler
3,3,0.6106266853224449,2024-03-07 21:10:40.017088,2024-03-07 21:10:51.271970,0 days 00:00:11.254882,30,400.0,COMPLETE,RandomForest,0.6244914028468803,,,,,,,,,,,,,,,,,,,4,BaselinePreprocessor,RevenueQuantileBucketImputer:3-buckets,ArcSinhTargetScaler
4,4,0.6036742211330101,2024-03-07 21:10:51.272707,2024-03-07 21:11:14.636168,0 days 00:00:23.363461,54,600.0,COMPLETE,RandomForest,0.6244914028468803,,,,,,,,,,,,,,,,,,,4,BaselinePreprocessor,RevenueQuantileBucketImputer:3-buckets,ArcSinhTargetScaler
5,5,0.607178006778791,2024-03-07 21:11:14.637801,2024-03-07 21:11:36.506214,0 days 00:00:21.868413,42,700.0,COMPLETE,RandomForest,0.6244914028468803,,,,,,,,,,,,,,,,,,,4,BaselinePreprocessor,RevenueQuantileBucketImputer:3-buckets,ArcSinhTargetScaler
