,number,value,datetime_start,datetime_complete,duration,params_max_depth,params_n_estimators,state,model,best_value,params_bagging_fraction,params_bagging_freq,params_feature_fraction,params_lambda_l1,params_lambda_l2,params_learning_rate,params_min_child_samples,params_num_leaves,params_alpha,params_booster,params_eta,params_gamma,params_grow_policy,params_lambda,params_normalize_type,params_rate_drop,params_sample_type,params_skip_drop,config_id,preprocessor,imputer,target_scaler
26,26,0.5711257699235982,2024-03-08 04:11:22.435607,2024-03-08 04:11:24.253198,0 days 00:00:01.817591,9,100.0,COMPLETE,RandomForest,0.6581710686189851,,,,,,,,,,,,,,,,,,,10,IIDPreprocessor,DummyImputer,ArcSinhTargetScaler
27,27,0.6513324556574077,2024-03-08 04:11:24.254084,2024-03-08 04:11:29.599215,0 days 00:00:05.345131,51,200.0,COMPLETE,RandomForest,0.6581710686189851,,,,,,,,,,,,,,,,,,,10,IIDPreprocessor,DummyImputer,ArcSinhTargetScaler
28,28,0.6481742194338287,2024-03-08 04:11:29.600085,2024-03-08 04:11:40.956171,0 days 00:00:11.356086,72,400.0,COMPLETE,RandomForest,0.6581710686189851,,,,,,,,,,,,,,,,,,,10,IIDPreprocessor,DummyImputer,ArcSinhTargetScaler
29,29,0.6474426576049225,2024-03-08 04:11:40.957051,2024-03-08 04:12:15.209481,0 days 00:00:34.252430,57,1200.0,COMPLETE,RandomForest,0.6581710686189851,,,,,,,,,,,,,,,,,,,10,IIDPreprocessor,DummyImputer,ArcSinhTargetScaler
30,30,0.6377780313285915,2024-03-08 04:12:15.210098,2024-03-08 04:12:35.261386,0 days 00:00:20.051288,69,700.0,COMPLETE,RandomForest,0.6581710686189851,,,,,,,,,,,,,,,,,,,10,IIDPreprocessor,DummyImputer,ArcSinhTargetScaler
31,31,0.6499135385189818,2024-03-08 04:12:35.262316,2024-03-08 04:13:00.653745,0 days 00:00:25.391429,33,900.0,COMPLETE,RandomForest,0.6581710686189851,,,,,,,,,,,,,,,,,,,10,IIDPreprocessor,DummyImputer,ArcSinhTargetScaler
32,32,0.6487233225795801,2024-03-08 04:13:00.654391,2024-03-08 04:13:40.409215,0 days 00:00:39.754824,96,1500.0,COMPLETE,RandomForest,0.6581710686189851,,,,,,,,,,,,,,,,,,,10,IIDPreprocessor,DummyImputer,ArcSinhTargetScaler
33,33,0.6486838006003919,2024-03-08 04:13:40.409872,2024-03-08 04:14:15.748475,0 days 00:00:35.338603,54,1300.0,COMPLETE,RandomForest,0.6581710686189851,,,,,,,,,,,,,,,,,,,10,IIDPreprocessor,DummyImputer,ArcSinhTargetScaler
34,34,0.6125934198409351,2024-03-08 04:14:15.749087,2024-03-08 04:14:18.379896,0 days 00:00:02.630809,27,100.0,COMPLETE,RandomForest,0.6581710686189851,,,,,,,,,,,,,,,,,,,10,IIDPreprocessor,DummyImputer,ArcSinhTargetScaler
35,35,0.6581710686189851,2024-03-08 04:14:18.380572,2024-03-08 04:14:56.917474,0 days 00:00:38.536902,75,1500.0,COMPLETE,RandomForest,0.6581710686189851,,,,,,,,,,,,,,,,,,,10,IIDPreprocessor,DummyImputer,ArcSinhTargetScaler
36,36,0.6529468199633239,2024-03-08 04:14:56.918110,2024-03-08 04:15:17.564917,0 days 00:00:20.646807,63,700.0,COMPLETE,RandomForest,0.6581710686189851,,,,,,,,,,,,,,,,,,,10,IIDPreprocessor,DummyImputer,ArcSinhTargetScaler
37,37,0.5872400636516667,2024-03-08 04:15:17.565549,2024-03-08 04:15:29.517590,0 days 00:00:11.952041,9,600.0,COMPLETE,RandomForest,0.6581710686189851,,,,,,,,,,,,,,,,,,,10,IIDPreprocessor,DummyImputer,ArcSinhTargetScaler
38,38,0.6455261230514517,2024-03-08 04:15:29.518371,2024-03-08 04:15:43.242491,0 days 00:00:13.724120,18,500.0,COMPLETE,RandomForest,0.6581710686189851,,,,,,,,,,,,,,,,,,,10,IIDPreprocessor,DummyImputer,ArcSinhTargetScaler
39,39,0.6527602049941462,2024-03-08 04:15:43.243435,2024-03-08 04:16:02.326085,0 days 00:00:19.082650,57,700.0,COMPLETE,RandomForest,0.6581710686189851,,,,,,,,,,,,,,,,,,,10,IIDPreprocessor,DummyImputer,ArcSinhTargetScaler
0,0,0.6301044896493181,2024-03-08 04:16:41.762361,2024-03-08 04:17:03.791367,0 days 00:00:22.029006,21,910.0,COMPLETE,LGBM,0.6540271516306233,0.5353125974368008,6.0,0.5383346042982549,2.0635145552203217e-08,0.0027162359191592075,0.06903894750254001,99.0,30.0,,,,,,,,,,,10,IIDPreprocessor,DummyImputer,ArcSinhTargetScaler
1,1,0.6344820507783195,2024-03-08 04:17:03.792642,2024-03-08 04:17:22.079601,0 days 00:00:18.286959,99,1210.0,COMPLETE,LGBM,0.6540271516306233,0.6884238961118379,1.0,0.6828566916365808,9.629692368800538e-07,8.41207274627879e-08,0.23137145378086152,10.0,23.0,,,,,,,,,,,10,IIDPreprocessor,DummyImputer,ArcSinhTargetScaler
2,2,0.6419822470085872,2024-03-08 04:17:22.081366,2024-03-08 04:17:29.051956,0 days 00:00:06.970590,15,110.0,COMPLETE,LGBM,0.6540271516306233,0.5871330247044233,5.0,0.4637406816187595,0.000761878125569572,8.355940016997037e-08,0.03289266299358189,24.0,195.0,,,,,,,,,,,10,IIDPreprocessor,DummyImputer,ArcSinhTargetScaler
3,3,0.6428152520334017,2024-03-08 04:17:29.053550,2024-03-08 04:17:57.201425,0 days 00:00:28.147875,75,310.0,COMPLETE,LGBM,0.6540271516306233,0.5923016573386528,3.0,0.9252460255028304,0.0061221972003315875,4.64753935641729e-06,0.056041441762433454,33.0,27.0,,,,,,,,,,,10,IIDPreprocessor,DummyImputer,ArcSinhTargetScaler
4,4,0.5914349503643961,2024-03-08 04:17:57.203477,2024-03-08 04:18:00.297491,0 days 00:00:03.094014,60,110.0,COMPLETE,LGBM,0.6540271516306233,0.6176742943924588,6.0,0.7188173041628839,0.2158958129206195,1.207192861128979,0.010119398674993502,98.0,211.0,,,,,,,,,,,10,IIDPreprocessor,DummyImputer,ArcSinhTargetScaler
5,5,0.6432170717006361,2024-03-08 04:18:00.313109,2024-03-08 04:20:45.148721,0 days 00:02:44.835612,93,1310.0,COMPLETE,LGBM,0.6540271516306233,0.6790884046324115,3.0,0.7974459184973332,0.0008925703771108709,0.44087643237210167,0.01362386501765196,6.0,191.0,,,,,,,,,,,10,IIDPreprocessor,DummyImputer,ArcSinhTargetScaler
6,6,0.647977973652901,2024-03-08 04:20:45.156683,2024-03-08 04:21:47.519497,0 days 00:01:02.362814,36,1210.0,COMPLETE,LGBM,0.6540271516306233,0.8828457248919024,3.0,0.597536289285463,1.233473217131783e-08,4.111066133532833,0.03088667764820031,37.0,108.0,,,,,,,,,,,10,IIDPreprocessor,DummyImputer,ArcSinhTargetScaler
7,7,0.6012242281584955,2024-03-08 04:21:47.520831,2024-03-08 04:21:57.780630,0 days 00:00:10.259799,96,1310.0,COMPLETE,LGBM,0.6540271516306233,0.8787000536050342,6.0,0.5178360775266366,5.258186961089227,2.31334620686296e-05,0.1913686335753999,59.0,57.0,,,,,,,,,,,10,IIDPreprocessor,DummyImputer,ArcSinhTargetScaler
8,8,0.6212141699601045,2024-03-08 04:21:57.782436,2024-03-08 04:22:16.074218,0 days 00:00:18.291782,78,810.0,COMPLETE,LGBM,0.6540271516306233,0.5985813185462032,6.0,0.5126129164783981,2.0776594959739274,0.33278824470672896,0.02397185577661684,56.0,136.0,,,,,,,,,,,10,IIDPreprocessor,DummyImputer,ArcSinhTargetScaler
9,9,0.6023953767735728,2024-03-08 04:22:16.075203,2024-03-08 04:22:23.311234,0 days 00:00:07.236031,66,410.0,COMPLETE,LGBM,0.6540271516306233,0.9092197658248193,4.0,0.8095346654574478,6.872928029080377,4.3359500715834114e-05,0.054072341388941944,90.0,163.0,,,,,,,,,,,10,IIDPreprocessor,DummyImputer,ArcSinhTargetScaler
10,10,0.6377889899834238,2024-03-08 04:22:23.313450,2024-03-08 04:23:24.355835,0 days 00:01:01.042385,48,710.0,COMPLETE,LGBM,0.6540271516306233,0.5240716465918542,6.0,0.6704858187467073,1.1584816557123235e-08,1.894438968763455e-08,0.018398477817884378,32.0,204.0,,,,,,,,,,,10,IIDPreprocessor,DummyImputer,ArcSinhTargetScaler
11,11,0.5880098862741857,2024-03-08 04:23:24.357068,2024-03-08 04:23:26.400535,0 days 00:00:02.043467,78,10.0,COMPLETE,LGBM,0.6540271516306233,0.6253502677154081,4.0,0.824146852228645,1.7696864400942882e-06,0.02152175725116464,0.010722285733253064,6.0,96.0,,,,,,,,,,,10,IIDPreprocessor,DummyImputer,ArcSinhTargetScaler
12,12,0.6099068894287837,2024-03-08 04:23:26.402181,2024-03-08 04:23:36.050799,0 days 00:00:09.648618,24,910.0,COMPLETE,LGBM,0.6540271516306233,0.41277059619594475,2.0,0.5000460704605633,0.060501786316195495,0.020921913571624394,0.27927322224414736,84.0,209.0,,,,,,,,,,,10,IIDPreprocessor,DummyImputer,ArcSinhTargetScaler
13,13,0.6456335269830186,2024-03-08 04:23:36.054983,2024-03-08 04:23:52.210225,0 days 00:00:16.155242,60,410.0,COMPLETE,LGBM,0.6540271516306233,0.882810303835512,4.0,0.5865971744913792,5.0370410356454267e-08,6.481876787421979e-07,0.133013612659497,80.0,111.0,,,,,,,,,,,10,IIDPreprocessor,DummyImputer,ArcSinhTargetScaler
14,14,0.6278340740614028,2024-03-08 04:23:52.211305,2024-03-08 04:24:05.947635,0 days 00:00:13.736330,75,310.0,COMPLETE,LGBM,0.6540271516306233,0.8947736945190222,1.0,0.9666092506528585,0.013494578616596378,1.2799394806522818e-08,0.15079855109374582,53.0,179.0,,,,,,,,,,,10,IIDPreprocessor,DummyImputer,ArcSinhTargetScaler
15,15,0.6488633572744762,2024-03-08 04:24:05.948987,2024-03-08 04:25:00.913252,0 days 00:00:54.964265,75,710.0,COMPLETE,LGBM,0.6540271516306233,0.8310222278265713,2.0,0.6305292822993341,5.237639439134533e-05,3.654237200828135e-07,0.011221760381698951,46.0,67.0,,,,,,,,,,,10,IIDPreprocessor,DummyImputer,ArcSinhTargetScaler
16,16,0.6304721270110677,2024-03-08 04:25:00.917948,2024-03-08 04:25:11.517847,0 days 00:00:10.599899,99,410.0,COMPLETE,LGBM,0.6540271516306233,0.8687280241967856,4.0,0.8006572526154565,0.023840384121618426,1.7793004148850033e-07,0.23188037983987575,76.0,67.0,,,,,,,,,,,10,IIDPreprocessor,DummyImputer,ArcSinhTargetScaler
17,17,0.6260535284130323,2024-03-08 04:25:11.520003,2024-03-08 04:25:39.293158,0 days 00:00:27.773155,75,1010.0,COMPLETE,LGBM,0.6540271516306233,0.8336141766916626,1.0,0.6877361281158103,1.298520173668472e-07,6.302406158912305,0.12303245704004394,98.0,74.0,,,,,,,,,,,10,IIDPreprocessor,DummyImputer,ArcSinhTargetScaler
18,18,0.6522671429709711,2024-03-08 04:25:39.294229,2024-03-08 04:26:08.220349,0 days 00:00:28.926120,30,910.0,COMPLETE,LGBM,0.6540271516306233,0.8819914448173359,6.0,0.6029870923245311,0.006588433234128046,0.00019121444238293144,0.06050987656917165,33.0,255.0,,,,,,,,,,,10,IIDPreprocessor,DummyImputer,ArcSinhTargetScaler
19,19,0.5934096648809297,2024-03-08 04:26:08.221525,2024-03-08 04:26:08.971480,0 days 00:00:00.749955,99,10.0,COMPLETE,LGBM,0.6540271516306233,0.6513659314319666,7.0,0.8441368643252195,0.0006392218052275331,7.947421228976115e-05,0.013688098924902149,39.0,99.0,,,,,,,,,,,10,IIDPreprocessor,DummyImputer,ArcSinhTargetScaler
20,20,0.6331349727309665,2024-03-08 04:26:08.972657,2024-03-08 04:26:26.577702,0 days 00:00:17.605045,24,1210.0,COMPLETE,LGBM,0.6540271516306233,0.9121734843990281,1.0,0.6435776447751715,1.010966767335766,3.1374993317248644e-07,0.08839659544920332,75.0,110.0,,,,,,,,,,,10,IIDPreprocessor,DummyImputer,ArcSinhTargetScaler
21,21,0.6373085463816653,2024-03-08 04:26:26.578862,2024-03-08 04:26:47.881746,0 days 00:00:21.302884,39,510.0,COMPLETE,LGBM,0.6540271516306233,0.8372274990204223,7.0,0.707213022286813,0.000744504371348241,0.18942288713559297,0.058270405539571746,89.0,208.0,,,,,,,,,,,10,IIDPreprocessor,DummyImputer,ArcSinhTargetScaler
22,22,0.5724562213082004,2024-03-08 04:26:47.882717,2024-03-08 04:26:51.634501,0 days 00:00:03.751784,69,610.0,COMPLETE,LGBM,0.6540271516306233,0.4536568111580308,4.0,0.8293069243103532,0.2923738747765244,3.7817138551049863,0.019640280409403056,62.0,2.0,,,,,,,,,,,10,IIDPreprocessor,DummyImputer,ArcSinhTargetScaler
23,23,0.6169786141894049,2024-03-08 04:26:51.636309,2024-03-08 04:27:08.419376,0 days 00:00:16.783067,3,910.0,COMPLETE,LGBM,0.6540271516306233,0.6040800281533827,1.0,0.7313953936279172,0.00011430082976311649,0.0016403756244464103,0.11906231274257702,59.0,245.0,,,,,,,,,,,10,IIDPreprocessor,DummyImputer,ArcSinhTargetScaler
24,24,0.5979593501987654,2024-03-08 04:27:08.421019,2024-03-08 04:27:16.672312,0 days 00:00:08.251293,21,310.0,COMPLETE,LGBM,0.6540271516306233,0.7780044782915547,5.0,0.43862650187783925,0.42148467716326626,2.121918126361678e-05,0.013987759020538703,85.0,15.0,,,,,,,,,,,10,IIDPreprocessor,DummyImputer,ArcSinhTargetScaler
25,25,0.6285112601454331,2024-03-08 04:27:16.673270,2024-03-08 04:27:44.749872,0 days 00:00:28.076602,12,310.0,COMPLETE,LGBM,0.6540271516306233,0.9857180240973612,4.0,0.8464075183880482,0.00013208530012912158,6.716885686157585e-05,0.09043201556261735,5.0,136.0,,,,,,,,,,,10,IIDPreprocessor,DummyImputer,ArcSinhTargetScaler
26,26,0.6216478676793051,2024-03-08 04:27:44.751269,2024-03-08 04:28:18.267320,0 days 00:00:33.516051,87,1410.0,COMPLETE,LGBM,0.6540271516306233,0.49358588832747263,6.0,0.5455375024346231,0.06840504041342359,2.1469490281267506e-05,0.03190933173838378,64.0,128.0,,,,,,,,,,,10,IIDPreprocessor,DummyImputer,ArcSinhTargetScaler
27,27,0.6357895902503341,2024-03-08 04:28:18.268824,2024-03-08 04:29:20.414504,0 days 00:01:02.145680,72,1310.0,COMPLETE,LGBM,0.6540271516306233,0.8368499503140772,7.0,0.7932460251186906,1.6388901367406515e-07,0.3844676590685356,0.01312380103456387,93.0,35.0,,,,,,,,,,,10,IIDPreprocessor,DummyImputer,ArcSinhTargetScaler
28,28,0.6010803745972259,2024-03-08 04:29:20.415803,2024-03-08 04:29:36.093201,0 days 00:00:15.677398,3,1010.0,COMPLETE,LGBM,0.6540271516306233,0.46657989945312706,3.0,0.6251629254272724,0.0319914293871878,1.2123494739993899,0.16157147498816254,56.0,52.0,,,,,,,,,,,10,IIDPreprocessor,DummyImputer,ArcSinhTargetScaler
29,29,0.633431562701429,2024-03-08 04:29:36.094590,2024-03-08 04:30:02.819142,0 days 00:00:26.724552,21,1110.0,COMPLETE,LGBM,0.6540271516306233,0.9984258455681384,2.0,0.9629915914735807,1.3150581002972657e-08,1.377919627404988e-05,0.21330138911979904,36.0,6.0,,,,,,,,,,,10,IIDPreprocessor,DummyImputer,ArcSinhTargetScaler
30,30,0.6540271516306233,2024-03-08 04:30:02.821225,2024-03-08 04:30:29.281060,0 days 00:00:26.459835,18,1410.0,COMPLETE,LGBM,0.6540271516306233,0.7218810822243813,4.0,0.41421700184865484,8.272313063878072e-07,1.1118784425797529e-05,0.11248039122203952,47.0,174.0,,,,,,,,,,,10,IIDPreprocessor,DummyImputer,ArcSinhTargetScaler
31,31,0.6180533391065846,2024-03-08 04:30:29.282878,2024-03-08 04:30:44.380826,0 days 00:00:15.097948,27,510.0,COMPLETE,LGBM,0.6540271516306233,0.4298915029702547,2.0,0.9474124627107539,0.0026293910327396764,4.4361505769252295e-08,0.040315639228942046,94.0,51.0,,,,,,,,,,,10,IIDPreprocessor,DummyImputer,ArcSinhTargetScaler
32,32,0.6245972400939229,2024-03-08 04:30:44.381909,2024-03-08 04:30:58.648749,0 days 00:00:14.266840,54,510.0,COMPLETE,LGBM,0.6540271516306233,0.6491402919617503,1.0,0.5537053556142608,0.00017478295435296637,0.00035661253346093175,0.04335918437573512,90.0,10.0,,,,,,,,,,,10,IIDPreprocessor,DummyImputer,ArcSinhTargetScaler
33,33,0.6162311598985759,2024-03-08 04:30:58.650190,2024-03-08 04:31:08.699732,0 days 00:00:10.049542,84,210.0,COMPLETE,LGBM,0.6540271516306233,0.7351171066426807,5.0,0.9413085723980065,1.0121565604210332,7.566830234567955e-05,0.08606199247894751,41.0,200.0,,,,,,,,,,,10,IIDPreprocessor,DummyImputer,ArcSinhTargetScaler
34,34,0.6001122287458914,2024-03-08 04:31:08.701808,2024-03-08 04:31:18.625987,0 days 00:00:09.924179,42,410.0,COMPLETE,LGBM,0.6540271516306233,0.7416403736479271,6.0,0.8216722794910749,3.415621486396708,1.3277092134894181e-05,0.030549501268590476,99.0,9.0,,,,,,,,,,,10,IIDPreprocessor,DummyImputer,ArcSinhTargetScaler
35,35,0.6266733993601694,2024-03-08 04:31:18.627281,2024-03-08 04:31:50.619750,0 days 00:00:31.992469,69,210.0,COMPLETE,LGBM,0.6540271516306233,0.6881283841683876,6.0,0.9371669273157549,0.0019030094268675112,0.09823418266343688,0.010854574898504348,10.0,40.0,,,,,,,,,,,10,IIDPreprocessor,DummyImputer,ArcSinhTargetScaler
36,36,0.606930416085557,2024-03-08 04:31:50.621381,2024-03-08 04:32:05.113069,0 days 00:00:14.491688,24,210.0,COMPLETE,LGBM,0.6540271516306233,0.7585626660688337,7.0,0.788105128279941,0.000383563802973462,1.7745873221675277e-08,0.012322386231289348,54.0,34.0,,,,,,,,,,,10,IIDPreprocessor,DummyImputer,ArcSinhTargetScaler
37,37,0.6353270675444894,2024-03-08 04:32:05.115865,2024-03-08 04:32:17.205702,0 days 00:00:12.089837,45,210.0,COMPLETE,LGBM,0.6540271516306233,0.6922741592565038,3.0,0.7463352892133341,0.08490646692361896,0.004346158622188387,0.04891960184710499,57.0,147.0,,,,,,,,,,,10,IIDPreprocessor,DummyImputer,ArcSinhTargetScaler
38,38,0.6182055465100398,2024-03-08 04:32:17.207498,2024-03-08 04:32:29.313922,0 days 00:00:12.106424,75,1110.0,COMPLETE,LGBM,0.6540271516306233,0.5431806660593309,7.0,0.40337548166047155,0.1639812550242508,0.08371187147871263,0.24745972520094883,30.0,95.0,,,,,,,,,,,10,IIDPreprocessor,DummyImputer,ArcSinhTargetScaler
39,39,0.6440162983419001,2024-03-08 04:32:29.315240,2024-03-08 04:33:55.398530,0 days 00:01:26.083290,66,510.0,COMPLETE,LGBM,0.6540271516306233,0.9357220801780554,4.0,0.8405608991645701,1.7600862631870447e-05,1.6914947753427152e-07,0.013447390317843469,31.0,134.0,,,,,,,,,,,10,IIDPreprocessor,DummyImputer,ArcSinhTargetScaler
0,0,0.5668383539660494,2024-03-08 04:34:20.777461,2024-03-08 04:35:01.194949,0 days 00:00:40.417488,4,,COMPLETE,XGB,0.634874791761776,,,,,,,,,0.48640867942818294,dart,1.009506316856933e-06,9.004645401148479e-08,depthwise,0.00038504766958562665,tree,4.711755301781295e-06,weighted,5.777841843599954e-08,10,IIDPreprocessor,DummyImputer,ArcSinhTargetScaler
1,1,0.6148347859616586,2024-03-08 04:35:01.196556,2024-03-08 04:35:51.421916,0 days 00:00:50.225360,6,,COMPLETE,XGB,0.634874791761776,,,,,,,,,3.975650070964324e-05,dart,0.05397318747803376,2.1273364137072472e-05,lossguide,2.252154220729414e-07,forest,3.3098938903711305e-07,uniform,0.6758468563740979,10,IIDPreprocessor,DummyImputer,ArcSinhTargetScaler
2,2,0.5521071740485501,2024-03-08 04:35:51.423350,2024-03-08 04:36:48.858743,0 days 00:00:57.435393,9,,COMPLETE,XGB,0.634874791761776,,,,,,,,,3.6339866728160597e-07,dart,3.7830938168982232e-06,0.002755404712228582,lossguide,5.716688804569647e-06,forest,1.5765250070313894e-06,uniform,2.278238564061959e-06,10,IIDPreprocessor,DummyImputer,ArcSinhTargetScaler
3,3,0.5823687304191453,2024-03-08 04:36:48.860196,2024-03-08 04:37:43.510499,0 days 00:00:54.650303,8,,COMPLETE,XGB,0.634874791761776,,,,,,,,,0.006362434355488946,dart,0.002154301760815526,0.0023653212369674353,depthwise,9.559792745110151e-05,forest,0.02543786862695213,uniform,1.7106822083607074e-08,10,IIDPreprocessor,DummyImputer,ArcSinhTargetScaler
4,4,0.634874791761776,2024-03-08 04:37:43.512258,2024-03-08 04:38:15.488178,0 days 00:00:31.975920,3,,COMPLETE,XGB,0.634874791761776,,,,,,,,,0.0015332500824685735,dart,0.47828363603877366,4.0269935878555313e-05,lossguide,0.0006668619857595513,forest,4.505877562111235e-06,uniform,0.00023199503494286775,10,IIDPreprocessor,DummyImputer,ArcSinhTargetScaler
5,5,0.5420682830762669,2024-03-08 04:38:15.489213,2024-03-08 04:39:06.142745,0 days 00:00:50.653532,7,,COMPLETE,XGB,0.634874791761776,,,,,,,,,4.943626882163619e-06,dart,2.4761871166026046e-06,2.781199496099661e-07,lossguide,4.8090816295432645e-06,forest,1.3456464655699609e-08,uniform,1.2492890306044452e-07,10,IIDPreprocessor,DummyImputer,ArcSinhTargetScaler
6,6,0.5523562133768504,2024-03-08 04:39:06.144631,2024-03-08 04:39:55.643254,0 days 00:00:49.498623,6,,COMPLETE,XGB,0.634874791761776,,,,,,,,,8.345863934175503e-06,dart,4.032342152786103e-06,0.00918964252370002,depthwise,0.13286351285659717,tree,0.12131339372440728,uniform,0.5230005857445976,10,IIDPreprocessor,DummyImputer,ArcSinhTargetScaler
7,7,0.5938386550480229,2024-03-08 04:39:55.644614,2024-03-08 04:40:33.998830,0 days 00:00:38.354216,9,,COMPLETE,XGB,0.634874791761776,,,,,,,,,0.0006025065665989837,dart,0.7501978721893705,9.31922859880884e-06,depthwise,0.0018556394301280665,forest,0.0002531033168379798,uniform,0.8724570462919707,10,IIDPreprocessor,DummyImputer,ArcSinhTargetScaler
8,8,0.526151365865363,2024-03-08 04:40:34.000745,2024-03-08 04:40:57.673368,0 days 00:00:23.672623,1,,COMPLETE,XGB,0.634874791761776,,,,,,,,,6.115260162289964e-08,dart,0.036239447876971524,3.4342079900943126e-08,depthwise,0.0006435150512892078,tree,1.66432596220963e-08,uniform,0.03965385742290233,10,IIDPreprocessor,DummyImputer,ArcSinhTargetScaler
9,9,0.5732209757540817,2024-03-08 04:40:57.674950,2024-03-08 04:41:56.894255,0 days 00:00:59.219305,9,,COMPLETE,XGB,0.634874791761776,,,,,,,,,0.08313525128331953,dart,0.0008633948635821858,1.3774592844564632e-07,lossguide,3.752577862394666e-08,tree,2.4497835640218705e-08,uniform,0.002046741046887689,10,IIDPreprocessor,DummyImputer,ArcSinhTargetScaler
10,10,0.6236246101603982,2024-03-08 04:41:56.895586,2024-03-08 04:42:35.571713,0 days 00:00:38.676127,5,,COMPLETE,XGB,0.634874791761776,,,,,,,,,2.1251763512740348e-08,dart,0.24094958336220038,0.00043871319909260495,depthwise,0.0693329117451565,forest,0.017368040783367185,weighted,3.8035769631824563e-06,10,IIDPreprocessor,DummyImputer,ArcSinhTargetScaler
11,11,0.44473385168618473,2024-03-08 04:42:35.573180,2024-03-08 04:42:56.310823,0 days 00:00:20.737643,1,,COMPLETE,XGB,0.634874791761776,,,,,,,,,0.27898123615756687,dart,0.001138546504441025,2.0966499284730787e-06,depthwise,0.0015739073387717427,tree,0.09838040701880947,weighted,0.0006292942241008001,10,IIDPreprocessor,DummyImputer,ArcSinhTargetScaler
12,12,0.5659284271397244,2024-03-08 04:42:56.312059,2024-03-08 04:43:19.842577,0 days 00:00:23.530518,1,,COMPLETE,XGB,0.634874791761776,,,,,,,,,8.504183610994933e-07,dart,0.09503846904699494,6.975835765258956e-06,depthwise,8.65935194363134e-06,tree,0.00042282111889625415,weighted,1.4547808812626805e-07,10,IIDPreprocessor,DummyImputer,ArcSinhTargetScaler
13,13,0.5695989167131992,2024-03-08 04:43:19.843905,2024-03-08 04:43:56.609462,0 days 00:00:36.765557,4,,COMPLETE,XGB,0.634874791761776,,,,,,,,,3.853775536082286e-07,dart,5.074363375327187e-06,7.672148630936993e-07,lossguide,0.02342014652779383,tree,0.001981067752235861,uniform,3.0814906756196126e-08,10,IIDPreprocessor,DummyImputer,ArcSinhTargetScaler
14,14,0.5229374616857045,2024-03-08 04:43:56.610595,2024-03-08 04:44:22.958711,0 days 00:00:26.348116,2,,COMPLETE,XGB,0.634874791761776,,,,,,,,,3.643541747600666e-06,dart,8.715157116019974e-05,0.05866218980286108,depthwise,0.08278711027000496,forest,0.006929062306499531,uniform,0.0060947851281773656,10,IIDPreprocessor,DummyImputer,ArcSinhTargetScaler
