,number,value,datetime_start,datetime_complete,duration,params_max_depth,params_n_estimators,state,model,best_value,params_bagging_fraction,params_bagging_freq,params_feature_fraction,params_lambda_l1,params_lambda_l2,params_learning_rate,params_min_child_samples,params_num_leaves,params_alpha,params_booster,params_eta,params_gamma,params_grow_policy,params_lambda,params_normalize_type,params_rate_drop,params_sample_type,params_skip_drop,config_id,preprocessor,imputer,target_scaler
34,34,0.5688386542697424,2024-03-07 19:58:27.642948,2024-03-07 19:59:02.295726,0 days 00:00:34.652778,3,,COMPLETE,XGB,0.6342950436650778,,,,,,,,,0.10259489655644169,dart,0.0003542853313249979,7.959784414626458e-05,depthwise,1.6350508332554925e-06,tree,8.714099018877832e-08,uniform,0.002028606294701779,2,BaselinePreprocessor,DummyImputer,DummyTargetScaler
35,35,0.5507890971686591,2024-03-07 19:59:02.297482,2024-03-07 20:00:05.207539,0 days 00:01:02.910057,8,,COMPLETE,XGB,0.6342950436650778,,,,,,,,,0.0017255953021860693,dart,8.784877560560172e-05,3.1867210140819196e-06,depthwise,3.6733018467726094e-06,tree,0.04050264113046946,weighted,8.716927456762164e-06,2,BaselinePreprocessor,DummyImputer,DummyTargetScaler
36,36,0.5765169647817522,2024-03-07 20:00:05.212785,2024-03-07 20:00:49.742487,0 days 00:00:44.529702,5,,COMPLETE,XGB,0.6342950436650778,,,,,,,,,0.14030552048604816,dart,5.872395447772793e-05,1.1777732288025835e-05,depthwise,0.007699156828759161,forest,4.022903759076732e-06,uniform,0.4815653989644809,2,BaselinePreprocessor,DummyImputer,DummyTargetScaler
37,37,0.546106045776002,2024-03-07 20:00:49.743920,2024-03-07 20:01:42.582902,0 days 00:00:52.838982,8,,COMPLETE,XGB,0.6342950436650778,,,,,,,,,2.725024520240405e-08,dart,4.740569377044877e-05,0.008049602240175016,lossguide,3.6987707053892285e-07,tree,0.2706044233257344,uniform,1.44204929977621e-08,2,BaselinePreprocessor,DummyImputer,DummyTargetScaler
38,38,0.5709125201007466,2024-03-07 20:01:42.584998,2024-03-07 20:02:40.372356,0 days 00:00:57.787358,7,,COMPLETE,XGB,0.6342950436650778,,,,,,,,,3.0408718981698375e-07,dart,3.729703494448116e-05,7.421619127351676e-07,depthwise,0.9000599592927696,forest,3.365147947575416e-08,weighted,1.5606230662169543e-06,2,BaselinePreprocessor,DummyImputer,DummyTargetScaler
39,39,0.5660188879807349,2024-03-07 20:02:40.375292,2024-03-07 20:03:17.047181,0 days 00:00:36.671889,3,,COMPLETE,XGB,0.6342950436650778,,,,,,,,,2.091821842585591e-05,dart,0.009060051969281797,0.08889933220626557,lossguide,1.1510761107884798e-05,forest,8.682531232305976e-05,uniform,0.13946656052562956,2,BaselinePreprocessor,DummyImputer,DummyTargetScaler
0,0,0.5974651199197791,2024-03-07 20:04:44.875259,2024-03-07 20:04:55.539291,0 days 00:00:10.664032,15,400.0,COMPLETE,RandomForest,0.6179069565215595,,,,,,,,,,,,,,,,,,,3,BaselinePreprocessor,RevenueQuantileBucketImputer:3-buckets,LogTargetScaler
1,1,0.6148087503959503,2024-03-07 20:04:55.540058,2024-03-07 20:05:28.158679,0 days 00:00:32.618621,30,1100.0,COMPLETE,RandomForest,0.6179069565215595,,,,,,,,,,,,,,,,,,,3,BaselinePreprocessor,RevenueQuantileBucketImputer:3-buckets,LogTargetScaler
2,2,0.601007904674581,2024-03-07 20:05:28.159341,2024-03-07 20:05:42.868154,0 days 00:00:14.708813,51,500.0,COMPLETE,RandomForest,0.6179069565215595,,,,,,,,,,,,,,,,,,,3,BaselinePreprocessor,RevenueQuantileBucketImputer:3-buckets,LogTargetScaler
3,3,0.6050315911285622,2024-03-07 20:05:42.868902,2024-03-07 20:05:48.676879,0 days 00:00:05.807977,48,200.0,COMPLETE,RandomForest,0.6179069565215595,,,,,,,,,,,,,,,,,,,3,BaselinePreprocessor,RevenueQuantileBucketImputer:3-buckets,LogTargetScaler
4,4,0.6069106330839352,2024-03-07 20:05:48.677455,2024-03-07 20:06:03.402501,0 days 00:00:14.725046,99,300.0,COMPLETE,RandomForest,0.6179069565215595,,,,,,,,,,,,,,,,,,,3,BaselinePreprocessor,RevenueQuantileBucketImputer:3-buckets,LogTargetScaler
5,5,0.5961803104639423,2024-03-07 20:06:03.404573,2024-03-07 20:06:25.504560,0 days 00:00:22.099987,21,700.0,COMPLETE,RandomForest,0.6179069565215595,,,,,,,,,,,,,,,,,,,3,BaselinePreprocessor,RevenueQuantileBucketImputer:3-buckets,LogTargetScaler
6,6,0.606458774725982,2024-03-07 20:06:25.505352,2024-03-07 20:07:06.350196,0 days 00:00:40.844844,51,1300.0,COMPLETE,RandomForest,0.6179069565215595,,,,,,,,,,,,,,,,,,,3,BaselinePreprocessor,RevenueQuantileBucketImputer:3-buckets,LogTargetScaler
7,7,0.6053081971161665,2024-03-07 20:07:06.350748,2024-03-07 20:07:40.204769,0 days 00:00:33.854021,96,1100.0,COMPLETE,RandomForest,0.6179069565215595,,,,,,,,,,,,,,,,,,,3,BaselinePreprocessor,RevenueQuantileBucketImputer:3-buckets,LogTargetScaler
8,8,0.603641609452513,2024-03-07 20:07:40.205436,2024-03-07 20:08:09.170958,0 days 00:00:28.965522,54,800.0,COMPLETE,RandomForest,0.6179069565215595,,,,,,,,,,,,,,,,,,,3,BaselinePreprocessor,RevenueQuantileBucketImputer:3-buckets,LogTargetScaler
9,9,0.6136405303167778,2024-03-07 20:08:09.172632,2024-03-07 20:08:23.415220,0 days 00:00:14.242588,33,500.0,COMPLETE,RandomForest,0.6179069565215595,,,,,,,,,,,,,,,,,,,3,BaselinePreprocessor,RevenueQuantileBucketImputer:3-buckets,LogTargetScaler
10,10,0.6133726033207394,2024-03-07 20:08:23.415859,2024-03-07 20:08:42.887808,0 days 00:00:19.471949,54,700.0,COMPLETE,RandomForest,0.6179069565215595,,,,,,,,,,,,,,,,,,,3,BaselinePreprocessor,RevenueQuantileBucketImputer:3-buckets,LogTargetScaler
11,11,0.6121918864416711,2024-03-07 20:08:42.888374,2024-03-07 20:08:53.884042,0 days 00:00:10.995668,54,400.0,COMPLETE,RandomForest,0.6179069565215595,,,,,,,,,,,,,,,,,,,3,BaselinePreprocessor,RevenueQuantileBucketImputer:3-buckets,LogTargetScaler
12,12,0.5989101275657881,2024-03-07 20:08:53.884669,2024-03-07 20:09:06.121501,0 days 00:00:12.236832,33,400.0,COMPLETE,RandomForest,0.6179069565215595,,,,,,,,,,,,,,,,,,,3,BaselinePreprocessor,RevenueQuantileBucketImputer:3-buckets,LogTargetScaler
13,13,0.6162895687545236,2024-03-07 20:09:06.122234,2024-03-07 20:09:44.512768,0 days 00:00:38.390534,81,1300.0,COMPLETE,RandomForest,0.6179069565215595,,,,,,,,,,,,,,,,,,,3,BaselinePreprocessor,RevenueQuantileBucketImputer:3-buckets,LogTargetScaler
14,14,0.5984052158106514,2024-03-07 20:09:44.513672,2024-03-07 20:09:50.260256,0 days 00:00:05.746584,66,200.0,COMPLETE,RandomForest,0.6179069565215595,,,,,,,,,,,,,,,,,,,3,BaselinePreprocessor,RevenueQuantileBucketImputer:3-buckets,LogTargetScaler
15,15,0.6059000138193424,2024-03-07 20:09:50.260814,2024-03-07 20:10:33.617467,0 days 00:00:43.356653,36,1400.0,COMPLETE,RandomForest,0.6179069565215595,,,,,,,,,,,,,,,,,,,3,BaselinePreprocessor,RevenueQuantileBucketImputer:3-buckets,LogTargetScaler
16,16,0.594815808577778,2024-03-07 20:10:33.618301,2024-03-07 20:10:54.331635,0 days 00:00:20.713334,84,700.0,COMPLETE,RandomForest,0.6179069565215595,,,,,,,,,,,,,,,,,,,3,BaselinePreprocessor,RevenueQuantileBucketImputer:3-buckets,LogTargetScaler
17,17,0.598431668399749,2024-03-07 20:10:54.332390,2024-03-07 20:11:36.502984,0 days 00:00:42.170594,27,1400.0,COMPLETE,RandomForest,0.6179069565215595,,,,,,,,,,,,,,,,,,,3,BaselinePreprocessor,RevenueQuantileBucketImputer:3-buckets,LogTargetScaler
18,18,0.6124069342914802,2024-03-07 20:11:36.503640,2024-03-07 20:11:58.758003,0 days 00:00:22.254363,93,600.0,COMPLETE,RandomForest,0.6179069565215595,,,,,,,,,,,,,,,,,,,3,BaselinePreprocessor,RevenueQuantileBucketImputer:3-buckets,LogTargetScaler
19,19,0.5849711245516107,2024-03-07 20:11:58.760103,2024-03-07 20:12:17.276624,0 days 00:00:18.516521,27,600.0,COMPLETE,RandomForest,0.6179069565215595,,,,,,,,,,,,,,,,,,,3,BaselinePreprocessor,RevenueQuantileBucketImputer:3-buckets,LogTargetScaler
20,20,0.3340471860917154,2024-03-07 20:12:17.277451,2024-03-07 20:12:19.252912,0 days 00:00:01.975461,3,200.0,COMPLETE,RandomForest,0.6179069565215595,,,,,,,,,,,,,,,,,,,3,BaselinePreprocessor,RevenueQuantileBucketImputer:3-buckets,LogTargetScaler
21,21,0.6019336122865387,2024-03-07 20:12:19.253675,2024-03-07 20:12:48.085200,0 days 00:00:28.831525,90,1000.0,COMPLETE,RandomForest,0.6179069565215595,,,,,,,,,,,,,,,,,,,3,BaselinePreprocessor,RevenueQuantileBucketImputer:3-buckets,LogTargetScaler
22,22,0.6179069565215595,2024-03-07 20:12:48.085876,2024-03-07 20:13:16.256069,0 days 00:00:28.170193,39,900.0,COMPLETE,RandomForest,0.6179069565215595,,,,,,,,,,,,,,,,,,,3,BaselinePreprocessor,RevenueQuantileBucketImputer:3-buckets,LogTargetScaler
23,23,0.6088429241238452,2024-03-07 20:13:16.256883,2024-03-07 20:13:31.355587,0 days 00:00:15.098704,60,500.0,COMPLETE,RandomForest,0.6179069565215595,,,,,,,,,,,,,,,,,,,3,BaselinePreprocessor,RevenueQuantileBucketImputer:3-buckets,LogTargetScaler
24,24,0.5799322917115202,2024-03-07 20:13:31.356168,2024-03-07 20:14:10.198641,0 days 00:00:38.842473,12,1400.0,COMPLETE,RandomForest,0.6179069565215595,,,,,,,,,,,,,,,,,,,3,BaselinePreprocessor,RevenueQuantileBucketImputer:3-buckets,LogTargetScaler
25,25,0.5942880592933789,2024-03-07 20:14:10.200317,2024-03-07 20:14:21.753733,0 days 00:00:11.553416,60,400.0,COMPLETE,RandomForest,0.6179069565215595,,,,,,,,,,,,,,,,,,,3,BaselinePreprocessor,RevenueQuantileBucketImputer:3-buckets,LogTargetScaler
26,26,0.6060272747294273,2024-03-07 20:14:21.754320,2024-03-07 20:14:27.238184,0 days 00:00:05.483864,57,200.0,COMPLETE,RandomForest,0.6179069565215595,,,,,,,,,,,,,,,,,,,3,BaselinePreprocessor,RevenueQuantileBucketImputer:3-buckets,LogTargetScaler
27,27,0.6025861178979405,2024-03-07 20:14:27.238709,2024-03-07 20:14:41.284431,0 days 00:00:14.045722,93,500.0,COMPLETE,RandomForest,0.6179069565215595,,,,,,,,,,,,,,,,,,,3,BaselinePreprocessor,RevenueQuantileBucketImputer:3-buckets,LogTargetScaler
28,28,0.5963854228097784,2024-03-07 20:14:41.285041,2024-03-07 20:15:21.262573,0 days 00:00:39.977532,21,1400.0,COMPLETE,RandomForest,0.6179069565215595,,,,,,,,,,,,,,,,,,,3,BaselinePreprocessor,RevenueQuantileBucketImputer:3-buckets,LogTargetScaler
29,29,0.6036555920629837,2024-03-07 20:15:21.263348,2024-03-07 20:16:09.412633,0 days 00:00:48.149285,99,1500.0,COMPLETE,RandomForest,0.6179069565215595,,,,,,,,,,,,,,,,,,,3,BaselinePreprocessor,RevenueQuantileBucketImputer:3-buckets,LogTargetScaler
30,30,0.608455045550601,2024-03-07 20:16:09.414047,2024-03-07 20:16:26.003040,0 days 00:00:16.588993,63,600.0,COMPLETE,RandomForest,0.6179069565215595,,,,,,,,,,,,,,,,,,,3,BaselinePreprocessor,RevenueQuantileBucketImputer:3-buckets,LogTargetScaler
31,31,0.6070464305817544,2024-03-07 20:16:26.003863,2024-03-07 20:17:03.678096,0 days 00:00:37.674233,30,1300.0,COMPLETE,RandomForest,0.6179069565215595,,,,,,,,,,,,,,,,,,,3,BaselinePreprocessor,RevenueQuantileBucketImputer:3-buckets,LogTargetScaler
32,32,0.6059417130327276,2024-03-07 20:17:03.679129,2024-03-07 20:17:32.216957,0 days 00:00:28.537828,21,1000.0,COMPLETE,RandomForest,0.6179069565215595,,,,,,,,,,,,,,,,,,,3,BaselinePreprocessor,RevenueQuantileBucketImputer:3-buckets,LogTargetScaler
33,33,0.6067169886794624,2024-03-07 20:17:32.217762,2024-03-07 20:17:56.497406,0 days 00:00:24.279644,30,800.0,COMPLETE,RandomForest,0.6179069565215595,,,,,,,,,,,,,,,,,,,3,BaselinePreprocessor,RevenueQuantileBucketImputer:3-buckets,LogTargetScaler
34,34,0.597641189223658,2024-03-07 20:17:56.498202,2024-03-07 20:17:59.682043,0 days 00:00:03.183841,33,100.0,COMPLETE,RandomForest,0.6179069565215595,,,,,,,,,,,,,,,,,,,3,BaselinePreprocessor,RevenueQuantileBucketImputer:3-buckets,LogTargetScaler
35,35,0.6039174891711381,2024-03-07 20:17:59.682787,2024-03-07 20:18:24.188990,0 days 00:00:24.506203,99,800.0,COMPLETE,RandomForest,0.6179069565215595,,,,,,,,,,,,,,,,,,,3,BaselinePreprocessor,RevenueQuantileBucketImputer:3-buckets,LogTargetScaler
36,36,0.487687719435246,2024-03-07 20:18:24.189549,2024-03-07 20:18:43.198855,0 days 00:00:19.009306,6,1300.0,COMPLETE,RandomForest,0.6179069565215595,,,,,,,,,,,,,,,,,,,3,BaselinePreprocessor,RevenueQuantileBucketImputer:3-buckets,LogTargetScaler
37,37,0.614762927666244,2024-03-07 20:18:43.199583,2024-03-07 20:19:20.664172,0 days 00:00:37.464589,33,1200.0,COMPLETE,RandomForest,0.6179069565215595,,,,,,,,,,,,,,,,,,,3,BaselinePreprocessor,RevenueQuantileBucketImputer:3-buckets,LogTargetScaler
38,38,0.6035616183035941,2024-03-07 20:19:20.664794,2024-03-07 20:19:32.729434,0 days 00:00:12.064640,24,400.0,COMPLETE,RandomForest,0.6179069565215595,,,,,,,,,,,,,,,,,,,3,BaselinePreprocessor,RevenueQuantileBucketImputer:3-buckets,LogTargetScaler
39,39,0.5976171290185641,2024-03-07 20:19:32.730133,2024-03-07 20:19:35.924923,0 days 00:00:03.194790,90,100.0,COMPLETE,RandomForest,0.6179069565215595,,,,,,,,,,,,,,,,,,,3,BaselinePreprocessor,RevenueQuantileBucketImputer:3-buckets,LogTargetScaler
0,0,0.6324924102542775,2024-03-07 20:20:08.921087,2024-03-07 20:20:18.280091,0 days 00:00:09.359004,84,310.0,COMPLETE,LGBM,0.6502714122074738,0.6168009720333274,3.0,0.5156162261427799,2.0085534600352558e-05,7.84963712195864e-06,0.07280031602815032,88.0,217.0,,,,,,,,,,,3,BaselinePreprocessor,RevenueQuantileBucketImputer:3-buckets,LogTargetScaler
1,1,0.6330088169773557,2024-03-07 20:20:18.282018,2024-03-07 20:21:22.855289,0 days 00:01:04.573271,36,910.0,COMPLETE,LGBM,0.6502714122074738,0.9705718776338714,6.0,0.9393251002348357,0.06337316660586285,0.04206928973950465,0.02041625594243696,25.0,142.0,,,,,,,,,,,3,BaselinePreprocessor,RevenueQuantileBucketImputer:3-buckets,LogTargetScaler
2,2,0.6403681671721859,2024-03-07 20:21:22.856411,2024-03-07 20:22:22.160919,0 days 00:00:59.304508,72,1010.0,COMPLETE,LGBM,0.6502714122074738,0.5108406359992087,6.0,0.6106428626986488,0.00046243082878341674,1.1167474567113018,0.028004939123101227,16.0,221.0,,,,,,,,,,,3,BaselinePreprocessor,RevenueQuantileBucketImputer:3-buckets,LogTargetScaler
3,3,0.6281107000278695,2024-03-07 20:22:22.165166,2024-03-07 20:22:40.233218,0 days 00:00:18.068052,93,1210.0,COMPLETE,LGBM,0.6502714122074738,0.9100754544342602,3.0,0.5606794307882528,0.44369760493835997,0.005907807798800733,0.07623370197032378,46.0,238.0,,,,,,,,,,,3,BaselinePreprocessor,RevenueQuantileBucketImputer:3-buckets,LogTargetScaler
4,4,0.6231970567321878,2024-03-07 20:22:40.234641,2024-03-07 20:23:01.696438,0 days 00:00:21.461797,15,810.0,COMPLETE,LGBM,0.6502714122074738,0.5035618717009644,2.0,0.7852070771126263,2.0612868561515052e-06,6.191424921714586e-07,0.012826043359594091,87.0,8.0,,,,,,,,,,,3,BaselinePreprocessor,RevenueQuantileBucketImputer:3-buckets,LogTargetScaler
5,5,0.6398093585364496,2024-03-07 20:23:01.698568,2024-03-07 20:24:05.391775,0 days 00:01:03.693207,21,1010.0,COMPLETE,LGBM,0.6502714122074738,0.9166893218117307,5.0,0.5603715126273222,0.010710120326698963,0.3776620280790275,0.05988042098568712,43.0,35.0,,,,,,,,,,,3,BaselinePreprocessor,RevenueQuantileBucketImputer:3-buckets,LogTargetScaler
6,6,0.628547957608238,2024-03-07 20:24:05.396975,2024-03-07 20:24:18.928646,0 days 00:00:13.531671,75,110.0,COMPLETE,LGBM,0.6502714122074738,0.6099434507498688,4.0,0.8941957234193887,0.010481982195466477,0.00034950045826891233,0.043592909061387325,18.0,187.0,,,,,,,,,,,3,BaselinePreprocessor,RevenueQuantileBucketImputer:3-buckets,LogTargetScaler
7,7,0.12616854038432046,2024-03-07 20:24:18.930098,2024-03-07 20:24:29.345370,0 days 00:00:10.415272,81,710.0,COMPLETE,LGBM,0.6502714122074738,0.4178073499458211,7.0,0.4147099926045999,6.76388810500881e-08,3.200970960765887e-07,0.15354671606348874,9.0,110.0,,,,,,,,,,,3,BaselinePreprocessor,RevenueQuantileBucketImputer:3-buckets,LogTargetScaler
8,8,0.6502714122074738,2024-03-07 20:24:29.347164,2024-03-07 20:25:48.370771,0 days 00:01:19.023607,75,610.0,COMPLETE,LGBM,0.6502714122074738,0.769126807932947,1.0,0.6275840591506604,0.004769397289066568,0.04361658435320011,0.016294705958683004,8.0,205.0,,,,,,,,,,,3,BaselinePreprocessor,RevenueQuantileBucketImputer:3-buckets,LogTargetScaler
9,9,0.6059175791947148,2024-03-07 20:25:48.372479,2024-03-07 20:26:15.843279,0 days 00:00:27.470800,69,810.0,COMPLETE,LGBM,0.6502714122074738,0.9868895525296252,1.0,0.7290716574731388,3.72827029006229,0.0007493447305759631,0.02408314291068987,11.0,128.0,,,,,,,,,,,3,BaselinePreprocessor,RevenueQuantileBucketImputer:3-buckets,LogTargetScaler
10,10,0.5665978007171703,2024-03-07 20:26:15.845604,2024-03-07 20:26:16.370545,0 days 00:00:00.524941,78,10.0,COMPLETE,LGBM,0.6502714122074738,0.6221071220677461,7.0,0.5670260759648948,0.011963767052395775,1.2538001051798384e-05,0.1358660094396094,61.0,85.0,,,,,,,,,,,3,BaselinePreprocessor,RevenueQuantileBucketImputer:3-buckets,LogTargetScaler
11,11,0.6134810004599264,2024-03-07 20:26:16.371892,2024-03-07 20:26:19.463844,0 days 00:00:03.091952,3,210.0,COMPLETE,LGBM,0.6502714122074738,0.531454553154913,1.0,0.9875350159701496,1.812017499069205e-06,0.18299248489566577,0.2062761672582355,88.0,3.0,,,,,,,,,,,3,BaselinePreprocessor,RevenueQuantileBucketImputer:3-buckets,LogTargetScaler
12,12,0.5858580128798995,2024-03-07 20:26:19.465444,2024-03-07 20:26:26.983224,0 days 00:00:07.517780,66,810.0,COMPLETE,LGBM,0.6502714122074738,0.960414315204467,7.0,0.7274069658689546,0.00019553435399248864,7.123060467995242e-08,0.09998169664744583,5.0,2.0,,,,,,,,,,,3,BaselinePreprocessor,RevenueQuantileBucketImputer:3-buckets,LogTargetScaler
13,13,0.6279316978806034,2024-03-07 20:26:26.984191,2024-03-07 20:26:53.685251,0 days 00:00:26.701060,42,1210.0,COMPLETE,LGBM,0.6502714122074738,0.8707936598136982,5.0,0.6635747266169729,0.05787987552431261,0.22461769323437278,0.08394419655618762,65.0,49.0,,,,,,,,,,,3,BaselinePreprocessor,RevenueQuantileBucketImputer:3-buckets,LogTargetScaler
14,14,0.6246449632226538,2024-03-07 20:26:53.686727,2024-03-07 20:27:46.431180,0 days 00:00:52.744453,69,310.0,COMPLETE,LGBM,0.6502714122074738,0.7357047180594578,5.0,0.9244341798070959,0.39675325018135604,3.626418641065264e-08,0.018430205210909288,7.0,54.0,,,,,,,,,,,3,BaselinePreprocessor,RevenueQuantileBucketImputer:3-buckets,LogTargetScaler
15,15,0.632658228221643,2024-03-07 20:27:46.432836,2024-03-07 20:28:31.467179,0 days 00:00:45.034343,51,910.0,COMPLETE,LGBM,0.6502714122074738,0.4538978194470925,3.0,0.9602160697272099,3.2744619708567086e-05,0.02105912972731256,0.0479653207379127,73.0,48.0,,,,,,,,,,,3,BaselinePreprocessor,RevenueQuantileBucketImputer:3-buckets,LogTargetScaler
16,16,0.5976726895488709,2024-03-07 20:28:31.470863,2024-03-07 20:28:36.720000,0 days 00:00:05.249137,69,310.0,COMPLETE,LGBM,0.6502714122074738,0.4143116322698967,5.0,0.534433643930976,3.0340950167348555e-08,0.003523406908903962,0.15864630614173164,97.0,42.0,,,,,,,,,,,3,BaselinePreprocessor,RevenueQuantileBucketImputer:3-buckets,LogTargetScaler
17,17,0.6351296968215835,2024-03-07 20:28:36.721235,2024-03-07 20:29:45.464532,0 days 00:01:08.743297,36,1210.0,COMPLETE,LGBM,0.6502714122074738,0.8188616663419799,6.0,0.7408229838197002,4.382020608037861e-08,0.17949746383918452,0.046857040348110404,33.0,212.0,,,,,,,,,,,3,BaselinePreprocessor,RevenueQuantileBucketImputer:3-buckets,LogTargetScaler
18,18,0.5786097107109622,2024-03-07 20:29:45.465489,2024-03-07 20:29:49.888033,0 days 00:00:04.422544,30,110.0,COMPLETE,LGBM,0.6502714122074738,0.6162558812706566,5.0,0.7147484337157854,0.11135359803881452,0.007032823081963778,0.01017302161821031,57.0,184.0,,,,,,,,,,,3,BaselinePreprocessor,RevenueQuantileBucketImputer:3-buckets,LogTargetScaler
19,19,0.608162593191408,2024-03-07 20:29:49.889561,2024-03-07 20:30:11.145626,0 days 00:00:21.256065,9,1410.0,COMPLETE,LGBM,0.6502714122074738,0.5876846206331232,5.0,0.4853121138782282,8.151801615594746,0.16443489708534137,0.03417409100258354,14.0,158.0,,,,,,,,,,,3,BaselinePreprocessor,RevenueQuantileBucketImputer:3-buckets,LogTargetScaler
20,20,0.6233228770346951,2024-03-07 20:30:11.149521,2024-03-07 20:30:33.707521,0 days 00:00:22.558000,51,1210.0,COMPLETE,LGBM,0.6502714122074738,0.7905985294819129,2.0,0.9853543382331494,5.779145596453589,3.993626238743278e-05,0.030130370341297057,93.0,64.0,,,,,,,,,,,3,BaselinePreprocessor,RevenueQuantileBucketImputer:3-buckets,LogTargetScaler
21,21,0.6217062892762859,2024-03-07 20:30:33.709626,2024-03-07 20:30:44.971184,0 days 00:00:11.261558,21,210.0,COMPLETE,LGBM,0.6502714122074738,0.7101670714013673,6.0,0.4202464334566709,2.2717665403301577e-08,0.2803523398968659,0.01916914702445093,32.0,62.0,,,,,,,,,,,3,BaselinePreprocessor,RevenueQuantileBucketImputer:3-buckets,LogTargetScaler
22,22,0.6339455768195417,2024-03-07 20:30:44.972604,2024-03-07 20:30:54.726635,0 days 00:00:09.754031,69,110.0,COMPLETE,LGBM,0.6502714122074738,0.7552854432106322,4.0,0.924152885534057,2.896591121609926e-08,0.000497124727769136,0.24721195497579557,54.0,53.0,,,,,,,,,,,3,BaselinePreprocessor,RevenueQuantileBucketImputer:3-buckets,LogTargetScaler
23,23,0.6386527817496389,2024-03-07 20:30:54.728010,2024-03-07 20:31:28.289942,0 days 00:00:33.561932,6,1210.0,COMPLETE,LGBM,0.6502714122074738,0.5514066079238273,4.0,0.5983809491933396,0.005229741731918193,9.2556499359869,0.16183018989564754,32.0,88.0,,,,,,,,,,,3,BaselinePreprocessor,RevenueQuantileBucketImputer:3-buckets,LogTargetScaler
24,24,0.6327941489364068,2024-03-07 20:31:28.291112,2024-03-07 20:32:10.361796,0 days 00:00:42.070684,42,1010.0,COMPLETE,LGBM,0.6502714122074738,0.5956190421243677,3.0,0.4972168105422475,7.811822194051552e-06,2.7774210946063333e-08,0.07116666360517777,12.0,70.0,,,,,,,,,,,3,BaselinePreprocessor,RevenueQuantileBucketImputer:3-buckets,LogTargetScaler
25,25,0.6285277114326057,2024-03-07 20:32:10.364892,2024-03-07 20:32:22.054988,0 days 00:00:11.690096,48,410.0,COMPLETE,LGBM,0.6502714122074738,0.8677857829940903,2.0,0.49002464860543377,6.54090069330443e-07,0.5260960497473713,0.15330053487088463,95.0,169.0,,,,,,,,,,,3,BaselinePreprocessor,RevenueQuantileBucketImputer:3-buckets,LogTargetScaler
26,26,0.6220331628477467,2024-03-07 20:32:22.056592,2024-03-07 20:32:42.013929,0 days 00:00:19.957337,45,1210.0,COMPLETE,LGBM,0.6502714122074738,0.7330744003699907,3.0,0.813512043753275,5.085791902057257e-07,2.1863231498738468e-08,0.2507489240876199,16.0,34.0,,,,,,,,,,,3,BaselinePreprocessor,RevenueQuantileBucketImputer:3-buckets,LogTargetScaler
