,number,value,datetime_start,datetime_complete,duration,params_max_depth,params_n_estimators,state,model,best_value,params_bagging_fraction,params_bagging_freq,params_feature_fraction,params_lambda_l1,params_lambda_l2,params_learning_rate,params_min_child_samples,params_num_leaves,params_alpha,params_booster,params_eta,params_gamma,params_grow_policy,params_lambda,params_normalize_type,params_rate_drop,params_sample_type,params_skip_drop,config_id,preprocessor,imputer,target_scaler
33,33,0.6549408894141953,2024-03-07 23:35:40.859319,2024-03-07 23:35:49.379832,0 days 00:00:08.520513,36,300.0,COMPLETE,RandomForest,0.67355193000151,,,,,,,,,,,,,,,,,,,6,BaselinePreprocessor,HybridCategoricalStatisticsImputer,LogTargetScaler
34,34,0.6724598957166997,2024-03-07 23:35:49.380979,2024-03-07 23:36:07.065322,0 days 00:00:17.684343,63,600.0,COMPLETE,RandomForest,0.67355193000151,,,,,,,,,,,,,,,,,,,6,BaselinePreprocessor,HybridCategoricalStatisticsImputer,LogTargetScaler
35,35,0.6547053875785979,2024-03-07 23:36:07.066236,2024-03-07 23:36:12.964475,0 days 00:00:05.898239,78,200.0,COMPLETE,RandomForest,0.67355193000151,,,,,,,,,,,,,,,,,,,6,BaselinePreprocessor,HybridCategoricalStatisticsImputer,LogTargetScaler
36,36,0.6629894457841727,2024-03-07 23:36:12.965457,2024-03-07 23:36:24.088162,0 days 00:00:11.122705,69,400.0,COMPLETE,RandomForest,0.67355193000151,,,,,,,,,,,,,,,,,,,6,BaselinePreprocessor,HybridCategoricalStatisticsImputer,LogTargetScaler
37,37,0.6660059133583143,2024-03-07 23:36:24.089139,2024-03-07 23:36:41.232224,0 days 00:00:17.143085,54,600.0,COMPLETE,RandomForest,0.67355193000151,,,,,,,,,,,,,,,,,,,6,BaselinePreprocessor,HybridCategoricalStatisticsImputer,LogTargetScaler
38,38,0.6542623426269827,2024-03-07 23:36:41.233311,2024-03-07 23:37:16.386978,0 days 00:00:35.153667,12,1400.0,COMPLETE,RandomForest,0.67355193000151,,,,,,,,,,,,,,,,,,,6,BaselinePreprocessor,HybridCategoricalStatisticsImputer,LogTargetScaler
39,39,0.6465932715180547,2024-03-07 23:37:16.387951,2024-03-07 23:37:24.498479,0 days 00:00:08.110528,9,400.0,COMPLETE,RandomForest,0.67355193000151,,,,,,,,,,,,,,,,,,,6,BaselinePreprocessor,HybridCategoricalStatisticsImputer,LogTargetScaler
0,0,0.6744848582027266,2024-03-07 23:37:50.445192,2024-03-07 23:37:59.757576,0 days 00:00:09.312384,21,510.0,COMPLETE,LGBM,0.6911462660712957,0.4520342203887952,4.0,0.4305103841353665,5.6584102501572896e-05,0.034993762027902844,0.11114530699910319,78.0,124.0,,,,,,,,,,,6,BaselinePreprocessor,HybridCategoricalStatisticsImputer,LogTargetScaler
1,1,0.652672566576232,2024-03-07 23:37:59.758429,2024-03-07 23:38:05.555701,0 days 00:00:05.797272,3,510.0,COMPLETE,LGBM,0.6911462660712957,0.8966496725318507,2.0,0.687446686501394,9.530309518682845,1.59321772220559,0.03326704521086266,13.0,3.0,,,,,,,,,,,6,BaselinePreprocessor,HybridCategoricalStatisticsImputer,LogTargetScaler
2,2,0.6545517942148514,2024-03-07 23:38:05.556922,2024-03-07 23:38:17.171757,0 days 00:00:11.614835,87,710.0,COMPLETE,LGBM,0.6911462660712957,0.6975961550971972,3.0,0.42374679848875896,0.024816145369072503,2.19611888724257e-06,0.11523232719498958,72.0,26.0,,,,,,,,,,,6,BaselinePreprocessor,HybridCategoricalStatisticsImputer,LogTargetScaler
3,3,0.6684545135412956,2024-03-07 23:38:17.172982,2024-03-07 23:40:08.378494,0 days 00:01:51.205512,78,1410.0,COMPLETE,LGBM,0.6911462660712957,0.5388039864248104,3.0,0.9091841945535398,1.7074359347806465e-08,0.00012279273471600967,0.012363747530857162,39.0,59.0,,,,,,,,,,,6,BaselinePreprocessor,HybridCategoricalStatisticsImputer,LogTargetScaler
4,4,0.6746339206023387,2024-03-07 23:40:08.380000,2024-03-07 23:40:25.371277,0 days 00:00:16.991277,72,1010.0,COMPLETE,LGBM,0.6911462660712957,0.5857175694163442,6.0,0.6325389078623489,0.07020292615540012,2.8394053901393643e-05,0.15015754587428737,21.0,209.0,,,,,,,,,,,6,BaselinePreprocessor,HybridCategoricalStatisticsImputer,LogTargetScaler
5,5,0.661602699585096,2024-03-07 23:40:25.372945,2024-03-07 23:40:52.145836,0 days 00:00:26.772891,51,310.0,COMPLETE,LGBM,0.6911462660712957,0.40494722402017747,7.0,0.4930950736849685,1.0965775769828607e-05,1.6662231950226122e-07,0.06677671149182468,13.0,206.0,,,,,,,,,,,6,BaselinePreprocessor,HybridCategoricalStatisticsImputer,LogTargetScaler
6,6,0.6670820860331548,2024-03-07 23:40:52.147465,2024-03-07 23:41:15.595256,0 days 00:00:23.447791,15,410.0,COMPLETE,LGBM,0.6911462660712957,0.882977789697106,1.0,0.6098609453575046,1.2149468994202444,6.201283987024236e-08,0.02373744440373126,7.0,198.0,,,,,,,,,,,6,BaselinePreprocessor,HybridCategoricalStatisticsImputer,LogTargetScaler
7,7,0.6387608310218431,2024-03-07 23:41:15.596612,2024-03-07 23:41:15.999010,0 days 00:00:00.402398,96,10.0,COMPLETE,LGBM,0.6911462660712957,0.6797084969159304,2.0,0.8020395548312188,0.06115510294206604,4.17592888599119e-06,0.014433237618106779,92.0,148.0,,,,,,,,,,,6,BaselinePreprocessor,HybridCategoricalStatisticsImputer,LogTargetScaler
8,8,0.6786215260321435,2024-03-07 23:41:16.000383,2024-03-07 23:42:33.085349,0 days 00:01:17.084966,39,1110.0,COMPLETE,LGBM,0.6911462660712957,0.6710587390889341,5.0,0.916918040463057,7.449263936185977e-07,7.481931677413348,0.035745345528761005,19.0,41.0,,,,,,,,,,,6,BaselinePreprocessor,HybridCategoricalStatisticsImputer,LogTargetScaler
9,9,0.67659511185731,2024-03-07 23:42:33.086974,2024-03-07 23:43:59.862718,0 days 00:01:26.775744,45,1310.0,COMPLETE,LGBM,0.6911462660712957,0.9260476540517197,2.0,0.5657563841542205,0.0009591476758412602,7.767073292156154e-05,0.012055515963463567,56.0,191.0,,,,,,,,,,,6,BaselinePreprocessor,HybridCategoricalStatisticsImputer,LogTargetScaler
10,10,0.6392648867754447,2024-03-07 23:43:59.864062,2024-03-07 23:44:02.449909,0 days 00:00:02.585847,48,10.0,COMPLETE,LGBM,0.6911462660712957,0.9810681391462497,6.0,0.6281270018559802,0.021669045469681278,1.662550849591666e-08,0.219655253694284,11.0,229.0,,,,,,,,,,,6,BaselinePreprocessor,HybridCategoricalStatisticsImputer,LogTargetScaler
11,11,0.6073024040433704,2024-03-07 23:44:02.451101,2024-03-07 23:44:02.833994,0 days 00:00:00.382893,54,10.0,COMPLETE,LGBM,0.6911462660712957,0.6463804746887514,7.0,0.5348388561180986,0.06926088638974803,1.8668197767637211,0.07854771319578614,59.0,38.0,,,,,,,,,,,6,BaselinePreprocessor,HybridCategoricalStatisticsImputer,LogTargetScaler
12,12,0.6682778841519973,2024-03-07 23:44:02.835334,2024-03-07 23:44:24.005340,0 days 00:00:21.170006,84,910.0,COMPLETE,LGBM,0.6911462660712957,0.7210825366820981,2.0,0.5843358526987992,1.8369598282064158e-08,1.5396828509520145e-06,0.10860606906529406,84.0,214.0,,,,,,,,,,,6,BaselinePreprocessor,HybridCategoricalStatisticsImputer,LogTargetScaler
13,13,0.6674734705404485,2024-03-07 23:44:24.006196,2024-03-07 23:45:07.185354,0 days 00:00:43.179158,42,1410.0,COMPLETE,LGBM,0.6911462660712957,0.6435261357686093,1.0,0.9543966556541885,1.6431885001602926,2.971022061783774e-06,0.019974976286938013,30.0,62.0,,,,,,,,,,,6,BaselinePreprocessor,HybridCategoricalStatisticsImputer,LogTargetScaler
14,14,0.6661540680691603,2024-03-07 23:45:07.186949,2024-03-07 23:45:17.148097,0 days 00:00:09.961148,51,310.0,COMPLETE,LGBM,0.6911462660712957,0.496983879524055,2.0,0.47657438626727605,9.126993347114952e-08,4.3711624261774825e-08,0.014415078117492597,75.0,252.0,,,,,,,,,,,6,BaselinePreprocessor,HybridCategoricalStatisticsImputer,LogTargetScaler
15,15,0.6530821474656953,2024-03-07 23:45:17.149163,2024-03-07 23:45:20.944141,0 days 00:00:03.794978,42,110.0,COMPLETE,LGBM,0.6911462660712957,0.8957056132337959,2.0,0.8035068180266072,1.130933248510278,0.5309751430092133,0.016323691406166435,75.0,165.0,,,,,,,,,,,6,BaselinePreprocessor,HybridCategoricalStatisticsImputer,LogTargetScaler
16,16,0.6588732725361448,2024-03-07 23:45:20.945176,2024-03-07 23:45:29.231811,0 days 00:00:08.286635,66,410.0,COMPLETE,LGBM,0.6911462660712957,0.5134701491440866,6.0,0.5877987592949594,0.013514570483574333,0.08748775311277744,0.20509005870053937,78.0,141.0,,,,,,,,,,,6,BaselinePreprocessor,HybridCategoricalStatisticsImputer,LogTargetScaler
17,17,0.6711486889164031,2024-03-07 23:45:29.232970,2024-03-07 23:45:42.700094,0 days 00:00:13.467124,99,510.0,COMPLETE,LGBM,0.6911462660712957,0.46540296337247816,3.0,0.4683343600790054,6.175192546494639e-06,0.20801811030451098,0.09067088299196381,42.0,105.0,,,,,,,,,,,6,BaselinePreprocessor,HybridCategoricalStatisticsImputer,LogTargetScaler
18,18,0.675162606232576,2024-03-07 23:45:42.701208,2024-03-07 23:46:21.248402,0 days 00:00:38.547194,81,1410.0,COMPLETE,LGBM,0.6911462660712957,0.6176034706612968,2.0,0.5606895219562972,2.2266814336341916e-05,0.05084639780083939,0.04480143686490278,77.0,245.0,,,,,,,,,,,6,BaselinePreprocessor,HybridCategoricalStatisticsImputer,LogTargetScaler
19,19,0.6757194007127048,2024-03-07 23:46:21.249909,2024-03-07 23:46:46.037972,0 days 00:00:24.788063,78,710.0,COMPLETE,LGBM,0.6911462660712957,0.4295391885042264,2.0,0.849803433636816,0.0031941041284917313,0.0004434258802888282,0.0800671995674643,47.0,110.0,,,,,,,,,,,6,BaselinePreprocessor,HybridCategoricalStatisticsImputer,LogTargetScaler
20,20,0.6592098321811934,2024-03-07 23:46:46.039680,2024-03-07 23:46:57.655994,0 days 00:00:11.616314,69,310.0,COMPLETE,LGBM,0.6911462660712957,0.9964294818538165,7.0,0.5974772310861578,0.038299103273287935,3.2323508480303915,0.034804687104009156,93.0,28.0,,,,,,,,,,,6,BaselinePreprocessor,HybridCategoricalStatisticsImputer,LogTargetScaler
21,21,0.6623031971192469,2024-03-07 23:46:57.657754,2024-03-07 23:47:18.133286,0 days 00:00:20.475532,84,410.0,COMPLETE,LGBM,0.6911462660712957,0.6696790804631283,6.0,0.7426622990006575,9.977751294285756e-05,0.015118313454709787,0.027203459311103285,70.0,222.0,,,,,,,,,,,6,BaselinePreprocessor,HybridCategoricalStatisticsImputer,LogTargetScaler
22,22,0.6619364572670827,2024-03-07 23:47:18.134873,2024-03-07 23:47:24.020795,0 days 00:00:05.885922,39,210.0,COMPLETE,LGBM,0.6911462660712957,0.9105170055653928,6.0,0.7733700655251023,1.2997701317549837,4.689352266906475e-06,0.13272031917932933,17.0,241.0,,,,,,,,,,,6,BaselinePreprocessor,HybridCategoricalStatisticsImputer,LogTargetScaler
23,23,0.04483870530517222,2024-03-07 23:47:24.022173,2024-03-07 23:47:36.085480,0 days 00:00:12.063307,90,810.0,COMPLETE,LGBM,0.6911462660712957,0.40962003161702776,5.0,0.4889950378902522,9.785147167950634e-08,0.0006411249453278668,0.11854548867223776,64.0,161.0,,,,,,,,,,,6,BaselinePreprocessor,HybridCategoricalStatisticsImputer,LogTargetScaler
24,24,0.662855865512558,2024-03-07 23:47:36.086515,2024-03-07 23:47:57.858653,0 days 00:00:21.772138,9,710.0,COMPLETE,LGBM,0.6911462660712957,0.40780171884053373,4.0,0.9840889704323218,1.3291805146303896e-08,2.4158226725835056e-06,0.014465348693162308,87.0,196.0,,,,,,,,,,,6,BaselinePreprocessor,HybridCategoricalStatisticsImputer,LogTargetScaler
25,25,0.6808450085340753,2024-03-07 23:47:57.860248,2024-03-07 23:48:25.682787,0 days 00:00:27.822539,3,1410.0,COMPLETE,LGBM,0.6911462660712957,0.6018401329349476,3.0,0.8704261403283183,0.002738703755025851,0.0005267271298715952,0.08690597479240296,33.0,81.0,,,,,,,,,,,6,BaselinePreprocessor,HybridCategoricalStatisticsImputer,LogTargetScaler
26,26,0.6641054859865422,2024-03-07 23:48:25.684371,2024-03-07 23:48:39.871468,0 days 00:00:14.187097,63,910.0,COMPLETE,LGBM,0.6911462660712957,0.7746452921594942,6.0,0.7578552339228102,4.526583709975169,0.01278811407280785,0.03635473863862425,95.0,46.0,,,,,,,,,,,6,BaselinePreprocessor,HybridCategoricalStatisticsImputer,LogTargetScaler
27,27,0.65832774245957,2024-03-07 23:48:39.873198,2024-03-07 23:48:41.304749,0 days 00:00:01.431551,84,110.0,COMPLETE,LGBM,0.6911462660712957,0.9535573072855299,4.0,0.43956728010415547,8.786932198887078,0.46066377609029596,0.13204749655894318,45.0,144.0,,,,,,,,,,,6,BaselinePreprocessor,HybridCategoricalStatisticsImputer,LogTargetScaler
28,28,0.671460365759652,2024-03-07 23:48:41.305814,2024-03-07 23:49:02.732756,0 days 00:00:21.426942,51,710.0,COMPLETE,LGBM,0.6911462660712957,0.4106376791253569,3.0,0.571309127867816,1.902919959362555e-07,0.7236903949977227,0.05139694054468355,34.0,93.0,,,,,,,,,,,6,BaselinePreprocessor,HybridCategoricalStatisticsImputer,LogTargetScaler
29,29,0.6646950228231584,2024-03-07 23:49:02.734387,2024-03-07 23:49:41.902422,0 days 00:00:39.168035,33,710.0,COMPLETE,LGBM,0.6911462660712957,0.8831945338470195,7.0,0.9135846656236064,3.171256515831761e-06,0.3410739454741695,0.030346177513493857,83.0,159.0,,,,,,,,,,,6,BaselinePreprocessor,HybridCategoricalStatisticsImputer,LogTargetScaler
30,30,0.669331773962338,2024-03-07 23:49:41.903690,2024-03-07 23:49:59.734527,0 days 00:00:17.830837,96,610.0,COMPLETE,LGBM,0.6911462660712957,0.43886402503640454,4.0,0.8441211002184541,0.040010492867369706,0.1281907970003596,0.08689993202116669,60.0,124.0,,,,,,,,,,,6,BaselinePreprocessor,HybridCategoricalStatisticsImputer,LogTargetScaler
31,31,0.6828748859171603,2024-03-07 23:49:59.736252,2024-03-07 23:52:19.072752,0 days 00:02:19.336500,99,1410.0,COMPLETE,LGBM,0.6911462660712957,0.7457687357519469,4.0,0.6402856281445919,2.6162998058998455e-05,0.12012547200253114,0.012678335522446963,12.0,130.0,,,,,,,,,,,6,BaselinePreprocessor,HybridCategoricalStatisticsImputer,LogTargetScaler
32,32,0.6911462660712957,2024-03-07 23:52:19.074858,2024-03-07 23:53:12.623256,0 days 00:00:53.548398,54,1210.0,COMPLETE,LGBM,0.6911462660712957,0.7049011219827136,7.0,0.6621158914947558,7.732468076497016e-05,6.0318516956962285e-06,0.03727890244454814,38.0,131.0,,,,,,,,,,,6,BaselinePreprocessor,HybridCategoricalStatisticsImputer,LogTargetScaler
33,33,0.6716480193877562,2024-03-07 23:53:12.624901,2024-03-07 23:53:24.203344,0 days 00:00:11.578443,51,310.0,COMPLETE,LGBM,0.6911462660712957,0.7267166933966573,7.0,0.8835739854342902,0.735788052777167,2.9928926305232827e-07,0.03425240045196524,88.0,196.0,,,,,,,,,,,6,BaselinePreprocessor,HybridCategoricalStatisticsImputer,LogTargetScaler
34,34,0.6435713849467648,2024-03-07 23:53:24.204409,2024-03-07 23:53:24.655584,0 days 00:00:00.451175,15,10.0,COMPLETE,LGBM,0.6911462660712957,0.7247544325788865,7.0,0.7801989455032046,0.00013459002302546315,1.892321062432943e-06,0.07279900544559799,81.0,85.0,,,,,,,,,,,6,BaselinePreprocessor,HybridCategoricalStatisticsImputer,LogTargetScaler
35,35,0.6659417652978005,2024-03-07 23:53:24.656948,2024-03-07 23:53:50.021456,0 days 00:00:25.364508,66,310.0,COMPLETE,LGBM,0.6911462660712957,0.988020883138157,3.0,0.7587014514143302,1.1412816897777234e-07,1.4852177112879652e-07,0.03807552368307266,67.0,45.0,,,,,,,,,,,6,BaselinePreprocessor,HybridCategoricalStatisticsImputer,LogTargetScaler
36,36,0.674636217710657,2024-03-07 23:53:50.023008,2024-03-07 23:54:00.646531,0 days 00:00:10.623523,78,310.0,COMPLETE,LGBM,0.6911462660712957,0.9820286225558303,1.0,0.6357287851496775,2.505638656226619e-06,4.464448859563575e-08,0.20796753992564057,71.0,59.0,,,,,,,,,,,6,BaselinePreprocessor,HybridCategoricalStatisticsImputer,LogTargetScaler
37,37,0.6523052985092535,2024-03-07 23:54:00.648507,2024-03-07 23:54:01.243372,0 days 00:00:00.594865,24,10.0,COMPLETE,LGBM,0.6911462660712957,0.7142982146404889,6.0,0.9940715946297272,4.161992371973752e-07,0.07811780634598536,0.03681637616021031,96.0,157.0,,,,,,,,,,,6,BaselinePreprocessor,HybridCategoricalStatisticsImputer,LogTargetScaler
38,38,0.6609070839384342,2024-03-07 23:54:01.275851,2024-03-07 23:54:07.133631,0 days 00:00:05.857780,51,410.0,COMPLETE,LGBM,0.6911462660712957,0.6290524216274436,3.0,0.5528465908453357,5.123510521180376,0.9919689202678895,0.06254806017458893,99.0,73.0,,,,,,,,,,,6,BaselinePreprocessor,HybridCategoricalStatisticsImputer,LogTargetScaler
39,39,0.6572834408863952,2024-03-07 23:54:07.135235,2024-03-07 23:54:19.102291,0 days 00:00:11.967056,96,210.0,COMPLETE,LGBM,0.6911462660712957,0.924379755140546,4.0,0.7177971231797833,8.079837566702116e-06,1.0982516543261488e-08,0.028538036736613974,88.0,252.0,,,,,,,,,,,6,BaselinePreprocessor,HybridCategoricalStatisticsImputer,LogTargetScaler
0,0,0.6495607221171602,2024-03-07 23:55:14.101648,2024-03-07 23:55:59.018046,0 days 00:00:44.916398,6,,COMPLETE,XGB,0.6701685037427981,,,,,,,,,0.00011731062045341136,dart,0.19681889921974235,1.3949933713910581e-06,depthwise,0.00045541015985711133,forest,1.5848510072783143e-07,weighted,0.005104651050381424,6,BaselinePreprocessor,HybridCategoricalStatisticsImputer,LogTargetScaler
1,1,0.6577267886695074,2024-03-07 23:55:59.019620,2024-03-07 23:56:37.068467,0 days 00:00:38.048847,4,,COMPLETE,XGB,0.6701685037427981,,,,,,,,,2.0861137723845352e-07,dart,0.04329658220832548,7.262812711320342e-08,lossguide,0.03262987743671562,tree,0.0001898219537176826,weighted,0.001239487679936983,6,BaselinePreprocessor,HybridCategoricalStatisticsImputer,LogTargetScaler
2,2,0.6019590844277993,2024-03-07 23:56:37.069700,2024-03-07 23:57:34.517604,0 days 00:00:57.447904,8,,COMPLETE,XGB,0.6701685037427981,,,,,,,,,0.01601389324843284,dart,1.389548718698229e-06,7.674276370020178e-07,depthwise,7.145044836166837e-07,tree,1.3098404758573465e-05,uniform,0.22573111243093874,6,BaselinePreprocessor,HybridCategoricalStatisticsImputer,LogTargetScaler
3,3,0.4777659679501542,2024-03-07 23:57:34.518669,2024-03-07 23:58:01.126339,0 days 00:00:26.607670,2,,COMPLETE,XGB,0.6701685037427981,,,,,,,,,0.0006620562477319913,dart,1.6591485641419195e-08,0.0009679696404844199,lossguide,0.005392279444863655,tree,3.8712503598948455e-07,weighted,0.00031900318080697215,6,BaselinePreprocessor,HybridCategoricalStatisticsImputer,LogTargetScaler
4,4,0.6066559956606519,2024-03-07 23:58:01.128099,2024-03-07 23:58:23.848086,0 days 00:00:22.719987,1,,COMPLETE,XGB,0.6701685037427981,,,,,,,,,1.425168945278591e-07,dart,0.0012517231070254262,0.0003484087615201724,lossguide,4.977788827859445e-08,forest,0.00019098824851619827,uniform,5.920052855655369e-08,6,BaselinePreprocessor,HybridCategoricalStatisticsImputer,LogTargetScaler
5,5,0.5285923260651132,2024-03-07 23:58:23.849728,2024-03-07 23:59:23.510787,0 days 00:00:59.661059,8,,COMPLETE,XGB,0.6701685037427981,,,,,,,,,1.7349648474656302e-07,dart,1.360511316166528e-08,0.0012170309653747797,depthwise,2.249028335997358e-06,forest,2.1572837160191733e-06,weighted,0.07527148960864014,6,BaselinePreprocessor,HybridCategoricalStatisticsImputer,LogTargetScaler
6,6,0.6187805795633025,2024-03-07 23:59:23.512020,2024-03-08 00:00:10.828975,0 days 00:00:47.316955,5,,COMPLETE,XGB,0.6701685037427981,,,,,,,,,1.2618838090782004e-06,dart,0.0008586760693836336,3.101076061896713e-05,depthwise,0.014717589756069406,forest,2.67766196763145e-07,weighted,1.0175065771042323e-05,6,BaselinePreprocessor,HybridCategoricalStatisticsImputer,LogTargetScaler
7,7,0.6701685037427981,2024-03-08 00:00:10.830342,2024-03-08 00:00:59.495210,0 days 00:00:48.664868,3,,COMPLETE,XGB,0.6701685037427981,,,,,,,,,1.008797123854721e-05,dart,0.19821384767828412,0.00035883292507352647,lossguide,0.00019913610437838946,tree,4.4594835561252485e-06,weighted,7.224969512808167e-07,6,BaselinePreprocessor,HybridCategoricalStatisticsImputer,LogTargetScaler
8,8,0.5392772828523146,2024-03-08 00:00:59.497215,2024-03-08 00:02:14.418941,0 days 00:01:14.921726,9,,COMPLETE,XGB,0.6701685037427981,,,,,,,,,0.0007240491985702374,dart,1.3699445546762708e-08,6.423194670199868e-05,depthwise,1.0398789248396226e-05,forest,6.742512707413112e-06,uniform,1.2241246946714032e-07,6,BaselinePreprocessor,HybridCategoricalStatisticsImputer,LogTargetScaler
9,9,0.6267438174692421,2024-03-08 00:02:14.420589,2024-03-08 00:03:00.778564,0 days 00:00:46.357975,5,,COMPLETE,XGB,0.6701685037427981,,,,,,,,,0.019066535078141558,dart,5.677004023108445e-07,2.3604572520953168e-05,depthwise,5.605629351239958e-08,forest,0.002011720586824698,weighted,1.5239785878479082e-06,6,BaselinePreprocessor,HybridCategoricalStatisticsImputer,LogTargetScaler
10,10,0.5899891194773789,2024-03-08 00:03:00.780364,2024-03-08 00:03:27.466309,0 days 00:00:26.685945,1,,COMPLETE,XGB,0.6701685037427981,,,,,,,,,8.412670041253585e-07,dart,3.221943389053996e-07,0.04043695139547105,depthwise,2.3821625910578762e-07,tree,3.3657348668719123e-06,uniform,4.9784788428309195e-08,6,BaselinePreprocessor,HybridCategoricalStatisticsImputer,LogTargetScaler
11,11,0.636125345958103,2024-03-08 00:03:27.467644,2024-03-08 00:04:00.702979,0 days 00:00:33.235335,3,,COMPLETE,XGB,0.6701685037427981,,,,,,,,,0.27304401215491153,dart,5.165128646697746e-08,0.000219983127784372,depthwise,8.966307429990851e-08,tree,0.2772632342033195,uniform,0.015521298205733863,6,BaselinePreprocessor,HybridCategoricalStatisticsImputer,LogTargetScaler
12,12,0.6373090027877206,2024-03-08 00:04:00.704670,2024-03-08 00:04:42.645644,0 days 00:00:41.940974,4,,COMPLETE,XGB,0.6701685037427981,,,,,,,,,1.4514548015656364e-06,dart,0.00557922377618239,0.1622466534295281,depthwise,4.3246484551940605e-07,forest,4.34141495419338e-08,uniform,2.6231141796332725e-05,6,BaselinePreprocessor,HybridCategoricalStatisticsImputer,LogTargetScaler
13,13,0.634884480138823,2024-03-08 00:04:42.647152,2024-03-08 00:05:45.432754,0 days 00:01:02.785602,7,,COMPLETE,XGB,0.6701685037427981,,,,,,,,,0.0524202016653284,dart,0.010659905955788656,8.544109902445011e-07,depthwise,2.630960043081174e-07,tree,0.004576394616480615,weighted,1.4775073713432818e-08,6,BaselinePreprocessor,HybridCategoricalStatisticsImputer,LogTargetScaler
14,14,0.6202531052291913,2024-03-08 00:05:45.434253,2024-03-08 00:06:19.474359,0 days 00:00:34.040106,2,,COMPLETE,XGB,0.6701685037427981,,,,,,,,,1.9469291879154776e-08,dart,0.004601597915464503,0.002413012316830627,lossguide,0.00012805758263395743,forest,6.590587419542417e-05,uniform,3.3972803518098193e-07,6,BaselinePreprocessor,HybridCategoricalStatisticsImputer,LogTargetScaler
15,15,0.6452576076325975,2024-03-08 00:06:19.476101,2024-03-08 00:07:20.356814,0 days 00:01:00.880713,6,,COMPLETE,XGB,0.6701685037427981,,,,,,,,,0.5647304491221543,dart,0.037615571508923584,5.121680319774837e-07,lossguide,0.11721364716181654,tree,1.1421783447036239e-07,weighted,5.349343901612649e-08,6,BaselinePreprocessor,HybridCategoricalStatisticsImputer,LogTargetScaler
