,number,value,datetime_start,datetime_complete,duration,params_max_depth,params_n_estimators,state,model,best_value,params_bagging_fraction,params_bagging_freq,params_feature_fraction,params_lambda_l1,params_lambda_l2,params_learning_rate,params_min_child_samples,params_num_leaves,params_alpha,params_booster,params_eta,params_gamma,params_grow_policy,params_lambda,params_normalize_type,params_rate_drop,params_sample_type,params_skip_drop,config_id,preprocessor,imputer,target_scaler
29,29,0.6348279095957351,2024-03-08 06:33:54.323849,2024-03-08 06:34:45.671965,0 days 00:00:51.348116,96,1110.0,COMPLETE,LGBM,0.6524361889277908,0.7339864625571191,4.0,0.8717223527988326,0.0014910251922635029,0.09308181008424064,0.0959569420131276,45.0,27.0,,,,,,,,,,,12,IIDPreprocessor,RevenueQuantileBucketImputer:3-buckets,LogTargetScaler
30,30,0.6057771594226322,2024-03-08 06:34:45.673871,2024-03-08 06:34:50.185878,0 days 00:00:04.512007,3,310.0,COMPLETE,LGBM,0.6524361889277908,0.4811351939363013,5.0,0.6972352018817869,1.5023048642875658e-05,0.10904595601928496,0.03336836391413733,90.0,112.0,,,,,,,,,,,12,IIDPreprocessor,RevenueQuantileBucketImputer:3-buckets,LogTargetScaler
31,31,0.6231371910540984,2024-03-08 06:34:50.187459,2024-03-08 06:35:06.012935,0 days 00:00:15.825476,96,1110.0,COMPLETE,LGBM,0.6524361889277908,0.4865592213160077,5.0,0.9692339508211918,0.4905240850010163,0.0011215280867424462,0.17570763196072162,71.0,224.0,,,,,,,,,,,12,IIDPreprocessor,RevenueQuantileBucketImputer:3-buckets,LogTargetScaler
32,32,0.6369746473780342,2024-03-08 06:35:06.018048,2024-03-08 06:35:17.355774,0 days 00:00:11.337726,36,310.0,COMPLETE,LGBM,0.6524361889277908,0.4761841783894769,3.0,0.5485081658874857,1.9804153614858648e-08,1.3479505176047646,0.13494519589833126,25.0,133.0,,,,,,,,,,,12,IIDPreprocessor,RevenueQuantileBucketImputer:3-buckets,LogTargetScaler
33,33,0.6321867104387119,2024-03-08 06:35:17.356920,2024-03-08 06:35:37.516074,0 days 00:00:20.159154,24,1410.0,COMPLETE,LGBM,0.6524361889277908,0.9657238889263077,2.0,0.47296032849458336,7.354455945372914e-06,3.6032232063048097e-07,0.17994536346818502,22.0,53.0,,,,,,,,,,,12,IIDPreprocessor,RevenueQuantileBucketImputer:3-buckets,LogTargetScaler
34,34,0.6363434089989298,2024-03-08 06:35:37.517118,2024-03-08 06:36:03.431378,0 days 00:00:25.914260,87,410.0,COMPLETE,LGBM,0.6524361889277908,0.7682465481619345,4.0,0.7011624624975703,0.0012711137700347356,1.6504053090654858e-05,0.0413219729147643,63.0,32.0,,,,,,,,,,,12,IIDPreprocessor,RevenueQuantileBucketImputer:3-buckets,LogTargetScaler
35,35,0.6121943530152858,2024-03-08 06:36:03.433081,2024-03-08 06:36:41.691818,0 days 00:00:38.258737,81,1210.0,COMPLETE,LGBM,0.6524361889277908,0.9782827946819753,2.0,0.7354420415001899,1.2877541050168781,1.1820418717981152e-08,0.033194566093285416,61.0,204.0,,,,,,,,,,,12,IIDPreprocessor,RevenueQuantileBucketImputer:3-buckets,LogTargetScaler
36,36,0.6339043243089537,2024-03-08 06:36:41.692872,2024-03-08 06:37:16.595251,0 days 00:00:34.902379,78,1110.0,COMPLETE,LGBM,0.6524361889277908,0.8955119718627242,2.0,0.6396166507402582,0.0001007256985969517,0.00199511249371754,0.08877380979158647,31.0,204.0,,,,,,,,,,,12,IIDPreprocessor,RevenueQuantileBucketImputer:3-buckets,LogTargetScaler
37,37,0.6344021458530544,2024-03-08 06:37:16.596526,2024-03-08 06:37:25.097360,0 days 00:00:08.500834,18,1010.0,COMPLETE,LGBM,0.6524361889277908,0.8888936639002768,7.0,0.5057566674875631,0.21095490240662432,0.07201027512861098,0.22329007708182347,22.0,64.0,,,,,,,,,,,12,IIDPreprocessor,RevenueQuantileBucketImputer:3-buckets,LogTargetScaler
38,38,0.6472072441311862,2024-03-08 06:37:25.098434,2024-03-08 06:38:31.261129,0 days 00:01:06.162695,84,610.0,COMPLETE,LGBM,0.6524361889277908,0.9063290074021595,6.0,0.4840406331147732,1.0100874422902541e-07,0.002724302901074212,0.011812836895510982,21.0,220.0,,,,,,,,,,,12,IIDPreprocessor,RevenueQuantileBucketImputer:3-buckets,LogTargetScaler
39,39,0.6367564817082311,2024-03-08 06:38:31.262601,2024-03-08 06:39:06.831731,0 days 00:00:35.569130,9,1310.0,COMPLETE,LGBM,0.6524361889277908,0.8740832181530629,6.0,0.8170498166484703,6.61489954008176e-06,3.112135283974697e-07,0.1274009026809457,46.0,256.0,,,,,,,,,,,12,IIDPreprocessor,RevenueQuantileBucketImputer:3-buckets,LogTargetScaler
0,0,0.5339115214422792,2024-03-08 06:39:45.710321,2024-03-08 06:40:26.572158,0 days 00:00:40.861837,6,,COMPLETE,XGB,0.6045064773654881,,,,,,,,,0.02666813485768285,dart,0.0005448561413076659,0.00010809607523061203,depthwise,4.728194949009698e-06,tree,0.5960695184761932,uniform,8.982414047529e-06,12,IIDPreprocessor,RevenueQuantileBucketImputer:3-buckets,LogTargetScaler
1,1,0.5413876328827036,2024-03-08 06:40:26.573820,2024-03-08 06:41:19.969662,0 days 00:00:53.395842,7,,COMPLETE,XGB,0.6045064773654881,,,,,,,,,4.634393408541981e-06,dart,0.005017283385410709,1.146205604852654e-06,depthwise,0.03121510575094376,tree,0.24817745221130466,weighted,0.015091180754715692,12,IIDPreprocessor,RevenueQuantileBucketImputer:3-buckets,LogTargetScaler
2,2,0.55760164987935,2024-03-08 06:41:19.971182,2024-03-08 06:42:03.214889,0 days 00:00:43.243707,4,,COMPLETE,XGB,0.6045064773654881,,,,,,,,,0.9343768214004099,dart,0.0004525507644308383,1.1187006260668221e-05,lossguide,0.08411365559346194,tree,0.4656622091287675,weighted,0.021351206552917425,12,IIDPreprocessor,RevenueQuantileBucketImputer:3-buckets,LogTargetScaler
3,3,0.46466950053266964,2024-03-08 06:42:03.216201,2024-03-08 06:42:29.126617,0 days 00:00:25.910416,1,,COMPLETE,XGB,0.6045064773654881,,,,,,,,,5.396869860281157e-07,dart,8.524227461495046e-07,0.2528370710367444,depthwise,0.07424188917106067,tree,0.014309275964677055,uniform,0.48554943701261366,12,IIDPreprocessor,RevenueQuantileBucketImputer:3-buckets,LogTargetScaler
4,4,0.5321387817475381,2024-03-08 06:42:29.127852,2024-03-08 06:42:48.991039,0 days 00:00:19.863187,2,,COMPLETE,XGB,0.6045064773654881,,,,,,,,,0.00046685480481236915,dart,5.582844025311606e-06,1.378436904944482e-06,depthwise,0.004690754260318528,forest,0.4495316505803391,weighted,1.6129486524279014e-07,12,IIDPreprocessor,RevenueQuantileBucketImputer:3-buckets,LogTargetScaler
5,5,0.5284959329466524,2024-03-08 06:42:48.992108,2024-03-08 06:43:46.404882,0 days 00:00:57.412774,8,,COMPLETE,XGB,0.6045064773654881,,,,,,,,,0.00014908171363454826,dart,8.978924151216849e-05,0.002439623874463045,lossguide,2.7729430982252e-07,tree,0.02253736088467656,uniform,0.00010948144052775063,12,IIDPreprocessor,RevenueQuantileBucketImputer:3-buckets,LogTargetScaler
6,6,0.5640238397152314,2024-03-08 06:43:46.406710,2024-03-08 06:44:51.483704,0 days 00:01:05.076994,9,,COMPLETE,XGB,0.6045064773654881,,,,,,,,,1.8775568491558025e-08,dart,0.002678886565466983,0.0965996775155462,lossguide,1.9888777931063958e-08,tree,2.618440082863306e-07,weighted,0.029070869160808862,12,IIDPreprocessor,RevenueQuantileBucketImputer:3-buckets,LogTargetScaler
7,7,0.5245920212818952,2024-03-08 06:44:51.485519,2024-03-08 06:45:25.264404,0 days 00:00:33.778885,2,,COMPLETE,XGB,0.6045064773654881,,,,,,,,,6.363031618131748e-05,dart,0.003307285509696972,0.0009231114942914779,depthwise,4.770871142304571e-08,forest,1.0433994005680599e-06,weighted,0.07730179564128958,12,IIDPreprocessor,RevenueQuantileBucketImputer:3-buckets,LogTargetScaler
8,8,0.5520529131943818,2024-03-08 06:45:25.265702,2024-03-08 06:45:54.924300,0 days 00:00:29.658598,2,,COMPLETE,XGB,0.6045064773654881,,,,,,,,,0.001786053129765914,dart,0.009185042201935275,9.669374826561944e-08,lossguide,4.053648780003922e-06,forest,2.006532807352851e-08,weighted,0.0014772780164008885,12,IIDPreprocessor,RevenueQuantileBucketImputer:3-buckets,LogTargetScaler
9,9,0.6045064773654881,2024-03-08 06:45:54.925758,2024-03-08 06:46:35.795395,0 days 00:00:40.869637,4,,COMPLETE,XGB,0.6045064773654881,,,,,,,,,2.5287515552118848e-08,dart,0.10300623021024834,1.3318338648869906e-05,depthwise,3.6616778280495475e-08,tree,0.0006653684192349364,weighted,0.005089187965630011,12,IIDPreprocessor,RevenueQuantileBucketImputer:3-buckets,LogTargetScaler
10,10,0.22084432949040042,2024-03-08 06:46:35.796390,2024-03-08 06:46:59.477468,0 days 00:00:23.681078,1,,COMPLETE,XGB,0.6045064773654881,,,,,,,,,6.004034318402451e-05,dart,2.34600367810768e-08,0.005038715154523186,depthwise,0.00021324961036659723,tree,0.05867139772208823,weighted,0.0057845053249394015,12,IIDPreprocessor,RevenueQuantileBucketImputer:3-buckets,LogTargetScaler
11,11,0.5321387817475381,2024-03-08 06:46:59.478885,2024-03-08 06:47:29.148126,0 days 00:00:29.669241,2,,COMPLETE,XGB,0.6045064773654881,,,,,,,,,0.001213195330910351,dart,7.629120241532953e-06,3.829936899115728e-07,depthwise,0.003106358734744148,tree,3.5986497180622627e-06,uniform,4.214666885681422e-07,12,IIDPreprocessor,RevenueQuantileBucketImputer:3-buckets,LogTargetScaler
12,12,0.5372428025700082,2024-03-08 06:47:29.149194,2024-03-08 06:48:15.094211,0 days 00:00:45.945017,5,,COMPLETE,XGB,0.6045064773654881,,,,,,,,,7.529304557345232e-08,dart,3.657256040900389e-07,1.92913968306427e-06,lossguide,6.08614880741028e-08,tree,9.403015114897025e-07,weighted,4.3343202268608683e-05,12,IIDPreprocessor,RevenueQuantileBucketImputer:3-buckets,LogTargetScaler
13,13,0.55178513853158,2024-03-08 06:48:15.095919,2024-03-08 06:48:49.192636,0 days 00:00:34.096717,3,,COMPLETE,XGB,0.6045064773654881,,,,,,,,,0.0009784996978835399,dart,0.0007958127469503963,1.0664556590007354e-07,lossguide,3.3624802900234354e-08,tree,3.767155122956233e-07,uniform,1.1360104965751241e-08,12,IIDPreprocessor,RevenueQuantileBucketImputer:3-buckets,LogTargetScaler
14,14,0.5655669572454519,2024-03-08 06:48:49.193968,2024-03-08 06:49:39.060734,0 days 00:00:49.866766,6,,COMPLETE,XGB,0.6045064773654881,,,,,,,,,1.408021155660166e-08,dart,0.0010558742005958633,0.00046740134930478084,lossguide,0.42089452868995036,forest,0.00038235676405427995,weighted,0.028009330322502198,12,IIDPreprocessor,RevenueQuantileBucketImputer:3-buckets,LogTargetScaler
15,15,0.550692616815146,2024-03-08 06:49:39.062335,2024-03-08 06:50:17.060262,0 days 00:00:37.997927,3,,COMPLETE,XGB,0.6045064773654881,,,,,,,,,2.5579648537402265e-08,dart,0.00011943084913426347,0.011876685867084446,depthwise,1.5714494180926137e-06,forest,0.004087543708916279,weighted,0.055678326790383335,12,IIDPreprocessor,RevenueQuantileBucketImputer:3-buckets,LogTargetScaler
16,16,0.5518905202790024,2024-03-08 06:50:17.062113,2024-03-08 06:50:48.371309,0 days 00:00:31.309196,1,,COMPLETE,XGB,0.6045064773654881,,,,,,,,,8.171790316879723e-07,dart,0.0825539591444514,8.857559814721251e-07,depthwise,0.32150547108300426,forest,0.002360570189271774,uniform,0.0001384054317246723,12,IIDPreprocessor,RevenueQuantileBucketImputer:3-buckets,LogTargetScaler
17,17,0.5326949180416586,2024-03-08 06:50:48.372907,2024-03-08 06:51:18.420536,0 days 00:00:30.047629,5,,COMPLETE,XGB,0.6045064773654881,,,,,,,,,2.5129686351746636e-05,dart,4.073668262431472e-06,0.07903272710914366,lossguide,9.825287883454705e-05,tree,0.7658076416255418,uniform,1.2616583770810488e-06,12,IIDPreprocessor,RevenueQuantileBucketImputer:3-buckets,LogTargetScaler
18,18,0.5535151230431321,2024-03-08 06:51:18.422094,2024-03-08 06:51:48.098008,0 days 00:00:29.675914,2,,COMPLETE,XGB,0.6045064773654881,,,,,,,,,2.6190445244102087e-07,dart,0.007884160361855705,8.317037083289207e-05,depthwise,5.327546421371192e-08,forest,0.00021154270433176804,weighted,0.0006412902682834999,12,IIDPreprocessor,RevenueQuantileBucketImputer:3-buckets,LogTargetScaler
19,19,0.5304518183889089,2024-03-08 06:51:48.099808,2024-03-08 06:52:49.060451,0 days 00:01:00.960643,8,,COMPLETE,XGB,0.6045064773654881,,,,,,,,,2.2347016941566573e-07,dart,3.839440687319087e-06,0.29860565269485834,lossguide,0.0015790692301550164,tree,1.4439805994368178e-07,uniform,0.00863061214817789,12,IIDPreprocessor,RevenueQuantileBucketImputer:3-buckets,LogTargetScaler
20,20,0.5543782069642285,2024-03-08 06:52:49.062009,2024-03-08 06:53:30.176582,0 days 00:00:41.114573,6,,COMPLETE,XGB,0.6045064773654881,,,,,,,,,0.006728139302370717,dart,0.05238301779755536,1.1868977667332886e-07,lossguide,9.211252526559216e-05,tree,0.41622675141550963,uniform,6.112920552058366e-08,12,IIDPreprocessor,RevenueQuantileBucketImputer:3-buckets,LogTargetScaler
21,21,0.3720320314056576,2024-03-08 06:53:30.177985,2024-03-08 06:54:00.772299,0 days 00:00:30.594314,2,,COMPLETE,XGB,0.6045064773654881,,,,,,,,,0.23298646201628026,dart,2.7018916569057005e-08,5.629504120581118e-06,depthwise,0.018048783141370598,tree,8.55630943262337e-08,uniform,1.0767034124460978e-05,12,IIDPreprocessor,RevenueQuantileBucketImputer:3-buckets,LogTargetScaler
22,22,0.5333179969026548,2024-03-08 06:54:00.773877,2024-03-08 06:55:02.365572,0 days 00:01:01.591695,7,,COMPLETE,XGB,0.6045064773654881,,,,,,,,,4.060724223506641e-08,dart,2.0016074731371027e-07,0.318634219083913,lossguide,1.0897459946320199e-06,forest,0.00034858780007513866,weighted,0.11914620671051683,12,IIDPreprocessor,RevenueQuantileBucketImputer:3-buckets,LogTargetScaler
23,23,0.5875634672718658,2024-03-08 06:55:02.367271,2024-03-08 06:56:07.993467,0 days 00:01:05.626196,8,,COMPLETE,XGB,0.6045064773654881,,,,,,,,,0.133502573796294,dart,0.02183630247170468,0.0002887827567530093,lossguide,0.006789761139378236,tree,0.0024507068044281755,uniform,0.054372221804101194,12,IIDPreprocessor,RevenueQuantileBucketImputer:3-buckets,LogTargetScaler
24,24,0.5750923934110893,2024-03-08 06:56:07.994683,2024-03-08 06:57:17.724949,0 days 00:01:09.730266,9,,COMPLETE,XGB,0.6045064773654881,,,,,,,,,6.451896631626826e-06,dart,0.039106510757175326,0.00027091214477697453,lossguide,0.0004225285102735587,tree,0.015051942352668124,weighted,0.002425507119880878,12,IIDPreprocessor,RevenueQuantileBucketImputer:3-buckets,LogTargetScaler
25,25,0.46466950053266964,2024-03-08 06:57:17.726534,2024-03-08 06:57:41.897718,0 days 00:00:24.171184,1,,COMPLETE,XGB,0.6045064773654881,,,,,,,,,3.51544495406724e-07,dart,1.9631788250313608e-07,0.16528052127499818,lossguide,0.0002492981551423524,forest,0.0020881990797988006,uniform,3.7797394592517835e-08,12,IIDPreprocessor,RevenueQuantileBucketImputer:3-buckets,LogTargetScaler
26,26,0.5373559134292181,2024-03-08 06:57:41.898804,2024-03-08 06:58:30.162482,0 days 00:00:48.263678,6,,COMPLETE,XGB,0.6045064773654881,,,,,,,,,4.779987043601363e-07,dart,6.214997321874139e-07,0.006461030206206437,depthwise,0.0011185598915425974,forest,1.7433430695691592e-05,weighted,0.0007649193851557028,12,IIDPreprocessor,RevenueQuantileBucketImputer:3-buckets,LogTargetScaler
27,27,0.46466950053266964,2024-03-08 06:58:30.163928,2024-03-08 06:58:53.958889,0 days 00:00:23.794961,1,,COMPLETE,XGB,0.6045064773654881,,,,,,,,,0.0020985742963119244,dart,6.069208465383907e-07,1.3869451720531795e-06,lossguide,0.0001875799526402503,forest,6.484157612826465e-05,uniform,0.008687670504235823,12,IIDPreprocessor,RevenueQuantileBucketImputer:3-buckets,LogTargetScaler
28,28,0.5355799727499166,2024-03-08 06:58:53.960098,2024-03-08 06:59:37.656802,0 days 00:00:43.696704,6,,COMPLETE,XGB,0.6045064773654881,,,,,,,,,9.028574302239228e-08,dart,7.880232522189523e-08,0.3425285630409944,depthwise,0.0028026660331293665,forest,0.23439422465651408,weighted,2.9242161773400253e-06,12,IIDPreprocessor,RevenueQuantileBucketImputer:3-buckets,LogTargetScaler
29,29,0.5621602752894389,2024-03-08 06:59:37.658238,2024-03-08 07:00:27.061072,0 days 00:00:49.402834,5,,COMPLETE,XGB,0.6045064773654881,,,,,,,,,0.6476337305894776,dart,0.00020358241208937044,0.06941792711473221,depthwise,2.7816249548610992e-05,tree,0.013012617052234627,uniform,1.9058670568492738e-05,12,IIDPreprocessor,RevenueQuantileBucketImputer:3-buckets,LogTargetScaler
30,30,0.5298080002927831,2024-03-08 07:00:27.062342,2024-03-08 07:01:24.624129,0 days 00:00:57.561787,8,,COMPLETE,XGB,0.6045064773654881,,,,,,,,,1.7601719950666836e-06,dart,7.007309320890133e-07,2.685647718823273e-06,lossguide,2.464875134623237e-08,tree,0.577631719530297,weighted,3.366892377350194e-08,12,IIDPreprocessor,RevenueQuantileBucketImputer:3-buckets,LogTargetScaler
31,31,0.5376841892243491,2024-03-08 07:01:24.625666,2024-03-08 07:02:11.054461,0 days 00:00:46.428795,4,,COMPLETE,XGB,0.6045064773654881,,,,,,,,,0.004253086073618438,dart,3.034192149787728e-07,0.0005660552761354431,depthwise,2.2022917040486806e-08,forest,0.0010473297330266661,uniform,7.273002476328858e-08,12,IIDPreprocessor,RevenueQuantileBucketImputer:3-buckets,LogTargetScaler
32,32,0.5379864093176491,2024-03-08 07:02:11.055594,2024-03-08 07:03:08.651709,0 days 00:00:57.596115,7,,COMPLETE,XGB,0.6045064773654881,,,,,,,,,0.030465153922174245,dart,2.849263380329699e-06,0.00042944511497593045,lossguide,0.0040213247905702115,tree,1.2473886948363061e-05,weighted,4.607347301673621e-06,12,IIDPreprocessor,RevenueQuantileBucketImputer:3-buckets,LogTargetScaler
33,33,0.5452030886995829,2024-03-08 07:03:08.653387,2024-03-08 07:03:56.024699,0 days 00:00:47.371312,5,,COMPLETE,XGB,0.6045064773654881,,,,,,,,,1.1030562449345009e-07,dart,4.964242888687576e-07,0.0001665330188889531,lossguide,0.8437311722509302,tree,5.914406088451226e-05,uniform,2.0385010072349407e-07,12,IIDPreprocessor,RevenueQuantileBucketImputer:3-buckets,LogTargetScaler
34,34,0.4992820540678055,2024-03-08 07:03:56.026149,2024-03-08 07:04:26.633739,0 days 00:00:30.607590,2,,COMPLETE,XGB,0.6045064773654881,,,,,,,,,0.0049602711358193215,dart,2.7975999463981813e-07,2.3029965195050198e-08,lossguide,0.45332997279096027,tree,0.0011146899446403179,weighted,0.584934535158068,12,IIDPreprocessor,RevenueQuantileBucketImputer:3-buckets,LogTargetScaler
35,35,0.5524696788226291,2024-03-08 07:04:26.634920,2024-03-08 07:04:51.811550,0 days 00:00:25.176630,1,,COMPLETE,XGB,0.6045064773654881,,,,,,,,,7.249207703968312e-07,dart,0.0924379050441319,0.01398327473059897,depthwise,0.04017555859515297,forest,0.012337184863977266,weighted,0.6903345102619776,12,IIDPreprocessor,RevenueQuantileBucketImputer:3-buckets,LogTargetScaler
36,36,0.5555435469318141,2024-03-08 07:04:51.813281,2024-03-08 07:05:48.126016,0 days 00:00:56.312735,7,,COMPLETE,XGB,0.6045064773654881,,,,,,,,,0.0019820423878440263,dart,2.3969340406131624e-05,3.4003971242831513e-08,lossguide,0.47271258104866154,tree,8.79827013306441e-05,uniform,1.753328307205063e-06,12,IIDPreprocessor,RevenueQuantileBucketImputer:3-buckets,LogTargetScaler
37,37,0.5500947363705396,2024-03-08 07:05:48.127709,2024-03-08 07:06:23.412620,0 days 00:00:35.284911,3,,COMPLETE,XGB,0.6045064773654881,,,,,,,,,6.124025174571853e-07,dart,2.9110559711320477e-07,0.0004127531406599778,lossguide,0.27433040207905357,tree,8.369939834394752e-08,weighted,0.0003195379584907704,12,IIDPreprocessor,RevenueQuantileBucketImputer:3-buckets,LogTargetScaler
38,38,0.4661380247168166,2024-03-08 07:06:23.413871,2024-03-08 07:06:47.461388,0 days 00:00:24.047517,1,,COMPLETE,XGB,0.6045064773654881,,,,,,,,,0.00037946327508805956,dart,0.001697685604942529,9.436008014606196e-05,depthwise,1.1966364232053934e-06,tree,0.0016963277718322154,weighted,0.03395508320341628,12,IIDPreprocessor,RevenueQuantileBucketImputer:3-buckets,LogTargetScaler
39,39,0.5327563104947628,2024-03-08 07:06:47.462606,2024-03-08 07:07:38.771417,0 days 00:00:51.308811,6,,COMPLETE,XGB,0.6045064773654881,,,,,,,,,1.1987090825854403e-07,dart,1.2772864104407145e-05,0.004050628652182067,depthwise,1.7455628267050483e-07,forest,0.02198080808992505,weighted,0.3384172179818436,12,IIDPreprocessor,RevenueQuantileBucketImputer:3-buckets,LogTargetScaler
0,0,0.5986929729926909,2024-03-08 07:09:12.177615,2024-03-08 07:09:48.101603,0 days 00:00:35.923988,93,1200.0,COMPLETE,RandomForest,0.6177307182999774,,,,,,,,,,,,,,,,,,,13,IIDPreprocessor,RevenueQuantileBucketImputer:3-buckets,ArcSinhTargetScaler
1,1,0.6094288845068602,2024-03-08 07:09:48.102702,2024-03-08 07:10:34.719145,0 days 00:00:46.616443,90,1500.0,COMPLETE,RandomForest,0.6177307182999774,,,,,,,,,,,,,,,,,,,13,IIDPreprocessor,RevenueQuantileBucketImputer:3-buckets,ArcSinhTargetScaler
2,2,0.608409783012775,2024-03-08 07:10:34.720062,2024-03-08 07:10:49.589338,0 days 00:00:14.869276,93,500.0,COMPLETE,RandomForest,0.6177307182999774,,,,,,,,,,,,,,,,,,,13,IIDPreprocessor,RevenueQuantileBucketImputer:3-buckets,ArcSinhTargetScaler
3,3,0.606449607563704,2024-03-08 07:10:49.589981,2024-03-08 07:11:16.036508,0 days 00:00:26.446527,99,900.0,COMPLETE,RandomForest,0.6177307182999774,,,,,,,,,,,,,,,,,,,13,IIDPreprocessor,RevenueQuantileBucketImputer:3-buckets,ArcSinhTargetScaler
4,4,0.6076570632836436,2024-03-08 07:11:16.037403,2024-03-08 07:11:26.855561,0 days 00:00:10.818158,54,400.0,COMPLETE,RandomForest,0.6177307182999774,,,,,,,,,,,,,,,,,,,13,IIDPreprocessor,RevenueQuantileBucketImputer:3-buckets,ArcSinhTargetScaler
5,5,0.6109511605145674,2024-03-08 07:11:26.856186,2024-03-08 07:11:47.073092,0 days 00:00:20.216906,48,700.0,COMPLETE,RandomForest,0.6177307182999774,,,,,,,,,,,,,,,,,,,13,IIDPreprocessor,RevenueQuantileBucketImputer:3-buckets,ArcSinhTargetScaler
6,6,0.6103992692398456,2024-03-08 07:11:47.073957,2024-03-08 07:12:11.424247,0 days 00:00:24.350290,42,800.0,COMPLETE,RandomForest,0.6177307182999774,,,,,,,,,,,,,,,,,,,13,IIDPreprocessor,RevenueQuantileBucketImputer:3-buckets,ArcSinhTargetScaler
7,7,0.6081703541315859,2024-03-08 07:12:11.424929,2024-03-08 07:12:43.706192,0 days 00:00:32.281263,93,1100.0,COMPLETE,RandomForest,0.6177307182999774,,,,,,,,,,,,,,,,,,,13,IIDPreprocessor,RevenueQuantileBucketImputer:3-buckets,ArcSinhTargetScaler
8,8,0.6087923335853194,2024-03-08 07:12:43.706819,2024-03-08 07:13:19.187178,0 days 00:00:35.480359,87,1200.0,COMPLETE,RandomForest,0.6177307182999774,,,,,,,,,,,,,,,,,,,13,IIDPreprocessor,RevenueQuantileBucketImputer:3-buckets,ArcSinhTargetScaler
9,9,0.5815693732782986,2024-03-08 07:13:19.188040,2024-03-08 07:13:21.491732,0 days 00:00:02.303692,12,100.0,COMPLETE,RandomForest,0.6177307182999774,,,,,,,,,,,,,,,,,,,13,IIDPreprocessor,RevenueQuantileBucketImputer:3-buckets,ArcSinhTargetScaler
