,number,value,datetime_start,datetime_complete,duration,params_max_depth,params_n_estimators,state,model,best_value,params_bagging_fraction,params_bagging_freq,params_feature_fraction,params_lambda_l1,params_lambda_l2,params_learning_rate,params_min_child_samples,params_num_leaves,params_alpha,params_booster,params_eta,params_gamma,params_grow_policy,params_lambda,params_normalize_type,params_rate_drop,params_sample_type,params_skip_drop,config_id,preprocessor,imputer,target_scaler
26,26,0.6021334453514393,2024-03-08 01:34:42.737456,2024-03-08 01:35:53.584126,0 days 00:01:10.846670,8,,COMPLETE,XGB,0.6753870530494209,,,,,,,,,0.0012859877668736227,dart,2.0550566471986338e-07,1.7273875249022458e-06,lossguide,2.7956301886066696e-08,forest,9.221218282457893e-07,weighted,0.4907354817214829,7,BaselinePreprocessor,HybridCategoricalStatisticsImputer,ArcSinhTargetScaler
27,27,0.6129786858695887,2024-03-08 01:35:53.586084,2024-03-08 01:36:55.569349,0 days 00:01:01.983265,7,,COMPLETE,XGB,0.6753870530494209,,,,,,,,,1.457760663760507e-05,dart,9.205966876481045e-07,9.56138163543556e-06,lossguide,5.7220401034955016e-08,tree,7.921778323362944e-08,uniform,3.2609420752147858e-06,7,BaselinePreprocessor,HybridCategoricalStatisticsImputer,ArcSinhTargetScaler
28,28,0.5915878777759604,2024-03-08 01:36:55.571196,2024-03-08 01:37:22.252093,0 days 00:00:26.680897,2,,COMPLETE,XGB,0.6753870530494209,,,,,,,,,0.001547552256679126,dart,0.0005991823218099487,0.0523323003589959,depthwise,6.8693092956345e-06,tree,0.27404498977877445,uniform,0.0023134247855657805,7,BaselinePreprocessor,HybridCategoricalStatisticsImputer,ArcSinhTargetScaler
29,29,0.6448367708198314,2024-03-08 01:37:22.253311,2024-03-08 01:38:07.924101,0 days 00:00:45.670790,6,,COMPLETE,XGB,0.6753870530494209,,,,,,,,,0.00024555812523394723,dart,0.5440144499197213,0.05331648510534749,lossguide,0.0002038954154347377,tree,0.44047647206327717,uniform,0.45072703709030415,7,BaselinePreprocessor,HybridCategoricalStatisticsImputer,ArcSinhTargetScaler
30,30,0.6297516245040866,2024-03-08 01:38:07.925804,2024-03-08 01:38:48.776505,0 days 00:00:40.850701,4,,COMPLETE,XGB,0.6753870530494209,,,,,,,,,8.421009493169171e-05,dart,3.455843822812142e-05,0.001703775096231881,lossguide,3.9995188353616564e-05,forest,5.317716563422735e-08,uniform,0.13802028981462797,7,BaselinePreprocessor,HybridCategoricalStatisticsImputer,ArcSinhTargetScaler
31,31,0.6675674924541549,2024-03-08 01:38:48.778054,2024-03-08 01:39:27.416340,0 days 00:00:38.638286,3,,COMPLETE,XGB,0.6753870530494209,,,,,,,,,2.5585889487036188e-08,dart,0.17805143719404679,9.851989571883433e-07,lossguide,1.5037169385866882e-06,forest,9.667119733528637e-07,weighted,3.2567009282292944e-06,7,BaselinePreprocessor,HybridCategoricalStatisticsImputer,ArcSinhTargetScaler
32,32,0.6432322318074956,2024-03-08 01:39:27.417433,2024-03-08 01:40:06.814250,0 days 00:00:39.396817,3,,COMPLETE,XGB,0.6753870530494209,,,,,,,,,1.7112985796373384e-06,dart,5.842653286550698e-07,0.0041279540367083044,depthwise,3.5661565776271506e-06,forest,0.00014846286271043475,weighted,0.000724055820147489,7,BaselinePreprocessor,HybridCategoricalStatisticsImputer,ArcSinhTargetScaler
33,33,0.6307435118048064,2024-03-08 01:40:06.815519,2024-03-08 01:41:04.399507,0 days 00:00:57.583988,6,,COMPLETE,XGB,0.6753870530494209,,,,,,,,,1.2283795467468284e-07,dart,1.1791267484434705e-05,0.0005987795320273535,depthwise,1.828591697930311e-08,forest,5.201264954269662e-07,uniform,3.4321327311204314e-08,7,BaselinePreprocessor,HybridCategoricalStatisticsImputer,ArcSinhTargetScaler
34,34,0.6251036134324018,2024-03-08 01:41:04.401196,2024-03-08 01:42:05.964154,0 days 00:01:01.562958,7,,COMPLETE,XGB,0.6753870530494209,,,,,,,,,2.080067612473025e-06,dart,0.0006013803106841996,0.5108208099689697,lossguide,7.950619815121349e-05,tree,0.0011460734662224823,weighted,3.488407107754824e-05,7,BaselinePreprocessor,HybridCategoricalStatisticsImputer,ArcSinhTargetScaler
35,35,0.6198561644139463,2024-03-08 01:42:05.965595,2024-03-08 01:42:53.782616,0 days 00:00:47.817021,5,,COMPLETE,XGB,0.6753870530494209,,,,,,,,,1.8027568220186227e-05,dart,4.12999954782162e-08,1.003473755663398e-06,lossguide,0.003918624970741466,tree,2.2539008646574852e-05,weighted,0.0023301228122909333,7,BaselinePreprocessor,HybridCategoricalStatisticsImputer,ArcSinhTargetScaler
36,36,0.6276620323503191,2024-03-08 01:42:53.784930,2024-03-08 01:43:49.587266,0 days 00:00:55.802336,6,,COMPLETE,XGB,0.6753870530494209,,,,,,,,,1.052996623387605e-06,dart,2.0805363598496373e-07,0.008839470870005068,depthwise,3.530565718118376e-08,forest,5.05322948631652e-06,weighted,1.9087070379063426e-05,7,BaselinePreprocessor,HybridCategoricalStatisticsImputer,ArcSinhTargetScaler
37,37,0.6753870530494209,2024-03-08 01:43:49.588614,2024-03-08 01:44:27.860115,0 days 00:00:38.271501,3,,COMPLETE,XGB,0.6753870530494209,,,,,,,,,1.1806785831997942e-08,dart,0.16160639870362964,0.3429580479193064,lossguide,4.441976985224963e-05,forest,4.3383888409504804e-05,weighted,1.655242081990637e-08,7,BaselinePreprocessor,HybridCategoricalStatisticsImputer,ArcSinhTargetScaler
38,38,0.6256093528893372,2024-03-08 01:44:27.861648,2024-03-08 01:45:12.737161,0 days 00:00:44.875513,4,,COMPLETE,XGB,0.6753870530494209,,,,,,,,,0.3098529439681806,dart,1.779928241987387e-05,2.169118085670573e-05,lossguide,0.001714582015626287,tree,0.0019842427538491587,weighted,0.09359706850425259,7,BaselinePreprocessor,HybridCategoricalStatisticsImputer,ArcSinhTargetScaler
39,39,0.6295570487471698,2024-03-08 01:45:12.738538,2024-03-08 01:46:00.373629,0 days 00:00:47.635091,5,,COMPLETE,XGB,0.6753870530494209,,,,,,,,,0.0010149792728792327,dart,1.3155627629488916e-06,0.006727420999501296,depthwise,9.355727844264244e-06,tree,0.0007949001000683312,weighted,3.821813351569552e-06,7,BaselinePreprocessor,HybridCategoricalStatisticsImputer,ArcSinhTargetScaler
0,0,0.6690389715643571,2024-03-08 01:58:16.192076,2024-03-08 01:59:02.891523,0 days 00:00:46.699447,36,1500.0,COMPLETE,RandomForest,0.677615034970145,,,,,,,,,,,,,,,,,,,8,BaselinePreprocessor,HybridCategoricalStatisticsImputer,DummyTargetScaler
1,1,0.6622505990906233,2024-03-08 01:59:02.904210,2024-03-08 01:59:16.306086,0 days 00:00:13.401876,99,400.0,COMPLETE,RandomForest,0.677615034970145,,,,,,,,,,,,,,,,,,,8,BaselinePreprocessor,HybridCategoricalStatisticsImputer,DummyTargetScaler
2,2,0.6657914999094093,2024-03-08 01:59:16.306658,2024-03-08 01:59:25.406970,0 days 00:00:09.100312,69,300.0,COMPLETE,RandomForest,0.677615034970145,,,,,,,,,,,,,,,,,,,8,BaselinePreprocessor,HybridCategoricalStatisticsImputer,DummyTargetScaler
3,3,0.6676566462301138,2024-03-08 01:59:25.407679,2024-03-08 01:59:58.669593,0 days 00:00:33.261914,36,1100.0,COMPLETE,RandomForest,0.677615034970145,,,,,,,,,,,,,,,,,,,8,BaselinePreprocessor,HybridCategoricalStatisticsImputer,DummyTargetScaler
4,4,0.6679981201033208,2024-03-08 01:59:58.670201,2024-03-08 02:00:10.079789,0 days 00:00:11.409588,33,300.0,COMPLETE,RandomForest,0.677615034970145,,,,,,,,,,,,,,,,,,,8,BaselinePreprocessor,HybridCategoricalStatisticsImputer,DummyTargetScaler
5,5,0.667118858737108,2024-03-08 02:00:10.080580,2024-03-08 02:00:52.124519,0 days 00:00:42.043939,78,1200.0,COMPLETE,RandomForest,0.677615034970145,,,,,,,,,,,,,,,,,,,8,BaselinePreprocessor,HybridCategoricalStatisticsImputer,DummyTargetScaler
6,6,0.6722264321778456,2024-03-08 02:00:52.125420,2024-03-08 02:01:32.222512,0 days 00:00:40.097092,90,1200.0,COMPLETE,RandomForest,0.677615034970145,,,,,,,,,,,,,,,,,,,8,BaselinePreprocessor,HybridCategoricalStatisticsImputer,DummyTargetScaler
7,7,0.6645660664348486,2024-03-08 02:01:32.223350,2024-03-08 02:01:58.348113,0 days 00:00:26.124763,54,800.0,COMPLETE,RandomForest,0.677615034970145,,,,,,,,,,,,,,,,,,,8,BaselinePreprocessor,HybridCategoricalStatisticsImputer,DummyTargetScaler
8,8,0.6735522721509432,2024-03-08 02:01:58.348860,2024-03-08 02:02:37.715457,0 days 00:00:39.366597,90,1200.0,COMPLETE,RandomForest,0.677615034970145,,,,,,,,,,,,,,,,,,,8,BaselinePreprocessor,HybridCategoricalStatisticsImputer,DummyTargetScaler
9,9,0.6596872897919245,2024-03-08 02:02:37.716258,2024-03-08 02:02:44.080729,0 days 00:00:06.364471,42,200.0,COMPLETE,RandomForest,0.677615034970145,,,,,,,,,,,,,,,,,,,8,BaselinePreprocessor,HybridCategoricalStatisticsImputer,DummyTargetScaler
10,10,0.6658565316178446,2024-03-08 02:02:44.081441,2024-03-08 02:03:19.595134,0 days 00:00:35.513693,42,1100.0,COMPLETE,RandomForest,0.677615034970145,,,,,,,,,,,,,,,,,,,8,BaselinePreprocessor,HybridCategoricalStatisticsImputer,DummyTargetScaler
11,11,0.6717341881654014,2024-03-08 02:03:19.595655,2024-03-08 02:03:29.170207,0 days 00:00:09.574552,60,300.0,COMPLETE,RandomForest,0.677615034970145,,,,,,,,,,,,,,,,,,,8,BaselinePreprocessor,HybridCategoricalStatisticsImputer,DummyTargetScaler
12,12,0.6623895733680072,2024-03-08 02:03:29.170902,2024-03-08 02:03:45.156227,0 days 00:00:15.985325,54,500.0,COMPLETE,RandomForest,0.677615034970145,,,,,,,,,,,,,,,,,,,8,BaselinePreprocessor,HybridCategoricalStatisticsImputer,DummyTargetScaler
13,13,0.6625952458105252,2024-03-08 02:03:45.156785,2024-03-08 02:04:34.840278,0 days 00:00:49.683493,93,1500.0,COMPLETE,RandomForest,0.677615034970145,,,,,,,,,,,,,,,,,,,8,BaselinePreprocessor,HybridCategoricalStatisticsImputer,DummyTargetScaler
14,14,0.6580837107490682,2024-03-08 02:04:34.841036,2024-03-08 02:04:38.037343,0 days 00:00:03.196307,54,100.0,COMPLETE,RandomForest,0.677615034970145,,,,,,,,,,,,,,,,,,,8,BaselinePreprocessor,HybridCategoricalStatisticsImputer,DummyTargetScaler
15,15,0.6623093812996386,2024-03-08 02:04:38.038193,2024-03-08 02:04:56.359594,0 days 00:00:18.321401,75,600.0,COMPLETE,RandomForest,0.677615034970145,,,,,,,,,,,,,,,,,,,8,BaselinePreprocessor,HybridCategoricalStatisticsImputer,DummyTargetScaler
16,16,0.6731981905658351,2024-03-08 02:04:56.360196,2024-03-08 02:05:22.784225,0 days 00:00:26.424029,72,800.0,COMPLETE,RandomForest,0.677615034970145,,,,,,,,,,,,,,,,,,,8,BaselinePreprocessor,HybridCategoricalStatisticsImputer,DummyTargetScaler
17,17,0.6721758329241345,2024-03-08 02:05:22.784798,2024-03-08 02:05:59.226115,0 days 00:00:36.441317,24,1200.0,COMPLETE,RandomForest,0.677615034970145,,,,,,,,,,,,,,,,,,,8,BaselinePreprocessor,HybridCategoricalStatisticsImputer,DummyTargetScaler
18,18,0.6707964565943473,2024-03-08 02:05:59.226714,2024-03-08 02:06:27.996526,0 days 00:00:28.769812,27,900.0,COMPLETE,RandomForest,0.677615034970145,,,,,,,,,,,,,,,,,,,8,BaselinePreprocessor,HybridCategoricalStatisticsImputer,DummyTargetScaler
19,19,0.6655057725066943,2024-03-08 02:06:27.997104,2024-03-08 02:06:43.668120,0 days 00:00:15.671016,66,500.0,COMPLETE,RandomForest,0.677615034970145,,,,,,,,,,,,,,,,,,,8,BaselinePreprocessor,HybridCategoricalStatisticsImputer,DummyTargetScaler
20,20,0.6490475985142801,2024-03-08 02:06:43.668773,2024-03-08 02:06:46.764788,0 days 00:00:03.096015,96,100.0,COMPLETE,RandomForest,0.677615034970145,,,,,,,,,,,,,,,,,,,8,BaselinePreprocessor,HybridCategoricalStatisticsImputer,DummyTargetScaler
21,21,0.6679121896787157,2024-03-08 02:06:46.765305,2024-03-08 02:07:05.630969,0 days 00:00:18.865664,87,600.0,COMPLETE,RandomForest,0.677615034970145,,,,,,,,,,,,,,,,,,,8,BaselinePreprocessor,HybridCategoricalStatisticsImputer,DummyTargetScaler
22,22,0.6693842662774551,2024-03-08 02:07:05.631860,2024-03-08 02:07:43.285280,0 days 00:00:37.653420,63,1200.0,COMPLETE,RandomForest,0.677615034970145,,,,,,,,,,,,,,,,,,,8,BaselinePreprocessor,HybridCategoricalStatisticsImputer,DummyTargetScaler
23,23,0.6698738768660197,2024-03-08 02:07:43.285963,2024-03-08 02:07:58.707812,0 days 00:00:15.421849,54,500.0,COMPLETE,RandomForest,0.677615034970145,,,,,,,,,,,,,,,,,,,8,BaselinePreprocessor,HybridCategoricalStatisticsImputer,DummyTargetScaler
24,24,0.6674935242691201,2024-03-08 02:07:58.708441,2024-03-08 02:08:26.442491,0 days 00:00:27.734050,93,900.0,COMPLETE,RandomForest,0.677615034970145,,,,,,,,,,,,,,,,,,,8,BaselinePreprocessor,HybridCategoricalStatisticsImputer,DummyTargetScaler
25,25,0.664630461709088,2024-03-08 02:08:26.443112,2024-03-08 02:08:32.621926,0 days 00:00:06.178814,48,200.0,COMPLETE,RandomForest,0.677615034970145,,,,,,,,,,,,,,,,,,,8,BaselinePreprocessor,HybridCategoricalStatisticsImputer,DummyTargetScaler
26,26,0.6705143071499295,2024-03-08 02:08:32.622465,2024-03-08 02:08:57.874711,0 days 00:00:25.252246,51,800.0,COMPLETE,RandomForest,0.677615034970145,,,,,,,,,,,,,,,,,,,8,BaselinePreprocessor,HybridCategoricalStatisticsImputer,DummyTargetScaler
27,27,0.6295195785717662,2024-03-08 02:08:57.875538,2024-03-08 02:09:26.500241,0 days 00:00:28.624703,9,1300.0,COMPLETE,RandomForest,0.677615034970145,,,,,,,,,,,,,,,,,,,8,BaselinePreprocessor,HybridCategoricalStatisticsImputer,DummyTargetScaler
28,28,0.6674941748109864,2024-03-08 02:09:26.500883,2024-03-08 02:09:55.818831,0 days 00:00:29.317948,39,900.0,COMPLETE,RandomForest,0.677615034970145,,,,,,,,,,,,,,,,,,,8,BaselinePreprocessor,HybridCategoricalStatisticsImputer,DummyTargetScaler
29,29,0.6595512845699593,2024-03-08 02:09:55.819399,2024-03-08 02:10:22.568273,0 days 00:00:26.748874,87,800.0,COMPLETE,RandomForest,0.677615034970145,,,,,,,,,,,,,,,,,,,8,BaselinePreprocessor,HybridCategoricalStatisticsImputer,DummyTargetScaler
30,30,0.6690137104286016,2024-03-08 02:10:22.568909,2024-03-08 02:10:55.532652,0 days 00:00:32.963743,48,1100.0,COMPLETE,RandomForest,0.677615034970145,,,,,,,,,,,,,,,,,,,8,BaselinePreprocessor,HybridCategoricalStatisticsImputer,DummyTargetScaler
31,31,0.6580238359731686,2024-03-08 02:10:55.533292,2024-03-08 02:11:23.817900,0 days 00:00:28.284608,24,900.0,COMPLETE,RandomForest,0.677615034970145,,,,,,,,,,,,,,,,,,,8,BaselinePreprocessor,HybridCategoricalStatisticsImputer,DummyTargetScaler
32,32,0.6553919922481231,2024-03-08 02:11:23.818698,2024-03-08 02:11:26.886228,0 days 00:00:03.067530,15,100.0,COMPLETE,RandomForest,0.677615034970145,,,,,,,,,,,,,,,,,,,8,BaselinePreprocessor,HybridCategoricalStatisticsImputer,DummyTargetScaler
33,33,0.6605126608688073,2024-03-08 02:11:26.887013,2024-03-08 02:11:29.992250,0 days 00:00:03.105237,48,100.0,COMPLETE,RandomForest,0.677615034970145,,,,,,,,,,,,,,,,,,,8,BaselinePreprocessor,HybridCategoricalStatisticsImputer,DummyTargetScaler
34,34,0.6677825247993036,2024-03-08 02:11:29.992772,2024-03-08 02:11:42.494464,0 days 00:00:12.501692,75,400.0,COMPLETE,RandomForest,0.677615034970145,,,,,,,,,,,,,,,,,,,8,BaselinePreprocessor,HybridCategoricalStatisticsImputer,DummyTargetScaler
35,35,0.5750520316502516,2024-03-08 02:11:42.495012,2024-03-08 02:12:08.035023,0 days 00:00:25.540011,6,1500.0,COMPLETE,RandomForest,0.677615034970145,,,,,,,,,,,,,,,,,,,8,BaselinePreprocessor,HybridCategoricalStatisticsImputer,DummyTargetScaler
36,36,0.6730859496085851,2024-03-08 02:12:08.035870,2024-03-08 02:12:38.024066,0 days 00:00:29.988196,57,1000.0,COMPLETE,RandomForest,0.677615034970145,,,,,,,,,,,,,,,,,,,8,BaselinePreprocessor,HybridCategoricalStatisticsImputer,DummyTargetScaler
37,37,0.6617005490179219,2024-03-08 02:12:38.024643,2024-03-08 02:13:07.775008,0 days 00:00:29.750365,84,900.0,COMPLETE,RandomForest,0.677615034970145,,,,,,,,,,,,,,,,,,,8,BaselinePreprocessor,HybridCategoricalStatisticsImputer,DummyTargetScaler
38,38,0.677615034970145,2024-03-08 02:13:07.775837,2024-03-08 02:13:43.098923,0 days 00:00:35.323086,87,1100.0,COMPLETE,RandomForest,0.677615034970145,,,,,,,,,,,,,,,,,,,8,BaselinePreprocessor,HybridCategoricalStatisticsImputer,DummyTargetScaler
39,39,0.6626771985662647,2024-03-08 02:13:43.099518,2024-03-08 02:14:25.490959,0 days 00:00:42.391441,60,1300.0,COMPLETE,RandomForest,0.677615034970145,,,,,,,,,,,,,,,,,,,8,BaselinePreprocessor,HybridCategoricalStatisticsImputer,DummyTargetScaler
0,0,0.6751515822727576,2024-03-08 02:15:01.383745,2024-03-08 02:15:52.116994,0 days 00:00:50.733249,42,510.0,COMPLETE,LGBM,0.6923876126176829,0.41205981247600043,7.0,0.788533996518079,0.00018840616176782175,1.4022092135173647e-07,0.0372839898191676,21.0,237.0,,,,,,,,,,,8,BaselinePreprocessor,HybridCategoricalStatisticsImputer,DummyTargetScaler
1,1,0.6604393807993638,2024-03-08 02:15:52.119177,2024-03-08 02:15:57.493357,0 days 00:00:05.374180,15,410.0,COMPLETE,LGBM,0.6923876126176829,0.6173612703760858,2.0,0.8803572459189792,9.407148337645538,0.055868390456288476,0.11071193164945495,22.0,185.0,,,,,,,,,,,8,BaselinePreprocessor,HybridCategoricalStatisticsImputer,DummyTargetScaler
2,2,0.6790624175950599,2024-03-08 02:15:57.494454,2024-03-08 02:16:31.106855,0 days 00:00:33.612401,81,510.0,COMPLETE,LGBM,0.6923876126176829,0.717178512360545,6.0,0.9896286643800573,0.011207104128538025,4.403637036934524e-06,0.06319216021236414,12.0,12.0,,,,,,,,,,,8,BaselinePreprocessor,HybridCategoricalStatisticsImputer,DummyTargetScaler
3,3,0.6809100798301715,2024-03-08 02:16:31.108686,2024-03-08 02:16:57.800091,0 days 00:00:26.691405,18,510.0,COMPLETE,LGBM,0.6923876126176829,0.6070927691644082,2.0,0.8034904565248695,7.522014566797885e-07,2.090467733107839e-05,0.11140744811937116,6.0,17.0,,,,,,,,,,,8,BaselinePreprocessor,HybridCategoricalStatisticsImputer,DummyTargetScaler
4,4,0.6644786461488927,2024-03-08 02:16:57.801547,2024-03-08 02:17:23.506023,0 days 00:00:25.704476,42,710.0,COMPLETE,LGBM,0.6923876126176829,0.4355712212357595,2.0,0.945185771045806,3.9423303200758234e-05,0.0020425170228900633,0.1127658011733484,64.0,24.0,,,,,,,,,,,8,BaselinePreprocessor,HybridCategoricalStatisticsImputer,DummyTargetScaler
5,5,0.6845253651129221,2024-03-08 02:17:23.507816,2024-03-08 02:18:01.686734,0 days 00:00:38.178918,48,810.0,COMPLETE,LGBM,0.6923876126176829,0.6550830560894274,6.0,0.5119385546011312,9.222858574536894e-08,6.530290361743432e-07,0.04788935595562303,48.0,186.0,,,,,,,,,,,8,BaselinePreprocessor,HybridCategoricalStatisticsImputer,DummyTargetScaler
6,6,0.6875558685585959,2024-03-08 02:18:01.697993,2024-03-08 02:18:19.556709,0 days 00:00:17.858716,54,210.0,COMPLETE,LGBM,0.6923876126176829,0.6831581761187642,6.0,0.7735939898142619,5.264987606956607e-05,6.134617442027293e-08,0.14248486436315635,23.0,243.0,,,,,,,,,,,8,BaselinePreprocessor,HybridCategoricalStatisticsImputer,DummyTargetScaler
7,7,0.6638680134130454,2024-03-08 02:18:19.557934,2024-03-08 02:18:29.800357,0 days 00:00:10.242423,57,610.0,COMPLETE,LGBM,0.6923876126176829,0.576464530184595,2.0,0.4969844092306452,0.3595526119770295,2.4625762782264395,0.26544462155997567,24.0,217.0,,,,,,,,,,,8,BaselinePreprocessor,HybridCategoricalStatisticsImputer,DummyTargetScaler
8,8,0.6842561849486745,2024-03-08 02:18:29.801414,2024-03-08 02:18:59.217011,0 days 00:00:29.415597,12,610.0,COMPLETE,LGBM,0.6923876126176829,0.8831497031656386,6.0,0.4723146709469547,0.00039429639627735406,2.3770825841345004e-08,0.05383946471168165,24.0,76.0,,,,,,,,,,,8,BaselinePreprocessor,HybridCategoricalStatisticsImputer,DummyTargetScaler
9,9,0.6524636096578906,2024-03-08 02:18:59.218571,2024-03-08 02:19:04.510021,0 days 00:00:05.291450,99,110.0,COMPLETE,LGBM,0.6923876126176829,0.76745002967157,2.0,0.5931585283150427,0.0032334316698900177,1.98916541305175,0.027360241827175332,53.0,130.0,,,,,,,,,,,8,BaselinePreprocessor,HybridCategoricalStatisticsImputer,DummyTargetScaler
10,10,0.6696822022106569,2024-03-08 02:19:04.511534,2024-03-08 02:19:32.715351,0 days 00:00:28.203817,54,1410.0,COMPLETE,LGBM,0.6923876126176829,0.5863280554880312,7.0,0.5228837160712075,7.928996119378501e-08,9.29195096595801,0.01945915517559034,62.0,7.0,,,,,,,,,,,8,BaselinePreprocessor,HybridCategoricalStatisticsImputer,DummyTargetScaler
11,11,0.5868629514980096,2024-03-08 02:19:32.725090,2024-03-08 02:19:33.343903,0 days 00:00:00.618813,30,10.0,COMPLETE,LGBM,0.6923876126176829,0.8457237962660682,1.0,0.41199353071723827,0.021854936447441173,0.010164858126389863,0.06412991770728729,59.0,118.0,,,,,,,,,,,8,BaselinePreprocessor,HybridCategoricalStatisticsImputer,DummyTargetScaler
12,12,0.6811019548405993,2024-03-08 02:19:33.345688,2024-03-08 02:20:03.408341,0 days 00:00:30.062653,72,410.0,COMPLETE,LGBM,0.6923876126176829,0.6635458842067468,2.0,0.6936006070112757,1.5591731633212605e-06,0.6345143447445559,0.07306205588194453,19.0,203.0,,,,,,,,,,,8,BaselinePreprocessor,HybridCategoricalStatisticsImputer,DummyTargetScaler
13,13,0.6588969681782696,2024-03-08 02:20:03.423456,2024-03-08 02:20:07.497284,0 days 00:00:04.073828,90,110.0,COMPLETE,LGBM,0.6923876126176829,0.6769161528082891,1.0,0.6451183285702342,2.590184783228972,0.00018769358296022142,0.10449933674957704,57.0,159.0,,,,,,,,,,,8,BaselinePreprocessor,HybridCategoricalStatisticsImputer,DummyTargetScaler
14,14,0.6565516938444486,2024-03-08 02:20:07.499902,2024-03-08 02:20:26.658717,0 days 00:00:19.158815,6,1010.0,COMPLETE,LGBM,0.6923876126176829,0.9903719901395441,4.0,0.8287296408107432,0.5364697007866509,1.8958742127334125,0.1032832752387522,10.0,136.0,,,,,,,,,,,8,BaselinePreprocessor,HybridCategoricalStatisticsImputer,DummyTargetScaler
15,15,0.6536431997333303,2024-03-08 02:20:26.660195,2024-03-08 02:20:32.181904,0 days 00:00:05.521709,72,110.0,COMPLETE,LGBM,0.6923876126176829,0.8153920344018393,1.0,0.9467413956294712,0.38872840400230196,7.202374386541337e-07,0.024509796577240856,88.0,242.0,,,,,,,,,,,8,BaselinePreprocessor,HybridCategoricalStatisticsImputer,DummyTargetScaler
16,16,0.6570779399629457,2024-03-08 02:20:32.183431,2024-03-08 02:21:02.372174,0 days 00:00:30.188743,9,510.0,COMPLETE,LGBM,0.6923876126176829,0.9929268453906854,3.0,0.7098533029052966,0.1928004035080743,0.00020972527450489073,0.013460196370436665,68.0,206.0,,,,,,,,,,,8,BaselinePreprocessor,HybridCategoricalStatisticsImputer,DummyTargetScaler
17,17,0.6729886137566813,2024-03-08 02:21:02.374244,2024-03-08 02:21:45.136534,0 days 00:00:42.762290,15,1310.0,COMPLETE,LGBM,0.6923876126176829,0.7600249718267629,3.0,0.5603407468126204,0.0001308683937731748,4.924707203111915,0.014113059105132447,74.0,213.0,,,,,,,,,,,8,BaselinePreprocessor,HybridCategoricalStatisticsImputer,DummyTargetScaler
