,number,value,datetime_start,datetime_complete,duration,params_max_depth,params_n_estimators,state,model,best_value,params_bagging_fraction,params_bagging_freq,params_feature_fraction,params_lambda_l1,params_lambda_l2,params_learning_rate,params_min_child_samples,params_num_leaves,params_alpha,params_booster,params_eta,params_gamma,params_grow_policy,params_lambda,params_normalize_type,params_rate_drop,params_sample_type,params_skip_drop,config_id,preprocessor,imputer,target_scaler
5,5,0.5368847000167567,2024-03-07 22:45:00.023339,2024-03-07 22:45:33.923319,0 days 00:00:33.899980,3,,COMPLETE,XGB,0.6184139641399494,,,,,,,,,0.12389849185516934,dart,1.6351173571100848e-08,1.6859847482234056e-08,lossguide,2.5752725154393455e-06,forest,1.4298451545344061e-08,uniform,1.0238554809646436e-05,5,BaselinePreprocessor,RevenueQuantileBucketImputer:3-buckets,DummyTargetScaler
6,6,0.535288687950453,2024-03-07 22:45:33.924559,2024-03-07 22:46:27.412303,0 days 00:00:53.487744,7,,COMPLETE,XGB,0.6184139641399494,,,,,,,,,1.1013760511832825e-08,dart,1.2389916850295327e-05,0.001572004120016877,depthwise,0.0005636225654542757,forest,4.124976147613749e-07,weighted,5.229865157836149e-05,5,BaselinePreprocessor,RevenueQuantileBucketImputer:3-buckets,DummyTargetScaler
7,7,0.5368231936270264,2024-03-07 22:46:27.413447,2024-03-07 22:47:17.075898,0 days 00:00:49.662451,6,,COMPLETE,XGB,0.6184139641399494,,,,,,,,,0.00154869102829122,dart,1.2388106522136943e-07,0.0008282985814761494,depthwise,2.874258984398593e-07,tree,0.01229794433212107,weighted,0.7311496165228855,5,BaselinePreprocessor,RevenueQuantileBucketImputer:3-buckets,DummyTargetScaler
8,8,0.5321387817475381,2024-03-07 22:47:17.077921,2024-03-07 22:47:48.433205,0 days 00:00:31.355284,2,,COMPLETE,XGB,0.6184139641399494,,,,,,,,,0.18098009300238527,dart,9.119138112056338e-06,0.004032616322679968,depthwise,1.8808311258548578e-07,tree,0.0004489139279067352,uniform,0.009330680015416142,5,BaselinePreprocessor,RevenueQuantileBucketImputer:3-buckets,DummyTargetScaler
9,9,0.564354646501391,2024-03-07 22:47:48.436623,2024-03-07 22:48:45.514142,0 days 00:00:57.077519,9,,COMPLETE,XGB,0.6184139641399494,,,,,,,,,1.1813286874473562e-06,dart,0.004450912299945213,0.00021852269024475352,depthwise,0.0012073073277861833,tree,0.00010690604519961128,weighted,5.865245128948597e-08,5,BaselinePreprocessor,RevenueQuantileBucketImputer:3-buckets,DummyTargetScaler
10,10,0.5321387817475381,2024-03-07 22:48:45.515610,2024-03-07 22:49:06.937030,0 days 00:00:21.421420,2,,COMPLETE,XGB,0.6184139641399494,,,,,,,,,0.0014495372941560494,dart,5.195582993155868e-06,0.0008424420589087092,depthwise,0.000660516674959721,tree,0.49736929548771797,weighted,7.462404844151642e-05,5,BaselinePreprocessor,RevenueQuantileBucketImputer:3-buckets,DummyTargetScaler
11,11,0.5343584125079817,2024-03-07 22:49:06.938741,2024-03-07 22:50:03.552988,0 days 00:00:56.614247,7,,COMPLETE,XGB,0.6184139641399494,,,,,,,,,4.3282114830767253e-05,dart,6.919683569102828e-07,0.067536811261427,lossguide,3.595770036138936e-06,forest,0.0019836713120437426,weighted,2.2968553854446248e-05,5,BaselinePreprocessor,RevenueQuantileBucketImputer:3-buckets,DummyTargetScaler
12,12,0.5905538704036788,2024-03-07 22:50:03.557373,2024-03-07 22:51:05.869034,0 days 00:01:02.311661,8,,COMPLETE,XGB,0.6184139641399494,,,,,,,,,0.38417132921124053,dart,0.011681687658778772,0.00011269234621458566,depthwise,1.6393910752125107e-07,tree,4.505274787008625e-07,weighted,1.5237347607981096e-05,5,BaselinePreprocessor,RevenueQuantileBucketImputer:3-buckets,DummyTargetScaler
13,13,0.5549785274458697,2024-03-07 22:51:05.870813,2024-03-07 22:52:03.269824,0 days 00:00:57.399011,8,,COMPLETE,XGB,0.6184139641399494,,,,,,,,,0.28048332186705355,dart,3.1553979837129268e-06,0.013917409174920351,depthwise,0.9343367211463737,tree,3.8238254047048123e-05,uniform,1.3311369537456233e-07,5,BaselinePreprocessor,RevenueQuantileBucketImputer:3-buckets,DummyTargetScaler
14,14,0.5466581315164243,2024-03-07 22:52:03.274462,2024-03-07 22:52:30.947312,0 days 00:00:27.672850,3,,COMPLETE,XGB,0.6184139641399494,,,,,,,,,0.351644485813049,dart,3.9638149817707127e-07,6.011875046665169e-07,lossguide,3.023294477941611e-05,forest,4.3369657889411564e-08,weighted,0.40447321734790953,5,BaselinePreprocessor,RevenueQuantileBucketImputer:3-buckets,DummyTargetScaler
15,15,0.5943229281268725,2024-03-07 22:52:30.948488,2024-03-07 22:53:06.669516,0 days 00:00:35.721028,4,,COMPLETE,XGB,0.6184139641399494,,,,,,,,,0.6885317084524122,dart,0.05017750988950301,0.00030036872447057643,depthwise,0.0005417204106695164,tree,1.3340091841682052e-06,weighted,8.188654690833888e-06,5,BaselinePreprocessor,RevenueQuantileBucketImputer:3-buckets,DummyTargetScaler
16,16,0.5274281246118747,2024-03-07 22:53:06.671479,2024-03-07 22:53:38.277740,0 days 00:00:31.606261,2,,COMPLETE,XGB,0.6184139641399494,,,,,,,,,1.2017037569302399e-06,dart,0.000998656727705307,6.151189060759756e-05,depthwise,0.05525296020719378,tree,2.5446720203497583e-07,weighted,0.8753694116694727,5,BaselinePreprocessor,RevenueQuantileBucketImputer:3-buckets,DummyTargetScaler
17,17,0.5387449259389837,2024-03-07 22:53:38.281321,2024-03-07 22:54:27.329007,0 days 00:00:49.047686,6,,COMPLETE,XGB,0.6184139641399494,,,,,,,,,3.585483919929005e-06,dart,6.199314225110228e-05,0.002397771145485788,depthwise,0.0011759807982650412,forest,3.3087852817082085e-08,uniform,1.9058426349129771e-06,5,BaselinePreprocessor,RevenueQuantileBucketImputer:3-buckets,DummyTargetScaler
18,18,0.5496942297062711,2024-03-07 22:54:27.330717,2024-03-07 22:54:50.586068,0 days 00:00:23.255351,1,,COMPLETE,XGB,0.6184139641399494,,,,,,,,,1.3843536493877847e-08,dart,0.04102187663074569,2.5309624121174433e-06,lossguide,2.256805618735232e-06,forest,0.03145480154210276,uniform,0.017457201371081008,5,BaselinePreprocessor,RevenueQuantileBucketImputer:3-buckets,DummyTargetScaler
19,19,0.5390180883666562,2024-03-07 22:54:50.587229,2024-03-07 22:55:28.911761,0 days 00:00:38.324532,3,,COMPLETE,XGB,0.6184139641399494,,,,,,,,,1.1347798283552437e-06,dart,1.214021416787132e-07,2.8389272915320258e-08,depthwise,0.0017241469394235092,tree,0.0033295234615018507,weighted,3.5404477036347105e-05,5,BaselinePreprocessor,RevenueQuantileBucketImputer:3-buckets,DummyTargetScaler
20,20,0.46466950053266964,2024-03-07 22:55:28.914356,2024-03-07 22:55:48.805641,0 days 00:00:19.891285,1,,COMPLETE,XGB,0.6184139641399494,,,,,,,,,0.6276986698265998,dart,7.288431692191634e-07,0.2296824364318516,lossguide,4.9751860593719035e-05,forest,0.19083426411257107,uniform,0.489524033385298,5,BaselinePreprocessor,RevenueQuantileBucketImputer:3-buckets,DummyTargetScaler
21,21,0.5349685881563809,2024-03-07 22:55:48.806715,2024-03-07 22:56:39.426928,0 days 00:00:50.620213,7,,COMPLETE,XGB,0.6184139641399494,,,,,,,,,2.2561817784811946e-07,dart,6.696165812150546e-08,4.046482097115388e-06,depthwise,9.432372009872153e-08,tree,0.004018265267764455,weighted,5.964320366677385e-07,5,BaselinePreprocessor,RevenueQuantileBucketImputer:3-buckets,DummyTargetScaler
22,22,0.5393413152872715,2024-03-07 22:56:39.428180,2024-03-07 22:57:42.444634,0 days 00:01:03.016454,9,,COMPLETE,XGB,0.6184139641399494,,,,,,,,,3.40062656082116e-05,dart,8.514075936520989e-06,1.420895327182335e-05,lossguide,0.005587777947428517,tree,8.92363467166414e-07,uniform,0.4022048372722574,5,BaselinePreprocessor,RevenueQuantileBucketImputer:3-buckets,DummyTargetScaler
23,23,0.5615385542962906,2024-03-07 22:57:42.449937,2024-03-07 22:58:12.930415,0 days 00:00:30.480478,2,,COMPLETE,XGB,0.6184139641399494,,,,,,,,,0.14652672544565934,dart,0.026892900517938308,2.0269056992643523e-05,depthwise,0.617149621981131,tree,2.2082719418425934e-05,weighted,4.1145272775771256e-05,5,BaselinePreprocessor,RevenueQuantileBucketImputer:3-buckets,DummyTargetScaler
24,24,0.551513714971232,2024-03-07 22:58:12.931853,2024-03-07 22:58:52.779182,0 days 00:00:39.847329,6,,COMPLETE,XGB,0.6184139641399494,,,,,,,,,0.0004591780679226225,dart,0.004794753704381873,1.7589859480835736e-06,lossguide,0.019248096598123213,forest,0.36174025223768386,uniform,1.6683801100273353e-05,5,BaselinePreprocessor,RevenueQuantileBucketImputer:3-buckets,DummyTargetScaler
25,25,0.5347515379090221,2024-03-07 22:58:52.780834,2024-03-07 22:59:23.508392,0 days 00:00:30.727558,6,,COMPLETE,XGB,0.6184139641399494,,,,,,,,,2.457412915315931e-08,dart,3.3374323772684087e-06,0.00029521177106913414,lossguide,3.715143898410157e-08,forest,0.9045442882260399,weighted,2.290792323384298e-08,5,BaselinePreprocessor,RevenueQuantileBucketImputer:3-buckets,DummyTargetScaler
26,26,0.5675892928609395,2024-03-07 22:59:23.510819,2024-03-07 23:00:09.774419,0 days 00:00:46.263600,9,,COMPLETE,XGB,0.6184139641399494,,,,,,,,,3.249297101021476e-05,dart,0.0032808808727544793,4.976073758346197e-06,lossguide,0.01221049842391917,forest,0.7716793679505631,weighted,5.566217020881524e-07,5,BaselinePreprocessor,RevenueQuantileBucketImputer:3-buckets,DummyTargetScaler
27,27,0.5321387817475381,2024-03-07 23:00:09.776913,2024-03-07 23:00:41.797689,0 days 00:00:32.020776,2,,COMPLETE,XGB,0.6184139641399494,,,,,,,,,1.2037060967883611e-05,dart,0.00014603912976154742,0.0003810944947194439,lossguide,5.650550997732839e-07,forest,4.728142839613361e-07,uniform,0.0008389115781269797,5,BaselinePreprocessor,RevenueQuantileBucketImputer:3-buckets,DummyTargetScaler
28,28,0.5606348257725339,2024-03-07 23:00:41.807033,2024-03-07 23:01:30.327635,0 days 00:00:48.520602,5,,COMPLETE,XGB,0.6184139641399494,,,,,,,,,6.346244223613654e-08,dart,0.0017711919756492314,1.1901888012403441e-05,lossguide,0.03785939758855285,forest,3.823106847255206e-08,weighted,0.018679840078287113,5,BaselinePreprocessor,RevenueQuantileBucketImputer:3-buckets,DummyTargetScaler
29,29,0.46466950053266964,2024-03-07 23:01:30.329416,2024-03-07 23:02:00.116263,0 days 00:00:29.786847,1,,COMPLETE,XGB,0.6184139641399494,,,,,,,,,0.00014060925364291893,dart,4.910722718388556e-05,0.0066346123206465595,lossguide,1.1299575064699235e-06,forest,1.710126776049997e-08,uniform,1.9017922756126417e-05,5,BaselinePreprocessor,RevenueQuantileBucketImputer:3-buckets,DummyTargetScaler
30,30,0.6048093427872618,2024-03-07 23:02:00.118771,2024-03-07 23:02:33.070589,0 days 00:00:32.951818,3,,COMPLETE,XGB,0.6184139641399494,,,,,,,,,1.6555077294899222e-06,dart,0.5158512708646419,7.868336529043638e-08,lossguide,0.006311485606653285,forest,2.591987203354989e-05,uniform,0.00011102094458013808,5,BaselinePreprocessor,RevenueQuantileBucketImputer:3-buckets,DummyTargetScaler
31,31,0.5347417984322301,2024-03-07 23:02:33.072124,2024-03-07 23:03:20.221572,0 days 00:00:47.149448,6,,COMPLETE,XGB,0.6184139641399494,,,,,,,,,5.7390801486045856e-08,dart,1.1754951313194015e-05,0.056976301688103095,depthwise,0.00015447886958874587,tree,0.09345051370766226,uniform,2.2665320611490827e-08,5,BaselinePreprocessor,RevenueQuantileBucketImputer:3-buckets,DummyTargetScaler
32,32,0.5597907784494139,2024-03-07 23:03:20.223086,2024-03-07 23:04:07.362443,0 days 00:00:47.139357,5,,COMPLETE,XGB,0.6184139641399494,,,,,,,,,5.014176622605456e-07,dart,0.011735725309631668,1.0402881439881316e-08,lossguide,5.3989332493381964e-06,tree,3.3778292553316353e-07,uniform,0.7333160162493088,5,BaselinePreprocessor,RevenueQuantileBucketImputer:3-buckets,DummyTargetScaler
33,33,0.5991372124544405,2024-03-07 23:04:07.365559,2024-03-07 23:04:40.811484,0 days 00:00:33.445925,4,,COMPLETE,XGB,0.6184139641399494,,,,,,,,,1.015648003115422e-07,dart,0.7623787802946262,0.32647415927309226,depthwise,0.03568617453393124,tree,2.421649679960906e-07,weighted,0.00014877868234660323,5,BaselinePreprocessor,RevenueQuantileBucketImputer:3-buckets,DummyTargetScaler
34,34,0.5281246538442544,2024-03-07 23:04:40.812769,2024-03-07 23:05:28.859511,0 days 00:00:48.046742,7,,COMPLETE,XGB,0.6184139641399494,,,,,,,,,6.796058352794367e-07,dart,7.502346483884374e-07,0.051261881378907366,lossguide,0.0004284252743921882,tree,0.2880062268653281,uniform,8.43016349943791e-05,5,BaselinePreprocessor,RevenueQuantileBucketImputer:3-buckets,DummyTargetScaler
35,35,0.5385664323079861,2024-03-07 23:05:28.861082,2024-03-07 23:06:11.549771,0 days 00:00:42.688689,4,,COMPLETE,XGB,0.6184139641399494,,,,,,,,,0.00391335345748549,dart,1.0458607237438659e-05,0.25189335561959414,lossguide,0.00022148015586882642,forest,3.0599112348929006e-07,uniform,0.005468924123962905,5,BaselinePreprocessor,RevenueQuantileBucketImputer:3-buckets,DummyTargetScaler
36,36,0.550692616815146,2024-03-07 23:06:11.551490,2024-03-07 23:06:43.979794,0 days 00:00:32.428304,3,,COMPLETE,XGB,0.6184139641399494,,,,,,,,,7.591206960773151e-07,dart,0.0002208624229540093,0.000790171947410103,depthwise,1.9583961168145942e-08,forest,0.09869400675684459,weighted,2.3092416640022012e-06,5,BaselinePreprocessor,RevenueQuantileBucketImputer:3-buckets,DummyTargetScaler
37,37,0.5464369534199185,2024-03-07 23:06:43.981899,2024-03-07 23:07:31.582755,0 days 00:00:47.600856,5,,COMPLETE,XGB,0.6184139641399494,,,,,,,,,0.002850010125107949,dart,2.2698053913353046e-08,0.040096901260089066,depthwise,1.694701645803333e-07,tree,9.829049015606142e-05,uniform,6.17825175752716e-06,5,BaselinePreprocessor,RevenueQuantileBucketImputer:3-buckets,DummyTargetScaler
38,38,0.5536140976002468,2024-03-07 23:07:31.587601,2024-03-07 23:08:28.797524,0 days 00:00:57.209923,8,,COMPLETE,XGB,0.6184139641399494,,,,,,,,,6.817330313748213e-08,dart,0.0018387122685434455,9.956265815055845e-07,depthwise,0.010967729112473996,tree,5.755934121711189e-07,uniform,5.121858462805955e-06,5,BaselinePreprocessor,RevenueQuantileBucketImputer:3-buckets,DummyTargetScaler
39,39,0.5605849972373349,2024-03-07 23:08:28.798854,2024-03-07 23:08:59.293447,0 days 00:00:30.494593,3,,COMPLETE,XGB,0.6184139641399494,,,,,,,,,0.7496348425864223,dart,3.5582910283625705e-05,6.521083970815451e-05,depthwise,0.0020562060427502223,forest,0.05707430530640068,weighted,0.00017460962760354007,5,BaselinePreprocessor,RevenueQuantileBucketImputer:3-buckets,DummyTargetScaler
0,0,0.6620084195084618,2024-03-07 23:21:15.206899,2024-03-07 23:21:46.778852,0 days 00:00:31.571953,12,1200.0,COMPLETE,RandomForest,0.67355193000151,,,,,,,,,,,,,,,,,,,6,BaselinePreprocessor,HybridCategoricalStatisticsImputer,LogTargetScaler
1,1,0.6257633003477321,2024-03-07 23:21:46.779665,2024-03-07 23:22:06.397732,0 days 00:00:19.618067,9,900.0,COMPLETE,RandomForest,0.67355193000151,,,,,,,,,,,,,,,,,,,6,BaselinePreprocessor,HybridCategoricalStatisticsImputer,LogTargetScaler
2,2,0.6390266794812562,2024-03-07 23:22:06.398538,2024-03-07 23:22:37.974788,0 days 00:00:31.576250,9,1500.0,COMPLETE,RandomForest,0.67355193000151,,,,,,,,,,,,,,,,,,,6,BaselinePreprocessor,HybridCategoricalStatisticsImputer,LogTargetScaler
3,3,0.6357455285055107,2024-03-07 23:22:37.975562,2024-03-07 23:22:55.902946,0 days 00:00:17.927384,9,800.0,COMPLETE,RandomForest,0.67355193000151,,,,,,,,,,,,,,,,,,,6,BaselinePreprocessor,HybridCategoricalStatisticsImputer,LogTargetScaler
4,4,0.67355193000151,2024-03-07 23:22:55.903724,2024-03-07 23:23:23.969384,0 days 00:00:28.065660,69,900.0,COMPLETE,RandomForest,0.67355193000151,,,,,,,,,,,,,,,,,,,6,BaselinePreprocessor,HybridCategoricalStatisticsImputer,LogTargetScaler
5,5,0.6613570732846704,2024-03-07 23:23:23.969909,2024-03-07 23:24:03.754322,0 days 00:00:39.784413,90,1300.0,COMPLETE,RandomForest,0.67355193000151,,,,,,,,,,,,,,,,,,,6,BaselinePreprocessor,HybridCategoricalStatisticsImputer,LogTargetScaler
6,6,0.6616129828178435,2024-03-07 23:24:03.754985,2024-03-07 23:24:15.404865,0 days 00:00:11.649880,87,400.0,COMPLETE,RandomForest,0.67355193000151,,,,,,,,,,,,,,,,,,,6,BaselinePreprocessor,HybridCategoricalStatisticsImputer,LogTargetScaler
7,7,0.6656845366672921,2024-03-07 23:24:15.405437,2024-03-07 23:25:00.192073,0 days 00:00:44.786636,99,1500.0,COMPLETE,RandomForest,0.67355193000151,,,,,,,,,,,,,,,,,,,6,BaselinePreprocessor,HybridCategoricalStatisticsImputer,LogTargetScaler
8,8,0.6616382699814156,2024-03-07 23:25:00.192852,2024-03-07 23:25:25.768417,0 days 00:00:25.575565,90,800.0,COMPLETE,RandomForest,0.67355193000151,,,,,,,,,,,,,,,,,,,6,BaselinePreprocessor,HybridCategoricalStatisticsImputer,LogTargetScaler
9,9,0.6542273761541635,2024-03-07 23:25:25.768966,2024-03-07 23:25:57.354332,0 days 00:00:31.585366,12,1200.0,COMPLETE,RandomForest,0.67355193000151,,,,,,,,,,,,,,,,,,,6,BaselinePreprocessor,HybridCategoricalStatisticsImputer,LogTargetScaler
10,10,0.6708967145637973,2024-03-07 23:25:57.355045,2024-03-07 23:26:37.048059,0 days 00:00:39.693014,21,1300.0,COMPLETE,RandomForest,0.67355193000151,,,,,,,,,,,,,,,,,,,6,BaselinePreprocessor,HybridCategoricalStatisticsImputer,LogTargetScaler
11,11,0.6721286723389905,2024-03-07 23:26:37.048652,2024-03-07 23:27:23.421940,0 days 00:00:46.373288,33,1500.0,COMPLETE,RandomForest,0.67355193000151,,,,,,,,,,,,,,,,,,,6,BaselinePreprocessor,HybridCategoricalStatisticsImputer,LogTargetScaler
12,12,0.6597670067420442,2024-03-07 23:27:23.422484,2024-03-07 23:27:45.386131,0 days 00:00:21.963647,51,700.0,COMPLETE,RandomForest,0.67355193000151,,,,,,,,,,,,,,,,,,,6,BaselinePreprocessor,HybridCategoricalStatisticsImputer,LogTargetScaler
13,13,0.6591424104740542,2024-03-07 23:27:45.386736,2024-03-07 23:27:54.564727,0 days 00:00:09.177991,48,300.0,COMPLETE,RandomForest,0.67355193000151,,,,,,,,,,,,,,,,,,,6,BaselinePreprocessor,HybridCategoricalStatisticsImputer,LogTargetScaler
14,14,0.6723686585201578,2024-03-07 23:27:54.565544,2024-03-07 23:28:42.273200,0 days 00:00:47.707656,75,1500.0,COMPLETE,RandomForest,0.67355193000151,,,,,,,,,,,,,,,,,,,6,BaselinePreprocessor,HybridCategoricalStatisticsImputer,LogTargetScaler
15,15,0.6583830412689816,2024-03-07 23:28:42.273915,2024-03-07 23:29:10.477923,0 days 00:00:28.204008,48,900.0,COMPLETE,RandomForest,0.67355193000151,,,,,,,,,,,,,,,,,,,6,BaselinePreprocessor,HybridCategoricalStatisticsImputer,LogTargetScaler
16,16,0.6708328896768428,2024-03-07 23:29:10.478753,2024-03-07 23:29:38.288523,0 days 00:00:27.809770,30,900.0,COMPLETE,RandomForest,0.67355193000151,,,,,,,,,,,,,,,,,,,6,BaselinePreprocessor,HybridCategoricalStatisticsImputer,LogTargetScaler
17,17,0.6581657026666774,2024-03-07 23:29:38.289298,2024-03-07 23:30:12.517864,0 days 00:00:34.228566,78,1000.0,COMPLETE,RandomForest,0.67355193000151,,,,,,,,,,,,,,,,,,,6,BaselinePreprocessor,HybridCategoricalStatisticsImputer,LogTargetScaler
18,18,0.6692787299324052,2024-03-07 23:30:12.527194,2024-03-07 23:30:42.733977,0 days 00:00:30.206783,81,900.0,COMPLETE,RandomForest,0.67355193000151,,,,,,,,,,,,,,,,,,,6,BaselinePreprocessor,HybridCategoricalStatisticsImputer,LogTargetScaler
19,19,0.6625808024758337,2024-03-07 23:30:42.734837,2024-03-07 23:31:24.519455,0 days 00:00:41.784618,45,1400.0,COMPLETE,RandomForest,0.67355193000151,,,,,,,,,,,,,,,,,,,6,BaselinePreprocessor,HybridCategoricalStatisticsImputer,LogTargetScaler
20,20,0.6689113681646691,2024-03-07 23:31:24.520020,2024-03-07 23:31:44.947099,0 days 00:00:20.427079,69,700.0,COMPLETE,RandomForest,0.67355193000151,,,,,,,,,,,,,,,,,,,6,BaselinePreprocessor,HybridCategoricalStatisticsImputer,LogTargetScaler
21,21,0.42307309379800134,2024-03-07 23:31:44.947800,2024-03-07 23:31:46.826763,0 days 00:00:01.878963,3,200.0,COMPLETE,RandomForest,0.67355193000151,,,,,,,,,,,,,,,,,,,6,BaselinePreprocessor,HybridCategoricalStatisticsImputer,LogTargetScaler
22,22,0.6644603744021537,2024-03-07 23:31:46.827382,2024-03-07 23:32:18.590256,0 days 00:00:31.762874,81,1100.0,COMPLETE,RandomForest,0.67355193000151,,,,,,,,,,,,,,,,,,,6,BaselinePreprocessor,HybridCategoricalStatisticsImputer,LogTargetScaler
23,23,0.6384596758177938,2024-03-07 23:32:18.590956,2024-03-07 23:32:39.221013,0 days 00:00:20.630057,9,1000.0,COMPLETE,RandomForest,0.67355193000151,,,,,,,,,,,,,,,,,,,6,BaselinePreprocessor,HybridCategoricalStatisticsImputer,LogTargetScaler
24,24,0.672335939612019,2024-03-07 23:32:39.221600,2024-03-07 23:33:08.462032,0 days 00:00:29.240432,63,1000.0,COMPLETE,RandomForest,0.67355193000151,,,,,,,,,,,,,,,,,,,6,BaselinePreprocessor,HybridCategoricalStatisticsImputer,LogTargetScaler
25,25,0.6367515875652738,2024-03-07 23:33:08.462715,2024-03-07 23:33:25.205089,0 days 00:00:16.742374,9,800.0,COMPLETE,RandomForest,0.67355193000151,,,,,,,,,,,,,,,,,,,6,BaselinePreprocessor,HybridCategoricalStatisticsImputer,LogTargetScaler
26,26,0.6672354305381831,2024-03-07 23:33:25.205668,2024-03-07 23:33:56.876782,0 days 00:00:31.671114,24,1100.0,COMPLETE,RandomForest,0.67355193000151,,,,,,,,,,,,,,,,,,,6,BaselinePreprocessor,HybridCategoricalStatisticsImputer,LogTargetScaler
27,27,0.6720325987679245,2024-03-07 23:33:56.877459,2024-03-07 23:34:16.651690,0 days 00:00:19.774231,57,700.0,COMPLETE,RandomForest,0.67355193000151,,,,,,,,,,,,,,,,,,,6,BaselinePreprocessor,HybridCategoricalStatisticsImputer,LogTargetScaler
28,28,0.665700860034425,2024-03-07 23:34:16.652246,2024-03-07 23:34:41.012167,0 days 00:00:24.359921,33,900.0,COMPLETE,RandomForest,0.67355193000151,,,,,,,,,,,,,,,,,,,6,BaselinePreprocessor,HybridCategoricalStatisticsImputer,LogTargetScaler
29,29,0.6665250729283746,2024-03-07 23:34:41.012990,2024-03-07 23:35:21.237682,0 days 00:00:40.224692,54,1400.0,COMPLETE,RandomForest,0.67355193000151,,,,,,,,,,,,,,,,,,,6,BaselinePreprocessor,HybridCategoricalStatisticsImputer,LogTargetScaler
30,30,0.6698955467745958,2024-03-07 23:35:21.238230,2024-03-07 23:35:26.818895,0 days 00:00:05.580665,45,200.0,COMPLETE,RandomForest,0.67355193000151,,,,,,,,,,,,,,,,,,,6,BaselinePreprocessor,HybridCategoricalStatisticsImputer,LogTargetScaler
31,31,0.66105218061789,2024-03-07 23:35:26.819482,2024-03-07 23:35:29.556553,0 days 00:00:02.737071,60,100.0,COMPLETE,RandomForest,0.67355193000151,,,,,,,,,,,,,,,,,,,6,BaselinePreprocessor,HybridCategoricalStatisticsImputer,LogTargetScaler
32,32,0.43717593152230394,2024-03-07 23:35:29.557065,2024-03-07 23:35:40.857955,0 days 00:00:11.300890,3,1000.0,COMPLETE,RandomForest,0.67355193000151,,,,,,,,,,,,,,,,,,,6,BaselinePreprocessor,HybridCategoricalStatisticsImputer,LogTargetScaler
