,number,value,datetime_start,datetime_complete,duration,params_max_depth,params_n_estimators,state,model,best_value,params_bagging_fraction,params_bagging_freq,params_feature_fraction,params_lambda_l1,params_lambda_l2,params_learning_rate,params_min_child_samples,params_num_leaves,params_alpha,params_booster,params_eta,params_gamma,params_grow_policy,params_lambda,params_normalize_type,params_rate_drop,params_sample_type,params_skip_drop,config_id,preprocessor,imputer,target_scaler
12,12,0.6333940273777295,2024-03-08 05:23:32.510391,2024-03-08 05:23:56.458393,0 days 00:00:23.948002,39,1210.0,COMPLETE,LGBM,0.6568113253452701,0.4563670453255508,1.0,0.6955042370117732,1.3895953755116946e-07,7.839843090317097,0.25987435803086933,62.0,214.0,,,,,,,,,,,11,IIDPreprocessor,DummyImputer,DummyTargetScaler
13,13,0.643032412168567,2024-03-08 05:23:56.459569,2024-03-08 05:25:38.033816,0 days 00:01:41.574247,99,1110.0,COMPLETE,LGBM,0.6568113253452701,0.7838868055238493,4.0,0.9978155405055923,0.000315469319101352,3.9297316374726486e-05,0.026163247322425878,23.0,250.0,,,,,,,,,,,11,IIDPreprocessor,DummyImputer,DummyTargetScaler
14,14,0.6222999807572506,2024-03-08 05:25:38.035027,2024-03-08 05:25:49.537494,0 days 00:00:11.502467,75,610.0,COMPLETE,LGBM,0.6568113253452701,0.4051457235567762,1.0,0.46444358512171563,0.23595773733965777,4.276446058367582e-05,0.07677573569678922,62.0,170.0,,,,,,,,,,,11,IIDPreprocessor,DummyImputer,DummyTargetScaler
15,15,0.6248272654232429,2024-03-08 05:25:49.539022,2024-03-08 05:26:17.335998,0 days 00:00:27.796976,84,710.0,COMPLETE,LGBM,0.6568113253452701,0.4372868847476713,5.0,0.9003239993509194,2.267987706184833e-07,1.0609810371670377e-06,0.05456570339206403,72.0,78.0,,,,,,,,,,,11,IIDPreprocessor,DummyImputer,DummyTargetScaler
16,16,0.6337772298014869,2024-03-08 05:26:17.336972,2024-03-08 05:26:57.585249,0 days 00:00:40.248277,84,1310.0,COMPLETE,LGBM,0.6568113253452701,0.7800610515735729,5.0,0.5509397264221676,1.754355464607075,1.168678916938245,0.015247986010182117,29.0,118.0,,,,,,,,,,,11,IIDPreprocessor,DummyImputer,DummyTargetScaler
17,17,0.6183191372253498,2024-03-08 05:26:57.586576,2024-03-08 05:27:07.668807,0 days 00:00:10.082231,75,710.0,COMPLETE,LGBM,0.6568113253452701,0.5991687723380537,7.0,0.40070961908788405,0.005295068511996879,4.535720327152836e-07,0.24797500645326437,62.0,34.0,,,,,,,,,,,11,IIDPreprocessor,DummyImputer,DummyTargetScaler
18,18,0.6284308161207085,2024-03-08 05:27:07.670279,2024-03-08 05:27:28.236922,0 days 00:00:20.566643,84,1110.0,COMPLETE,LGBM,0.6568113253452701,0.9986366618427462,6.0,0.7077298447038072,0.5239301407115592,6.671106788782226e-07,0.046245608216537816,59.0,61.0,,,,,,,,,,,11,IIDPreprocessor,DummyImputer,DummyTargetScaler
19,19,0.6132892755392562,2024-03-08 05:27:28.238009,2024-03-08 05:27:31.591976,0 days 00:00:03.353967,63,110.0,COMPLETE,LGBM,0.6568113253452701,0.8587312691434854,3.0,0.5839727569862636,0.0008982386173332686,0.0033821707528221513,0.1430452503150639,66.0,8.0,,,,,,,,,,,11,IIDPreprocessor,DummyImputer,DummyTargetScaler
20,20,0.6404199943092008,2024-03-08 05:27:31.593468,2024-03-08 05:28:07.382187,0 days 00:00:35.788719,36,1310.0,COMPLETE,LGBM,0.6568113253452701,0.9076986635231191,2.0,0.8775479709579777,1.7567717554745763e-07,0.0010357326831610752,0.13596587552573583,91.0,109.0,,,,,,,,,,,11,IIDPreprocessor,DummyImputer,DummyTargetScaler
21,21,0.6330845652882685,2024-03-08 05:28:07.383325,2024-03-08 05:29:16.033730,0 days 00:01:08.650405,39,1110.0,COMPLETE,LGBM,0.6568113253452701,0.9698993334637344,4.0,0.641425629648519,9.726350736123617e-06,0.00154559391930727,0.015718336902373897,75.0,108.0,,,,,,,,,,,11,IIDPreprocessor,DummyImputer,DummyTargetScaler
22,22,0.6371708820263786,2024-03-08 05:29:16.034926,2024-03-08 05:32:05.105608,0 days 00:02:49.070682,99,1410.0,COMPLETE,LGBM,0.6568113253452701,0.9916676470783193,4.0,0.7658857051199808,0.0504507918817377,1.4387351755868876,0.011751250158219638,9.0,64.0,,,,,,,,,,,11,IIDPreprocessor,DummyImputer,DummyTargetScaler
23,23,0.5907144728601649,2024-03-08 05:32:05.108375,2024-03-08 05:32:11.981453,0 days 00:00:06.873078,66,210.0,COMPLETE,LGBM,0.6568113253452701,0.487873278916894,5.0,0.6359822127421652,0.004776406074124005,0.000484012112163922,0.014438683978619847,87.0,194.0,,,,,,,,,,,11,IIDPreprocessor,DummyImputer,DummyTargetScaler
24,24,0.6296990129705312,2024-03-08 05:32:11.982588,2024-03-08 05:32:49.019986,0 days 00:00:37.037398,27,1410.0,COMPLETE,LGBM,0.6568113253452701,0.4630366902996029,1.0,0.9021262109735524,0.00037769302258810783,0.5461464804131311,0.06421054551786354,77.0,131.0,,,,,,,,,,,11,IIDPreprocessor,DummyImputer,DummyTargetScaler
25,25,0.6155479483705105,2024-03-08 05:32:49.021316,2024-03-08 05:33:06.690119,0 days 00:00:17.668803,63,1410.0,COMPLETE,LGBM,0.6568113253452701,0.47736445261028904,5.0,0.5779566222531531,6.209546505543345e-07,5.349054914348961e-05,0.26195912766122054,46.0,227.0,,,,,,,,,,,11,IIDPreprocessor,DummyImputer,DummyTargetScaler
26,26,0.6248693382553975,2024-03-08 05:33:06.691703,2024-03-08 05:33:19.344210,0 days 00:00:12.652507,60,610.0,COMPLETE,LGBM,0.6568113253452701,0.6145147359937143,6.0,0.8703526507697246,0.18211235989678004,7.243412518897748e-07,0.14906348712469797,20.0,247.0,,,,,,,,,,,11,IIDPreprocessor,DummyImputer,DummyTargetScaler
27,27,0.6284590559868315,2024-03-08 05:33:19.345622,2024-03-08 05:33:57.166255,0 days 00:00:37.820633,75,1210.0,COMPLETE,LGBM,0.6568113253452701,0.4927723338268421,6.0,0.9717799996182745,1.9292331329868002,2.2906772652054164e-06,0.01922940717117526,29.0,77.0,,,,,,,,,,,11,IIDPreprocessor,DummyImputer,DummyTargetScaler
28,28,0.6260471568452816,2024-03-08 05:33:57.167291,2024-03-08 05:34:06.708455,0 days 00:00:09.541164,90,110.0,COMPLETE,LGBM,0.6568113253452701,0.6210405918643933,2.0,0.5751395715379877,5.997444741292631e-08,4.382969228607322e-06,0.19668137163223778,31.0,240.0,,,,,,,,,,,11,IIDPreprocessor,DummyImputer,DummyTargetScaler
29,29,0.5910045354575667,2024-03-08 05:34:06.710139,2024-03-08 05:34:07.258172,0 days 00:00:00.548033,54,10.0,COMPLETE,LGBM,0.6568113253452701,0.6031550779313876,1.0,0.7225180721598974,0.652226986677373,2.1888915413400456,0.10577284849416094,27.0,71.0,,,,,,,,,,,11,IIDPreprocessor,DummyImputer,DummyTargetScaler
30,30,0.5916829741921544,2024-03-08 05:34:07.259441,2024-03-08 05:34:07.634232,0 days 00:00:00.374791,90,10.0,COMPLETE,LGBM,0.6568113253452701,0.4477045956085645,4.0,0.7612373335931593,0.05209466337274517,2.529397382673636e-06,0.16365506248453282,76.0,163.0,,,,,,,,,,,11,IIDPreprocessor,DummyImputer,DummyTargetScaler
31,31,0.6370178554082625,2024-03-08 05:34:07.635717,2024-03-08 05:35:07.906285,0 days 00:01:00.270568,24,1010.0,COMPLETE,LGBM,0.6568113253452701,0.8295861859936013,1.0,0.8801004767807104,8.107712571236871e-06,0.0003279751725418682,0.017141145277049543,94.0,22.0,,,,,,,,,,,11,IIDPreprocessor,DummyImputer,DummyTargetScaler
32,32,0.6568113253452701,2024-03-08 05:35:07.907315,2024-03-08 05:35:44.378574,0 days 00:00:36.471259,30,210.0,COMPLETE,LGBM,0.6568113253452701,0.9134996310909008,2.0,0.8380718650897336,4.1393781466208026e-08,2.343167711620149e-06,0.06840323955896764,14.0,108.0,,,,,,,,,,,11,IIDPreprocessor,DummyImputer,DummyTargetScaler
33,33,0.5943856646138158,2024-03-08 05:35:44.380094,2024-03-08 05:35:58.172614,0 days 00:00:13.792520,93,1010.0,COMPLETE,LGBM,0.6568113253452701,0.515551757939428,3.0,0.9663231110993948,1.0548578542266528e-08,0.0071346595593248865,0.01943488318696889,66.0,3.0,,,,,,,,,,,11,IIDPreprocessor,DummyImputer,DummyTargetScaler
34,34,0.6192563414033142,2024-03-08 05:35:58.174097,2024-03-08 05:36:04.980844,0 days 00:00:06.806747,81,210.0,COMPLETE,LGBM,0.6568113253452701,0.5766742852307009,3.0,0.5921102530249926,6.727082508945712e-07,2.378181133689173,0.06823195360642734,82.0,103.0,,,,,,,,,,,11,IIDPreprocessor,DummyImputer,DummyTargetScaler
35,35,0.6282031137080005,2024-03-08 05:36:04.982403,2024-03-08 05:36:50.515673,0 days 00:00:45.533270,9,1010.0,COMPLETE,LGBM,0.6568113253452701,0.9979902904696982,5.0,0.790897409017253,1.0487401573106863e-05,3.155470410516657,0.04208983664930101,95.0,211.0,,,,,,,,,,,11,IIDPreprocessor,DummyImputer,DummyTargetScaler
36,36,0.6341737759488575,2024-03-08 05:36:50.517245,2024-03-08 05:36:57.156232,0 days 00:00:06.638987,81,110.0,COMPLETE,LGBM,0.6568113253452701,0.7823110530808806,4.0,0.9218746632668995,0.07497849976653882,0.28020873447383204,0.1368697832894994,75.0,20.0,,,,,,,,,,,11,IIDPreprocessor,DummyImputer,DummyTargetScaler
37,37,0.6351815565379637,2024-03-08 05:36:57.157651,2024-03-08 05:37:08.853696,0 days 00:00:11.696045,99,910.0,COMPLETE,LGBM,0.6568113253452701,0.9578027406904408,6.0,0.6913310665362251,0.5906627251052488,0.26208706340749977,0.16248101439372606,92.0,133.0,,,,,,,,,,,11,IIDPreprocessor,DummyImputer,DummyTargetScaler
38,38,0.6327789366810432,2024-03-08 05:37:08.855113,2024-03-08 05:37:27.936227,0 days 00:00:19.081114,24,710.0,COMPLETE,LGBM,0.6568113253452701,0.4071950896279709,1.0,0.7808039313327715,0.25393057223808785,3.239750702645672,0.054564439461594366,49.0,236.0,,,,,,,,,,,11,IIDPreprocessor,DummyImputer,DummyTargetScaler
39,39,0.5859770519492401,2024-03-08 05:37:27.937469,2024-03-08 05:37:32.040794,0 days 00:00:04.103325,63,110.0,COMPLETE,LGBM,0.6568113253452701,0.4532903287693184,5.0,0.592688422604406,7.666457455281946e-05,0.00677547403369813,0.02344714376631676,47.0,124.0,,,,,,,,,,,11,IIDPreprocessor,DummyImputer,DummyTargetScaler
0,0,0.5738117949493565,2024-03-08 05:38:09.049810,2024-03-08 05:38:43.666708,0 days 00:00:34.616898,3,,COMPLETE,XGB,0.637897134320953,,,,,,,,,1.0566459344826282e-05,dart,0.0302776398919803,0.007184118569224913,lossguide,0.0026398430305841483,tree,0.004937467874482622,uniform,0.041101348427132985,11,IIDPreprocessor,DummyImputer,DummyTargetScaler
1,1,0.2390579768617789,2024-03-08 05:38:43.667801,2024-03-08 05:38:54.596797,0 days 00:00:10.928996,1,,COMPLETE,XGB,0.637897134320953,,,,,,,,,0.8586453092218255,dart,4.670328876657199e-08,8.960137046411408e-05,depthwise,0.001858967168258882,forest,0.7296308339771667,uniform,0.001895924372597172,11,IIDPreprocessor,DummyImputer,DummyTargetScaler
2,2,0.5594789984193423,2024-03-08 05:38:54.598112,2024-03-08 05:39:51.269641,0 days 00:00:56.671529,8,,COMPLETE,XGB,0.637897134320953,,,,,,,,,0.06074836378756628,dart,0.00044309779258408863,0.07442649107695808,lossguide,0.13584799756612292,tree,5.9467582809123255e-06,weighted,1.3190492345738547e-05,11,IIDPreprocessor,DummyImputer,DummyTargetScaler
3,3,0.5687375426461287,2024-03-08 05:39:51.271081,2024-03-08 05:40:36.435656,0 days 00:00:45.164575,4,,COMPLETE,XGB,0.637897134320953,,,,,,,,,0.016754516772652082,dart,0.0018308742790431516,8.32471337265584e-07,depthwise,0.04049381621262953,forest,1.3258629812869206e-08,uniform,0.09598273400777944,11,IIDPreprocessor,DummyImputer,DummyTargetScaler
4,4,0.637897134320953,2024-03-08 05:40:36.436794,2024-03-08 05:41:10.474754,0 days 00:00:34.037960,3,,COMPLETE,XGB,0.637897134320953,,,,,,,,,1.2085276947819392e-07,dart,0.357482237797298,8.919893847324312e-07,depthwise,0.0009511620479705396,forest,2.413774316907084e-08,weighted,1.3048237273359386e-07,11,IIDPreprocessor,DummyImputer,DummyTargetScaler
5,5,0.5653350054915035,2024-03-08 05:41:10.476290,2024-03-08 05:41:45.361053,0 days 00:00:34.884763,3,,COMPLETE,XGB,0.637897134320953,,,,,,,,,7.790342200460709e-08,dart,4.951710845205751e-06,0.0010061689648867753,lossguide,0.0017703553203452225,forest,0.00952124449666067,uniform,5.453916114286053e-06,11,IIDPreprocessor,DummyImputer,DummyTargetScaler
6,6,0.5537650360949457,2024-03-08 05:41:45.362559,2024-03-08 05:42:40.242758,0 days 00:00:54.880199,7,,COMPLETE,XGB,0.637897134320953,,,,,,,,,9.927336456885008e-08,dart,6.307554916920952e-08,1.2016589056369065e-07,lossguide,3.504771460897073e-08,forest,2.4544333484892096e-07,uniform,4.251003330774458e-06,11,IIDPreprocessor,DummyImputer,DummyTargetScaler
7,7,0.5558224346908116,2024-03-08 05:42:40.244463,2024-03-08 05:43:43.510707,0 days 00:01:03.266244,9,,COMPLETE,XGB,0.637897134320953,,,,,,,,,5.578218104462425e-06,dart,2.4978142053189346e-07,3.2354444686078286e-07,depthwise,8.60212595413542e-06,tree,2.9327581005480378e-08,uniform,0.21484502027834076,11,IIDPreprocessor,DummyImputer,DummyTargetScaler
8,8,0.6126391436189513,2024-03-08 05:43:43.512033,2024-03-08 05:44:27.564515,0 days 00:00:44.052482,5,,COMPLETE,XGB,0.637897134320953,,,,,,,,,1.9791201888079758e-05,dart,0.0694597091245257,0.0009233609847048256,depthwise,8.937764079938599e-08,tree,5.339522784083861e-06,uniform,0.047578989088230175,11,IIDPreprocessor,DummyImputer,DummyTargetScaler
9,9,0.5229374616857045,2024-03-08 05:44:27.566050,2024-03-08 05:44:40.082136,0 days 00:00:12.516086,2,,COMPLETE,XGB,0.637897134320953,,,,,,,,,0.06000050713334118,dart,0.00010910576773534775,4.648013809534646e-07,depthwise,8.296142325691543e-07,forest,0.8382304984776977,weighted,4.411428916882382e-07,11,IIDPreprocessor,DummyImputer,DummyTargetScaler
10,10,0.44473385168618473,2024-03-08 05:44:40.083622,2024-03-08 05:45:09.223455,0 days 00:00:29.139833,1,,COMPLETE,XGB,0.637897134320953,,,,,,,,,7.240610622046672e-08,dart,8.464822327227569e-05,2.4658406207372257e-05,lossguide,1.3110273108889e-07,tree,0.009461542659697796,uniform,3.546454618492178e-05,11,IIDPreprocessor,DummyImputer,DummyTargetScaler
11,11,0.5839285222467486,2024-03-08 05:45:09.237089,2024-03-08 05:45:54.653466,0 days 00:00:45.416377,5,,COMPLETE,XGB,0.637897134320953,,,,,,,,,1.5295498395170786e-08,dart,0.037928202317985917,2.2744921080572948e-08,lossguide,7.478271214480314e-07,tree,0.019308004283698034,uniform,0.1712759036997797,11,IIDPreprocessor,DummyImputer,DummyTargetScaler
12,12,0.6066718913881614,2024-03-08 05:45:54.655342,2024-03-08 05:46:31.922376,0 days 00:00:37.267034,7,,COMPLETE,XGB,0.637897134320953,,,,,,,,,5.261453219487882e-07,dart,0.7705951588987529,0.0007653859592706075,depthwise,0.0008277860175281099,tree,2.5913001581541808e-08,weighted,0.0037987038222076666,11,IIDPreprocessor,DummyImputer,DummyTargetScaler
13,13,0.5450343521655148,2024-03-08 05:46:31.923892,2024-03-08 05:47:24.501455,0 days 00:00:52.577563,6,,COMPLETE,XGB,0.637897134320953,,,,,,,,,6.804051764716916e-08,dart,2.822735657799017e-08,0.20774814740340733,depthwise,3.0004102118208422e-06,tree,9.012550883919473e-05,weighted,0.048908250077171464,11,IIDPreprocessor,DummyImputer,DummyTargetScaler
14,14,0.5732984216327288,2024-03-08 05:47:24.502647,2024-03-08 05:48:08.165218,0 days 00:00:43.662571,5,,COMPLETE,XGB,0.637897134320953,,,,,,,,,0.0022446268586197955,dart,9.269024475671724e-05,1.4537820414877105e-06,lossguide,9.963415026737248e-07,forest,0.28651201972731083,weighted,2.911991865617862e-05,11,IIDPreprocessor,DummyImputer,DummyTargetScaler
15,15,0.5696558282698475,2024-03-08 05:48:08.167034,2024-03-08 05:49:01.205399,0 days 00:00:53.038365,9,,COMPLETE,XGB,0.637897134320953,,,,,,,,,0.013351864141462638,dart,0.11843670135978578,0.10457263658810088,lossguide,1.3434159943330628e-06,tree,0.46440026686735075,uniform,0.013877083289940036,11,IIDPreprocessor,DummyImputer,DummyTargetScaler
16,16,0.5508676652807274,2024-03-08 05:49:01.206913,2024-03-08 05:50:02.962820,0 days 00:01:01.755907,8,,COMPLETE,XGB,0.637897134320953,,,,,,,,,0.009112708915605698,dart,1.5822132886583496e-06,0.000745757706834291,depthwise,8.489950718696693e-08,forest,1.4537979308379069e-06,uniform,0.0005294397493054131,11,IIDPreprocessor,DummyImputer,DummyTargetScaler
17,17,0.5432965953376416,2024-03-08 05:50:02.964903,2024-03-08 05:50:57.229140,0 days 00:00:54.264237,6,,COMPLETE,XGB,0.637897134320953,,,,,,,,,0.331173597573337,dart,1.7365527484643292e-07,5.628365959573988e-05,depthwise,0.03564435044843586,forest,5.0808221143068174e-08,uniform,3.8071851844850904e-07,11,IIDPreprocessor,DummyImputer,DummyTargetScaler
18,18,0.6093575698053039,2024-03-08 05:50:57.231018,2024-03-08 05:51:50.625137,0 days 00:00:53.394119,7,,COMPLETE,XGB,0.637897134320953,,,,,,,,,2.724836633015765e-07,dart,0.057727061299015926,3.597537283611892e-06,lossguide,0.00025656448952146317,tree,3.108356269127534e-07,uniform,2.3380295052046834e-07,11,IIDPreprocessor,DummyImputer,DummyTargetScaler
19,19,0.5773900820803236,2024-03-08 05:51:50.626969,2024-03-08 05:52:16.626067,0 days 00:00:25.999098,1,,COMPLETE,XGB,0.637897134320953,,,,,,,,,0.0029287051101545,dart,0.22630406220796473,2.720881117877439e-07,depthwise,0.00016614300920607004,tree,9.657583181098222e-05,weighted,0.0029045769885251414,11,IIDPreprocessor,DummyImputer,DummyTargetScaler
20,20,0.576065305974588,2024-03-08 05:52:16.627280,2024-03-08 05:53:14.324588,0 days 00:00:57.697308,8,,COMPLETE,XGB,0.637897134320953,,,,,,,,,6.629034808446462e-07,dart,0.0016900617880001327,6.83859959069536e-07,depthwise,0.1964556755242296,forest,5.409018353101097e-05,weighted,0.158136022658516,11,IIDPreprocessor,DummyImputer,DummyTargetScaler
21,21,0.44473385168618473,2024-03-08 05:53:14.326755,2024-03-08 05:53:39.917350,0 days 00:00:25.590595,1,,COMPLETE,XGB,0.637897134320953,,,,,,,,,1.1736358926951142e-06,dart,0.0001216508973992219,3.0028684514554584e-08,depthwise,0.141912032619542,tree,0.07341815121974953,weighted,4.3206466014072905e-07,11,IIDPreprocessor,DummyImputer,DummyTargetScaler
22,22,0.5787623593037681,2024-03-08 05:53:39.918323,2024-03-08 05:54:42.564968,0 days 00:01:02.646645,9,,COMPLETE,XGB,0.637897134320953,,,,,,,,,0.005708454985562488,dart,3.6582591757520937e-06,0.7142330529702648,lossguide,0.27947338304346253,tree,2.358843018023444e-08,weighted,0.025550410323059134,11,IIDPreprocessor,DummyImputer,DummyTargetScaler
23,23,0.5671378366928808,2024-03-08 05:54:42.566123,2024-03-08 05:55:18.628089,0 days 00:00:36.061966,3,,COMPLETE,XGB,0.637897134320953,,,,,,,,,0.039145430395929846,dart,7.457446935792916e-07,0.009825424968390577,depthwise,6.584984025970643e-08,tree,3.2742593877713013e-08,weighted,1.0582666042464048e-07,11,IIDPreprocessor,DummyImputer,DummyTargetScaler
24,24,0.6034703013499699,2024-03-08 05:55:18.630178,2024-03-08 05:55:55.094065,0 days 00:00:36.463887,7,,COMPLETE,XGB,0.637897134320953,,,,,,,,,3.202472654832231e-08,dart,0.724302163845033,0.0019229486028158774,lossguide,0.1177122489590033,forest,2.0784177485602102e-08,weighted,8.879678668707689e-08,11,IIDPreprocessor,DummyImputer,DummyTargetScaler
25,25,0.5975024144245246,2024-03-08 05:55:55.095881,2024-03-08 05:56:55.555638,0 days 00:01:00.459757,9,,COMPLETE,XGB,0.637897134320953,,,,,,,,,0.0012290767145593305,dart,0.011253469491450613,3.5300324869600716e-06,depthwise,2.8189327230303303e-07,tree,7.701018868055514e-08,weighted,1.4875559744792858e-08,11,IIDPreprocessor,DummyImputer,DummyTargetScaler
26,26,0.5580098727562949,2024-03-08 05:56:55.557106,2024-03-08 05:57:45.265487,0 days 00:00:49.708381,6,,COMPLETE,XGB,0.637897134320953,,,,,,,,,0.07267639209207766,dart,5.997269356401137e-08,0.0008838479247740583,depthwise,5.497603900353872e-07,tree,0.014110847184055903,weighted,4.7856893403178205e-08,11,IIDPreprocessor,DummyImputer,DummyTargetScaler
27,27,0.5715058856540771,2024-03-08 05:57:45.266564,2024-03-08 05:58:20.524225,0 days 00:00:35.257661,5,,COMPLETE,XGB,0.637897134320953,,,,,,,,,5.656560410095808e-05,dart,0.01690203383140849,2.0262855158062795e-05,depthwise,6.09401295984071e-06,tree,0.7651679824152003,weighted,4.074187654980743e-05,11,IIDPreprocessor,DummyImputer,DummyTargetScaler
28,28,0.5725773435588588,2024-03-08 05:58:20.525283,2024-03-08 05:58:48.853322,0 days 00:00:28.328039,2,,COMPLETE,XGB,0.637897134320953,,,,,,,,,0.022199096058691147,dart,0.0552783683365192,5.919363033014217e-08,depthwise,6.074879468968795e-08,tree,4.887760771993189e-06,uniform,0.0020025630670976787,11,IIDPreprocessor,DummyImputer,DummyTargetScaler
29,29,0.6141375014252722,2024-03-08 05:58:48.854928,2024-03-08 05:59:39.496280,0 days 00:00:50.641352,7,,COMPLETE,XGB,0.637897134320953,,,,,,,,,3.3832274738995826e-05,dart,0.04636958114896035,6.159080601518641e-06,lossguide,0.05335352789727539,tree,2.425448577968814e-07,weighted,0.17418113419871342,11,IIDPreprocessor,DummyImputer,DummyTargetScaler
30,30,0.5845868790412008,2024-03-08 05:59:39.497359,2024-03-08 06:00:31.325408,0 days 00:00:51.828049,6,,COMPLETE,XGB,0.637897134320953,,,,,,,,,0.006923131453542375,dart,0.0026531869890938143,0.005001708416069787,lossguide,0.014770026164607935,tree,0.0020720785686123553,uniform,0.3003562708677859,11,IIDPreprocessor,DummyImputer,DummyTargetScaler
31,31,0.5225531350710865,2024-03-08 06:00:31.326735,2024-03-08 06:01:00.341904,0 days 00:00:29.015169,2,,COMPLETE,XGB,0.637897134320953,,,,,,,,,1.4541009336750904e-05,dart,6.398930115704378e-06,1.466543463153484e-07,depthwise,5.254882665193756e-07,forest,0.12326850747341964,uniform,0.0005148107612795584,11,IIDPreprocessor,DummyImputer,DummyTargetScaler
32,32,0.5695020805154305,2024-03-08 06:01:00.343740,2024-03-08 06:01:37.877769,0 days 00:00:37.534029,3,,COMPLETE,XGB,0.637897134320953,,,,,,,,,2.060308228122302e-05,dart,1.1257079985607468e-08,0.0037329490574592485,lossguide,0.007100614256148519,forest,3.495180606652923e-08,weighted,0.1597595265888988,11,IIDPreprocessor,DummyImputer,DummyTargetScaler
33,33,0.5467146786079599,2024-03-08 06:01:37.879405,2024-03-08 06:02:22.267360,0 days 00:00:44.387955,4,,COMPLETE,XGB,0.637897134320953,,,,,,,,,1.0953817130581107e-08,dart,1.5842134509632586e-08,0.00293516759521983,lossguide,1.2666830979424735e-07,tree,0.04498075943301781,uniform,0.01272601662606606,11,IIDPreprocessor,DummyImputer,DummyTargetScaler
34,34,0.22884570362649256,2024-03-08 06:02:22.268535,2024-03-08 06:02:50.297774,0 days 00:00:28.029239,7,,COMPLETE,XGB,0.637897134320953,,,,,,,,,2.3114441531312945e-05,dart,0.9063917124641113,3.167618805935537e-05,depthwise,4.1535133288042056e-05,forest,0.1641338402415728,uniform,0.003228135922822973,11,IIDPreprocessor,DummyImputer,DummyTargetScaler
