,number,value,datetime_start,datetime_complete,duration,params_max_depth,params_n_estimators,state,model,best_value,params_bagging_fraction,params_bagging_freq,params_feature_fraction,params_lambda_l1,params_lambda_l2,params_learning_rate,params_min_child_samples,params_num_leaves,params_alpha,params_booster,params_eta,params_gamma,params_grow_policy,params_lambda,params_normalize_type,params_rate_drop,params_sample_type,params_skip_drop,config_id,preprocessor,imputer,target_scaler
10,10,0.5792256237290344,2024-03-08 09:10:34.839453,2024-03-08 09:11:03.656353,0 days 00:00:28.816900,1,,COMPLETE,XGB,0.6119687521565602,,,,,,,,,4.94942872476237e-08,dart,0.7237412920937589,5.843568816879938e-06,depthwise,0.2606628479012618,forest,0.0004914847040447391,uniform,2.8001724411691157e-05,14,IIDPreprocessor,RevenueQuantileBucketImputer:3-buckets,DummyTargetScaler
11,11,0.46466950053266964,2024-03-08 09:11:03.657876,2024-03-08 09:11:29.594045,0 days 00:00:25.936169,1,,COMPLETE,XGB,0.6119687521565602,,,,,,,,,1.8840845122359421e-06,dart,0.002060321370792996,0.043001807976149414,depthwise,0.06011758664930287,tree,0.05864285773876933,weighted,2.3865396361221665e-05,14,IIDPreprocessor,RevenueQuantileBucketImputer:3-buckets,DummyTargetScaler
12,12,0.5382743150429596,2024-03-08 09:11:29.595505,2024-03-08 09:12:27.362823,0 days 00:00:57.767318,7,,COMPLETE,XGB,0.6119687521565602,,,,,,,,,0.0014798936306191263,dart,7.964489760324909e-08,1.8937534333530597e-07,lossguide,4.801155619067286e-07,forest,5.0652358843631835e-06,uniform,1.7169380130311423e-07,14,IIDPreprocessor,RevenueQuantileBucketImputer:3-buckets,DummyTargetScaler
13,13,0.5321387817475381,2024-03-08 09:12:27.363960,2024-03-08 09:12:56.675478,0 days 00:00:29.311518,2,,COMPLETE,XGB,0.6119687521565602,,,,,,,,,0.010562760528460193,dart,2.018859223273667e-06,1.7927122902815167e-07,lossguide,1.60137894243805e-06,forest,9.30326151349317e-08,weighted,1.0319322239312989e-06,14,IIDPreprocessor,RevenueQuantileBucketImputer:3-buckets,DummyTargetScaler
14,14,0.6062677692740625,2024-03-08 09:12:56.676527,2024-03-08 09:13:33.110723,0 days 00:00:36.434196,3,,COMPLETE,XGB,0.6119687521565602,,,,,,,,,2.5741975273732754e-08,dart,0.20497319595290833,0.0006244745861701646,depthwise,1.7983935228512923e-06,tree,0.04272002555100959,uniform,0.4050087748381868,14,IIDPreprocessor,RevenueQuantileBucketImputer:3-buckets,DummyTargetScaler
15,15,0.5381841198907045,2024-03-08 09:13:33.112174,2024-03-08 09:14:10.271797,0 days 00:00:37.159623,3,,COMPLETE,XGB,0.6119687521565602,,,,,,,,,1.079679432537567e-08,dart,2.432693198690329e-07,2.906271972763032e-07,lossguide,1.6783400396769826e-06,tree,0.04100834839591718,weighted,0.013969520540947451,14,IIDPreprocessor,RevenueQuantileBucketImputer:3-buckets,DummyTargetScaler
16,16,0.513480778061787,2024-03-08 09:14:10.273115,2024-03-08 09:14:51.328059,0 days 00:00:41.054944,4,,COMPLETE,XGB,0.6119687521565602,,,,,,,,,2.664033752384431e-05,dart,1.7366106926459884e-08,0.00017314245953206847,depthwise,0.0010364141752658696,tree,0.00016613486376696317,weighted,0.00011995100696540372,14,IIDPreprocessor,RevenueQuantileBucketImputer:3-buckets,DummyTargetScaler
17,17,0.5411517050224547,2024-03-08 09:14:51.329739,2024-03-08 09:15:56.708265,0 days 00:01:05.378526,8,,COMPLETE,XGB,0.6119687521565602,,,,,,,,,0.016126400982521338,dart,1.560238211523491e-06,0.13911338473212712,depthwise,0.0007428468983002997,tree,0.00032600722435692216,weighted,4.783639098595547e-05,14,IIDPreprocessor,RevenueQuantileBucketImputer:3-buckets,DummyTargetScaler
18,18,0.5359258860148455,2024-03-08 09:15:56.709748,2024-03-08 09:16:37.417924,0 days 00:00:40.708176,4,,COMPLETE,XGB,0.6119687521565602,,,,,,,,,8.017380643695142e-06,dart,1.3316559405785855e-06,0.00011624690938488491,depthwise,0.002683169693922719,forest,1.1363235717169919e-05,uniform,1.0504219384170332e-08,14,IIDPreprocessor,RevenueQuantileBucketImputer:3-buckets,DummyTargetScaler
19,19,0.5781864446514955,2024-03-08 09:16:37.419296,2024-03-08 09:17:20.367902,0 days 00:00:42.948606,4,,COMPLETE,XGB,0.6119687521565602,,,,,,,,,4.6923247366847855e-05,dart,0.03371887395169768,4.531550995335878e-08,depthwise,8.005111779943515e-07,tree,0.003391383934570019,uniform,2.665295587164e-06,14,IIDPreprocessor,RevenueQuantileBucketImputer:3-buckets,DummyTargetScaler
20,20,0.5387526346868875,2024-03-08 09:17:20.368995,2024-03-08 09:18:09.886595,0 days 00:00:49.517600,6,,COMPLETE,XGB,0.6119687521565602,,,,,,,,,2.6235424773607003e-06,dart,6.959494274471138e-07,0.008680043433171249,depthwise,0.0004579316965407533,tree,0.16184919862105232,weighted,3.623378552681088e-08,14,IIDPreprocessor,RevenueQuantileBucketImputer:3-buckets,DummyTargetScaler
21,21,0.5321387817475381,2024-03-08 09:18:09.888117,2024-03-08 09:18:39.459318,0 days 00:00:29.571201,2,,COMPLETE,XGB,0.6119687521565602,,,,,,,,,5.448315378818004e-08,dart,3.4586432686987192e-06,0.0002377349698137676,lossguide,4.1013010502526616e-08,tree,0.015817788155078328,uniform,1.5586708862486467e-08,14,IIDPreprocessor,RevenueQuantileBucketImputer:3-buckets,DummyTargetScaler
22,22,0.5502279690927818,2024-03-08 09:18:39.460708,2024-03-08 09:19:16.151213,0 days 00:00:36.690505,3,,COMPLETE,XGB,0.6119687521565602,,,,,,,,,6.510074621430733e-05,dart,2.0193804430272922e-06,0.9843789751231855,lossguide,0.0013011906980649377,forest,2.6156428873415582e-06,uniform,0.06617773317811136,14,IIDPreprocessor,RevenueQuantileBucketImputer:3-buckets,DummyTargetScaler
23,23,0.592569273516145,2024-03-08 09:19:16.152405,2024-03-08 09:20:28.139035,0 days 00:01:11.986630,9,,COMPLETE,XGB,0.6119687521565602,,,,,,,,,1.4478242026547527e-06,dart,0.026353434881562936,0.0006151690149176912,depthwise,1.4069150167007212e-06,forest,0.00014684489086521285,weighted,0.16181406227116887,14,IIDPreprocessor,RevenueQuantileBucketImputer:3-buckets,DummyTargetScaler
24,24,0.5664979072828374,2024-03-08 09:20:28.140499,2024-03-08 09:21:02.463645,0 days 00:00:34.323146,3,,COMPLETE,XGB,0.6119687521565602,,,,,,,,,6.893199018688858e-08,dart,0.009888810122818675,0.5019124570490561,depthwise,1.0198022797487001e-06,forest,5.830700489402295e-07,uniform,2.673544129670366e-08,14,IIDPreprocessor,RevenueQuantileBucketImputer:3-buckets,DummyTargetScaler
25,25,0.5472062748578016,2024-03-08 09:21:02.465394,2024-03-08 09:22:10.533742,0 days 00:01:08.068348,9,,COMPLETE,XGB,0.6119687521565602,,,,,,,,,0.007671892637995962,dart,0.00010519914490914834,1.5031098855275595e-05,lossguide,0.07834095609326663,tree,3.2219129903837536e-07,uniform,7.70097393289558e-05,14,IIDPreprocessor,RevenueQuantileBucketImputer:3-buckets,DummyTargetScaler
26,26,0.5560671790495976,2024-03-08 09:22:10.535786,2024-03-08 09:23:04.664411,0 days 00:00:54.128625,6,,COMPLETE,XGB,0.6119687521565602,,,,,,,,,1.068248119699342e-05,dart,2.2578466714827057e-07,0.00030622142941262137,depthwise,0.277410742742024,forest,8.939872324277734e-05,uniform,0.00027330562898504455,14,IIDPreprocessor,RevenueQuantileBucketImputer:3-buckets,DummyTargetScaler
27,27,0.5389921315515445,2024-03-08 09:23:04.666151,2024-03-08 09:23:48.908073,0 days 00:00:44.241922,4,,COMPLETE,XGB,0.6119687521565602,,,,,,,,,0.3291397222342079,dart,2.9445536822772273e-07,1.6169643175642056e-07,depthwise,7.37682929843717e-08,tree,0.0002169596079132052,uniform,0.00034971414292655676,14,IIDPreprocessor,RevenueQuantileBucketImputer:3-buckets,DummyTargetScaler
28,28,0.5797943136486958,2024-03-08 09:23:48.909778,2024-03-08 09:24:46.421088,0 days 00:00:57.511310,6,,COMPLETE,XGB,0.6119687521565602,,,,,,,,,1.4009165522583231e-06,dart,0.012209981128664461,7.178034808813636e-06,depthwise,1.1179236268227946e-05,tree,1.1320250475244816e-07,weighted,7.367295995156069e-07,14,IIDPreprocessor,RevenueQuantileBucketImputer:3-buckets,DummyTargetScaler
29,29,0.5844164471725801,2024-03-08 09:24:46.422465,2024-03-08 09:25:35.277660,0 days 00:00:48.855195,4,,COMPLETE,XGB,0.6119687521565602,,,,,,,,,0.0004925630762288046,dart,0.05550760069005509,7.00257447779311e-06,depthwise,0.010770907950194478,tree,0.0025088777388927964,uniform,0.009255008012714847,14,IIDPreprocessor,RevenueQuantileBucketImputer:3-buckets,DummyTargetScaler
30,30,0.5321387817475381,2024-03-08 09:25:35.279528,2024-03-08 09:26:06.793421,0 days 00:00:31.513893,2,,COMPLETE,XGB,0.6119687521565602,,,,,,,,,9.965706639989568e-08,dart,3.725476708158379e-05,1.3854613054091863e-08,depthwise,0.001091244212481668,forest,0.002261796795860233,uniform,0.0007433950758642316,14,IIDPreprocessor,RevenueQuantileBucketImputer:3-buckets,DummyTargetScaler
31,31,0.5565075089135064,2024-03-08 09:26:06.796128,2024-03-08 09:26:48.001388,0 days 00:00:41.205260,4,,COMPLETE,XGB,0.6119687521565602,,,,,,,,,3.032088403595527e-06,dart,0.0009160009123193522,1.7534376335426756e-06,depthwise,3.4210823598314696e-05,tree,0.0001744834234450319,uniform,0.003851616189416642,14,IIDPreprocessor,RevenueQuantileBucketImputer:3-buckets,DummyTargetScaler
32,32,0.46466950053266964,2024-03-08 09:26:48.002998,2024-03-08 09:27:14.268073,0 days 00:00:26.265075,1,,COMPLETE,XGB,0.6119687521565602,,,,,,,,,0.00034355839245778664,dart,0.00013521433763237302,4.487591383831222e-07,depthwise,5.1223757525500175e-08,tree,1.8870722037787047e-05,uniform,2.9671195753876192e-08,14,IIDPreprocessor,RevenueQuantileBucketImputer:3-buckets,DummyTargetScaler
33,33,0.5338521980950296,2024-03-08 09:27:14.269593,2024-03-08 09:28:14.534113,0 days 00:01:00.264520,7,,COMPLETE,XGB,0.6119687521565602,,,,,,,,,2.1258496050197975e-08,dart,5.6096870680694034e-08,1.935594933489047e-07,lossguide,5.082372266694277e-06,tree,1.8519287674132132e-06,uniform,0.14764331162275138,14,IIDPreprocessor,RevenueQuantileBucketImputer:3-buckets,DummyTargetScaler
34,34,0.5321387817475381,2024-03-08 09:28:14.535593,2024-03-08 09:28:44.432978,0 days 00:00:29.897385,2,,COMPLETE,XGB,0.6119687521565602,,,,,,,,,2.4181810424855013e-05,dart,8.111632598175393e-05,2.612573939367231e-06,lossguide,0.001490167090266533,forest,1.1481540335557944e-05,uniform,0.07215298966067972,14,IIDPreprocessor,RevenueQuantileBucketImputer:3-buckets,DummyTargetScaler
35,35,0.548839973359775,2024-03-08 09:28:44.434376,2024-03-08 09:29:51.385354,0 days 00:01:06.950978,9,,COMPLETE,XGB,0.6119687521565602,,,,,,,,,0.413634891336161,dart,1.77433164744667e-06,0.005002252369304399,depthwise,8.399443706934569e-07,forest,1.790873829023094e-08,uniform,0.007999723317985534,14,IIDPreprocessor,RevenueQuantileBucketImputer:3-buckets,DummyTargetScaler
36,36,0.5546339443522407,2024-03-08 09:29:51.386987,2024-03-08 09:30:52.502059,0 days 00:01:01.115072,7,,COMPLETE,XGB,0.6119687521565602,,,,,,,,,0.3539458737906136,dart,4.719789000332701e-05,3.300878448399974e-05,lossguide,0.005021702403797125,tree,0.0010631353150386152,weighted,3.432570028116051e-07,14,IIDPreprocessor,RevenueQuantileBucketImputer:3-buckets,DummyTargetScaler
37,37,0.5431562203962399,2024-03-08 09:30:52.503465,2024-03-08 09:31:40.598057,0 days 00:00:48.094592,5,,COMPLETE,XGB,0.6119687521565602,,,,,,,,,2.1717703628086846e-08,dart,0.00016889187762761485,0.00022238764913104083,depthwise,3.80522981789923e-05,forest,3.574826737317076e-08,uniform,9.798682639961305e-06,14,IIDPreprocessor,RevenueQuantileBucketImputer:3-buckets,DummyTargetScaler
38,38,0.5547280083664667,2024-03-08 09:31:40.599361,2024-03-08 09:32:17.272658,0 days 00:00:36.673297,3,,COMPLETE,XGB,0.6119687521565602,,,,,,,,,1.3143434015598694e-08,dart,5.15793525122994e-07,0.0011793139475604782,depthwise,6.729406179683001e-08,tree,0.0029477390988766217,uniform,1.777398953718688e-05,14,IIDPreprocessor,RevenueQuantileBucketImputer:3-buckets,DummyTargetScaler
39,39,0.556155802646122,2024-03-08 09:32:17.274384,2024-03-08 09:33:01.827174,0 days 00:00:44.552790,5,,COMPLETE,XGB,0.6119687521565602,,,,,,,,,7.000986419246633e-06,dart,0.003959001015030866,0.01347260124547269,depthwise,0.004902248324769801,forest,1.7410708427714603e-08,weighted,0.0004982339797786183,14,IIDPreprocessor,RevenueQuantileBucketImputer:3-buckets,DummyTargetScaler
0,0,0.5787590651108147,2024-03-08 09:50:07.471431,2024-03-08 09:50:23.178159,0 days 00:00:15.706728,6,800.0,COMPLETE,RandomForest,0.6781348498907097,,,,,,,,,,,,,,,,,,,15,IIDPreprocessor,HybridCategoricalStatisticsImputer,LogTargetScaler
1,1,0.653672507128294,2024-03-08 09:50:23.178938,2024-03-08 09:50:42.162137,0 days 00:00:18.983199,12,600.0,COMPLETE,RandomForest,0.6781348498907097,,,,,,,,,,,,,,,,,,,15,IIDPreprocessor,HybridCategoricalStatisticsImputer,LogTargetScaler
2,2,0.6706686278927069,2024-03-08 09:50:42.162996,2024-03-08 09:51:15.457009,0 days 00:00:33.294013,42,1000.0,COMPLETE,RandomForest,0.6781348498907097,,,,,,,,,,,,,,,,,,,15,IIDPreprocessor,HybridCategoricalStatisticsImputer,LogTargetScaler
3,3,0.6708444254303407,2024-03-08 09:51:15.457820,2024-03-08 09:51:49.641091,0 days 00:00:34.183271,87,1100.0,COMPLETE,RandomForest,0.6781348498907097,,,,,,,,,,,,,,,,,,,15,IIDPreprocessor,HybridCategoricalStatisticsImputer,LogTargetScaler
4,4,0.6720943591840912,2024-03-08 09:51:49.643398,2024-03-08 09:52:24.697736,0 days 00:00:35.054338,21,1100.0,COMPLETE,RandomForest,0.6781348498907097,,,,,,,,,,,,,,,,,,,15,IIDPreprocessor,HybridCategoricalStatisticsImputer,LogTargetScaler
5,5,0.5643850739835645,2024-03-08 09:52:24.698400,2024-03-08 09:52:28.055549,0 days 00:00:03.357149,6,200.0,COMPLETE,RandomForest,0.6781348498907097,,,,,,,,,,,,,,,,,,,15,IIDPreprocessor,HybridCategoricalStatisticsImputer,LogTargetScaler
6,6,0.4391551685886869,2024-03-08 09:52:28.056366,2024-03-08 09:52:29.108529,0 days 00:00:01.052163,3,100.0,COMPLETE,RandomForest,0.6781348498907097,,,,,,,,,,,,,,,,,,,15,IIDPreprocessor,HybridCategoricalStatisticsImputer,LogTargetScaler
7,7,0.6714664577634019,2024-03-08 09:52:29.109233,2024-03-08 09:52:56.180031,0 days 00:00:27.070798,18,900.0,COMPLETE,RandomForest,0.6781348498907097,,,,,,,,,,,,,,,,,,,15,IIDPreprocessor,HybridCategoricalStatisticsImputer,LogTargetScaler
8,8,0.6781348498907097,2024-03-08 09:52:56.180681,2024-03-08 09:53:39.131813,0 days 00:00:42.951132,42,1400.0,COMPLETE,RandomForest,0.6781348498907097,,,,,,,,,,,,,,,,,,,15,IIDPreprocessor,HybridCategoricalStatisticsImputer,LogTargetScaler
9,9,0.6707702637392288,2024-03-08 09:53:39.132669,2024-03-08 09:54:16.106203,0 days 00:00:36.973534,90,1200.0,COMPLETE,RandomForest,0.6781348498907097,,,,,,,,,,,,,,,,,,,15,IIDPreprocessor,HybridCategoricalStatisticsImputer,LogTargetScaler
10,10,0.6641329707939083,2024-03-08 09:54:16.106831,2024-03-08 09:54:19.320984,0 days 00:00:03.214153,63,100.0,COMPLETE,RandomForest,0.6781348498907097,,,,,,,,,,,,,,,,,,,15,IIDPreprocessor,HybridCategoricalStatisticsImputer,LogTargetScaler
11,11,0.6674275778511025,2024-03-08 09:54:19.321754,2024-03-08 09:54:44.949604,0 days 00:00:25.627850,87,900.0,COMPLETE,RandomForest,0.6781348498907097,,,,,,,,,,,,,,,,,,,15,IIDPreprocessor,HybridCategoricalStatisticsImputer,LogTargetScaler
12,12,0.6662112096486176,2024-03-08 09:54:44.950504,2024-03-08 09:54:56.943322,0 days 00:00:11.992818,24,400.0,COMPLETE,RandomForest,0.6781348498907097,,,,,,,,,,,,,,,,,,,15,IIDPreprocessor,HybridCategoricalStatisticsImputer,LogTargetScaler
13,13,0.6689954549237435,2024-03-08 09:54:56.944014,2024-03-08 09:55:10.826184,0 days 00:00:13.882170,42,400.0,COMPLETE,RandomForest,0.6781348498907097,,,,,,,,,,,,,,,,,,,15,IIDPreprocessor,HybridCategoricalStatisticsImputer,LogTargetScaler
14,14,0.6687160039175718,2024-03-08 09:55:10.827030,2024-03-08 09:55:26.378640,0 days 00:00:15.551610,90,500.0,COMPLETE,RandomForest,0.6781348498907097,,,,,,,,,,,,,,,,,,,15,IIDPreprocessor,HybridCategoricalStatisticsImputer,LogTargetScaler
15,15,0.671395733144571,2024-03-08 09:55:26.379548,2024-03-08 09:55:29.254782,0 days 00:00:02.875234,45,100.0,COMPLETE,RandomForest,0.6781348498907097,,,,,,,,,,,,,,,,,,,15,IIDPreprocessor,HybridCategoricalStatisticsImputer,LogTargetScaler
16,16,0.6633588060111959,2024-03-08 09:55:29.255490,2024-03-08 09:55:32.200343,0 days 00:00:02.944853,21,100.0,COMPLETE,RandomForest,0.6781348498907097,,,,,,,,,,,,,,,,,,,15,IIDPreprocessor,HybridCategoricalStatisticsImputer,LogTargetScaler
17,17,0.6691620294687787,2024-03-08 09:55:32.201006,2024-03-08 09:56:10.251170,0 days 00:00:38.050164,21,1300.0,COMPLETE,RandomForest,0.6781348498907097,,,,,,,,,,,,,,,,,,,15,IIDPreprocessor,HybridCategoricalStatisticsImputer,LogTargetScaler
18,18,0.6614384213566847,2024-03-08 09:56:10.251800,2024-03-08 09:56:52.372331,0 days 00:00:42.120531,18,1500.0,COMPLETE,RandomForest,0.6781348498907097,,,,,,,,,,,,,,,,,,,15,IIDPreprocessor,HybridCategoricalStatisticsImputer,LogTargetScaler
19,19,0.672401351661149,2024-03-08 09:56:52.373085,2024-03-08 09:57:23.320433,0 days 00:00:30.947348,57,1000.0,COMPLETE,RandomForest,0.6781348498907097,,,,,,,,,,,,,,,,,,,15,IIDPreprocessor,HybridCategoricalStatisticsImputer,LogTargetScaler
20,20,0.6500256099654432,2024-03-08 09:57:23.321325,2024-03-08 09:57:32.248218,0 days 00:00:08.926893,39,300.0,COMPLETE,RandomForest,0.6781348498907097,,,,,,,,,,,,,,,,,,,15,IIDPreprocessor,HybridCategoricalStatisticsImputer,LogTargetScaler
21,21,0.6706602931716593,2024-03-08 09:57:32.249140,2024-03-08 09:58:19.682198,0 days 00:00:47.433058,60,1500.0,COMPLETE,RandomForest,0.6781348498907097,,,,,,,,,,,,,,,,,,,15,IIDPreprocessor,HybridCategoricalStatisticsImputer,LogTargetScaler
22,22,0.6469915895392312,2024-03-08 09:58:19.683217,2024-03-08 09:58:22.913773,0 days 00:00:03.230556,57,100.0,COMPLETE,RandomForest,0.6781348498907097,,,,,,,,,,,,,,,,,,,15,IIDPreprocessor,HybridCategoricalStatisticsImputer,LogTargetScaler
23,23,0.649940653148026,2024-03-08 09:58:22.914742,2024-03-08 09:58:26.117869,0 days 00:00:03.203127,42,100.0,COMPLETE,RandomForest,0.6781348498907097,,,,,,,,,,,,,,,,,,,15,IIDPreprocessor,HybridCategoricalStatisticsImputer,LogTargetScaler
24,24,0.6726287460302556,2024-03-08 09:58:26.118619,2024-03-08 09:58:42.298842,0 days 00:00:16.180223,63,500.0,COMPLETE,RandomForest,0.6781348498907097,,,,,,,,,,,,,,,,,,,15,IIDPreprocessor,HybridCategoricalStatisticsImputer,LogTargetScaler
25,25,0.6649424697916112,2024-03-08 09:58:42.299838,2024-03-08 09:59:04.551520,0 days 00:00:22.251682,51,700.0,COMPLETE,RandomForest,0.6781348498907097,,,,,,,,,,,,,,,,,,,15,IIDPreprocessor,HybridCategoricalStatisticsImputer,LogTargetScaler
26,26,0.66730979503369,2024-03-08 09:59:04.552275,2024-03-08 09:59:28.522760,0 days 00:00:23.970485,60,800.0,COMPLETE,RandomForest,0.6781348498907097,,,,,,,,,,,,,,,,,,,15,IIDPreprocessor,HybridCategoricalStatisticsImputer,LogTargetScaler
27,27,0.6742743749312197,2024-03-08 09:59:28.523474,2024-03-08 09:59:52.898220,0 days 00:00:24.374746,69,800.0,COMPLETE,RandomForest,0.6781348498907097,,,,,,,,,,,,,,,,,,,15,IIDPreprocessor,HybridCategoricalStatisticsImputer,LogTargetScaler
28,28,0.6733502983668053,2024-03-08 09:59:52.898899,2024-03-08 10:00:02.880612,0 days 00:00:09.981713,69,300.0,COMPLETE,RandomForest,0.6781348498907097,,,,,,,,,,,,,,,,,,,15,IIDPreprocessor,HybridCategoricalStatisticsImputer,LogTargetScaler
29,29,0.6643202932099505,2024-03-08 10:00:02.881391,2024-03-08 10:00:50.164782,0 days 00:00:47.283391,90,1400.0,COMPLETE,RandomForest,0.6781348498907097,,,,,,,,,,,,,,,,,,,15,IIDPreprocessor,HybridCategoricalStatisticsImputer,LogTargetScaler
30,30,0.671811919952071,2024-03-08 10:00:50.165612,2024-03-08 10:01:38.232460,0 days 00:00:48.066848,81,1500.0,COMPLETE,RandomForest,0.6781348498907097,,,,,,,,,,,,,,,,,,,15,IIDPreprocessor,HybridCategoricalStatisticsImputer,LogTargetScaler
31,31,0.6709783977453063,2024-03-08 10:01:38.233218,2024-03-08 10:02:17.649812,0 days 00:00:39.416594,45,1200.0,COMPLETE,RandomForest,0.6781348498907097,,,,,,,,,,,,,,,,,,,15,IIDPreprocessor,HybridCategoricalStatisticsImputer,LogTargetScaler
32,32,0.6668851728971572,2024-03-08 10:02:17.650475,2024-03-08 10:02:36.444984,0 days 00:00:18.794509,18,600.0,COMPLETE,RandomForest,0.6781348498907097,,,,,,,,,,,,,,,,,,,15,IIDPreprocessor,HybridCategoricalStatisticsImputer,LogTargetScaler
33,33,0.658678807807926,2024-03-08 10:02:36.445817,2024-03-08 10:02:48.569029,0 days 00:00:12.123212,60,400.0,COMPLETE,RandomForest,0.6781348498907097,,,,,,,,,,,,,,,,,,,15,IIDPreprocessor,HybridCategoricalStatisticsImputer,LogTargetScaler
34,34,0.6647943558661903,2024-03-08 10:02:48.569720,2024-03-08 10:03:31.191832,0 days 00:00:42.622112,36,1300.0,COMPLETE,RandomForest,0.6781348498907097,,,,,,,,,,,,,,,,,,,15,IIDPreprocessor,HybridCategoricalStatisticsImputer,LogTargetScaler
35,35,0.6628467100173373,2024-03-08 10:03:31.192755,2024-03-08 10:04:03.484261,0 days 00:00:32.291506,75,1000.0,COMPLETE,RandomForest,0.6781348498907097,,,,,,,,,,,,,,,,,,,15,IIDPreprocessor,HybridCategoricalStatisticsImputer,LogTargetScaler
36,36,0.6546298497688815,2024-03-08 10:04:03.485161,2024-03-08 10:04:06.662316,0 days 00:00:03.177155,66,100.0,COMPLETE,RandomForest,0.6781348498907097,,,,,,,,,,,,,,,,,,,15,IIDPreprocessor,HybridCategoricalStatisticsImputer,LogTargetScaler
37,37,0.5746701233562846,2024-03-08 10:04:06.663230,2024-03-08 10:04:30.625744,0 days 00:00:23.962514,6,1400.0,COMPLETE,RandomForest,0.6781348498907097,,,,,,,,,,,,,,,,,,,15,IIDPreprocessor,HybridCategoricalStatisticsImputer,LogTargetScaler
38,38,0.6675176663331265,2024-03-08 10:04:30.626658,2024-03-08 10:05:08.172359,0 days 00:00:37.545701,63,1100.0,COMPLETE,RandomForest,0.6781348498907097,,,,,,,,,,,,,,,,,,,15,IIDPreprocessor,HybridCategoricalStatisticsImputer,LogTargetScaler
39,39,0.6728001540308253,2024-03-08 10:05:08.173327,2024-03-08 10:05:35.114028,0 days 00:00:26.940701,33,800.0,COMPLETE,RandomForest,0.6781348498907097,,,,,,,,,,,,,,,,,,,15,IIDPreprocessor,HybridCategoricalStatisticsImputer,LogTargetScaler
0,0,0.03540571704955763,2024-03-08 10:06:20.465586,2024-03-08 10:06:42.347630,0 days 00:00:21.882044,78,810.0,COMPLETE,LGBM,0.6896382851305164,0.7177393128768575,7.0,0.6657817343477406,1.0046838695098736e-05,9.425854494897297e-06,0.10549231748230693,46.0,162.0,,,,,,,,,,,15,IIDPreprocessor,HybridCategoricalStatisticsImputer,LogTargetScaler
