,number,value,datetime_start,datetime_complete,duration,params_max_depth,params_n_estimators,state,model,best_value,params_bagging_fraction,params_bagging_freq,params_feature_fraction,params_lambda_l1,params_lambda_l2,params_learning_rate,params_min_child_samples,params_num_leaves,params_alpha,params_booster,params_eta,params_gamma,params_grow_policy,params_lambda,params_normalize_type,params_rate_drop,params_sample_type,params_skip_drop,config_id,preprocessor,imputer,target_scaler
35,35,0.6245720230741589,2024-03-08 03:32:06.669945,2024-03-08 03:32:23.355738,0 days 00:00:16.685793,93,1110.0,COMPLETE,LGBM,0.6570295523790415,0.4204939467907652,1.0,0.9251544309058564,0.15871068437466718,0.22784720358914468,0.1451905372730857,90.0,24.0,,,,,,,,,,,9,IIDPreprocessor,DummyImputer,LogTargetScaler
36,36,0.6253059659100482,2024-03-08 03:32:23.357664,2024-03-08 03:32:49.328867,0 days 00:00:25.971203,60,910.0,COMPLETE,LGBM,0.6570295523790415,0.8300859881772547,2.0,0.4764014751335766,2.522831772566402,2.154249749880203,0.01667705668278696,42.0,254.0,,,,,,,,,,,9,IIDPreprocessor,DummyImputer,LogTargetScaler
37,37,0.6225710402679494,2024-03-08 03:32:49.330273,2024-03-08 03:33:00.750533,0 days 00:00:11.420260,6,310.0,COMPLETE,LGBM,0.6570295523790415,0.9217285550407933,2.0,0.5885630189525617,0.12617667701110266,3.080507791557819e-07,0.08712341909500042,63.0,53.0,,,,,,,,,,,9,IIDPreprocessor,DummyImputer,LogTargetScaler
38,38,0.5732443754529165,2024-03-08 03:33:00.752458,2024-03-08 03:33:01.499551,0 days 00:00:00.747093,36,10.0,COMPLETE,LGBM,0.6570295523790415,0.9596567297155715,7.0,0.7370306388198369,0.0001959402771134404,0.45834117731283364,0.011604565903734397,71.0,108.0,,,,,,,,,,,9,IIDPreprocessor,DummyImputer,LogTargetScaler
39,39,0.6510029416253108,2024-03-08 03:33:01.501171,2024-03-08 03:34:07.831010,0 days 00:01:06.329839,18,510.0,COMPLETE,LGBM,0.6570295523790415,0.6375293555057001,4.0,0.7672397866245209,1.4780176677352573e-08,0.027550286955399305,0.029639605764025145,17.0,176.0,,,,,,,,,,,9,IIDPreprocessor,DummyImputer,LogTargetScaler
0,0,0.5405300447073058,2024-03-08 03:35:22.756688,2024-03-08 03:36:15.947091,0 days 00:00:53.190403,7,,COMPLETE,XGB,0.6180641211906144,,,,,,,,,1.8039508787046822e-08,dart,1.3276525491093068e-06,0.01570178450169514,lossguide,1.4341136587386551e-08,tree,2.0859990888295015e-08,uniform,3.1180358995470573e-07,9,IIDPreprocessor,DummyImputer,LogTargetScaler
1,1,0.5476968367353855,2024-03-08 03:36:15.948707,2024-03-08 03:37:09.692282,0 days 00:00:53.743575,8,,COMPLETE,XGB,0.6180641211906144,,,,,,,,,1.2490542246273427e-07,dart,5.853480418413145e-07,5.671487078497074e-08,lossguide,0.0006422877862017816,forest,0.0013881434152979728,uniform,0.16322637231208448,9,IIDPreprocessor,DummyImputer,LogTargetScaler
2,2,0.5714130218965157,2024-03-08 03:37:09.693460,2024-03-08 03:37:47.238982,0 days 00:00:37.545522,4,,COMPLETE,XGB,0.6180641211906144,,,,,,,,,4.747646116043166e-07,dart,1.0543531045146185e-05,4.933050452684669e-06,lossguide,5.4812106812946874e-08,forest,3.660664159202766e-06,uniform,0.020331429080588548,9,IIDPreprocessor,DummyImputer,LogTargetScaler
3,3,0.44473385168618473,2024-03-08 03:37:47.240069,2024-03-08 03:38:13.814940,0 days 00:00:26.574871,1,,COMPLETE,XGB,0.6180641211906144,,,,,,,,,2.0510595356700798e-08,dart,1.0865966724238612e-05,9.770387465095577e-07,lossguide,3.359316227678727e-08,tree,0.0008979946942111942,uniform,0.00819830582166052,9,IIDPreprocessor,DummyImputer,LogTargetScaler
4,4,0.6180641211906144,2024-03-08 03:38:13.816580,2024-03-08 03:38:52.743012,0 days 00:00:38.926432,6,,COMPLETE,XGB,0.6180641211906144,,,,,,,,,6.341099628744491e-05,dart,0.5965772844837739,0.0006606007759071764,depthwise,0.0019881638432030714,forest,1.0116103692199139e-08,uniform,0.17997976707604607,9,IIDPreprocessor,DummyImputer,LogTargetScaler
5,5,0.5688386542697424,2024-03-08 03:38:52.744767,2024-03-08 03:39:27.793138,0 days 00:00:35.048371,3,,COMPLETE,XGB,0.6180641211906144,,,,,,,,,4.280644754836379e-08,dart,0.0001455985283981938,7.103074786925871e-06,depthwise,3.33203015677525e-05,tree,1.5667478679371205e-07,weighted,7.730227958667007e-08,9,IIDPreprocessor,DummyImputer,LogTargetScaler
6,6,0.5676439168175014,2024-03-08 03:39:27.794549,2024-03-08 03:40:07.755301,0 days 00:00:39.960752,4,,COMPLETE,XGB,0.6180641211906144,,,,,,,,,0.054952351812174255,dart,0.00012742697068249826,1.2957395865919092e-07,lossguide,0.00045714016876236306,tree,4.048103177914461e-05,uniform,0.20008146814318814,9,IIDPreprocessor,DummyImputer,LogTargetScaler
7,7,0.5274671050241436,2024-03-08 03:40:07.756978,2024-03-08 03:40:39.845772,0 days 00:00:32.088794,2,,COMPLETE,XGB,0.6180641211906144,,,,,,,,,0.010577505093571202,dart,0.0005531759951555367,0.002936183709518663,lossguide,2.2256651759825816e-05,forest,2.0447904032398514e-05,uniform,3.286313227827384e-05,9,IIDPreprocessor,DummyImputer,LogTargetScaler
8,8,0.44473385168618473,2024-03-08 03:40:39.847373,2024-03-08 03:41:02.819969,0 days 00:00:22.972596,1,,COMPLETE,XGB,0.6180641211906144,,,,,,,,,3.7072542435793236e-07,dart,4.030848738204196e-07,1.9217115419852204e-06,depthwise,0.214328660256164,forest,0.15237581392494565,weighted,8.414995761368663e-05,9,IIDPreprocessor,DummyImputer,LogTargetScaler
9,9,0.5630964750322829,2024-03-08 03:41:02.821226,2024-03-08 03:41:49.806564,0 days 00:00:46.985338,6,,COMPLETE,XGB,0.6180641211906144,,,,,,,,,2.0266505704896575e-07,dart,0.00011221614369253207,0.5371072003050202,lossguide,1.2732489501703925e-05,tree,1.6862482705419097e-07,uniform,0.0001751751988022567,9,IIDPreprocessor,DummyImputer,LogTargetScaler
10,10,0.5653350054915035,2024-03-08 03:41:49.808120,2024-03-08 03:42:24.181814,0 days 00:00:34.373694,3,,COMPLETE,XGB,0.6180641211906144,,,,,,,,,3.4691250867174045e-07,dart,5.328744056770183e-05,0.00011448534118994426,lossguide,0.02116997897799676,tree,2.2942056625250515e-08,weighted,0.031480978162447396,9,IIDPreprocessor,DummyImputer,LogTargetScaler
11,11,0.44473385168618473,2024-03-08 03:42:24.183851,2024-03-08 03:42:49.700713,0 days 00:00:25.516862,1,,COMPLETE,XGB,0.6180641211906144,,,,,,,,,0.11921314853769754,dart,6.687341482280083e-05,1.4118223287693388e-08,lossguide,0.9120320888840543,forest,9.273071632838772e-07,uniform,0.0816845251122288,9,IIDPreprocessor,DummyImputer,LogTargetScaler
12,12,0.5841249023409568,2024-03-08 03:42:49.702227,2024-03-08 03:43:26.839896,0 days 00:00:37.137669,8,,COMPLETE,XGB,0.6180641211906144,,,,,,,,,1.9735402852301488e-06,dart,0.9121918536534711,0.0002610803695877776,lossguide,0.20918243355986704,tree,0.00046278543822843163,uniform,3.6426407282011987e-06,9,IIDPreprocessor,DummyImputer,LogTargetScaler
13,13,0.5478804449973326,2024-03-08 03:43:26.841201,2024-03-08 03:44:07.998058,0 days 00:00:41.156857,4,,COMPLETE,XGB,0.6180641211906144,,,,,,,,,2.2550624505193376e-08,dart,1.0088348514753396e-08,1.1524060452767108e-07,depthwise,4.578932319325977e-05,tree,0.01173721537777934,weighted,0.017984909825142104,9,IIDPreprocessor,DummyImputer,LogTargetScaler
14,14,0.5452528532407392,2024-03-08 03:44:07.999817,2024-03-08 03:44:59.569522,0 days 00:00:51.569705,7,,COMPLETE,XGB,0.6180641211906144,,,,,,,,,0.20040696016512888,dart,1.7755446254147117e-06,1.3092654729122354e-05,lossguide,2.9180879381233985e-08,forest,1.6110021728237426e-07,uniform,0.010260043408163175,9,IIDPreprocessor,DummyImputer,LogTargetScaler
15,15,0.44473385168618473,2024-03-08 03:44:59.570658,2024-03-08 03:45:15.371829,0 days 00:00:15.801171,1,,COMPLETE,XGB,0.6180641211906144,,,,,,,,,5.630661760130009e-07,dart,2.1321209480839393e-06,0.05573615948621576,depthwise,1.6313037651407372e-06,forest,0.9231279988526162,weighted,0.5020968628375752,9,IIDPreprocessor,DummyImputer,LogTargetScaler
16,16,0.5695522447765541,2024-03-08 03:45:15.373668,2024-03-08 03:45:39.970021,0 days 00:00:24.596353,1,,COMPLETE,XGB,0.6180641211906144,,,,,,,,,0.00016579735385501324,dart,0.7995092305400217,0.024180272197446773,lossguide,0.0002645387146175052,forest,4.1188441047325004e-05,uniform,1.365092797693336e-05,9,IIDPreprocessor,DummyImputer,LogTargetScaler
17,17,0.5581071301027086,2024-03-08 03:45:39.971315,2024-03-08 03:46:18.379958,0 days 00:00:38.408643,4,,COMPLETE,XGB,0.6180641211906144,,,,,,,,,1.8316125564625547e-06,dart,4.104040739685708e-08,6.888806284142766e-06,depthwise,0.0017700625732971185,tree,0.0010345042463912638,uniform,0.003589509921774407,9,IIDPreprocessor,DummyImputer,LogTargetScaler
18,18,0.5445248037657096,2024-03-08 03:46:18.381146,2024-03-08 03:47:13.044779,0 days 00:00:54.663633,8,,COMPLETE,XGB,0.6180641211906144,,,,,,,,,0.003023348328102123,dart,3.939818787537038e-06,5.244582704097577e-08,depthwise,2.208330730198833e-05,tree,1.6907174103686143e-08,uniform,3.804615061570764e-07,9,IIDPreprocessor,DummyImputer,LogTargetScaler
19,19,0.6015063865473479,2024-03-08 03:47:13.046366,2024-03-08 03:47:40.373537,0 days 00:00:27.327171,2,,COMPLETE,XGB,0.6180641211906144,,,,,,,,,0.0017746859786739024,dart,0.3412186955444479,0.08940998397962528,lossguide,1.4438372351676824e-06,forest,1.2459746661383509e-08,uniform,3.177313236946295e-07,9,IIDPreprocessor,DummyImputer,LogTargetScaler
20,20,0.44277218426399095,2024-03-08 03:47:40.375875,2024-03-08 03:48:05.063531,0 days 00:00:24.687656,1,,COMPLETE,XGB,0.6180641211906144,,,,,,,,,1.1242598678073443e-08,dart,1.851451696173577e-07,0.030220020967536475,depthwise,0.00034053506294152655,tree,4.311982144260401e-05,uniform,2.837392182507678e-06,9,IIDPreprocessor,DummyImputer,LogTargetScaler
21,21,0.580967496882767,2024-03-08 03:48:05.064544,2024-03-08 03:48:28.536528,0 days 00:00:23.471984,1,,COMPLETE,XGB,0.6180641211906144,,,,,,,,,1.3266179157576212e-06,dart,0.5503359840900126,0.0009375445196719852,depthwise,4.21462772454337e-06,forest,2.7717008663385125e-08,uniform,2.918113136340744e-07,9,IIDPreprocessor,DummyImputer,LogTargetScaler
22,22,0.5504518293129865,2024-03-08 03:48:28.537674,2024-03-08 03:49:10.777421,0 days 00:00:42.239747,9,,COMPLETE,XGB,0.6180641211906144,,,,,,,,,1.0241558999597684e-07,dart,1.340410064212372e-06,0.00013949476938232664,depthwise,1.150936005707775e-05,tree,0.7645734204784826,uniform,4.601334506237573e-06,9,IIDPreprocessor,DummyImputer,LogTargetScaler
23,23,0.5955467549702433,2024-03-08 03:49:10.779296,2024-03-08 03:50:06.822115,0 days 00:00:56.042819,7,,COMPLETE,XGB,0.6180641211906144,,,,,,,,,0.0002932149284092868,dart,0.007123837491011225,2.682836681041899e-07,lossguide,0.00010423742956176158,tree,0.0001915306832164673,weighted,0.00011447720110708724,9,IIDPreprocessor,DummyImputer,LogTargetScaler
24,24,0.554765621702993,2024-03-08 03:50:06.823788,2024-03-08 03:50:34.652276,0 days 00:00:27.828488,1,,COMPLETE,XGB,0.6180641211906144,,,,,,,,,4.096485247325984e-08,dart,0.06306174957547618,6.094256623089287e-07,lossguide,4.46945189728117e-06,tree,8.124745478198958e-07,weighted,0.21613272895881114,9,IIDPreprocessor,DummyImputer,LogTargetScaler
25,25,0.60129351471222,2024-03-08 03:50:34.653233,2024-03-08 03:51:06.241271,0 days 00:00:31.588038,3,,COMPLETE,XGB,0.6180641211906144,,,,,,,,,8.213763475910218e-07,dart,0.981489632781971,0.014734985947540679,depthwise,0.006452778932378905,tree,7.156054738046956e-06,uniform,6.619916551589928e-05,9,IIDPreprocessor,DummyImputer,LogTargetScaler
26,26,0.5955387520357938,2024-03-08 03:51:06.242904,2024-03-08 03:52:06.104399,0 days 00:00:59.861495,8,,COMPLETE,XGB,0.6180641211906144,,,,,,,,,3.0593867675195563e-06,dart,0.011256308187803188,0.0002487612657293435,depthwise,0.00019639966707015003,tree,7.704909726469475e-05,weighted,0.0003029623776476891,9,IIDPreprocessor,DummyImputer,LogTargetScaler
27,27,0.5951312604255622,2024-03-08 03:52:06.106382,2024-03-08 03:52:52.913590,0 days 00:00:46.807208,7,,COMPLETE,XGB,0.6180641211906144,,,,,,,,,0.20637272955565694,dart,0.008715189725500354,0.0047687063881395805,depthwise,0.030241074265428925,tree,2.334037531687727e-06,weighted,0.00610417128364505,9,IIDPreprocessor,DummyImputer,LogTargetScaler
28,28,0.5648892320987571,2024-03-08 03:52:52.915228,2024-03-08 03:53:51.429753,0 days 00:00:58.514525,9,,COMPLETE,XGB,0.6180641211906144,,,,,,,,,1.2044950049281699e-07,dart,3.1560479411088406e-05,5.281308302923231e-06,depthwise,0.07220669019870359,forest,2.808026291044124e-07,weighted,3.916770473590665e-05,9,IIDPreprocessor,DummyImputer,LogTargetScaler
29,29,0.5817579972026581,2024-03-08 03:53:51.430605,2024-03-08 03:54:33.467117,0 days 00:00:42.036512,5,,COMPLETE,XGB,0.6180641211906144,,,,,,,,,1.733807650469935e-06,dart,0.007145507507455908,0.002384238689860406,depthwise,0.009982699053491039,forest,2.7765018534846204e-06,uniform,0.4818238830840814,9,IIDPreprocessor,DummyImputer,LogTargetScaler
30,30,0.5591014728960606,2024-03-08 03:54:33.468378,2024-03-08 03:55:23.549279,0 days 00:00:50.080901,6,,COMPLETE,XGB,0.6180641211906144,,,,,,,,,3.1891793821674746e-07,dart,2.4980289775919824e-05,1.1712975622900435e-08,lossguide,4.9650214897290976e-05,tree,0.0001122689704080961,weighted,0.7910387662429916,9,IIDPreprocessor,DummyImputer,LogTargetScaler
31,31,0.44586200849094704,2024-03-08 03:55:23.550965,2024-03-08 03:55:48.967378,0 days 00:00:25.416413,1,,COMPLETE,XGB,0.6180641211906144,,,,,,,,,0.0003926938545751379,dart,0.0004898647333661749,1.6438199028817647e-06,lossguide,3.11481919702825e-08,tree,8.57304131773628e-06,uniform,0.00021192365436050917,9,IIDPreprocessor,DummyImputer,LogTargetScaler
32,32,0.4475552165213546,2024-03-08 03:55:48.968967,2024-03-08 03:56:13.605854,0 days 00:00:24.636887,1,,COMPLETE,XGB,0.6180641211906144,,,,,,,,,2.5116345968416006e-05,dart,0.0022666222782650376,1.5236493178307756e-07,depthwise,9.679161972191303e-07,tree,0.0009452253236565572,uniform,0.5390055050090371,9,IIDPreprocessor,DummyImputer,LogTargetScaler
33,33,0.5540415816156381,2024-03-08 03:56:13.607630,2024-03-08 03:56:42.229419,0 days 00:00:28.621789,2,,COMPLETE,XGB,0.6180641211906144,,,,,,,,,0.0002066605025694643,dart,0.0017987409851076622,9.409535628441628e-08,depthwise,7.863332978837698e-06,forest,1.1732414175418127e-06,uniform,0.0022281628033594576,9,IIDPreprocessor,DummyImputer,LogTargetScaler
34,34,0.5720154502556223,2024-03-08 03:56:42.230815,2024-03-08 03:57:17.322408,0 days 00:00:35.091593,3,,COMPLETE,XGB,0.6180641211906144,,,,,,,,,9.851285358694318e-08,dart,1.687984238734803e-08,1.7715717661997782e-06,lossguide,4.971148231273463e-06,forest,4.401271930611459e-08,weighted,4.4040050549697574e-06,9,IIDPreprocessor,DummyImputer,LogTargetScaler
35,35,0.5653350054915035,2024-03-08 03:57:17.323699,2024-03-08 03:57:42.366927,0 days 00:00:25.043228,3,,COMPLETE,XGB,0.6180641211906144,,,,,,,,,2.598124689418953e-06,dart,6.405425428288041e-06,1.3066709264908227e-06,lossguide,0.01703830460790804,tree,0.325161185473315,uniform,0.008393736646607341,9,IIDPreprocessor,DummyImputer,LogTargetScaler
36,36,0.5439777765313414,2024-03-08 03:57:42.368106,2024-03-08 03:58:40.142208,0 days 00:00:57.774102,8,,COMPLETE,XGB,0.6180641211906144,,,,,,,,,0.0001441532245559096,dart,0.00034932153923126265,7.542122667501873e-06,lossguide,3.668341990766495e-05,forest,3.012579542357653e-06,weighted,0.25465693481809476,9,IIDPreprocessor,DummyImputer,LogTargetScaler
37,37,0.5452964552726254,2024-03-08 03:58:40.143457,2024-03-08 03:59:11.027797,0 days 00:00:30.884340,2,,COMPLETE,XGB,0.6180641211906144,,,,,,,,,0.015865216505016468,dart,0.002776742158758694,8.025973124399518e-08,depthwise,0.001580800825709441,tree,1.6962050781237823e-08,weighted,0.003881777842719966,9,IIDPreprocessor,DummyImputer,LogTargetScaler
38,38,0.5608657665549074,2024-03-08 03:59:11.028839,2024-03-08 03:59:59.771932,0 days 00:00:48.743093,6,,COMPLETE,XGB,0.6180641211906144,,,,,,,,,0.5211428228605859,dart,6.954361761859062e-06,0.004052375818224886,depthwise,1.5344576582174582e-07,forest,0.00040575913131955023,weighted,0.0023585954162426625,9,IIDPreprocessor,DummyImputer,LogTargetScaler
39,39,0.5351727912782122,2024-03-08 03:59:59.773520,2024-03-08 04:00:54.998173,0 days 00:00:55.224653,6,,COMPLETE,XGB,0.6180641211906144,,,,,,,,,0.00012324897172302557,dart,2.490141850850753e-08,9.74440598942597e-05,lossguide,3.1038310692528247e-06,tree,2.455837613259e-06,uniform,1.148142170366762e-06,9,IIDPreprocessor,DummyImputer,LogTargetScaler
0,0,0.6471724944567098,2024-03-08 04:02:25.784108,2024-03-08 04:03:02.055593,0 days 00:00:36.271485,72,1300.0,COMPLETE,RandomForest,0.6581710686189851,,,,,,,,,,,,,,,,,,,10,IIDPreprocessor,DummyImputer,ArcSinhTargetScaler
1,1,0.6534580821331354,2024-03-08 04:03:02.056801,2024-03-08 04:03:44.950580,0 days 00:00:42.893779,93,1500.0,COMPLETE,RandomForest,0.6581710686189851,,,,,,,,,,,,,,,,,,,10,IIDPreprocessor,DummyImputer,ArcSinhTargetScaler
2,2,0.6507501183784998,2024-03-08 04:03:44.951351,2024-03-08 04:04:21.253097,0 days 00:00:36.301746,27,1300.0,COMPLETE,RandomForest,0.6581710686189851,,,,,,,,,,,,,,,,,,,10,IIDPreprocessor,DummyImputer,ArcSinhTargetScaler
3,3,0.6518825250285809,2024-03-08 04:04:21.254062,2024-03-08 04:04:51.997937,0 days 00:00:30.743875,66,1100.0,COMPLETE,RandomForest,0.6581710686189851,,,,,,,,,,,,,,,,,,,10,IIDPreprocessor,DummyImputer,ArcSinhTargetScaler
4,4,0.6485150977463943,2024-03-08 04:04:51.998946,2024-03-08 04:05:24.093881,0 days 00:00:32.094935,36,1100.0,COMPLETE,RandomForest,0.6581710686189851,,,,,,,,,,,,,,,,,,,10,IIDPreprocessor,DummyImputer,ArcSinhTargetScaler
5,5,0.6521352593148997,2024-03-08 04:05:24.094784,2024-03-08 04:05:44.258664,0 days 00:00:20.163880,36,700.0,COMPLETE,RandomForest,0.6581710686189851,,,,,,,,,,,,,,,,,,,10,IIDPreprocessor,DummyImputer,ArcSinhTargetScaler
6,6,0.6364819250872584,2024-03-08 04:05:44.259566,2024-03-08 04:05:52.666307,0 days 00:00:08.406741,36,300.0,COMPLETE,RandomForest,0.6581710686189851,,,,,,,,,,,,,,,,,,,10,IIDPreprocessor,DummyImputer,ArcSinhTargetScaler
7,7,0.6428236708976716,2024-03-08 04:05:52.667228,2024-03-08 04:06:09.541659,0 days 00:00:16.874431,81,600.0,COMPLETE,RandomForest,0.6581710686189851,,,,,,,,,,,,,,,,,,,10,IIDPreprocessor,DummyImputer,ArcSinhTargetScaler
8,8,0.6447124904990194,2024-03-08 04:06:09.542741,2024-03-08 04:06:34.453867,0 days 00:00:24.911126,12,1100.0,COMPLETE,RandomForest,0.6581710686189851,,,,,,,,,,,,,,,,,,,10,IIDPreprocessor,DummyImputer,ArcSinhTargetScaler
9,9,0.6470023184297883,2024-03-08 04:06:34.454798,2024-03-08 04:06:42.478757,0 days 00:00:08.023959,36,300.0,COMPLETE,RandomForest,0.6581710686189851,,,,,,,,,,,,,,,,,,,10,IIDPreprocessor,DummyImputer,ArcSinhTargetScaler
10,10,0.6536843807940398,2024-03-08 04:06:42.479630,2024-03-08 04:07:14.477869,0 days 00:00:31.998239,21,1200.0,COMPLETE,RandomForest,0.6581710686189851,,,,,,,,,,,,,,,,,,,10,IIDPreprocessor,DummyImputer,ArcSinhTargetScaler
11,11,0.3420838640458651,2024-03-08 04:07:14.478779,2024-03-08 04:07:24.892810,0 days 00:00:10.414031,3,1200.0,COMPLETE,RandomForest,0.6581710686189851,,,,,,,,,,,,,,,,,,,10,IIDPreprocessor,DummyImputer,ArcSinhTargetScaler
12,12,0.5866382546742301,2024-03-08 04:07:24.893834,2024-03-08 04:07:52.056649,0 days 00:00:27.162815,9,1400.0,COMPLETE,RandomForest,0.6581710686189851,,,,,,,,,,,,,,,,,,,10,IIDPreprocessor,DummyImputer,ArcSinhTargetScaler
13,13,0.6487525002838131,2024-03-08 04:07:52.057655,2024-03-08 04:08:08.425766,0 days 00:00:16.368111,48,600.0,COMPLETE,RandomForest,0.6581710686189851,,,,,,,,,,,,,,,,,,,10,IIDPreprocessor,DummyImputer,ArcSinhTargetScaler
14,14,0.650113045211898,2024-03-08 04:08:08.426794,2024-03-08 04:08:34.174516,0 days 00:00:25.747722,72,1000.0,COMPLETE,RandomForest,0.6581710686189851,,,,,,,,,,,,,,,,,,,10,IIDPreprocessor,DummyImputer,ArcSinhTargetScaler
15,15,0.6465858423789239,2024-03-08 04:08:34.175681,2024-03-08 04:08:46.884921,0 days 00:00:12.709240,27,500.0,COMPLETE,RandomForest,0.6581710686189851,,,,,,,,,,,,,,,,,,,10,IIDPreprocessor,DummyImputer,ArcSinhTargetScaler
16,16,0.4967600235545018,2024-03-08 04:08:46.885785,2024-03-08 04:08:56.825881,0 days 00:00:09.940096,6,700.0,COMPLETE,RandomForest,0.6581710686189851,,,,,,,,,,,,,,,,,,,10,IIDPreprocessor,DummyImputer,ArcSinhTargetScaler
17,17,0.6477507426283708,2024-03-08 04:08:56.826644,2024-03-08 04:09:13.421210,0 days 00:00:16.594566,60,600.0,COMPLETE,RandomForest,0.6581710686189851,,,,,,,,,,,,,,,,,,,10,IIDPreprocessor,DummyImputer,ArcSinhTargetScaler
18,18,0.6386884545699645,2024-03-08 04:09:13.422161,2024-03-08 04:09:20.917884,0 days 00:00:07.495723,18,300.0,COMPLETE,RandomForest,0.6581710686189851,,,,,,,,,,,,,,,,,,,10,IIDPreprocessor,DummyImputer,ArcSinhTargetScaler
19,19,0.6470551198112117,2024-03-08 04:09:20.918668,2024-03-08 04:09:41.607780,0 days 00:00:20.689112,66,800.0,COMPLETE,RandomForest,0.6581710686189851,,,,,,,,,,,,,,,,,,,10,IIDPreprocessor,DummyImputer,ArcSinhTargetScaler
20,20,0.6507936105029585,2024-03-08 04:09:41.608811,2024-03-08 04:10:20.556818,0 days 00:00:38.948007,24,1400.0,COMPLETE,RandomForest,0.6581710686189851,,,,,,,,,,,,,,,,,,,10,IIDPreprocessor,DummyImputer,ArcSinhTargetScaler
21,21,0.6467406536437745,2024-03-08 04:10:20.557538,2024-03-08 04:10:28.748532,0 days 00:00:08.190994,54,300.0,COMPLETE,RandomForest,0.6581710686189851,,,,,,,,,,,,,,,,,,,10,IIDPreprocessor,DummyImputer,ArcSinhTargetScaler
22,22,0.6407752918969688,2024-03-08 04:10:28.749293,2024-03-08 04:10:47.608799,0 days 00:00:18.859506,81,700.0,COMPLETE,RandomForest,0.6581710686189851,,,,,,,,,,,,,,,,,,,10,IIDPreprocessor,DummyImputer,ArcSinhTargetScaler
23,23,0.6242819639488965,2024-03-08 04:10:47.609614,2024-03-08 04:10:50.259096,0 days 00:00:02.649482,39,100.0,COMPLETE,RandomForest,0.6581710686189851,,,,,,,,,,,,,,,,,,,10,IIDPreprocessor,DummyImputer,ArcSinhTargetScaler
24,24,0.639075829543322,2024-03-08 04:10:50.259754,2024-03-08 04:11:13.773567,0 days 00:00:23.513813,18,900.0,COMPLETE,RandomForest,0.6581710686189851,,,,,,,,,,,,,,,,,,,10,IIDPreprocessor,DummyImputer,ArcSinhTargetScaler
25,25,0.3362133346751315,2024-03-08 04:11:13.774237,2024-03-08 04:11:22.434915,0 days 00:00:08.660678,3,1000.0,COMPLETE,RandomForest,0.6581710686189851,,,,,,,,,,,,,,,,,,,10,IIDPreprocessor,DummyImputer,ArcSinhTargetScaler
