,number,value,datetime_start,datetime_complete,duration,params_max_depth,params_n_estimators,state,model,best_value,params_bagging_fraction,params_bagging_freq,params_feature_fraction,params_lambda_l1,params_lambda_l2,params_learning_rate,params_min_child_samples,params_num_leaves,params_alpha,params_booster,params_eta,params_gamma,params_grow_policy,params_lambda,params_normalize_type,params_rate_drop,params_sample_type,params_skip_drop,config_id,preprocessor,imputer,target_scaler
29,29,0.6519192395698995,2024-03-07 18:03:20.456691,2024-03-07 18:03:55.191694,0 days 00:00:34.735003,45,1200.0,COMPLETE,RandomForest,0.6600291217320183,,,,,,,,,,,,,,,,,,,1,BaselinePreprocessor,DummyImputer,ArcSinhTargetScaler
30,30,0.32886696800436066,2024-03-07 18:03:55.192343,2024-03-07 18:04:02.002124,0 days 00:00:06.809781,3,700.0,COMPLETE,RandomForest,0.6600291217320183,,,,,,,,,,,,,,,,,,,1,BaselinePreprocessor,DummyImputer,ArcSinhTargetScaler
31,31,0.6374948397113942,2024-03-07 18:04:02.010112,2024-03-07 18:04:13.461393,0 days 00:00:11.451281,63,400.0,COMPLETE,RandomForest,0.6600291217320183,,,,,,,,,,,,,,,,,,,1,BaselinePreprocessor,DummyImputer,ArcSinhTargetScaler
32,32,0.6492201278954763,2024-03-07 18:04:13.462176,2024-03-07 18:04:53.814233,0 days 00:00:40.352057,33,1400.0,COMPLETE,RandomForest,0.6600291217320183,,,,,,,,,,,,,,,,,,,1,BaselinePreprocessor,DummyImputer,ArcSinhTargetScaler
33,33,0.6517214493790352,2024-03-07 18:04:53.826215,2024-03-07 18:05:24.224339,0 days 00:00:30.398124,81,1100.0,COMPLETE,RandomForest,0.6600291217320183,,,,,,,,,,,,,,,,,,,1,BaselinePreprocessor,DummyImputer,ArcSinhTargetScaler
34,34,0.6459804032178582,2024-03-07 18:05:24.224900,2024-03-07 18:05:50.771894,0 days 00:00:26.546994,90,1000.0,COMPLETE,RandomForest,0.6600291217320183,,,,,,,,,,,,,,,,,,,1,BaselinePreprocessor,DummyImputer,ArcSinhTargetScaler
35,35,0.6443168279920549,2024-03-07 18:05:50.772545,2024-03-07 18:06:24.972229,0 days 00:00:34.199684,78,1200.0,COMPLETE,RandomForest,0.6600291217320183,,,,,,,,,,,,,,,,,,,1,BaselinePreprocessor,DummyImputer,ArcSinhTargetScaler
36,36,0.654782567506826,2024-03-07 18:06:24.973058,2024-03-07 18:06:38.708760,0 days 00:00:13.735702,51,500.0,COMPLETE,RandomForest,0.6600291217320183,,,,,,,,,,,,,,,,,,,1,BaselinePreprocessor,DummyImputer,ArcSinhTargetScaler
37,37,0.6436031507122231,2024-03-07 18:06:38.709549,2024-03-07 18:06:59.079270,0 days 00:00:20.369721,36,700.0,COMPLETE,RandomForest,0.6600291217320183,,,,,,,,,,,,,,,,,,,1,BaselinePreprocessor,DummyImputer,ArcSinhTargetScaler
38,38,0.6335475861706551,2024-03-07 18:06:59.080037,2024-03-07 18:07:11.346776,0 days 00:00:12.266739,27,400.0,COMPLETE,RandomForest,0.6600291217320183,,,,,,,,,,,,,,,,,,,1,BaselinePreprocessor,DummyImputer,ArcSinhTargetScaler
39,39,0.6543999805276693,2024-03-07 18:07:11.347547,2024-03-07 18:07:53.160691,0 days 00:00:41.813144,48,1500.0,COMPLETE,RandomForest,0.6600291217320183,,,,,,,,,,,,,,,,,,,1,BaselinePreprocessor,DummyImputer,ArcSinhTargetScaler
0,0,0.6252721908510983,2024-03-07 18:08:12.802864,2024-03-07 18:08:31.858812,0 days 00:00:19.055948,33,1010.0,COMPLETE,LGBM,0.6611563367548484,0.9119008939336187,6.0,0.9711158743577302,0.11359363453921709,0.09678783365939117,0.13473247374231956,10.0,250.0,,,,,,,,,,,1,BaselinePreprocessor,DummyImputer,ArcSinhTargetScaler
1,1,0.6386700072174178,2024-03-07 18:08:31.859996,2024-03-07 18:09:20.758464,0 days 00:00:48.898468,30,510.0,COMPLETE,LGBM,0.6611563367548484,0.5146977421598123,3.0,0.6779597611154042,0.0037837857098093363,2.3692321706449757e-07,0.019091807878832415,18.0,55.0,,,,,,,,,,,1,BaselinePreprocessor,DummyImputer,ArcSinhTargetScaler
2,2,0.6183342336596525,2024-03-07 18:09:20.759942,2024-03-07 18:09:41.675388,0 days 00:00:20.915446,90,1310.0,COMPLETE,LGBM,0.6611563367548484,0.9564147162170851,1.0,0.47145067421863995,4.626574297220286,0.00011281058770351059,0.017912800587658987,64.0,23.0,,,,,,,,,,,1,BaselinePreprocessor,DummyImputer,ArcSinhTargetScaler
3,3,0.6520634450656547,2024-03-07 18:09:41.676694,2024-03-07 18:10:04.917098,0 days 00:00:23.240404,63,510.0,COMPLETE,LGBM,0.6611563367548484,0.6862942469421531,3.0,0.9218821586381353,2.2811337008247266e-05,1.0649802619930177e-08,0.21559774690083885,6.0,188.0,,,,,,,,,,,1,BaselinePreprocessor,DummyImputer,ArcSinhTargetScaler
4,4,0.6408384852979202,2024-03-07 18:10:04.918771,2024-03-07 18:10:33.774498,0 days 00:00:28.855727,51,310.0,COMPLETE,LGBM,0.6611563367548484,0.590162735484468,7.0,0.9327671778080091,0.0005443571409049166,0.004561658225593795,0.057867527840834765,37.0,135.0,,,,,,,,,,,1,BaselinePreprocessor,DummyImputer,ArcSinhTargetScaler
5,5,0.6611563367548484,2024-03-07 18:10:33.775322,2024-03-07 18:12:46.120648,0 days 00:02:12.345326,42,710.0,COMPLETE,LGBM,0.6611563367548484,0.7360640323495029,5.0,0.8456687639269731,1.1679892944701745e-08,1.5439699110002153e-06,0.02124467749480169,12.0,90.0,,,,,,,,,,,1,BaselinePreprocessor,DummyImputer,ArcSinhTargetScaler
6,6,0.638890240114126,2024-03-07 18:12:46.123369,2024-03-07 18:13:17.714540,0 days 00:00:31.591171,33,1410.0,COMPLETE,LGBM,0.6611563367548484,0.6209532319246576,2.0,0.8393604076238651,0.0034226245137382303,2.192619817105983e-08,0.1560879680303935,82.0,129.0,,,,,,,,,,,1,BaselinePreprocessor,DummyImputer,ArcSinhTargetScaler
7,7,0.6478146732584079,2024-03-07 18:13:17.718925,2024-03-07 18:14:36.791207,0 days 00:01:19.072282,81,1010.0,COMPLETE,LGBM,0.6611563367548484,0.517469579762059,7.0,0.6990745792653152,6.214046335805417e-06,8.725891232190635e-08,0.02766448144949723,31.0,229.0,,,,,,,,,,,1,BaselinePreprocessor,DummyImputer,ArcSinhTargetScaler
8,8,0.6533958947872375,2024-03-07 18:14:36.792852,2024-03-07 18:15:16.584433,0 days 00:00:39.791581,21,510.0,COMPLETE,LGBM,0.6611563367548484,0.886593958104828,4.0,0.9732500028739115,0.004909392357281357,1.1247534489214289e-08,0.07119118535815842,30.0,232.0,,,,,,,,,,,1,BaselinePreprocessor,DummyImputer,ArcSinhTargetScaler
9,9,0.6308308554082324,2024-03-07 18:15:16.589669,2024-03-07 18:15:57.005725,0 days 00:00:40.416056,36,710.0,COMPLETE,LGBM,0.6611563367548484,0.6301021952970679,2.0,0.9417011309271419,2.7179343383298398e-08,0.00014307345120182364,0.0573667873861985,71.0,117.0,,,,,,,,,,,1,BaselinePreprocessor,DummyImputer,ArcSinhTargetScaler
10,10,0.597753529620157,2024-03-07 18:15:57.007143,2024-03-07 18:15:58.604145,0 days 00:00:01.597002,21,10.0,COMPLETE,LGBM,0.6611563367548484,0.9393650989680074,7.0,0.797543150929251,7.386744753217112e-08,2.1277795856261925e-08,0.22692279929544387,38.0,206.0,,,,,,,,,,,1,BaselinePreprocessor,DummyImputer,ArcSinhTargetScaler
11,11,0.6171305152693415,2024-03-07 18:15:58.605403,2024-03-07 18:16:20.962720,0 days 00:00:22.357317,63,610.0,COMPLETE,LGBM,0.6611563367548484,0.45243003206979415,7.0,0.8307405658436833,3.9270737200376146e-08,3.659623347795589e-05,0.036058951923133416,80.0,251.0,,,,,,,,,,,1,BaselinePreprocessor,DummyImputer,ArcSinhTargetScaler
12,12,0.6049667419942256,2024-03-07 18:16:20.964622,2024-03-07 18:16:32.631115,0 days 00:00:11.666493,42,910.0,COMPLETE,LGBM,0.6611563367548484,0.5608539171518505,4.0,0.9037274813223336,5.403634259925707,0.06292135121532062,0.08165050741888955,41.0,31.0,,,,,,,,,,,1,BaselinePreprocessor,DummyImputer,ArcSinhTargetScaler
13,13,0.6337572366307069,2024-03-07 18:16:32.632783,2024-03-07 18:16:52.136050,0 days 00:00:19.503267,93,510.0,COMPLETE,LGBM,0.6611563367548484,0.9792738142985116,6.0,0.424702237912981,1.2479882102243913e-08,0.009185086678953866,0.017232040890976737,97.0,132.0,,,,,,,,,,,1,BaselinePreprocessor,DummyImputer,ArcSinhTargetScaler
14,14,0.6043777611149551,2024-03-07 18:16:52.137831,2024-03-07 18:17:10.809333,0 days 00:00:18.671502,60,210.0,COMPLETE,LGBM,0.6611563367548484,0.7399676199076939,7.0,0.9026483446991439,1.194436100231073e-08,0.000410993005625794,0.013602404657734001,76.0,79.0,,,,,,,,,,,1,BaselinePreprocessor,DummyImputer,ArcSinhTargetScaler
15,15,0.5913444569704588,2024-03-07 18:17:10.815366,2024-03-07 18:17:12.515470,0 days 00:00:01.700104,3,110.0,COMPLETE,LGBM,0.6611563367548484,0.5217729735070515,7.0,0.4224578638350126,2.212249116118436e-06,0.004587489670242855,0.14868511260775227,80.0,199.0,,,,,,,,,,,1,BaselinePreprocessor,DummyImputer,ArcSinhTargetScaler
16,16,0.6409915340883955,2024-03-07 18:17:12.516763,2024-03-07 18:17:30.219000,0 days 00:00:17.702237,42,810.0,COMPLETE,LGBM,0.6611563367548484,0.9885215352013331,6.0,0.4113982750642942,3.1525701042679878e-06,2.324040935944977e-08,0.15523848616814623,39.0,132.0,,,,,,,,,,,1,BaselinePreprocessor,DummyImputer,ArcSinhTargetScaler
17,17,0.6344038234007895,2024-03-07 18:17:30.221555,2024-03-07 18:17:55.719305,0 days 00:00:25.497750,72,1110.0,COMPLETE,LGBM,0.6611563367548484,0.605544950147272,4.0,0.4993092395016839,0.9736820869385322,0.07122217017300811,0.029693220228920257,62.0,173.0,,,,,,,,,,,1,BaselinePreprocessor,DummyImputer,ArcSinhTargetScaler
18,18,0.6315770867631838,2024-03-07 18:17:55.721826,2024-03-07 18:19:38.465242,0 days 00:01:42.743416,51,1210.0,COMPLETE,LGBM,0.6611563367548484,0.9174210437820608,7.0,0.816654934924858,0.20640260344403893,2.1236948968917797e-07,0.010855348258690785,9.0,245.0,,,,,,,,,,,1,BaselinePreprocessor,DummyImputer,ArcSinhTargetScaler
19,19,0.5765446721119468,2024-03-07 18:19:38.468074,2024-03-07 18:19:38.966380,0 days 00:00:00.498306,84,10.0,COMPLETE,LGBM,0.6611563367548484,0.9283701368524803,4.0,0.44815330163012645,0.00043237092738153936,2.58403276153836,0.06981768611442811,65.0,148.0,,,,,,,,,,,1,BaselinePreprocessor,DummyImputer,ArcSinhTargetScaler
20,20,0.5806511452492298,2024-03-07 18:19:38.967668,2024-03-07 18:19:39.395094,0 days 00:00:00.427426,78,10.0,COMPLETE,LGBM,0.6611563367548484,0.4495106643007859,4.0,0.8394518767836514,9.91985612496483,7.218452336409858,0.10983116711278947,17.0,83.0,,,,,,,,,,,1,BaselinePreprocessor,DummyImputer,ArcSinhTargetScaler
21,21,0.603295928692219,2024-03-07 18:19:39.396264,2024-03-07 18:19:55.572850,0 days 00:00:16.176586,96,610.0,COMPLETE,LGBM,0.6611563367548484,0.4217839924939141,1.0,0.568891820673667,0.017161327932586713,0.0023318595347213765,0.011945576264118183,70.0,245.0,,,,,,,,,,,1,BaselinePreprocessor,DummyImputer,ArcSinhTargetScaler
22,22,0.5696091754023903,2024-03-07 18:19:55.574643,2024-03-07 18:19:56.133973,0 days 00:00:00.559330,99,10.0,COMPLETE,LGBM,0.6611563367548484,0.6366989787621361,3.0,0.6704437058759221,6.571819116684616e-05,0.12087015746384257,0.021213011634646433,55.0,120.0,,,,,,,,,,,1,BaselinePreprocessor,DummyImputer,ArcSinhTargetScaler
23,23,0.6209022649679478,2024-03-07 18:19:56.135752,2024-03-07 18:20:05.817610,0 days 00:00:09.681858,33,210.0,COMPLETE,LGBM,0.6611563367548484,0.8387306769353924,1.0,0.45328106139668856,3.728882900194722e-07,0.01534802050731124,0.02102882080391171,74.0,66.0,,,,,,,,,,,1,BaselinePreprocessor,DummyImputer,ArcSinhTargetScaler
24,24,0.6258618892692308,2024-03-07 18:20:05.819250,2024-03-07 18:20:22.465896,0 days 00:00:16.646646,57,410.0,COMPLETE,LGBM,0.6611563367548484,0.8699016847149523,3.0,0.9937425915752574,1.0598750732509048,0.013104699239275715,0.06168409449633089,13.0,34.0,,,,,,,,,,,1,BaselinePreprocessor,DummyImputer,ArcSinhTargetScaler
25,25,0.6404602761690974,2024-03-07 18:20:22.467500,2024-03-07 18:20:39.747360,0 days 00:00:17.279860,84,210.0,COMPLETE,LGBM,0.6611563367548484,0.9989659129965693,1.0,0.8952006553249213,1.0803692303984598e-08,0.0001944278479542029,0.058781484529781276,72.0,150.0,,,,,,,,,,,1,BaselinePreprocessor,DummyImputer,ArcSinhTargetScaler
26,26,0.6136695124197183,2024-03-07 18:20:39.748978,2024-03-07 18:21:02.631027,0 days 00:00:22.882049,12,1110.0,COMPLETE,LGBM,0.6611563367548484,0.4022957736374463,6.0,0.5367241934652788,0.018820953922318053,2.5526452186882267e-05,0.12151955411724605,85.0,92.0,,,,,,,,,,,1,BaselinePreprocessor,DummyImputer,ArcSinhTargetScaler
27,27,0.6299334065004227,2024-03-07 18:21:02.635884,2024-03-07 18:21:15.184350,0 days 00:00:12.548466,45,510.0,COMPLETE,LGBM,0.6611563367548484,0.9346455722191838,4.0,0.7016699450768495,0.01438880316145229,2.2913287989226436e-08,0.15846220255021806,57.0,211.0,,,,,,,,,,,1,BaselinePreprocessor,DummyImputer,ArcSinhTargetScaler
28,28,0.6320884568372481,2024-03-07 18:21:15.185984,2024-03-07 18:21:46.758247,0 days 00:00:31.572263,45,610.0,COMPLETE,LGBM,0.6611563367548484,0.6143025949343217,5.0,0.5938062521213057,1.0416785586054723e-05,2.198260725318764e-06,0.01978399584917441,58.0,183.0,,,,,,,,,,,1,BaselinePreprocessor,DummyImputer,ArcSinhTargetScaler
29,29,0.6400039700469055,2024-03-07 18:21:46.759471,2024-03-07 18:22:42.262388,0 days 00:00:55.502917,57,910.0,COMPLETE,LGBM,0.6611563367548484,0.8700452839194687,3.0,0.8407372436119713,7.3964603464477e-05,2.0789644702375766e-08,0.03506635297718807,88.0,125.0,,,,,,,,,,,1,BaselinePreprocessor,DummyImputer,ArcSinhTargetScaler
30,30,0.5751326141058484,2024-03-07 18:22:42.263799,2024-03-07 18:22:43.009206,0 days 00:00:00.745407,60,10.0,COMPLETE,LGBM,0.6611563367548484,0.5614890833904408,4.0,0.4454247508262771,1.0987366355644113e-06,0.0014665865706688078,0.012768094115385598,24.0,240.0,,,,,,,,,,,1,BaselinePreprocessor,DummyImputer,ArcSinhTargetScaler
31,31,0.6031157197642933,2024-03-07 18:22:43.010586,2024-03-07 18:23:09.528519,0 days 00:00:26.517933,87,610.0,COMPLETE,LGBM,0.6611563367548484,0.7094322852933727,7.0,0.6912867622224144,3.1347853694568366,6.27801381801715e-07,0.01202962474686301,49.0,247.0,,,,,,,,,,,1,BaselinePreprocessor,DummyImputer,ArcSinhTargetScaler
32,32,0.6317410070219576,2024-03-07 18:23:09.531493,2024-03-07 18:23:30.325232,0 days 00:00:20.793739,72,910.0,COMPLETE,LGBM,0.6611563367548484,0.6538646955802283,5.0,0.42687178114912694,0.6714494411259725,1.1245937426268199e-05,0.04302471704289953,9.0,173.0,,,,,,,,,,,1,BaselinePreprocessor,DummyImputer,ArcSinhTargetScaler
33,33,0.6329927200485711,2024-03-07 18:23:30.326647,2024-03-07 18:23:54.696238,0 days 00:00:24.369591,18,510.0,COMPLETE,LGBM,0.6611563367548484,0.9231558841120873,6.0,0.9140823481657632,0.014832648129903571,3.58691618237436,0.0661551689967581,87.0,61.0,,,,,,,,,,,1,BaselinePreprocessor,DummyImputer,ArcSinhTargetScaler
34,34,0.5838432079316983,2024-03-07 18:23:54.697919,2024-03-07 18:23:55.483736,0 days 00:00:00.785817,60,10.0,COMPLETE,LGBM,0.6611563367548484,0.40202719337808573,1.0,0.6971823433462102,0.02135811333025575,4.5839577883898726e-07,0.11827783403097304,19.0,219.0,,,,,,,,,,,1,BaselinePreprocessor,DummyImputer,ArcSinhTargetScaler
35,35,0.6268467175913961,2024-03-07 18:23:55.485266,2024-03-07 18:24:22.607403,0 days 00:00:27.122137,6,810.0,COMPLETE,LGBM,0.6611563367548484,0.8609299536678003,4.0,0.7292009437963309,7.548366396305787e-07,0.16825586322225033,0.09692730915029972,97.0,203.0,,,,,,,,,,,1,BaselinePreprocessor,DummyImputer,ArcSinhTargetScaler
36,36,0.6408364894803247,2024-03-07 18:24:22.608727,2024-03-07 18:25:48.819765,0 days 00:01:26.211038,99,810.0,COMPLETE,LGBM,0.6611563367548484,0.9660500476659548,4.0,0.8383140003560108,1.536220005667462e-08,4.7421233035261805,0.023620067460616102,17.0,95.0,,,,,,,,,,,1,BaselinePreprocessor,DummyImputer,ArcSinhTargetScaler
37,37,0.6411993632000472,2024-03-07 18:25:48.823545,2024-03-07 18:26:09.016131,0 days 00:00:20.192586,21,510.0,COMPLETE,LGBM,0.6611563367548484,0.9066742204840711,7.0,0.46096498592751134,2.4840185357659745e-05,0.0003498086087537073,0.10379797173393672,44.0,156.0,,,,,,,,,,,1,BaselinePreprocessor,DummyImputer,ArcSinhTargetScaler
38,38,0.6351618475793062,2024-03-07 18:26:09.017602,2024-03-07 18:26:37.828070,0 days 00:00:28.810468,15,1410.0,COMPLETE,LGBM,0.6611563367548484,0.6537951209686329,2.0,0.9126269641206362,1.2146842978633483,9.031881263359747e-05,0.04769423439410571,81.0,183.0,,,,,,,,,,,1,BaselinePreprocessor,DummyImputer,ArcSinhTargetScaler
39,39,0.6215502658224882,2024-03-07 18:26:37.830335,2024-03-07 18:27:29.894101,0 days 00:00:52.063766,27,1110.0,COMPLETE,LGBM,0.6611563367548484,0.7258484835193764,5.0,0.9642845975778933,0.00015597719984673013,0.035531953071236536,0.020666145715052386,10.0,7.0,,,,,,,,,,,1,BaselinePreprocessor,DummyImputer,ArcSinhTargetScaler
0,0,0.4662240979919304,2024-03-07 18:29:40.359581,2024-03-07 18:30:04.377402,0 days 00:00:24.017821,1,,COMPLETE,XGB,0.6269481464638257,,,,,,,,,1.5957689243976702e-07,dart,0.006931185646909713,5.17440433084088e-05,depthwise,2.8302955465083538e-05,tree,2.8428948900784746e-05,weighted,0.00016478506554019052,1,BaselinePreprocessor,DummyImputer,ArcSinhTargetScaler
1,1,0.5493772141637475,2024-03-07 18:30:04.378913,2024-03-07 18:30:33.753333,0 days 00:00:29.374420,2,,COMPLETE,XGB,0.6269481464638257,,,,,,,,,0.010125851783572701,dart,0.0010486129239829995,6.897759313828961e-05,depthwise,5.419205565377486e-06,tree,2.9731635264697e-07,uniform,1.0719679785684402e-05,1,BaselinePreprocessor,DummyImputer,ArcSinhTargetScaler
2,2,0.5824571266280721,2024-03-07 18:30:33.754852,2024-03-07 18:31:35.656978,0 days 00:01:01.902126,8,,COMPLETE,XGB,0.6269481464638257,,,,,,,,,0.66920346568285,dart,1.8972577985656745e-06,1.3983129074317108e-05,depthwise,0.0002294690931263443,forest,6.145153542431781e-06,weighted,0.8695009348971187,1,BaselinePreprocessor,DummyImputer,ArcSinhTargetScaler
3,3,0.6269481464638257,2024-03-07 18:31:35.660834,2024-03-07 18:32:27.848070,0 days 00:00:52.187236,8,,COMPLETE,XGB,0.6269481464638257,,,,,,,,,0.007109893484740222,dart,0.09869568939798258,1.3146770105059113e-05,lossguide,0.010983198473092823,tree,3.3815234832367474e-05,weighted,0.00023461027685339444,1,BaselinePreprocessor,DummyImputer,ArcSinhTargetScaler
4,4,0.594260200165085,2024-03-07 18:32:27.849706,2024-03-07 18:33:29.757146,0 days 00:01:01.907440,9,,COMPLETE,XGB,0.6269481464638257,,,,,,,,,0.3802995485199697,dart,0.014372683762952724,6.226372073752892e-06,lossguide,6.927644724433727e-08,forest,1.986231989539604e-07,uniform,4.143602524323406e-07,1,BaselinePreprocessor,DummyImputer,ArcSinhTargetScaler
5,5,0.6194167870605868,2024-03-07 18:33:29.760204,2024-03-07 18:34:23.678757,0 days 00:00:53.918553,9,,COMPLETE,XGB,0.6269481464638257,,,,,,,,,0.00019689713456301554,dart,0.10361064715058933,1.5092019807359026e-07,depthwise,0.0011705349762528854,forest,7.41380812653785e-08,uniform,0.0004169075446116139,1,BaselinePreprocessor,DummyImputer,ArcSinhTargetScaler
6,6,0.449316459998059,2024-03-07 18:34:23.680306,2024-03-07 18:34:46.928327,0 days 00:00:23.248021,1,,COMPLETE,XGB,0.6269481464638257,,,,,,,,,1.1385673739531366e-07,dart,0.0029481785935840067,6.070095250167438e-07,depthwise,2.491484692485676e-08,forest,0.004697281565746447,weighted,4.966895724401531e-05,1,BaselinePreprocessor,DummyImputer,ArcSinhTargetScaler
7,7,0.5550372974851855,2024-03-07 18:34:46.929533,2024-03-07 18:35:49.231977,0 days 00:01:02.302444,9,,COMPLETE,XGB,0.6269481464638257,,,,,,,,,0.025015612866274156,dart,1.0208524476079251e-07,0.002123023956277139,lossguide,0.009314839061228767,forest,6.433031993876822e-05,uniform,0.0003234622422235007,1,BaselinePreprocessor,DummyImputer,ArcSinhTargetScaler
8,8,0.5671378366928808,2024-03-07 18:35:49.234666,2024-03-07 18:36:20.711779,0 days 00:00:31.477113,3,,COMPLETE,XGB,0.6269481464638257,,,,,,,,,7.595543934220018e-08,dart,7.362490929447032e-07,2.230671804830995e-06,lossguide,3.769280888631844e-07,forest,0.00011767329512480412,uniform,0.38325378582239567,1,BaselinePreprocessor,DummyImputer,ArcSinhTargetScaler
9,9,0.5635983237739409,2024-03-07 18:36:20.713248,2024-03-07 18:36:55.674023,0 days 00:00:34.960775,3,,COMPLETE,XGB,0.6269481464638257,,,,,,,,,0.0012101833735052084,dart,0.003109326700357678,2.813444820478521e-06,depthwise,2.0128261228353055e-07,forest,0.0003050605344695299,weighted,0.027279075827970057,1,BaselinePreprocessor,DummyImputer,ArcSinhTargetScaler
10,10,0.5582462588777262,2024-03-07 18:36:55.682980,2024-03-07 18:37:47.413867,0 days 00:00:51.730887,6,,COMPLETE,XGB,0.6269481464638257,,,,,,,,,0.02144666600847188,dart,9.938860751975292e-08,1.4525848144800654e-07,depthwise,8.453956708355038e-08,tree,1.5309122652845026e-06,uniform,0.00021387291580913034,1,BaselinePreprocessor,DummyImputer,ArcSinhTargetScaler
11,11,0.5509788272753832,2024-03-07 18:37:47.415966,2024-03-07 18:38:42.299633,0 days 00:00:54.883667,7,,COMPLETE,XGB,0.6269481464638257,,,,,,,,,1.826826968626665e-05,dart,7.971865756529326e-08,4.710688126835813e-05,depthwise,3.2227819295613057e-06,tree,0.03906896313023003,uniform,1.6499163307112257e-07,1,BaselinePreprocessor,DummyImputer,ArcSinhTargetScaler
12,12,0.6096121567436142,2024-03-07 18:38:42.301481,2024-03-07 18:39:39.540568,0 days 00:00:57.239087,7,,COMPLETE,XGB,0.6269481464638257,,,,,,,,,0.02682838453783721,dart,0.04154263703109398,1.0544856596926293e-08,depthwise,0.2211973032837381,forest,0.0007064887341791596,uniform,2.967788432893957e-07,1,BaselinePreprocessor,DummyImputer,ArcSinhTargetScaler
13,13,0.562915538397744,2024-03-07 18:39:39.545189,2024-03-07 18:40:23.332725,0 days 00:00:43.787536,5,,COMPLETE,XGB,0.6269481464638257,,,,,,,,,2.6656717729009326e-05,dart,2.2222477787620265e-07,0.04514859231512897,depthwise,1.8392429144469163e-05,forest,0.030429171373904527,weighted,0.0003702539947476689,1,BaselinePreprocessor,DummyImputer,ArcSinhTargetScaler
14,14,0.5655114588970894,2024-03-07 18:40:23.333980,2024-03-07 18:41:00.768906,0 days 00:00:37.434926,3,,COMPLETE,XGB,0.6269481464638257,,,,,,,,,1.7527910828970904e-05,dart,8.054498732205666e-08,0.008247922900358726,lossguide,1.6847743666526167e-08,forest,1.1010848752408974e-07,weighted,3.7055420803886655e-08,1,BaselinePreprocessor,DummyImputer,ArcSinhTargetScaler
15,15,0.44473385168618473,2024-03-07 18:41:00.774510,2024-03-07 18:41:26.383744,0 days 00:00:25.609234,1,,COMPLETE,XGB,0.6269481464638257,,,,,,,,,0.00022483664337491485,dart,2.6313791670809952e-05,1.000144144374203e-05,lossguide,1.1271978896700412e-06,forest,9.436041269114138e-05,weighted,1.6795358559926746e-05,1,BaselinePreprocessor,DummyImputer,ArcSinhTargetScaler
