,number,value,datetime_start,datetime_complete,duration,params_max_depth,params_n_estimators,state,model,best_value,params_bagging_fraction,params_bagging_freq,params_feature_fraction,params_lambda_l1,params_lambda_l2,params_learning_rate,params_min_child_samples,params_num_leaves,params_alpha,params_booster,params_eta,params_gamma,params_grow_policy,params_lambda,params_normalize_type,params_rate_drop,params_sample_type,params_skip_drop,config_id,preprocessor,imputer,target_scaler
33,33,0.6118119885209214,2024-03-08 12:17:46.336788,2024-03-08 12:18:31.501420,0 days 00:00:45.164632,7,,COMPLETE,XGB,0.6631507755329327,,,,,,,,,1.1752316876102126e-07,dart,5.848057245326607e-05,2.7598108273250843e-06,depthwise,4.5316975091619415e-08,forest,0.5844521422448543,weighted,0.0006307202689955003,16,IIDPreprocessor,HybridCategoricalStatisticsImputer,ArcSinhTargetScaler
34,34,0.5982568561824018,2024-03-08 12:18:31.502618,2024-03-08 12:19:41.363981,0 days 00:01:09.861363,9,,COMPLETE,XGB,0.6631507755329327,,,,,,,,,0.00127500952528612,dart,0.0008204872572030386,0.0004608178972837964,lossguide,3.832041359657574e-06,tree,0.03213251788494271,weighted,3.5848682058404655e-05,16,IIDPreprocessor,HybridCategoricalStatisticsImputer,ArcSinhTargetScaler
35,35,0.625216358553353,2024-03-08 12:19:41.365588,2024-03-08 12:20:40.025445,0 days 00:00:58.659857,6,,COMPLETE,XGB,0.6631507755329327,,,,,,,,,0.038117632387944966,dart,1.0459701645635465e-06,0.0006812785481777597,lossguide,8.975603922292831e-07,forest,0.00011390558483217187,weighted,1.7309117898494298e-05,16,IIDPreprocessor,HybridCategoricalStatisticsImputer,ArcSinhTargetScaler
36,36,0.6246952939224455,2024-03-08 12:20:40.027018,2024-03-08 12:21:32.879609,0 days 00:00:52.852591,5,,COMPLETE,XGB,0.6631507755329327,,,,,,,,,0.017259405640930932,dart,0.00028807086026171193,0.004683440153892788,lossguide,2.1540997586469842e-05,forest,1.479566283530354e-08,weighted,2.570704575132357e-06,16,IIDPreprocessor,HybridCategoricalStatisticsImputer,ArcSinhTargetScaler
37,37,0.6608456655515196,2024-03-08 12:21:32.881203,2024-03-08 12:22:17.105853,0 days 00:00:44.224650,6,,COMPLETE,XGB,0.6631507755329327,,,,,,,,,2.2867658190454975e-08,dart,0.557686033355303,3.810830419529579e-06,depthwise,2.666607674851328e-05,tree,8.968533499800191e-08,weighted,0.008225917154251722,16,IIDPreprocessor,HybridCategoricalStatisticsImputer,ArcSinhTargetScaler
38,38,0.5915878777759604,2024-03-08 12:22:17.107347,2024-03-08 12:22:48.508916,0 days 00:00:31.401569,2,,COMPLETE,XGB,0.6631507755329327,,,,,,,,,1.3969093135178294e-07,dart,0.00011454047232014251,0.1042950781527704,lossguide,1.1946874493095532e-05,tree,0.000424520949253953,weighted,0.00023276982880210246,16,IIDPreprocessor,HybridCategoricalStatisticsImputer,ArcSinhTargetScaler
39,39,0.6261290761494824,2024-03-08 12:22:48.510428,2024-03-08 12:23:55.916368,0 days 00:01:07.405940,8,,COMPLETE,XGB,0.6631507755329327,,,,,,,,,3.163930404129904e-05,dart,0.0020286659334937587,5.993642743084233e-06,depthwise,0.00036927460740566494,forest,0.017366209981478725,uniform,0.0012619754481451649,16,IIDPreprocessor,HybridCategoricalStatisticsImputer,ArcSinhTargetScaler
0,0,0.6302660492627349,2024-03-08 12:41:14.097321,2024-03-08 12:41:39.516921,0 days 00:00:25.419600,9,1100.0,COMPLETE,RandomForest,0.6789179402205939,,,,,,,,,,,,,,,,,,,17,IIDPreprocessor,HybridCategoricalStatisticsImputer,DummyTargetScaler
1,1,0.6709675075604762,2024-03-08 12:41:39.517914,2024-03-08 12:42:04.970760,0 days 00:00:25.452846,60,800.0,COMPLETE,RandomForest,0.6789179402205939,,,,,,,,,,,,,,,,,,,17,IIDPreprocessor,HybridCategoricalStatisticsImputer,DummyTargetScaler
2,2,0.6673474222953534,2024-03-08 12:42:04.971835,2024-03-08 12:42:40.526454,0 days 00:00:35.554619,39,1200.0,COMPLETE,RandomForest,0.6789179402205939,,,,,,,,,,,,,,,,,,,17,IIDPreprocessor,HybridCategoricalStatisticsImputer,DummyTargetScaler
3,3,0.6672710067817894,2024-03-08 12:42:40.527338,2024-03-08 12:43:27.438869,0 days 00:00:46.911531,96,1500.0,COMPLETE,RandomForest,0.6789179402205939,,,,,,,,,,,,,,,,,,,17,IIDPreprocessor,HybridCategoricalStatisticsImputer,DummyTargetScaler
4,4,0.664638713787501,2024-03-08 12:43:27.439661,2024-03-08 12:43:51.843807,0 days 00:00:24.404146,48,800.0,COMPLETE,RandomForest,0.6789179402205939,,,,,,,,,,,,,,,,,,,17,IIDPreprocessor,HybridCategoricalStatisticsImputer,DummyTargetScaler
5,5,0.6724639559718618,2024-03-08 12:43:51.844427,2024-03-08 12:43:58.045497,0 days 00:00:06.201070,66,200.0,COMPLETE,RandomForest,0.6789179402205939,,,,,,,,,,,,,,,,,,,17,IIDPreprocessor,HybridCategoricalStatisticsImputer,DummyTargetScaler
6,6,0.6693882083598253,2024-03-08 12:43:58.046250,2024-03-08 12:44:10.809482,0 days 00:00:12.763232,96,400.0,COMPLETE,RandomForest,0.6789179402205939,,,,,,,,,,,,,,,,,,,17,IIDPreprocessor,HybridCategoricalStatisticsImputer,DummyTargetScaler
7,7,0.6677360169445554,2024-03-08 12:44:10.810465,2024-03-08 12:44:30.578602,0 days 00:00:19.768137,15,700.0,COMPLETE,RandomForest,0.6789179402205939,,,,,,,,,,,,,,,,,,,17,IIDPreprocessor,HybridCategoricalStatisticsImputer,DummyTargetScaler
8,8,0.6688697728012237,2024-03-08 12:44:30.579389,2024-03-08 12:44:54.694747,0 days 00:00:24.115358,21,800.0,COMPLETE,RandomForest,0.6789179402205939,,,,,,,,,,,,,,,,,,,17,IIDPreprocessor,HybridCategoricalStatisticsImputer,DummyTargetScaler
9,9,0.6549608697374187,2024-03-08 12:44:54.695569,2024-03-08 12:45:07.568549,0 days 00:00:12.872980,18,400.0,COMPLETE,RandomForest,0.6789179402205939,,,,,,,,,,,,,,,,,,,17,IIDPreprocessor,HybridCategoricalStatisticsImputer,DummyTargetScaler
10,10,0.6668779975394568,2024-03-08 12:45:07.574088,2024-03-08 12:45:32.084416,0 days 00:00:24.510328,90,800.0,COMPLETE,RandomForest,0.6789179402205939,,,,,,,,,,,,,,,,,,,17,IIDPreprocessor,HybridCategoricalStatisticsImputer,DummyTargetScaler
11,11,0.6724688323442535,2024-03-08 12:45:32.085084,2024-03-08 12:45:43.987525,0 days 00:00:11.902441,51,400.0,COMPLETE,RandomForest,0.6789179402205939,,,,,,,,,,,,,,,,,,,17,IIDPreprocessor,HybridCategoricalStatisticsImputer,DummyTargetScaler
12,12,0.6769327709037318,2024-03-08 12:45:43.988159,2024-03-08 12:46:17.400769,0 days 00:00:33.412610,75,1100.0,COMPLETE,RandomForest,0.6789179402205939,,,,,,,,,,,,,,,,,,,17,IIDPreprocessor,HybridCategoricalStatisticsImputer,DummyTargetScaler
13,13,0.6660883260125936,2024-03-08 12:46:17.401733,2024-03-08 12:46:26.887083,0 days 00:00:09.485350,84,300.0,COMPLETE,RandomForest,0.6789179402205939,,,,,,,,,,,,,,,,,,,17,IIDPreprocessor,HybridCategoricalStatisticsImputer,DummyTargetScaler
14,14,0.6656885635895208,2024-03-08 12:46:26.887671,2024-03-08 12:47:03.467491,0 days 00:00:36.579820,42,1200.0,COMPLETE,RandomForest,0.6789179402205939,,,,,,,,,,,,,,,,,,,17,IIDPreprocessor,HybridCategoricalStatisticsImputer,DummyTargetScaler
15,15,0.6744104459209991,2024-03-08 12:47:03.468163,2024-03-08 12:47:19.151556,0 days 00:00:15.683393,42,500.0,COMPLETE,RandomForest,0.6789179402205939,,,,,,,,,,,,,,,,,,,17,IIDPreprocessor,HybridCategoricalStatisticsImputer,DummyTargetScaler
16,16,0.6600128120494212,2024-03-08 12:47:19.152437,2024-03-08 12:47:31.137087,0 days 00:00:11.984650,81,400.0,COMPLETE,RandomForest,0.6789179402205939,,,,,,,,,,,,,,,,,,,17,IIDPreprocessor,HybridCategoricalStatisticsImputer,DummyTargetScaler
17,17,0.6544617621291813,2024-03-08 12:47:31.137819,2024-03-08 12:47:48.968613,0 days 00:00:17.830794,21,600.0,COMPLETE,RandomForest,0.6789179402205939,,,,,,,,,,,,,,,,,,,17,IIDPreprocessor,HybridCategoricalStatisticsImputer,DummyTargetScaler
18,18,0.670927822764751,2024-03-08 12:47:48.969309,2024-03-08 12:48:07.308872,0 days 00:00:18.339563,30,600.0,COMPLETE,RandomForest,0.6789179402205939,,,,,,,,,,,,,,,,,,,17,IIDPreprocessor,HybridCategoricalStatisticsImputer,DummyTargetScaler
19,19,0.6676326031398858,2024-03-08 12:48:07.309646,2024-03-08 12:48:50.152596,0 days 00:00:42.842950,96,1400.0,COMPLETE,RandomForest,0.6789179402205939,,,,,,,,,,,,,,,,,,,17,IIDPreprocessor,HybridCategoricalStatisticsImputer,DummyTargetScaler
20,20,0.6629634259516097,2024-03-08 12:48:50.153378,2024-03-08 12:49:21.712887,0 days 00:00:31.559509,54,1000.0,COMPLETE,RandomForest,0.6789179402205939,,,,,,,,,,,,,,,,,,,17,IIDPreprocessor,HybridCategoricalStatisticsImputer,DummyTargetScaler
21,21,0.6601710709076399,2024-03-08 12:49:21.713813,2024-03-08 12:49:39.769094,0 days 00:00:18.055281,60,600.0,COMPLETE,RandomForest,0.6789179402205939,,,,,,,,,,,,,,,,,,,17,IIDPreprocessor,HybridCategoricalStatisticsImputer,DummyTargetScaler
22,22,0.6376527309536816,2024-03-08 12:49:39.769827,2024-03-08 12:49:43.032915,0 days 00:00:03.263088,99,100.0,COMPLETE,RandomForest,0.6789179402205939,,,,,,,,,,,,,,,,,,,17,IIDPreprocessor,HybridCategoricalStatisticsImputer,DummyTargetScaler
23,23,0.6626864622381581,2024-03-08 12:49:43.033835,2024-03-08 12:50:13.682088,0 days 00:00:30.648253,87,900.0,COMPLETE,RandomForest,0.6789179402205939,,,,,,,,,,,,,,,,,,,17,IIDPreprocessor,HybridCategoricalStatisticsImputer,DummyTargetScaler
24,24,0.6710388348314302,2024-03-08 12:50:13.698185,2024-03-08 12:51:01.277516,0 days 00:00:47.579331,39,1400.0,COMPLETE,RandomForest,0.6789179402205939,,,,,,,,,,,,,,,,,,,17,IIDPreprocessor,HybridCategoricalStatisticsImputer,DummyTargetScaler
25,25,0.6688280101577095,2024-03-08 12:51:01.278414,2024-03-08 12:51:33.368918,0 days 00:00:32.090504,27,1000.0,COMPLETE,RandomForest,0.6789179402205939,,,,,,,,,,,,,,,,,,,17,IIDPreprocessor,HybridCategoricalStatisticsImputer,DummyTargetScaler
26,26,0.6324359515272007,2024-03-08 12:51:33.369661,2024-03-08 12:52:00.481040,0 days 00:00:27.111379,9,1200.0,COMPLETE,RandomForest,0.6789179402205939,,,,,,,,,,,,,,,,,,,17,IIDPreprocessor,HybridCategoricalStatisticsImputer,DummyTargetScaler
27,27,0.6705536404653113,2024-03-08 12:52:00.481801,2024-03-08 12:52:39.980172,0 days 00:00:39.498371,33,1300.0,COMPLETE,RandomForest,0.6789179402205939,,,,,,,,,,,,,,,,,,,17,IIDPreprocessor,HybridCategoricalStatisticsImputer,DummyTargetScaler
28,28,0.6789179402205939,2024-03-08 12:52:39.981023,2024-03-08 12:53:04.483736,0 days 00:00:24.502713,60,800.0,COMPLETE,RandomForest,0.6789179402205939,,,,,,,,,,,,,,,,,,,17,IIDPreprocessor,HybridCategoricalStatisticsImputer,DummyTargetScaler
29,29,0.6650092216469736,2024-03-08 12:53:04.484395,2024-03-08 12:53:07.424267,0 days 00:00:02.939872,30,100.0,COMPLETE,RandomForest,0.6789179402205939,,,,,,,,,,,,,,,,,,,17,IIDPreprocessor,HybridCategoricalStatisticsImputer,DummyTargetScaler
30,30,0.6639906409274245,2024-03-08 12:53:07.425044,2024-03-08 12:53:53.628217,0 days 00:00:46.203173,87,1500.0,COMPLETE,RandomForest,0.6789179402205939,,,,,,,,,,,,,,,,,,,17,IIDPreprocessor,HybridCategoricalStatisticsImputer,DummyTargetScaler
31,31,0.6488137587043066,2024-03-08 12:53:53.628980,2024-03-08 12:54:33.976107,0 days 00:00:40.347127,12,1500.0,COMPLETE,RandomForest,0.6789179402205939,,,,,,,,,,,,,,,,,,,17,IIDPreprocessor,HybridCategoricalStatisticsImputer,DummyTargetScaler
32,32,0.6613570084877116,2024-03-08 12:54:33.977047,2024-03-08 12:55:02.152139,0 days 00:00:28.175092,78,900.0,COMPLETE,RandomForest,0.6789179402205939,,,,,,,,,,,,,,,,,,,17,IIDPreprocessor,HybridCategoricalStatisticsImputer,DummyTargetScaler
33,33,0.5774981360286409,2024-03-08 12:55:02.152946,2024-03-08 12:55:05.984746,0 days 00:00:03.831800,6,200.0,COMPLETE,RandomForest,0.6789179402205939,,,,,,,,,,,,,,,,,,,17,IIDPreprocessor,HybridCategoricalStatisticsImputer,DummyTargetScaler
34,34,0.6644321513649659,2024-03-08 12:55:05.985710,2024-03-08 12:55:52.256210,0 days 00:00:46.270500,45,1400.0,COMPLETE,RandomForest,0.6789179402205939,,,,,,,,,,,,,,,,,,,17,IIDPreprocessor,HybridCategoricalStatisticsImputer,DummyTargetScaler
35,35,0.6657422496040296,2024-03-08 12:55:52.257048,2024-03-08 12:56:04.975994,0 days 00:00:12.718946,84,400.0,COMPLETE,RandomForest,0.6789179402205939,,,,,,,,,,,,,,,,,,,17,IIDPreprocessor,HybridCategoricalStatisticsImputer,DummyTargetScaler
36,36,0.6596575727910772,2024-03-08 12:56:04.976692,2024-03-08 12:56:49.929790,0 days 00:00:44.953098,33,1500.0,COMPLETE,RandomForest,0.6789179402205939,,,,,,,,,,,,,,,,,,,17,IIDPreprocessor,HybridCategoricalStatisticsImputer,DummyTargetScaler
37,37,0.6646281713930968,2024-03-08 12:56:49.930721,2024-03-08 12:57:08.745748,0 days 00:00:18.815027,24,600.0,COMPLETE,RandomForest,0.6789179402205939,,,,,,,,,,,,,,,,,,,17,IIDPreprocessor,HybridCategoricalStatisticsImputer,DummyTargetScaler
38,38,0.6632201759939619,2024-03-08 12:57:08.746407,2024-03-08 12:57:17.778216,0 days 00:00:09.031809,30,300.0,COMPLETE,RandomForest,0.6789179402205939,,,,,,,,,,,,,,,,,,,17,IIDPreprocessor,HybridCategoricalStatisticsImputer,DummyTargetScaler
39,39,0.6459433018591747,2024-03-08 12:57:17.779125,2024-03-08 12:57:30.708519,0 days 00:00:12.929394,12,500.0,COMPLETE,RandomForest,0.6789179402205939,,,,,,,,,,,,,,,,,,,17,IIDPreprocessor,HybridCategoricalStatisticsImputer,DummyTargetScaler
0,0,0.6796676013644757,2024-03-08 12:57:54.902204,2024-03-08 12:58:05.928282,0 days 00:00:11.026078,12,110.0,COMPLETE,LGBM,0.6921977006754532,0.41738536400173565,3.0,0.5244069047249484,0.00259638343168177,2.257824064507394e-08,0.05319377922769005,8.0,99.0,,,,,,,,,,,17,IIDPreprocessor,HybridCategoricalStatisticsImputer,DummyTargetScaler
1,1,0.671519473351333,2024-03-08 12:58:05.929549,2024-03-08 12:58:20.507353,0 days 00:00:14.577804,93,310.0,COMPLETE,LGBM,0.6921977006754532,0.6492335908433973,6.0,0.9217546177543043,0.061988524786778514,0.006424732484888985,0.05856115343837979,74.0,59.0,,,,,,,,,,,17,IIDPreprocessor,HybridCategoricalStatisticsImputer,DummyTargetScaler
2,2,0.6693204990465093,2024-03-08 12:58:20.508738,2024-03-08 13:00:00.530989,0 days 00:01:40.022251,30,910.0,COMPLETE,LGBM,0.6921977006754532,0.8794089530401704,1.0,0.652391046259156,3.207962909758891e-08,8.391700833122956,0.23841592881259394,5.0,125.0,,,,,,,,,,,17,IIDPreprocessor,HybridCategoricalStatisticsImputer,DummyTargetScaler
3,3,0.6757481156196727,2024-03-08 13:00:00.533589,2024-03-08 13:00:51.829159,0 days 00:00:51.295570,27,1110.0,COMPLETE,LGBM,0.6921977006754532,0.7944577467073268,4.0,0.9075614680091257,0.0001652055050282884,1.8777902201178166e-08,0.05470023469404874,89.0,110.0,,,,,,,,,,,17,IIDPreprocessor,HybridCategoricalStatisticsImputer,DummyTargetScaler
4,4,0.6533081851519849,2024-03-08 13:00:51.830157,2024-03-08 13:00:55.285084,0 days 00:00:03.454927,96,110.0,COMPLETE,LGBM,0.6921977006754532,0.6121348508016357,2.0,0.953051286052656,3.835000588089341e-07,2.748320758474862,0.01061606937630181,74.0,133.0,,,,,,,,,,,17,IIDPreprocessor,HybridCategoricalStatisticsImputer,DummyTargetScaler
5,5,0.66451878327674,2024-03-08 13:00:55.286437,2024-03-08 13:01:18.397568,0 days 00:00:23.111131,87,510.0,COMPLETE,LGBM,0.6921977006754532,0.7851184520569654,5.0,0.6831958730570817,0.2008037124807673,0.0020262603336645597,0.013718058829868342,76.0,102.0,,,,,,,,,,,17,IIDPreprocessor,HybridCategoricalStatisticsImputer,DummyTargetScaler
6,6,0.6536019988226345,2024-03-08 13:01:18.398294,2024-03-08 13:01:26.203636,0 days 00:00:07.805342,96,710.0,COMPLETE,LGBM,0.6921977006754532,0.9752312405147983,6.0,0.7877848177777396,0.41313289987584867,4.369139080032521e-05,0.2713259731955385,95.0,171.0,,,,,,,,,,,17,IIDPreprocessor,HybridCategoricalStatisticsImputer,DummyTargetScaler
7,7,0.6744097110835016,2024-03-08 13:01:26.205110,2024-03-08 13:01:47.499774,0 days 00:00:21.294664,15,810.0,COMPLETE,LGBM,0.6921977006754532,0.6501209217104109,5.0,0.5061186538278335,2.6198152367422276,6.82357046055393e-05,0.018533657017806755,34.0,17.0,,,,,,,,,,,17,IIDPreprocessor,HybridCategoricalStatisticsImputer,DummyTargetScaler
8,8,0.6660686624871046,2024-03-08 13:01:47.501837,2024-03-08 13:01:57.128742,0 days 00:00:09.626905,48,1010.0,COMPLETE,LGBM,0.6921977006754532,0.797309965830146,5.0,0.44331854236392576,0.8754806957905509,1.550893799211119e-05,0.18359190211788234,38.0,28.0,,,,,,,,,,,17,IIDPreprocessor,HybridCategoricalStatisticsImputer,DummyTargetScaler
9,9,0.6770262998440922,2024-03-08 13:01:57.129639,2024-03-08 13:02:32.660064,0 days 00:00:35.530425,27,1110.0,COMPLETE,LGBM,0.6921977006754532,0.7956250660393419,7.0,0.5392426429296151,1.4491216003625132e-08,0.00012031887219110993,0.058882399334527116,77.0,191.0,,,,,,,,,,,17,IIDPreprocessor,HybridCategoricalStatisticsImputer,DummyTargetScaler
10,10,0.6594694784930353,2024-03-08 13:02:32.661432,2024-03-08 13:02:36.501374,0 days 00:00:03.839942,30,110.0,COMPLETE,LGBM,0.6921977006754532,0.6517797496911815,3.0,0.8591518256928975,0.0010458139791269384,0.004932962408737043,0.022564997197630794,75.0,8.0,,,,,,,,,,,17,IIDPreprocessor,HybridCategoricalStatisticsImputer,DummyTargetScaler
11,11,0.6779926440889078,2024-03-08 13:02:36.502925,2024-03-08 13:02:50.021457,0 days 00:00:13.518532,99,610.0,COMPLETE,LGBM,0.6921977006754532,0.9990638545254088,2.0,0.45137084172356656,0.006769705931887765,0.05732522538534495,0.17543214284857758,77.0,239.0,,,,,,,,,,,17,IIDPreprocessor,HybridCategoricalStatisticsImputer,DummyTargetScaler
12,12,0.6661527377406841,2024-03-08 13:02:50.022924,2024-03-08 13:03:05.142591,0 days 00:00:15.119667,78,810.0,COMPLETE,LGBM,0.6921977006754532,0.5650646908848969,6.0,0.633910880929328,0.06278484656178977,0.0062564807719561084,0.16381254395939918,69.0,6.0,,,,,,,,,,,17,IIDPreprocessor,HybridCategoricalStatisticsImputer,DummyTargetScaler
13,13,0.6765414393716057,2024-03-08 13:03:05.144637,2024-03-08 13:03:26.542149,0 days 00:00:21.397512,3,1110.0,COMPLETE,LGBM,0.6921977006754532,0.910590027407695,1.0,0.6783047937714904,0.00011054816196858688,9.203241702717699e-06,0.06627856533567725,90.0,139.0,,,,,,,,,,,17,IIDPreprocessor,HybridCategoricalStatisticsImputer,DummyTargetScaler
14,14,0.03845299619544709,2024-03-08 13:03:26.543768,2024-03-08 13:04:00.337908,0 days 00:00:33.794140,39,1410.0,COMPLETE,LGBM,0.6921977006754532,0.4692864526348859,5.0,0.7015698681915497,0.0001256257431334467,0.0007560788695605636,0.08416621060972475,21.0,194.0,,,,,,,,,,,17,IIDPreprocessor,HybridCategoricalStatisticsImputer,DummyTargetScaler
15,15,0.6842178788951488,2024-03-08 13:04:00.339894,2024-03-08 13:04:15.201493,0 days 00:00:14.861599,69,910.0,COMPLETE,LGBM,0.6921977006754532,0.7490310922483119,1.0,0.4189360689312529,5.5723216240831775e-05,1.0888100697406042e-06,0.1640560838809841,90.0,249.0,,,,,,,,,,,17,IIDPreprocessor,HybridCategoricalStatisticsImputer,DummyTargetScaler
16,16,0.04674083261558336,2024-03-08 13:04:15.202663,2024-03-08 13:04:26.630584,0 days 00:00:11.427921,3,1110.0,COMPLETE,LGBM,0.6921977006754532,0.4679541584902712,6.0,0.6439629358333193,5.2597986578924165e-05,7.063472322298323e-05,0.18859631050294376,55.0,172.0,,,,,,,,,,,17,IIDPreprocessor,HybridCategoricalStatisticsImputer,DummyTargetScaler
17,17,0.6586778418265151,2024-03-08 13:04:26.632052,2024-03-08 13:04:49.043764,0 days 00:00:22.411712,93,510.0,COMPLETE,LGBM,0.6921977006754532,0.49748909418510523,5.0,0.8194664342578324,1.4926825363718892,0.09812229683972176,0.02913601930544019,14.0,238.0,,,,,,,,,,,17,IIDPreprocessor,HybridCategoricalStatisticsImputer,DummyTargetScaler
18,18,0.680764787924757,2024-03-08 13:04:49.044980,2024-03-08 13:05:12.943180,0 days 00:00:23.898200,84,210.0,COMPLETE,LGBM,0.6921977006754532,0.5181932585463161,1.0,0.932242447192284,6.612317289345961e-07,0.0003707067501750568,0.05579227919343071,26.0,252.0,,,,,,,,,,,17,IIDPreprocessor,HybridCategoricalStatisticsImputer,DummyTargetScaler
19,19,0.6587496052087861,2024-03-08 13:05:12.944891,2024-03-08 13:05:19.930996,0 days 00:00:06.986105,24,910.0,COMPLETE,LGBM,0.6921977006754532,0.8286202896818958,1.0,0.4548454073838439,4.334871714279166,2.113045960239161e-06,0.22545701721753125,86.0,87.0,,,,,,,,,,,17,IIDPreprocessor,HybridCategoricalStatisticsImputer,DummyTargetScaler
20,20,0.6754257871249549,2024-03-08 13:05:19.932305,2024-03-08 13:06:05.179404,0 days 00:00:45.247099,36,610.0,COMPLETE,LGBM,0.6921977006754532,0.5212909842529773,4.0,0.8383346568260326,1.50540873739164e-06,1.711755720907391,0.16804520517967456,9.0,145.0,,,,,,,,,,,17,IIDPreprocessor,HybridCategoricalStatisticsImputer,DummyTargetScaler
21,21,0.06949456400209489,2024-03-08 13:06:05.181076,2024-03-08 13:06:18.821106,0 days 00:00:13.640030,81,1410.0,COMPLETE,LGBM,0.6921977006754532,0.5531252603542804,6.0,0.5574918017329188,0.0004978868923110049,1.556513838182121e-06,0.14359607884150832,30.0,48.0,,,,,,,,,,,17,IIDPreprocessor,HybridCategoricalStatisticsImputer,DummyTargetScaler
22,22,0.6703148067528634,2024-03-08 13:06:18.822107,2024-03-08 13:06:31.655464,0 days 00:00:12.833357,99,510.0,COMPLETE,LGBM,0.6921977006754532,0.4107429942298514,3.0,0.4695172997849614,0.018101739995568078,1.616724347065741e-05,0.018468499051328108,56.0,146.0,,,,,,,,,,,17,IIDPreprocessor,HybridCategoricalStatisticsImputer,DummyTargetScaler
23,23,0.040340538582296824,2024-03-08 13:06:31.656714,2024-03-08 13:06:55.060941,0 days 00:00:23.404227,60,1210.0,COMPLETE,LGBM,0.6921977006754532,0.8127374148916329,7.0,0.8234567159561503,0.00030374468447501735,5.280368104707284e-07,0.1444198233146485,46.0,241.0,,,,,,,,,,,17,IIDPreprocessor,HybridCategoricalStatisticsImputer,DummyTargetScaler
24,24,0.6779218494211715,2024-03-08 13:06:55.062091,2024-03-08 13:07:00.913089,0 days 00:00:05.850998,39,310.0,COMPLETE,LGBM,0.6921977006754532,0.846517894345829,1.0,0.40152242892848905,0.14954093832790696,0.00747578658814722,0.21724907599025672,26.0,16.0,,,,,,,,,,,17,IIDPreprocessor,HybridCategoricalStatisticsImputer,DummyTargetScaler
25,25,0.6340105860438457,2024-03-08 13:07:00.914227,2024-03-08 13:07:01.377228,0 days 00:00:00.463001,99,10.0,COMPLETE,LGBM,0.6921977006754532,0.8451719675320171,1.0,0.5447667670691687,3.2521946400093995,0.8053278415854114,0.14529105294038697,91.0,44.0,,,,,,,,,,,17,IIDPreprocessor,HybridCategoricalStatisticsImputer,DummyTargetScaler
26,26,0.6730436214051138,2024-03-08 13:07:01.378882,2024-03-08 13:07:39.851201,0 days 00:00:38.472319,33,1010.0,COMPLETE,LGBM,0.6921977006754532,0.7114659158641038,1.0,0.9066647680522802,0.22689526488267192,0.9239508125064922,0.01495879147051617,93.0,94.0,,,,,,,,,,,17,IIDPreprocessor,HybridCategoricalStatisticsImputer,DummyTargetScaler
