,number,value,datetime_start,datetime_complete,duration,params_max_depth,params_n_estimators,state,model,best_value,params_bagging_fraction,params_bagging_freq,params_feature_fraction,params_lambda_l1,params_lambda_l2,params_learning_rate,params_min_child_samples,params_num_leaves,params_alpha,params_booster,params_eta,params_gamma,params_grow_policy,params_lambda,params_normalize_type,params_rate_drop,params_sample_type,params_skip_drop,config_id,preprocessor,imputer,target_scaler
15,15,0.5688386542697424,2024-03-08 04:44:22.959930,2024-03-08 04:44:54.418724,0 days 00:00:31.458794,3,,COMPLETE,XGB,0.634874791761776,,,,,,,,,0.00012175948814052506,dart,0.00017602112540005034,1.6998028415498963e-05,depthwise,1.2838732670395604e-05,forest,1.6223429790692446e-06,uniform,0.002686412526781815,10,IIDPreprocessor,DummyImputer,ArcSinhTargetScaler
16,16,0.5621911399964556,2024-03-08 04:44:54.420283,2024-03-08 04:45:42.665907,0 days 00:00:48.245624,6,,COMPLETE,XGB,0.634874791761776,,,,,,,,,9.738289061464677e-05,dart,2.1281717793751655e-07,0.018320116895578713,lossguide,0.08878826669488787,forest,3.5816971407912153e-06,weighted,0.0038272969491436925,10,IIDPreprocessor,DummyImputer,ArcSinhTargetScaler
17,17,0.5598564846847311,2024-03-08 04:45:42.667648,2024-03-08 04:46:32.217370,0 days 00:00:49.549722,6,,COMPLETE,XGB,0.634874791761776,,,,,,,,,2.613880734996987e-05,dart,1.201018095831937e-06,0.00023247102013764144,depthwise,4.73769871535039e-05,forest,0.0010010283979150541,weighted,0.10686225492177205,10,IIDPreprocessor,DummyImputer,ArcSinhTargetScaler
18,18,0.5956434963446634,2024-03-08 04:46:32.218939,2024-03-08 04:47:26.070633,0 days 00:00:53.851694,9,,COMPLETE,XGB,0.634874791761776,,,,,,,,,0.05543526979081139,dart,0.722843072897207,0.03455190182033177,depthwise,1.720235428993237e-05,tree,0.04971185200126667,uniform,0.0004237715123540755,10,IIDPreprocessor,DummyImputer,ArcSinhTargetScaler
19,19,0.5725250651121109,2024-03-08 04:47:26.072511,2024-03-08 04:47:52.161102,0 days 00:00:26.088591,1,,COMPLETE,XGB,0.634874791761776,,,,,,,,,0.04014613896516959,dart,0.5297750596245784,0.011057137267320808,lossguide,0.004602662616742695,tree,1.1363099259945991e-06,weighted,0.004869773483048024,10,IIDPreprocessor,DummyImputer,ArcSinhTargetScaler
20,20,0.6304710197108145,2024-03-08 04:47:52.162475,2024-03-08 04:48:36.982797,0 days 00:00:44.820322,8,,COMPLETE,XGB,0.634874791761776,,,,,,,,,0.003384636604214332,dart,0.24916713386799672,0.011360955716730781,depthwise,1.4182728786435974e-05,tree,4.2725885451811624e-08,weighted,3.142526183393901e-07,10,IIDPreprocessor,DummyImputer,ArcSinhTargetScaler
21,21,0.5469634322323124,2024-03-08 04:48:36.984131,2024-03-08 04:49:26.964255,0 days 00:00:49.980124,7,,COMPLETE,XGB,0.634874791761776,,,,,,,,,1.0014441412603045e-07,dart,3.6415399327723384e-06,0.08563596112086944,depthwise,0.0047858960757299765,forest,1.2350509316835578e-07,weighted,0.0214674711889939,10,IIDPreprocessor,DummyImputer,ArcSinhTargetScaler
22,22,0.5443801101663628,2024-03-08 04:49:26.965658,2024-03-08 04:50:18.479671,0 days 00:00:51.514013,6,,COMPLETE,XGB,0.634874791761776,,,,,,,,,0.2574395085293483,dart,7.187655679861842e-08,2.577956245490387e-05,lossguide,9.688878644128822e-05,tree,1.7740581830938084e-07,uniform,0.0004735703036216333,10,IIDPreprocessor,DummyImputer,ArcSinhTargetScaler
23,23,0.6133946692552702,2024-03-08 04:50:18.481295,2024-03-08 04:50:54.060306,0 days 00:00:35.579011,3,,COMPLETE,XGB,0.634874791761776,,,,,,,,,0.16655980431363138,dart,0.6943705630485425,4.4885656169902345e-07,depthwise,2.243574933851417e-07,forest,0.007419561064843471,weighted,1.4616896750855016e-08,10,IIDPreprocessor,DummyImputer,ArcSinhTargetScaler
24,24,0.5625354649055636,2024-03-08 04:50:54.061730,2024-03-08 04:51:37.138662,0 days 00:00:43.076932,4,,COMPLETE,XGB,0.634874791761776,,,,,,,,,0.6537025444843902,dart,6.037272429203183e-05,3.7881556894906805e-08,lossguide,0.00032663418323326934,forest,4.391614939024142e-05,uniform,3.8967145625282105e-05,10,IIDPreprocessor,DummyImputer,ArcSinhTargetScaler
25,25,0.44753246078593095,2024-03-08 04:51:37.140244,2024-03-08 04:52:04.944679,0 days 00:00:27.804435,1,,COMPLETE,XGB,0.634874791761776,,,,,,,,,0.0007904961971384007,dart,0.0011249750689233528,4.507307727068693e-06,lossguide,2.968760981950528e-07,tree,5.332417063735752e-06,weighted,0.0012429921549862713,10,IIDPreprocessor,DummyImputer,ArcSinhTargetScaler
26,26,0.5865915096136451,2024-03-08 04:52:04.946047,2024-03-08 04:52:38.766212,0 days 00:00:33.820165,8,,COMPLETE,XGB,0.634874791761776,,,,,,,,,3.4662236926973837e-06,dart,0.8683029118930792,0.003457782203184263,lossguide,6.218632699281565e-05,tree,0.0011062177816198635,uniform,0.33700156639159234,10,IIDPreprocessor,DummyImputer,ArcSinhTargetScaler
27,27,0.5681725494404588,2024-03-08 04:52:38.767675,2024-03-08 04:53:24.547956,0 days 00:00:45.780281,4,,COMPLETE,XGB,0.634874791761776,,,,,,,,,4.1589726709497155e-05,dart,0.0010938486726533223,2.990112411630724e-06,lossguide,0.0809285615322378,tree,0.00038983701521987893,weighted,5.680984393194523e-08,10,IIDPreprocessor,DummyImputer,ArcSinhTargetScaler
28,28,0.5708097488908268,2024-03-08 04:53:24.549464,2024-03-08 04:54:05.513612,0 days 00:00:40.964148,4,,COMPLETE,XGB,0.634874791761776,,,,,,,,,0.0031403956358226964,dart,9.55945715637947e-08,0.09354526798387956,lossguide,0.22356655023658414,tree,8.883469502871673e-08,uniform,0.00016315683629138165,10,IIDPreprocessor,DummyImputer,ArcSinhTargetScaler
29,29,0.4377465952684021,2024-03-08 04:54:05.515278,2024-03-08 04:54:27.427024,0 days 00:00:21.911746,1,,COMPLETE,XGB,0.634874791761776,,,,,,,,,0.00016314459296557472,dart,0.05947607866907667,3.460984624851028e-06,depthwise,0.595858384623992,tree,0.10163987510030062,uniform,0.0012712832178855761,10,IIDPreprocessor,DummyImputer,ArcSinhTargetScaler
30,30,0.5623493041601176,2024-03-08 04:54:27.428350,2024-03-08 04:55:18.764611,0 days 00:00:51.336261,7,,COMPLETE,XGB,0.634874791761776,,,,,,,,,0.2072147067574531,dart,0.0006364084201761221,3.3465553559544996e-05,lossguide,0.035368440689291084,tree,0.5158079693301812,uniform,0.7336723816799432,10,IIDPreprocessor,DummyImputer,ArcSinhTargetScaler
31,31,0.5651641744503587,2024-03-08 04:55:18.765824,2024-03-08 04:56:02.644589,0 days 00:00:43.878765,5,,COMPLETE,XGB,0.634874791761776,,,,,,,,,0.00011629899729264242,dart,4.939107460971345e-08,5.2322956325002645e-06,lossguide,0.0014409590195259938,forest,3.10919418826483e-06,weighted,7.083891398481624e-07,10,IIDPreprocessor,DummyImputer,ArcSinhTargetScaler
32,32,0.561815715783616,2024-03-08 04:56:02.646443,2024-03-08 04:57:00.443740,0 days 00:00:57.797297,9,,COMPLETE,XGB,0.634874791761776,,,,,,,,,0.0015322704756769259,dart,0.00022810677358939957,3.85821037551239e-08,depthwise,1.4845137640414429e-06,forest,2.7102167961720144e-05,weighted,5.2450112767409594e-06,10,IIDPreprocessor,DummyImputer,ArcSinhTargetScaler
33,33,0.5538815139120632,2024-03-08 04:57:00.445051,2024-03-08 04:57:46.308235,0 days 00:00:45.863184,6,,COMPLETE,XGB,0.634874791761776,,,,,,,,,8.983997704736812e-07,dart,9.115251058061426e-08,4.2037705568100286e-07,lossguide,0.0006959108642787168,tree,1.5032942403155947e-08,uniform,1.5752701894931508e-06,10,IIDPreprocessor,DummyImputer,ArcSinhTargetScaler
34,34,0.5229374616857045,2024-03-08 04:57:46.309301,2024-03-08 04:58:17.097697,0 days 00:00:30.788396,2,,COMPLETE,XGB,0.634874791761776,,,,,,,,,6.289186326488318e-06,dart,0.0016026984925757587,0.0016731772988368622,lossguide,0.34157708903433703,tree,0.10258646460961073,uniform,0.0010375625040350952,10,IIDPreprocessor,DummyImputer,ArcSinhTargetScaler
35,35,0.5612165323157995,2024-03-08 04:58:17.098757,2024-03-08 04:59:05.536437,0 days 00:00:48.437680,6,,COMPLETE,XGB,0.634874791761776,,,,,,,,,0.5045509583037034,dart,3.3600212409090434e-07,0.11993189295884356,depthwise,2.3569725982101903e-08,forest,4.006106349217975e-07,uniform,3.636888828986623e-07,10,IIDPreprocessor,DummyImputer,ArcSinhTargetScaler
36,36,0.5653350054915035,2024-03-08 04:59:05.538197,2024-03-08 04:59:40.700410,0 days 00:00:35.162213,3,,COMPLETE,XGB,0.634874791761776,,,,,,,,,2.7246554772954074e-07,dart,2.0647244532440623e-05,0.0001964629781658804,depthwise,2.7227488360876313e-07,tree,2.7765696056134598e-06,weighted,5.373111062458474e-05,10,IIDPreprocessor,DummyImputer,ArcSinhTargetScaler
37,37,0.15316506153944576,2024-03-08 04:59:40.701720,2024-03-08 05:00:07.544020,0 days 00:00:26.842300,1,,COMPLETE,XGB,0.634874791761776,,,,,,,,,5.984728678655795e-05,dart,3.06886096526359e-08,6.0292678926785e-06,depthwise,0.00025726234197463,forest,0.0002096507629042484,weighted,2.365660814771481e-06,10,IIDPreprocessor,DummyImputer,ArcSinhTargetScaler
38,38,0.5637918963028403,2024-03-08 05:00:07.545028,2024-03-08 05:01:00.607289,0 days 00:00:53.062261,6,,COMPLETE,XGB,0.634874791761776,,,,,,,,,1.7893930915353022e-06,dart,0.0001828123818514883,2.7963229445890076e-05,depthwise,1.4046455199487363e-06,forest,6.497966252430537e-07,weighted,0.05118196589949819,10,IIDPreprocessor,DummyImputer,ArcSinhTargetScaler
39,39,0.5677683567297052,2024-03-08 05:01:00.608835,2024-03-08 05:01:46.708155,0 days 00:00:46.099320,5,,COMPLETE,XGB,0.634874791761776,,,,,,,,,3.9888615107728556e-08,dart,1.57100564254319e-05,1.7511981832376918e-05,lossguide,3.4175245496838325e-06,forest,1.0120230942837604e-06,weighted,4.195779105180015e-06,10,IIDPreprocessor,DummyImputer,ArcSinhTargetScaler
0,0,0.6331791724446845,2024-03-08 05:03:09.572445,2024-03-08 05:03:22.923291,0 days 00:00:13.350846,48,500.0,COMPLETE,RandomForest,0.6637923569805501,,,,,,,,,,,,,,,,,,,11,IIDPreprocessor,DummyImputer,DummyTargetScaler
1,1,0.6483544143251263,2024-03-08 05:03:22.924174,2024-03-08 05:04:01.413106,0 days 00:00:38.488932,51,1400.0,COMPLETE,RandomForest,0.6637923569805501,,,,,,,,,,,,,,,,,,,11,IIDPreprocessor,DummyImputer,DummyTargetScaler
2,2,0.5894876529586954,2024-03-08 05:04:01.414351,2024-03-08 05:04:13.740423,0 days 00:00:12.326072,9,600.0,COMPLETE,RandomForest,0.6637923569805501,,,,,,,,,,,,,,,,,,,11,IIDPreprocessor,DummyImputer,DummyTargetScaler
3,3,0.6556512388958776,2024-03-08 05:04:13.741641,2024-03-08 05:04:44.770660,0 days 00:00:31.029019,45,1200.0,COMPLETE,RandomForest,0.6637923569805501,,,,,,,,,,,,,,,,,,,11,IIDPreprocessor,DummyImputer,DummyTargetScaler
4,4,0.649302606672878,2024-03-08 05:04:44.771745,2024-03-08 05:05:19.541513,0 days 00:00:34.769768,78,1200.0,COMPLETE,RandomForest,0.6637923569805501,,,,,,,,,,,,,,,,,,,11,IIDPreprocessor,DummyImputer,DummyTargetScaler
5,5,0.644957639800839,2024-03-08 05:05:19.542197,2024-03-08 05:05:51.864457,0 days 00:00:32.322260,90,1200.0,COMPLETE,RandomForest,0.6637923569805501,,,,,,,,,,,,,,,,,,,11,IIDPreprocessor,DummyImputer,DummyTargetScaler
6,6,0.6460826166479261,2024-03-08 05:05:51.865235,2024-03-08 05:06:05.460752,0 days 00:00:13.595517,24,500.0,COMPLETE,RandomForest,0.6637923569805501,,,,,,,,,,,,,,,,,,,11,IIDPreprocessor,DummyImputer,DummyTargetScaler
7,7,0.6564143111803581,2024-03-08 05:06:05.461522,2024-03-08 05:06:34.134973,0 days 00:00:28.673451,69,1100.0,COMPLETE,RandomForest,0.6637923569805501,,,,,,,,,,,,,,,,,,,11,IIDPreprocessor,DummyImputer,DummyTargetScaler
8,8,0.6276750444009119,2024-03-08 05:06:34.135736,2024-03-08 05:06:42.080952,0 days 00:00:07.945216,15,300.0,COMPLETE,RandomForest,0.6637923569805501,,,,,,,,,,,,,,,,,,,11,IIDPreprocessor,DummyImputer,DummyTargetScaler
9,9,0.6462193795572105,2024-03-08 05:06:42.081889,2024-03-08 05:07:09.478980,0 days 00:00:27.397091,42,1000.0,COMPLETE,RandomForest,0.6637923569805501,,,,,,,,,,,,,,,,,,,11,IIDPreprocessor,DummyImputer,DummyTargetScaler
10,10,0.6524799103988567,2024-03-08 05:07:09.479821,2024-03-08 05:07:17.554899,0 days 00:00:08.075078,30,300.0,COMPLETE,RandomForest,0.6637923569805501,,,,,,,,,,,,,,,,,,,11,IIDPreprocessor,DummyImputer,DummyTargetScaler
11,11,0.6443925831147057,2024-03-08 05:07:17.555611,2024-03-08 05:07:33.133916,0 days 00:00:15.578305,36,600.0,COMPLETE,RandomForest,0.6637923569805501,,,,,,,,,,,,,,,,,,,11,IIDPreprocessor,DummyImputer,DummyTargetScaler
12,12,0.6516466341819465,2024-03-08 05:07:33.134760,2024-03-08 05:07:45.989580,0 days 00:00:12.854820,57,500.0,COMPLETE,RandomForest,0.6637923569805501,,,,,,,,,,,,,,,,,,,11,IIDPreprocessor,DummyImputer,DummyTargetScaler
13,13,0.62400820363668,2024-03-08 05:07:45.990446,2024-03-08 05:08:06.401532,0 days 00:00:20.411086,12,900.0,COMPLETE,RandomForest,0.6637923569805501,,,,,,,,,,,,,,,,,,,11,IIDPreprocessor,DummyImputer,DummyTargetScaler
14,14,0.6537820310261506,2024-03-08 05:08:06.402316,2024-03-08 05:08:37.010899,0 days 00:00:30.608583,24,1200.0,COMPLETE,RandomForest,0.6637923569805501,,,,,,,,,,,,,,,,,,,11,IIDPreprocessor,DummyImputer,DummyTargetScaler
15,15,0.6515399627432116,2024-03-08 05:08:37.011568,2024-03-08 05:09:01.685627,0 days 00:00:24.674059,30,900.0,COMPLETE,RandomForest,0.6637923569805501,,,,,,,,,,,,,,,,,,,11,IIDPreprocessor,DummyImputer,DummyTargetScaler
16,16,0.6491245366199886,2024-03-08 05:09:01.686549,2024-03-08 05:09:21.112264,0 days 00:00:19.425715,78,700.0,COMPLETE,RandomForest,0.6637923569805501,,,,,,,,,,,,,,,,,,,11,IIDPreprocessor,DummyImputer,DummyTargetScaler
17,17,0.6531165654641421,2024-03-08 05:09:21.113123,2024-03-08 05:09:57.867860,0 days 00:00:36.754737,54,1400.0,COMPLETE,RandomForest,0.6637923569805501,,,,,,,,,,,,,,,,,,,11,IIDPreprocessor,DummyImputer,DummyTargetScaler
18,18,0.635977637380796,2024-03-08 05:09:57.868756,2024-03-08 05:10:30.450229,0 days 00:00:32.581473,48,1100.0,COMPLETE,RandomForest,0.6637923569805501,,,,,,,,,,,,,,,,,,,11,IIDPreprocessor,DummyImputer,DummyTargetScaler
19,19,0.6416906377840499,2024-03-08 05:10:30.451180,2024-03-08 05:11:03.524452,0 days 00:00:33.073272,48,1200.0,COMPLETE,RandomForest,0.6637923569805501,,,,,,,,,,,,,,,,,,,11,IIDPreprocessor,DummyImputer,DummyTargetScaler
20,20,0.6478395286740263,2024-03-08 05:11:03.525069,2024-03-08 05:11:27.705102,0 days 00:00:24.180033,42,900.0,COMPLETE,RandomForest,0.6637923569805501,,,,,,,,,,,,,,,,,,,11,IIDPreprocessor,DummyImputer,DummyTargetScaler
21,21,0.6445214708295322,2024-03-08 05:11:27.705708,2024-03-08 05:11:30.412570,0 days 00:00:02.706862,21,100.0,COMPLETE,RandomForest,0.6637923569805501,,,,,,,,,,,,,,,,,,,11,IIDPreprocessor,DummyImputer,DummyTargetScaler
22,22,0.6603019441430112,2024-03-08 05:11:30.413286,2024-03-08 05:11:55.223468,0 days 00:00:24.810182,42,900.0,COMPLETE,RandomForest,0.6637923569805501,,,,,,,,,,,,,,,,,,,11,IIDPreprocessor,DummyImputer,DummyTargetScaler
23,23,0.6542289122838665,2024-03-08 05:11:55.224310,2024-03-08 05:12:28.155643,0 days 00:00:32.931333,72,1200.0,COMPLETE,RandomForest,0.6637923569805501,,,,,,,,,,,,,,,,,,,11,IIDPreprocessor,DummyImputer,DummyTargetScaler
24,24,0.6397442163879853,2024-03-08 05:12:28.156255,2024-03-08 05:12:46.123515,0 days 00:00:17.967260,96,700.0,COMPLETE,RandomForest,0.6637923569805501,,,,,,,,,,,,,,,,,,,11,IIDPreprocessor,DummyImputer,DummyTargetScaler
25,25,0.6600059336531926,2024-03-08 05:12:46.124136,2024-03-08 05:13:05.329705,0 days 00:00:19.205569,93,700.0,COMPLETE,RandomForest,0.6637923569805501,,,,,,,,,,,,,,,,,,,11,IIDPreprocessor,DummyImputer,DummyTargetScaler
26,26,0.6430345090221624,2024-03-08 05:13:05.330425,2024-03-08 05:13:38.106867,0 days 00:00:32.776442,45,1200.0,COMPLETE,RandomForest,0.6637923569805501,,,,,,,,,,,,,,,,,,,11,IIDPreprocessor,DummyImputer,DummyTargetScaler
27,27,0.6519989909144543,2024-03-08 05:13:38.107787,2024-03-08 05:13:46.237277,0 days 00:00:08.129490,72,300.0,COMPLETE,RandomForest,0.6637923569805501,,,,,,,,,,,,,,,,,,,11,IIDPreprocessor,DummyImputer,DummyTargetScaler
28,28,0.6402459045753589,2024-03-08 05:13:46.238126,2024-03-08 05:13:54.240670,0 days 00:00:08.002544,93,300.0,COMPLETE,RandomForest,0.6637923569805501,,,,,,,,,,,,,,,,,,,11,IIDPreprocessor,DummyImputer,DummyTargetScaler
29,29,0.6486480164481454,2024-03-08 05:13:54.241387,2024-03-08 05:14:07.864423,0 days 00:00:13.623036,21,500.0,COMPLETE,RandomForest,0.6637923569805501,,,,,,,,,,,,,,,,,,,11,IIDPreprocessor,DummyImputer,DummyTargetScaler
30,30,0.609024571810625,2024-03-08 05:14:07.865066,2024-03-08 05:14:14.649505,0 days 00:00:06.784439,12,300.0,COMPLETE,RandomForest,0.6637923569805501,,,,,,,,,,,,,,,,,,,11,IIDPreprocessor,DummyImputer,DummyTargetScaler
31,31,0.647462452039695,2024-03-08 05:14:14.650286,2024-03-08 05:14:33.131039,0 days 00:00:18.480753,42,700.0,COMPLETE,RandomForest,0.6637923569805501,,,,,,,,,,,,,,,,,,,11,IIDPreprocessor,DummyImputer,DummyTargetScaler
32,32,0.647129821236904,2024-03-08 05:14:33.132008,2024-03-08 05:14:43.597325,0 days 00:00:10.465317,87,400.0,COMPLETE,RandomForest,0.6637923569805501,,,,,,,,,,,,,,,,,,,11,IIDPreprocessor,DummyImputer,DummyTargetScaler
33,33,0.6637923569805501,2024-03-08 05:14:43.598044,2024-03-08 05:15:11.721915,0 days 00:00:28.123871,75,1000.0,COMPLETE,RandomForest,0.6637923569805501,,,,,,,,,,,,,,,,,,,11,IIDPreprocessor,DummyImputer,DummyTargetScaler
34,34,0.6521804937631,2024-03-08 05:15:11.722812,2024-03-08 05:15:41.481651,0 days 00:00:29.758839,66,1100.0,COMPLETE,RandomForest,0.6637923569805501,,,,,,,,,,,,,,,,,,,11,IIDPreprocessor,DummyImputer,DummyTargetScaler
35,35,0.6474488005022146,2024-03-08 05:15:41.482535,2024-03-08 05:16:08.258154,0 days 00:00:26.775619,99,1000.0,COMPLETE,RandomForest,0.6637923569805501,,,,,,,,,,,,,,,,,,,11,IIDPreprocessor,DummyImputer,DummyTargetScaler
36,36,0.632312944977501,2024-03-08 05:16:08.258882,2024-03-08 05:16:11.084658,0 days 00:00:02.825776,93,100.0,COMPLETE,RandomForest,0.6637923569805501,,,,,,,,,,,,,,,,,,,11,IIDPreprocessor,DummyImputer,DummyTargetScaler
37,37,0.6412159823789318,2024-03-08 05:16:11.085313,2024-03-08 05:16:44.611615,0 days 00:00:33.526302,15,1300.0,COMPLETE,RandomForest,0.6637923569805501,,,,,,,,,,,,,,,,,,,11,IIDPreprocessor,DummyImputer,DummyTargetScaler
38,38,0.6528274140864645,2024-03-08 05:16:44.612346,2024-03-08 05:17:14.028144,0 days 00:00:29.415798,24,1100.0,COMPLETE,RandomForest,0.6637923569805501,,,,,,,,,,,,,,,,,,,11,IIDPreprocessor,DummyImputer,DummyTargetScaler
39,39,0.6472024184884196,2024-03-08 05:17:14.028962,2024-03-08 05:17:24.552743,0 days 00:00:10.523781,84,400.0,COMPLETE,RandomForest,0.6637923569805501,,,,,,,,,,,,,,,,,,,11,IIDPreprocessor,DummyImputer,DummyTargetScaler
0,0,0.6020175916226344,2024-03-08 05:17:49.661791,2024-03-08 05:17:57.893068,0 days 00:00:08.231277,93,310.0,COMPLETE,LGBM,0.6568113253452701,0.5737054633695162,6.0,0.966734319503419,0.09357684420057255,1.0767670487746162,0.2965252490613891,98.0,245.0,,,,,,,,,,,11,IIDPreprocessor,DummyImputer,DummyTargetScaler
1,1,0.6422060704742285,2024-03-08 05:17:57.894034,2024-03-08 05:18:26.140523,0 days 00:00:28.246489,84,510.0,COMPLETE,LGBM,0.6568113253452701,0.7408038569065722,4.0,0.6060451312474171,0.0007791528253943342,0.016727718111440335,0.014089149535883281,53.0,176.0,,,,,,,,,,,11,IIDPreprocessor,DummyImputer,DummyTargetScaler
2,2,0.6154670631367589,2024-03-08 05:18:26.141935,2024-03-08 05:18:43.920638,0 days 00:00:17.778703,3,810.0,COMPLETE,LGBM,0.6568113253452701,0.5906099063273987,1.0,0.9361264696526522,2.8931336584142985e-08,1.963187286196103e-07,0.08795230412973283,50.0,17.0,,,,,,,,,,,11,IIDPreprocessor,DummyImputer,DummyTargetScaler
3,3,0.6456972426723063,2024-03-08 05:18:43.921709,2024-03-08 05:19:11.046733,0 days 00:00:27.125024,93,810.0,COMPLETE,LGBM,0.6568113253452701,0.4599402258709326,6.0,0.9222765597776803,2.1697206507339043e-05,4.325248745684473e-06,0.11378063951133481,50.0,26.0,,,,,,,,,,,11,IIDPreprocessor,DummyImputer,DummyTargetScaler
4,4,0.6353814927683087,2024-03-08 05:19:11.047894,2024-03-08 05:19:44.595272,0 days 00:00:33.547378,54,810.0,COMPLETE,LGBM,0.6568113253452701,0.7716527775394257,1.0,0.5329206334281013,4.669405448255125e-08,0.8450779422235526,0.06207083884121533,36.0,71.0,,,,,,,,,,,11,IIDPreprocessor,DummyImputer,DummyTargetScaler
5,5,0.6305511532276702,2024-03-08 05:19:44.596392,2024-03-08 05:19:57.262258,0 days 00:00:12.665866,93,310.0,COMPLETE,LGBM,0.6568113253452701,0.9025322174369287,4.0,0.785102880667842,7.763371418009165e-06,2.3574966411435822e-08,0.24982575200158347,67.0,214.0,,,,,,,,,,,11,IIDPreprocessor,DummyImputer,DummyTargetScaler
6,6,0.6193208762775518,2024-03-08 05:19:57.263938,2024-03-08 05:20:04.856032,0 days 00:00:07.592094,3,710.0,COMPLETE,LGBM,0.6568113253452701,0.9671992208422419,1.0,0.40743261745789117,1.478989560756787,1.1164329141385984e-08,0.25908028507706443,21.0,111.0,,,,,,,,,,,11,IIDPreprocessor,DummyImputer,DummyTargetScaler
7,7,0.6305185125375071,2024-03-08 05:20:04.857643,2024-03-08 05:20:23.318724,0 days 00:00:18.461081,24,710.0,COMPLETE,LGBM,0.6568113253452701,0.950453595370829,2.0,0.9445924572436231,1.1188039238550155e-07,2.6303729441225254e-06,0.26543219710612415,50.0,53.0,,,,,,,,,,,11,IIDPreprocessor,DummyImputer,DummyTargetScaler
8,8,0.6562917689240838,2024-03-08 05:20:23.320026,2024-03-08 05:21:32.296636,0 days 00:01:08.976610,42,910.0,COMPLETE,LGBM,0.6568113253452701,0.5254785555553961,6.0,0.8075271098948178,4.248934554011152e-07,0.03678640065110931,0.020750780158323805,25.0,89.0,,,,,,,,,,,11,IIDPreprocessor,DummyImputer,DummyTargetScaler
9,9,0.6225144076510841,2024-03-08 05:21:32.297725,2024-03-08 05:21:58.538117,0 days 00:00:26.240392,45,1410.0,COMPLETE,LGBM,0.6568113253452701,0.8514387999540223,3.0,0.7978571841632579,4.390141886853363,0.0026078556143731228,0.029475460035912664,10.0,14.0,,,,,,,,,,,11,IIDPreprocessor,DummyImputer,DummyTargetScaler
10,10,0.6446573666687191,2024-03-08 05:21:58.539564,2024-03-08 05:22:44.487387,0 days 00:00:45.947823,81,1110.0,COMPLETE,LGBM,0.6568113253452701,0.7633322215256475,3.0,0.5277657665948944,1.680487519096281e-08,3.448519488061486e-07,0.03428444489597129,79.0,215.0,,,,,,,,,,,11,IIDPreprocessor,DummyImputer,DummyTargetScaler
11,11,0.6380115889153437,2024-03-08 05:22:44.489199,2024-03-08 05:23:32.508118,0 days 00:00:48.018919,51,610.0,COMPLETE,LGBM,0.6568113253452701,0.4558945536265284,2.0,0.8016906561747001,0.00015519260775201773,0.24742888200729088,0.03546909248723155,10.0,194.0,,,,,,,,,,,11,IIDPreprocessor,DummyImputer,DummyTargetScaler
