,number,value,datetime_start,datetime_complete,duration,params_max_depth,params_n_estimators,state,model,best_value,params_bagging_fraction,params_bagging_freq,params_feature_fraction,params_lambda_l1,params_lambda_l2,params_learning_rate,params_min_child_samples,params_num_leaves,params_alpha,params_booster,params_eta,params_gamma,params_grow_policy,params_lambda,params_normalize_type,params_rate_drop,params_sample_type,params_skip_drop,config_id,preprocessor,imputer,target_scaler
6,6,0.34886784224782313,2024-03-07 21:11:36.506994,2024-03-07 21:11:42.427181,0 days 00:00:05.920187,3,600.0,COMPLETE,RandomForest,0.6244914028468803,,,,,,,,,,,,,,,,,,,4,BaselinePreprocessor,RevenueQuantileBucketImputer:3-buckets,ArcSinhTargetScaler
7,7,0.5935057613611189,2024-03-07 21:11:42.427903,2024-03-07 21:11:48.752653,0 days 00:00:06.324750,24,200.0,COMPLETE,RandomForest,0.6244914028468803,,,,,,,,,,,,,,,,,,,4,BaselinePreprocessor,RevenueQuantileBucketImputer:3-buckets,ArcSinhTargetScaler
8,8,0.6103473335222589,2024-03-07 21:11:48.753385,2024-03-07 21:12:01.287529,0 days 00:00:12.534144,51,400.0,COMPLETE,RandomForest,0.6244914028468803,,,,,,,,,,,,,,,,,,,4,BaselinePreprocessor,RevenueQuantileBucketImputer:3-buckets,ArcSinhTargetScaler
9,9,0.5810411155409244,2024-03-07 21:12:01.288110,2024-03-07 21:12:04.461748,0 days 00:00:03.173638,30,100.0,COMPLETE,RandomForest,0.6244914028468803,,,,,,,,,,,,,,,,,,,4,BaselinePreprocessor,RevenueQuantileBucketImputer:3-buckets,ArcSinhTargetScaler
10,10,0.6006604069669049,2024-03-07 21:12:04.462304,2024-03-07 21:12:13.626623,0 days 00:00:09.164319,27,300.0,COMPLETE,RandomForest,0.6244914028468803,,,,,,,,,,,,,,,,,,,4,BaselinePreprocessor,RevenueQuantileBucketImputer:3-buckets,ArcSinhTargetScaler
11,11,0.5964876981180149,2024-03-07 21:12:13.627445,2024-03-07 21:12:31.635968,0 days 00:00:18.008523,18,600.0,COMPLETE,RandomForest,0.6244914028468803,,,,,,,,,,,,,,,,,,,4,BaselinePreprocessor,RevenueQuantileBucketImputer:3-buckets,ArcSinhTargetScaler
12,12,0.5988717090612811,2024-03-07 21:12:31.637697,2024-03-07 21:12:34.837491,0 days 00:00:03.199794,93,100.0,COMPLETE,RandomForest,0.6244914028468803,,,,,,,,,,,,,,,,,,,4,BaselinePreprocessor,RevenueQuantileBucketImputer:3-buckets,ArcSinhTargetScaler
13,13,0.6126126490233821,2024-03-07 21:12:34.838014,2024-03-07 21:12:40.736305,0 days 00:00:05.898291,30,200.0,COMPLETE,RandomForest,0.6244914028468803,,,,,,,,,,,,,,,,,,,4,BaselinePreprocessor,RevenueQuantileBucketImputer:3-buckets,ArcSinhTargetScaler
14,14,0.6012882785149665,2024-03-07 21:12:40.736887,2024-03-07 21:12:55.905187,0 days 00:00:15.168300,66,400.0,COMPLETE,RandomForest,0.6244914028468803,,,,,,,,,,,,,,,,,,,4,BaselinePreprocessor,RevenueQuantileBucketImputer:3-buckets,ArcSinhTargetScaler
15,15,0.5994256403222289,2024-03-07 21:12:55.910954,2024-03-07 21:13:27.795659,0 days 00:00:31.884705,99,1000.0,COMPLETE,RandomForest,0.6244914028468803,,,,,,,,,,,,,,,,,,,4,BaselinePreprocessor,RevenueQuantileBucketImputer:3-buckets,ArcSinhTargetScaler
16,16,0.6081986173951062,2024-03-07 21:13:27.796895,2024-03-07 21:13:54.682513,0 days 00:00:26.885618,24,900.0,COMPLETE,RandomForest,0.6244914028468803,,,,,,,,,,,,,,,,,,,4,BaselinePreprocessor,RevenueQuantileBucketImputer:3-buckets,ArcSinhTargetScaler
17,17,0.610606444426063,2024-03-07 21:13:54.683351,2024-03-07 21:14:32.393554,0 days 00:00:37.710203,15,1400.0,COMPLETE,RandomForest,0.6244914028468803,,,,,,,,,,,,,,,,,,,4,BaselinePreprocessor,RevenueQuantileBucketImputer:3-buckets,ArcSinhTargetScaler
18,18,0.5953695660921594,2024-03-07 21:14:32.394213,2024-03-07 21:14:46.607202,0 days 00:00:14.212989,12,600.0,COMPLETE,RandomForest,0.6244914028468803,,,,,,,,,,,,,,,,,,,4,BaselinePreprocessor,RevenueQuantileBucketImputer:3-buckets,ArcSinhTargetScaler
19,19,0.614169008315181,2024-03-07 21:14:46.607939,2024-03-07 21:15:31.592587,0 days 00:00:44.984648,63,1500.0,COMPLETE,RandomForest,0.6244914028468803,,,,,,,,,,,,,,,,,,,4,BaselinePreprocessor,RevenueQuantileBucketImputer:3-buckets,ArcSinhTargetScaler
20,20,0.5748793968279576,2024-03-07 21:15:31.593179,2024-03-07 21:15:34.312427,0 days 00:00:02.719248,30,100.0,COMPLETE,RandomForest,0.6244914028468803,,,,,,,,,,,,,,,,,,,4,BaselinePreprocessor,RevenueQuantileBucketImputer:3-buckets,ArcSinhTargetScaler
21,21,0.6244914028468803,2024-03-07 21:15:34.313081,2024-03-07 21:16:03.695159,0 days 00:00:29.382078,96,1000.0,COMPLETE,RandomForest,0.6244914028468803,,,,,,,,,,,,,,,,,,,4,BaselinePreprocessor,RevenueQuantileBucketImputer:3-buckets,ArcSinhTargetScaler
22,22,0.6035041134681792,2024-03-07 21:16:03.695937,2024-03-07 21:16:34.710567,0 days 00:00:31.014630,33,1100.0,COMPLETE,RandomForest,0.6244914028468803,,,,,,,,,,,,,,,,,,,4,BaselinePreprocessor,RevenueQuantileBucketImputer:3-buckets,ArcSinhTargetScaler
23,23,0.5962327156266469,2024-03-07 21:16:34.711297,2024-03-07 21:17:03.226450,0 days 00:00:28.515153,93,1000.0,COMPLETE,RandomForest,0.6244914028468803,,,,,,,,,,,,,,,,,,,4,BaselinePreprocessor,RevenueQuantileBucketImputer:3-buckets,ArcSinhTargetScaler
24,24,0.6035904947731268,2024-03-07 21:17:03.227267,2024-03-07 21:17:06.250615,0 days 00:00:03.023348,18,100.0,COMPLETE,RandomForest,0.6244914028468803,,,,,,,,,,,,,,,,,,,4,BaselinePreprocessor,RevenueQuantileBucketImputer:3-buckets,ArcSinhTargetScaler
25,25,0.6105445309567143,2024-03-07 21:17:06.251492,2024-03-07 21:17:39.781899,0 days 00:00:33.530407,93,1200.0,COMPLETE,RandomForest,0.6244914028468803,,,,,,,,,,,,,,,,,,,4,BaselinePreprocessor,RevenueQuantileBucketImputer:3-buckets,ArcSinhTargetScaler
26,26,0.603367887713752,2024-03-07 21:17:39.782583,2024-03-07 21:18:14.083433,0 days 00:00:34.300850,24,1200.0,COMPLETE,RandomForest,0.6244914028468803,,,,,,,,,,,,,,,,,,,4,BaselinePreprocessor,RevenueQuantileBucketImputer:3-buckets,ArcSinhTargetScaler
27,27,0.6147969296564979,2024-03-07 21:18:14.084105,2024-03-07 21:18:44.556795,0 days 00:00:30.472690,33,1100.0,COMPLETE,RandomForest,0.6244914028468803,,,,,,,,,,,,,,,,,,,4,BaselinePreprocessor,RevenueQuantileBucketImputer:3-buckets,ArcSinhTargetScaler
28,28,0.6053369872597896,2024-03-07 21:18:44.557547,2024-03-07 21:18:58.622523,0 days 00:00:14.064976,75,500.0,COMPLETE,RandomForest,0.6244914028468803,,,,,,,,,,,,,,,,,,,4,BaselinePreprocessor,RevenueQuantileBucketImputer:3-buckets,ArcSinhTargetScaler
29,29,0.5990374635209075,2024-03-07 21:18:58.623220,2024-03-07 21:19:26.793851,0 days 00:00:28.170631,57,1000.0,COMPLETE,RandomForest,0.6244914028468803,,,,,,,,,,,,,,,,,,,4,BaselinePreprocessor,RevenueQuantileBucketImputer:3-buckets,ArcSinhTargetScaler
30,30,0.594348025100134,2024-03-07 21:19:26.794379,2024-03-07 21:19:45.784120,0 days 00:00:18.989741,72,700.0,COMPLETE,RandomForest,0.6244914028468803,,,,,,,,,,,,,,,,,,,4,BaselinePreprocessor,RevenueQuantileBucketImputer:3-buckets,ArcSinhTargetScaler
31,31,0.6012049038795458,2024-03-07 21:19:45.784874,2024-03-07 21:19:48.420695,0 days 00:00:02.635821,99,100.0,COMPLETE,RandomForest,0.6244914028468803,,,,,,,,,,,,,,,,,,,4,BaselinePreprocessor,RevenueQuantileBucketImputer:3-buckets,ArcSinhTargetScaler
32,32,0.6000966473516872,2024-03-07 21:19:48.421290,2024-03-07 21:19:59.700030,0 days 00:00:11.278740,24,400.0,COMPLETE,RandomForest,0.6244914028468803,,,,,,,,,,,,,,,,,,,4,BaselinePreprocessor,RevenueQuantileBucketImputer:3-buckets,ArcSinhTargetScaler
33,33,0.6002687539908614,2024-03-07 21:19:59.700707,2024-03-07 21:20:06.327557,0 days 00:00:06.626850,90,200.0,COMPLETE,RandomForest,0.6244914028468803,,,,,,,,,,,,,,,,,,,4,BaselinePreprocessor,RevenueQuantileBucketImputer:3-buckets,ArcSinhTargetScaler
34,34,0.615269831794599,2024-03-07 21:20:06.328226,2024-03-07 21:20:20.616528,0 days 00:00:14.288302,93,500.0,COMPLETE,RandomForest,0.6244914028468803,,,,,,,,,,,,,,,,,,,4,BaselinePreprocessor,RevenueQuantileBucketImputer:3-buckets,ArcSinhTargetScaler
35,35,0.5901059270434992,2024-03-07 21:20:20.617056,2024-03-07 21:20:35.668464,0 days 00:00:15.051408,15,600.0,COMPLETE,RandomForest,0.6244914028468803,,,,,,,,,,,,,,,,,,,4,BaselinePreprocessor,RevenueQuantileBucketImputer:3-buckets,ArcSinhTargetScaler
36,36,0.591520550393558,2024-03-07 21:20:35.669005,2024-03-07 21:20:46.983751,0 days 00:00:11.314746,96,400.0,COMPLETE,RandomForest,0.6244914028468803,,,,,,,,,,,,,,,,,,,4,BaselinePreprocessor,RevenueQuantileBucketImputer:3-buckets,ArcSinhTargetScaler
37,37,0.6024490991804091,2024-03-07 21:20:46.984414,2024-03-07 21:21:14.873303,0 days 00:00:27.888889,60,1000.0,COMPLETE,RandomForest,0.6244914028468803,,,,,,,,,,,,,,,,,,,4,BaselinePreprocessor,RevenueQuantileBucketImputer:3-buckets,ArcSinhTargetScaler
38,38,0.5985615282985421,2024-03-07 21:21:14.873915,2024-03-07 21:21:28.856783,0 days 00:00:13.982868,24,500.0,COMPLETE,RandomForest,0.6244914028468803,,,,,,,,,,,,,,,,,,,4,BaselinePreprocessor,RevenueQuantileBucketImputer:3-buckets,ArcSinhTargetScaler
39,39,0.5639640043155982,2024-03-07 21:21:28.857533,2024-03-07 21:21:37.125814,0 days 00:00:08.268281,9,400.0,COMPLETE,RandomForest,0.6244914028468803,,,,,,,,,,,,,,,,,,,4,BaselinePreprocessor,RevenueQuantileBucketImputer:3-buckets,ArcSinhTargetScaler
0,0,0.6325531446913042,2024-03-07 21:22:06.572911,2024-03-07 21:22:34.312009,0 days 00:00:27.739098,45,1010.0,COMPLETE,LGBM,0.6501127851716584,0.7545107334003611,7.0,0.7134508022406294,2.9941214755248683e-07,0.6439678336876921,0.0830245186729794,61.0,9.0,,,,,,,,,,,4,BaselinePreprocessor,RevenueQuantileBucketImputer:3-buckets,ArcSinhTargetScaler
1,1,0.6159714148914089,2024-03-07 21:22:34.313535,2024-03-07 21:23:06.911047,0 days 00:00:32.597512,78,210.0,COMPLETE,LGBM,0.6501127851716584,0.9790575099893509,3.0,0.9943200301635982,1.5545227447078744e-06,1.0962443697387731e-06,0.0230655398635129,40.0,156.0,,,,,,,,,,,4,BaselinePreprocessor,RevenueQuantileBucketImputer:3-buckets,ArcSinhTargetScaler
2,2,0.6385616748535178,2024-03-07 21:23:06.912741,2024-03-07 21:23:33.627684,0 days 00:00:26.714943,12,410.0,COMPLETE,LGBM,0.6501127851716584,0.8127319003041972,6.0,0.787354980557536,1.440726445204815e-05,0.028176985152558103,0.07124291122468934,84.0,84.0,,,,,,,,,,,4,BaselinePreprocessor,RevenueQuantileBucketImputer:3-buckets,ArcSinhTargetScaler
3,3,0.6260986845537428,2024-03-07 21:23:33.631666,2024-03-07 21:23:48.579515,0 days 00:00:14.947849,3,710.0,COMPLETE,LGBM,0.6501127851716584,0.4442804586536297,1.0,0.9451272630087102,0.0012288206522247094,0.6147268567009191,0.10567031418475191,38.0,107.0,,,,,,,,,,,4,BaselinePreprocessor,RevenueQuantileBucketImputer:3-buckets,ArcSinhTargetScaler
4,4,0.619376280931978,2024-03-07 21:23:48.581347,2024-03-07 21:24:13.293308,0 days 00:00:24.711961,99,810.0,COMPLETE,LGBM,0.6501127851716584,0.9961400491503387,7.0,0.9226830958112323,7.484465619440342e-07,7.732980815625165e-05,0.20187221265303043,43.0,34.0,,,,,,,,,,,4,BaselinePreprocessor,RevenueQuantileBucketImputer:3-buckets,ArcSinhTargetScaler
5,5,0.6282085758277496,2024-03-07 21:24:13.294145,2024-03-07 21:24:19.008927,0 days 00:00:05.714782,57,310.0,COMPLETE,LGBM,0.6501127851716584,0.6058165764041592,1.0,0.5756178865558202,1.297460535759589,5.0092763028395764e-05,0.1982985503417456,14.0,90.0,,,,,,,,,,,4,BaselinePreprocessor,RevenueQuantileBucketImputer:3-buckets,ArcSinhTargetScaler
6,6,0.637340052734329,2024-03-07 21:24:19.010090,2024-03-07 21:24:45.345701,0 days 00:00:26.335611,21,1210.0,COMPLETE,LGBM,0.6501127851716584,0.9690523272770252,7.0,0.8257001989650736,9.15302861796109e-08,0.00040558994336312696,0.21541895851990234,92.0,125.0,,,,,,,,,,,4,BaselinePreprocessor,RevenueQuantileBucketImputer:3-buckets,ArcSinhTargetScaler
7,7,0.629223719283803,2024-03-07 21:24:45.347414,2024-03-07 21:25:05.012613,0 days 00:00:19.665199,87,410.0,COMPLETE,LGBM,0.6501127851716584,0.5748202266242721,1.0,0.46919050178368593,0.37872509971825885,1.2172539786171517e-06,0.014672395637918126,23.0,32.0,,,,,,,,,,,4,BaselinePreprocessor,RevenueQuantileBucketImputer:3-buckets,ArcSinhTargetScaler
8,8,0.5713203577608187,2024-03-07 21:25:05.014605,2024-03-07 21:25:05.680988,0 days 00:00:00.666383,96,10.0,COMPLETE,LGBM,0.6501127851716584,0.8967596024813623,5.0,0.6315276822863218,2.5209666626728905e-07,0.1038162535783689,0.023002534487074355,35.0,19.0,,,,,,,,,,,4,BaselinePreprocessor,RevenueQuantileBucketImputer:3-buckets,ArcSinhTargetScaler
9,9,0.6501127851716584,2024-03-07 21:25:05.682414,2024-03-07 21:25:54.103446,0 days 00:00:48.421032,87,410.0,COMPLETE,LGBM,0.6501127851716584,0.46154854906095855,3.0,0.5365659776955742,0.00038933867980010806,0.0005672415137680317,0.010699508363625614,8.0,89.0,,,,,,,,,,,4,BaselinePreprocessor,RevenueQuantileBucketImputer:3-buckets,ArcSinhTargetScaler
10,10,0.5764466318636221,2024-03-07 21:25:54.104746,2024-03-07 21:25:54.490641,0 days 00:00:00.385895,87,10.0,COMPLETE,LGBM,0.6501127851716584,0.5541499791950559,2.0,0.7356207453447281,1.9827954141644036e-05,0.10265969766091758,0.08249847865060336,89.0,67.0,,,,,,,,,,,4,BaselinePreprocessor,RevenueQuantileBucketImputer:3-buckets,ArcSinhTargetScaler
11,11,0.6405779554092375,2024-03-07 21:25:54.491639,2024-03-07 21:27:07.577900,0 days 00:01:13.086261,54,1010.0,COMPLETE,LGBM,0.6501127851716584,0.5535846034448921,4.0,0.8122193489355491,2.160206018609824e-06,1.3287317857250354e-05,0.011823697431930518,45.0,23.0,,,,,,,,,,,4,BaselinePreprocessor,RevenueQuantileBucketImputer:3-buckets,ArcSinhTargetScaler
12,12,0.6225600277397677,2024-03-07 21:27:07.579346,2024-03-07 21:27:20.793787,0 days 00:00:13.214441,30,1210.0,COMPLETE,LGBM,0.6501127851716584,0.9826971927914369,5.0,0.686926462372937,0.12862166578754117,0.00041107546741606945,0.26568946955913986,15.0,125.0,,,,,,,,,,,4,BaselinePreprocessor,RevenueQuantileBucketImputer:3-buckets,ArcSinhTargetScaler
13,13,0.6343872405027653,2024-03-07 21:27:20.798776,2024-03-07 21:27:44.279669,0 days 00:00:23.480893,93,510.0,COMPLETE,LGBM,0.6501127851716584,0.7622700957972992,3.0,0.6200859364390914,0.0002192300943232432,1.2037244807063769e-06,0.08163005173258493,89.0,80.0,,,,,,,,,,,4,BaselinePreprocessor,RevenueQuantileBucketImputer:3-buckets,ArcSinhTargetScaler
14,14,0.6365679261169904,2024-03-07 21:27:44.282720,2024-03-07 21:27:54.712452,0 days 00:00:10.429732,6,710.0,COMPLETE,LGBM,0.6501127851716584,0.5621746069661695,3.0,0.4149005057947327,0.0006548598829028968,0.397634492716054,0.23936866777285645,71.0,188.0,,,,,,,,,,,4,BaselinePreprocessor,RevenueQuantileBucketImputer:3-buckets,ArcSinhTargetScaler
15,15,0.6340995277725859,2024-03-07 21:27:54.713554,2024-03-07 21:28:20.638911,0 days 00:00:25.925357,66,510.0,COMPLETE,LGBM,0.6501127851716584,0.5799112682323023,4.0,0.9479241272177198,4.854791052998671e-07,2.891435480534406e-07,0.032245206729967654,48.0,13.0,,,,,,,,,,,4,BaselinePreprocessor,RevenueQuantileBucketImputer:3-buckets,ArcSinhTargetScaler
16,16,0.6255218834635922,2024-03-07 21:28:20.639860,2024-03-07 21:28:36.469057,0 days 00:00:15.829197,51,310.0,COMPLETE,LGBM,0.6501127851716584,0.7683799277004852,7.0,0.44182491541446905,1.2162056774335939,3.3857727517577416e-05,0.013418871674196578,14.0,164.0,,,,,,,,,,,4,BaselinePreprocessor,RevenueQuantileBucketImputer:3-buckets,ArcSinhTargetScaler
17,17,0.6436145385659172,2024-03-07 21:28:36.469983,2024-03-07 21:28:46.398314,0 days 00:00:09.928331,30,1010.0,COMPLETE,LGBM,0.6501127851716584,0.8355180597304156,6.0,0.751277215182508,2.6964063891409134,0.09036605899813055,0.16928645114035507,91.0,236.0,,,,,,,,,,,4,BaselinePreprocessor,RevenueQuantileBucketImputer:3-buckets,ArcSinhTargetScaler
18,18,0.6239254097656735,2024-03-07 21:28:46.399527,2024-03-07 21:29:32.737761,0 days 00:00:46.338234,42,1310.0,COMPLETE,LGBM,0.6501127851716584,0.9728062201020216,4.0,0.6553086235200305,2.5316719748251625e-08,1.2154032993390416e-08,0.06778504320119697,19.0,193.0,,,,,,,,,,,4,BaselinePreprocessor,RevenueQuantileBucketImputer:3-buckets,ArcSinhTargetScaler
19,19,0.593333107315447,2024-03-07 21:29:32.739264,2024-03-07 21:29:40.652536,0 days 00:00:07.913272,12,210.0,COMPLETE,LGBM,0.6501127851716584,0.6078369526664331,7.0,0.8293688639723071,0.033685055557490545,0.17143711497155203,0.012812060795752391,83.0,224.0,,,,,,,,,,,4,BaselinePreprocessor,RevenueQuantileBucketImputer:3-buckets,ArcSinhTargetScaler
20,20,0.637392341606898,2024-03-07 21:29:40.654237,2024-03-07 21:29:56.434531,0 days 00:00:15.780294,33,210.0,COMPLETE,LGBM,0.6501127851716584,0.8474410216093267,1.0,0.7937813510793197,0.0008927079957156037,0.1585221931429192,0.28952919339683014,17.0,53.0,,,,,,,,,,,4,BaselinePreprocessor,RevenueQuantileBucketImputer:3-buckets,ArcSinhTargetScaler
21,21,0.6416681360759433,2024-03-07 21:29:56.435736,2024-03-07 21:30:30.127507,0 days 00:00:33.691771,21,710.0,COMPLETE,LGBM,0.6501127851716584,0.8331497163797521,7.0,0.6960047354539192,2.9195636790243343e-07,0.1092004538601066,0.0454895271580046,72.0,98.0,,,,,,,,,,,4,BaselinePreprocessor,RevenueQuantileBucketImputer:3-buckets,ArcSinhTargetScaler
22,22,0.6472091229908395,2024-03-07 21:30:30.129041,2024-03-07 21:30:51.752015,0 days 00:00:21.622974,9,1110.0,COMPLETE,LGBM,0.6501127851716584,0.6779539737569655,1.0,0.758571002000904,6.55656220498645e-05,6.128530948074171e-05,0.16617737066668758,38.0,43.0,,,,,,,,,,,4,BaselinePreprocessor,RevenueQuantileBucketImputer:3-buckets,ArcSinhTargetScaler
23,23,0.6247769680837874,2024-03-07 21:30:51.753691,2024-03-07 21:30:59.899537,0 days 00:00:08.145846,30,1010.0,COMPLETE,LGBM,0.6501127851716584,0.6655339857019535,1.0,0.4779064011515846,3.661458186564816,2.796559293164278,0.21051470633611177,61.0,182.0,,,,,,,,,,,4,BaselinePreprocessor,RevenueQuantileBucketImputer:3-buckets,ArcSinhTargetScaler
24,24,0.627806305078434,2024-03-07 21:30:59.900939,2024-03-07 21:31:09.616658,0 days 00:00:09.715719,69,410.0,COMPLETE,LGBM,0.6501127851716584,0.8910731851910612,2.0,0.4236353874073076,1.676268197457628,0.0020872374999958546,0.03858431500672863,96.0,159.0,,,,,,,,,,,4,BaselinePreprocessor,RevenueQuantileBucketImputer:3-buckets,ArcSinhTargetScaler
25,25,0.5845179862670012,2024-03-07 21:31:09.618024,2024-03-07 21:31:13.805167,0 days 00:00:04.187143,33,110.0,COMPLETE,LGBM,0.6501127851716584,0.6346357683640604,3.0,0.7649995703433,4.2191067334104267e-08,3.5627656828956736e-06,0.013687688093301696,92.0,81.0,,,,,,,,,,,4,BaselinePreprocessor,RevenueQuantileBucketImputer:3-buckets,ArcSinhTargetScaler
26,26,0.6298513352302023,2024-03-07 21:31:13.806670,2024-03-07 21:31:31.284083,0 days 00:00:17.477413,84,410.0,COMPLETE,LGBM,0.6501127851716584,0.5074631173851949,2.0,0.6392877945219527,1.9481490005028724e-06,0.1525892552424945,0.09364486861480308,74.0,219.0,,,,,,,,,,,4,BaselinePreprocessor,RevenueQuantileBucketImputer:3-buckets,ArcSinhTargetScaler
27,27,0.6383162581627775,2024-03-07 21:31:31.287839,2024-03-07 21:33:57.483966,0 days 00:02:26.196127,42,1310.0,COMPLETE,LGBM,0.6501127851716584,0.8663661391572895,2.0,0.9821495933554989,0.00041743283729501243,9.944041581754517e-08,0.016145184581433422,31.0,72.0,,,,,,,,,,,4,BaselinePreprocessor,RevenueQuantileBucketImputer:3-buckets,ArcSinhTargetScaler
28,28,0.6394809768108741,2024-03-07 21:33:57.486458,2024-03-07 21:34:55.762651,0 days 00:00:58.276193,27,810.0,COMPLETE,LGBM,0.6501127851716584,0.4493430751052239,6.0,0.7003722573825284,5.633247427185281e-07,1.105651757537145e-08,0.02345035486252805,30.0,232.0,,,,,,,,,,,4,BaselinePreprocessor,RevenueQuantileBucketImputer:3-buckets,ArcSinhTargetScaler
29,29,0.6049762840854417,2024-03-07 21:34:55.764172,2024-03-07 21:34:59.340938,0 days 00:00:03.576766,6,110.0,COMPLETE,LGBM,0.6501127851716584,0.4903274276025589,3.0,0.8955790681037628,2.57241217487394e-08,1.1640509749264103,0.21269834507443924,73.0,132.0,,,,,,,,,,,4,BaselinePreprocessor,RevenueQuantileBucketImputer:3-buckets,ArcSinhTargetScaler
30,30,0.5605118055675558,2024-03-07 21:34:59.342212,2024-03-07 21:34:59.579187,0 days 00:00:00.236975,21,10.0,COMPLETE,LGBM,0.6501127851716584,0.8699803286526634,5.0,0.6494298397635088,0.001210234535850638,0.005199439552893773,0.15246690156488774,10.0,4.0,,,,,,,,,,,4,BaselinePreprocessor,RevenueQuantileBucketImputer:3-buckets,ArcSinhTargetScaler
31,31,0.6217357158506971,2024-03-07 21:34:59.580344,2024-03-07 21:35:14.757094,0 days 00:00:15.176750,27,710.0,COMPLETE,LGBM,0.6501127851716584,0.8837678574210772,5.0,0.8314936562278517,0.01424904408693151,0.028708718417460154,0.21033955746660965,81.0,72.0,,,,,,,,,,,4,BaselinePreprocessor,RevenueQuantileBucketImputer:3-buckets,ArcSinhTargetScaler
32,32,0.6403767540433452,2024-03-07 21:35:14.758586,2024-03-07 21:36:07.909255,0 days 00:00:53.150669,6,1210.0,COMPLETE,LGBM,0.6501127851716584,0.7671861652671806,1.0,0.7600336919484889,0.7312978507517938,4.876810516091875e-08,0.020664981376323843,17.0,104.0,,,,,,,,,,,4,BaselinePreprocessor,RevenueQuantileBucketImputer:3-buckets,ArcSinhTargetScaler
33,33,0.5797364692403972,2024-03-07 21:36:07.912167,2024-03-07 21:36:09.537907,0 days 00:00:01.625740,96,10.0,COMPLETE,LGBM,0.6501127851716584,0.9971667194272634,3.0,0.8422397609545416,0.015902927993204488,0.0002520673753532273,0.12721204581956913,23.0,249.0,,,,,,,,,,,4,BaselinePreprocessor,RevenueQuantileBucketImputer:3-buckets,ArcSinhTargetScaler
34,34,0.6420564314767913,2024-03-07 21:36:09.539048,2024-03-07 21:36:34.931796,0 days 00:00:25.392748,6,810.0,COMPLETE,LGBM,0.6501127851716584,0.7979807547184404,1.0,0.5933258905782639,3.020374377271231e-08,3.3032496207306413e-06,0.06917325318411432,64.0,106.0,,,,,,,,,,,4,BaselinePreprocessor,RevenueQuantileBucketImputer:3-buckets,ArcSinhTargetScaler
35,35,0.6193228799180035,2024-03-07 21:36:34.933000,2024-03-07 21:36:51.696816,0 days 00:00:16.763816,21,310.0,COMPLETE,LGBM,0.6501127851716584,0.6782610245292436,1.0,0.9923374843259768,0.002548989416921898,0.005608123189696456,0.12012975650539214,83.0,61.0,,,,,,,,,,,4,BaselinePreprocessor,RevenueQuantileBucketImputer:3-buckets,ArcSinhTargetScaler
