,number,value,datetime_start,datetime_complete,duration,params_max_depth,params_n_estimators,state,model,best_value,params_bagging_fraction,params_bagging_freq,params_feature_fraction,params_lambda_l1,params_lambda_l2,params_learning_rate,params_min_child_samples,params_num_leaves,params_alpha,params_booster,params_eta,params_gamma,params_grow_policy,params_lambda,params_normalize_type,params_rate_drop,params_sample_type,params_skip_drop,config_id,preprocessor,imputer,target_scaler
35,35,0.44753246078593095,2024-03-08 06:02:50.298915,2024-03-08 06:03:10.665795,0 days 00:00:20.366880,1,,COMPLETE,XGB,0.637897134320953,,,,,,,,,2.0907173757629428e-05,dart,0.001956985931087817,2.7227605153710094e-05,depthwise,0.44689337110029403,forest,0.30639045672482434,uniform,7.469739738244651e-07,11,IIDPreprocessor,DummyImputer,DummyTargetScaler
36,36,0.5789216090230056,2024-03-08 06:03:10.667693,2024-03-08 06:03:52.498698,0 days 00:00:41.831005,4,,COMPLETE,XGB,0.637897134320953,,,,,,,,,6.252590479729631e-08,dart,1.9114210947516627e-07,0.9464895812330347,lossguide,0.019323754733982654,tree,0.009728118500686136,weighted,0.00015659997371578842,11,IIDPreprocessor,DummyImputer,DummyTargetScaler
37,37,0.5242328723108491,2024-03-08 06:03:52.500258,2024-03-08 06:04:23.467196,0 days 00:00:30.966938,2,,COMPLETE,XGB,0.637897134320953,,,,,,,,,0.0010354824246107614,dart,7.191040602641327e-08,0.013385156931301845,depthwise,7.145737586581639e-06,forest,7.269005709119756e-06,weighted,1.057944299249052e-08,11,IIDPreprocessor,DummyImputer,DummyTargetScaler
38,38,0.5310936428458122,2024-03-08 06:04:23.469024,2024-03-08 06:04:51.883240,0 days 00:00:28.414216,2,,COMPLETE,XGB,0.637897134320953,,,,,,,,,0.0015521081024587168,dart,2.714432099451919e-06,0.042954418615797615,lossguide,1.735916046119501e-08,tree,1.0845107170998497e-06,weighted,0.08381837559721553,11,IIDPreprocessor,DummyImputer,DummyTargetScaler
39,39,0.5698210449558577,2024-03-08 06:04:51.885531,2024-03-08 06:05:39.360324,0 days 00:00:47.474793,5,,COMPLETE,XGB,0.637897134320953,,,,,,,,,6.94338887872295e-07,dart,0.00034535008976198085,8.143130530123884e-05,depthwise,2.983403258048298e-06,forest,0.001620307449778266,weighted,7.665150479327602e-05,11,IIDPreprocessor,DummyImputer,DummyTargetScaler
0,0,0.6142382033323399,2024-03-08 06:06:58.338716,2024-03-08 06:07:25.043556,0 days 00:00:26.704840,69,900.0,COMPLETE,RandomForest,0.6214447121527871,,,,,,,,,,,,,,,,,,,12,IIDPreprocessor,RevenueQuantileBucketImputer:3-buckets,LogTargetScaler
1,1,0.6124857731167637,2024-03-08 06:07:25.044760,2024-03-08 06:07:51.909925,0 days 00:00:26.865165,72,900.0,COMPLETE,RandomForest,0.6214447121527871,,,,,,,,,,,,,,,,,,,12,IIDPreprocessor,RevenueQuantileBucketImputer:3-buckets,LogTargetScaler
2,2,0.6073462997608833,2024-03-08 06:07:51.910857,2024-03-08 06:08:14.775341,0 days 00:00:22.864484,72,800.0,COMPLETE,RandomForest,0.6214447121527871,,,,,,,,,,,,,,,,,,,12,IIDPreprocessor,RevenueQuantileBucketImputer:3-buckets,LogTargetScaler
3,3,0.6117814101069079,2024-03-08 06:08:14.775939,2024-03-08 06:08:51.977791,0 days 00:00:37.201852,57,1300.0,COMPLETE,RandomForest,0.6214447121527871,,,,,,,,,,,,,,,,,,,12,IIDPreprocessor,RevenueQuantileBucketImputer:3-buckets,LogTargetScaler
4,4,0.6161312662400638,2024-03-08 06:08:51.978741,2024-03-08 06:09:23.622448,0 days 00:00:31.643707,57,1100.0,COMPLETE,RandomForest,0.6214447121527871,,,,,,,,,,,,,,,,,,,12,IIDPreprocessor,RevenueQuantileBucketImputer:3-buckets,LogTargetScaler
5,5,0.5936611094810459,2024-03-08 06:09:23.623084,2024-03-08 06:09:46.323502,0 days 00:00:22.700418,87,800.0,COMPLETE,RandomForest,0.6214447121527871,,,,,,,,,,,,,,,,,,,12,IIDPreprocessor,RevenueQuantileBucketImputer:3-buckets,LogTargetScaler
6,6,0.5933691607205432,2024-03-08 06:09:46.324395,2024-03-08 06:10:17.823848,0 days 00:00:31.499453,15,1100.0,COMPLETE,RandomForest,0.6214447121527871,,,,,,,,,,,,,,,,,,,12,IIDPreprocessor,RevenueQuantileBucketImputer:3-buckets,LogTargetScaler
7,7,0.6128025881003486,2024-03-08 06:10:17.824721,2024-03-08 06:10:58.458151,0 days 00:00:40.633430,21,1400.0,COMPLETE,RandomForest,0.6214447121527871,,,,,,,,,,,,,,,,,,,12,IIDPreprocessor,RevenueQuantileBucketImputer:3-buckets,LogTargetScaler
8,8,0.5991310519019678,2024-03-08 06:10:58.458830,2024-03-08 06:11:14.199992,0 days 00:00:15.741162,21,500.0,COMPLETE,RandomForest,0.6214447121527871,,,,,,,,,,,,,,,,,,,12,IIDPreprocessor,RevenueQuantileBucketImputer:3-buckets,LogTargetScaler
9,9,0.5952337706662583,2024-03-08 06:11:14.200607,2024-03-08 06:11:51.221813,0 days 00:00:37.021206,30,1300.0,COMPLETE,RandomForest,0.6214447121527871,,,,,,,,,,,,,,,,,,,12,IIDPreprocessor,RevenueQuantileBucketImputer:3-buckets,LogTargetScaler
10,10,0.35226711775735936,2024-03-08 06:11:51.222714,2024-03-08 06:12:04.435096,0 days 00:00:13.212382,3,1400.0,COMPLETE,RandomForest,0.6214447121527871,,,,,,,,,,,,,,,,,,,12,IIDPreprocessor,RevenueQuantileBucketImputer:3-buckets,LogTargetScaler
11,11,0.595124065574893,2024-03-08 06:12:04.436000,2024-03-08 06:12:10.007796,0 days 00:00:05.571796,84,200.0,COMPLETE,RandomForest,0.6214447121527871,,,,,,,,,,,,,,,,,,,12,IIDPreprocessor,RevenueQuantileBucketImputer:3-buckets,LogTargetScaler
12,12,0.6214447121527871,2024-03-08 06:12:10.008439,2024-03-08 06:12:46.726394,0 days 00:00:36.717955,96,1300.0,COMPLETE,RandomForest,0.6214447121527871,,,,,,,,,,,,,,,,,,,12,IIDPreprocessor,RevenueQuantileBucketImputer:3-buckets,LogTargetScaler
13,13,0.6078844971041525,2024-03-08 06:12:46.727202,2024-03-08 06:13:29.799759,0 days 00:00:43.072557,51,1500.0,COMPLETE,RandomForest,0.6214447121527871,,,,,,,,,,,,,,,,,,,12,IIDPreprocessor,RevenueQuantileBucketImputer:3-buckets,LogTargetScaler
14,14,0.5984537887127709,2024-03-08 06:13:29.800386,2024-03-08 06:13:41.295975,0 days 00:00:11.495589,75,400.0,COMPLETE,RandomForest,0.6214447121527871,,,,,,,,,,,,,,,,,,,12,IIDPreprocessor,RevenueQuantileBucketImputer:3-buckets,LogTargetScaler
15,15,0.602786184678964,2024-03-08 06:13:41.296848,2024-03-08 06:14:07.019795,0 days 00:00:25.722947,96,900.0,COMPLETE,RandomForest,0.6214447121527871,,,,,,,,,,,,,,,,,,,12,IIDPreprocessor,RevenueQuantileBucketImputer:3-buckets,LogTargetScaler
16,16,0.6013739992462875,2024-03-08 06:14:07.020449,2024-03-08 06:14:16.103922,0 days 00:00:09.083473,24,300.0,COMPLETE,RandomForest,0.6214447121527871,,,,,,,,,,,,,,,,,,,12,IIDPreprocessor,RevenueQuantileBucketImputer:3-buckets,LogTargetScaler
17,17,0.5949471495929495,2024-03-08 06:14:16.104579,2024-03-08 06:14:25.197633,0 days 00:00:09.093054,96,300.0,COMPLETE,RandomForest,0.6214447121527871,,,,,,,,,,,,,,,,,,,12,IIDPreprocessor,RevenueQuantileBucketImputer:3-buckets,LogTargetScaler
18,18,0.5537433984564566,2024-03-08 06:14:25.198407,2024-03-08 06:14:55.894209,0 days 00:00:30.695802,9,1500.0,COMPLETE,RandomForest,0.6214447121527871,,,,,,,,,,,,,,,,,,,12,IIDPreprocessor,RevenueQuantileBucketImputer:3-buckets,LogTargetScaler
19,19,0.6102017315049258,2024-03-08 06:14:55.894953,2024-03-08 06:15:23.537856,0 days 00:00:27.642903,33,900.0,COMPLETE,RandomForest,0.6214447121527871,,,,,,,,,,,,,,,,,,,12,IIDPreprocessor,RevenueQuantileBucketImputer:3-buckets,LogTargetScaler
20,20,0.5414429022775772,2024-03-08 06:15:23.538465,2024-03-08 06:15:37.086186,0 days 00:00:13.547721,9,700.0,COMPLETE,RandomForest,0.6214447121527871,,,,,,,,,,,,,,,,,,,12,IIDPreprocessor,RevenueQuantileBucketImputer:3-buckets,LogTargetScaler
21,21,0.6083332584390094,2024-03-08 06:15:37.087108,2024-03-08 06:16:23.366340,0 days 00:00:46.279232,57,1500.0,COMPLETE,RandomForest,0.6214447121527871,,,,,,,,,,,,,,,,,,,12,IIDPreprocessor,RevenueQuantileBucketImputer:3-buckets,LogTargetScaler
22,22,0.6148234374475166,2024-03-08 06:16:23.367201,2024-03-08 06:16:50.505654,0 days 00:00:27.138453,27,900.0,COMPLETE,RandomForest,0.6214447121527871,,,,,,,,,,,,,,,,,,,12,IIDPreprocessor,RevenueQuantileBucketImputer:3-buckets,LogTargetScaler
23,23,0.6115769206631215,2024-03-08 06:16:50.506375,2024-03-08 06:17:26.429109,0 days 00:00:35.922734,96,1200.0,COMPLETE,RandomForest,0.6214447121527871,,,,,,,,,,,,,,,,,,,12,IIDPreprocessor,RevenueQuantileBucketImputer:3-buckets,LogTargetScaler
24,24,0.5999400250211426,2024-03-08 06:17:26.429754,2024-03-08 06:17:43.367799,0 days 00:00:16.938045,69,600.0,COMPLETE,RandomForest,0.6214447121527871,,,,,,,,,,,,,,,,,,,12,IIDPreprocessor,RevenueQuantileBucketImputer:3-buckets,LogTargetScaler
25,25,0.6025422365911101,2024-03-08 06:17:43.368677,2024-03-08 06:18:25.030757,0 days 00:00:41.662080,18,1500.0,COMPLETE,RandomForest,0.6214447121527871,,,,,,,,,,,,,,,,,,,12,IIDPreprocessor,RevenueQuantileBucketImputer:3-buckets,LogTargetScaler
26,26,0.618972102593772,2024-03-08 06:18:25.031459,2024-03-08 06:18:30.624542,0 days 00:00:05.593083,42,200.0,COMPLETE,RandomForest,0.6214447121527871,,,,,,,,,,,,,,,,,,,12,IIDPreprocessor,RevenueQuantileBucketImputer:3-buckets,LogTargetScaler
27,27,0.599515933403012,2024-03-08 06:18:30.625145,2024-03-08 06:18:52.701098,0 days 00:00:22.075953,99,800.0,COMPLETE,RandomForest,0.6214447121527871,,,,,,,,,,,,,,,,,,,12,IIDPreprocessor,RevenueQuantileBucketImputer:3-buckets,LogTargetScaler
28,28,0.568778981638674,2024-03-08 06:18:52.701786,2024-03-08 06:18:55.608854,0 days 00:00:02.907068,45,100.0,COMPLETE,RandomForest,0.6214447121527871,,,,,,,,,,,,,,,,,,,12,IIDPreprocessor,RevenueQuantileBucketImputer:3-buckets,LogTargetScaler
29,29,0.3454631051820823,2024-03-08 06:18:55.609818,2024-03-08 06:19:05.113300,0 days 00:00:09.503482,3,1000.0,COMPLETE,RandomForest,0.6214447121527871,,,,,,,,,,,,,,,,,,,12,IIDPreprocessor,RevenueQuantileBucketImputer:3-buckets,LogTargetScaler
30,30,0.5954079501939988,2024-03-08 06:19:05.114096,2024-03-08 06:19:10.542698,0 days 00:00:05.428602,15,200.0,COMPLETE,RandomForest,0.6214447121527871,,,,,,,,,,,,,,,,,,,12,IIDPreprocessor,RevenueQuantileBucketImputer:3-buckets,LogTargetScaler
31,31,0.35007450416912494,2024-03-08 06:19:10.543358,2024-03-08 06:19:18.534987,0 days 00:00:07.991629,3,900.0,COMPLETE,RandomForest,0.6214447121527871,,,,,,,,,,,,,,,,,,,12,IIDPreprocessor,RevenueQuantileBucketImputer:3-buckets,LogTargetScaler
32,32,0.6100652954335181,2024-03-08 06:19:18.535778,2024-03-08 06:19:50.134602,0 days 00:00:31.598824,87,1100.0,COMPLETE,RandomForest,0.6214447121527871,,,,,,,,,,,,,,,,,,,12,IIDPreprocessor,RevenueQuantileBucketImputer:3-buckets,LogTargetScaler
33,33,0.6011618523393576,2024-03-08 06:19:50.135480,2024-03-08 06:20:33.390466,0 days 00:00:43.254986,54,1400.0,COMPLETE,RandomForest,0.6214447121527871,,,,,,,,,,,,,,,,,,,12,IIDPreprocessor,RevenueQuantileBucketImputer:3-buckets,LogTargetScaler
34,34,0.5974027432124186,2024-03-08 06:20:33.391236,2024-03-08 06:20:38.927294,0 days 00:00:05.536058,21,200.0,COMPLETE,RandomForest,0.6214447121527871,,,,,,,,,,,,,,,,,,,12,IIDPreprocessor,RevenueQuantileBucketImputer:3-buckets,LogTargetScaler
35,35,0.48266355695834146,2024-03-08 06:20:38.927973,2024-03-08 06:20:40.430993,0 days 00:00:01.503020,6,100.0,COMPLETE,RandomForest,0.6214447121527871,,,,,,,,,,,,,,,,,,,12,IIDPreprocessor,RevenueQuantileBucketImputer:3-buckets,LogTargetScaler
36,36,0.4837714134188889,2024-03-08 06:20:40.431660,2024-03-08 06:20:57.273849,0 days 00:00:16.842189,6,1100.0,COMPLETE,RandomForest,0.6214447121527871,,,,,,,,,,,,,,,,,,,12,IIDPreprocessor,RevenueQuantileBucketImputer:3-buckets,LogTargetScaler
37,37,0.6100766728520262,2024-03-08 06:20:57.274735,2024-03-08 06:21:42.095394,0 days 00:00:44.820659,84,1500.0,COMPLETE,RandomForest,0.6214447121527871,,,,,,,,,,,,,,,,,,,12,IIDPreprocessor,RevenueQuantileBucketImputer:3-buckets,LogTargetScaler
38,38,0.6050687923375531,2024-03-08 06:21:42.096057,2024-03-08 06:21:59.189712,0 days 00:00:17.093655,69,600.0,COMPLETE,RandomForest,0.6214447121527871,,,,,,,,,,,,,,,,,,,12,IIDPreprocessor,RevenueQuantileBucketImputer:3-buckets,LogTargetScaler
39,39,0.6113774250900335,2024-03-08 06:21:59.190614,2024-03-08 06:22:26.241082,0 days 00:00:27.050468,63,900.0,COMPLETE,RandomForest,0.6214447121527871,,,,,,,,,,,,,,,,,,,12,IIDPreprocessor,RevenueQuantileBucketImputer:3-buckets,LogTargetScaler
0,0,0.6415835744798752,2024-03-08 06:23:03.794989,2024-03-08 06:23:33.387912,0 days 00:00:29.592923,60,210.0,COMPLETE,LGBM,0.6524361889277908,0.8347011645404733,7.0,0.5242622077845174,0.10737328780777432,8.286557607085946e-06,0.0168921201169175,5.0,124.0,,,,,,,,,,,12,IIDPreprocessor,RevenueQuantileBucketImputer:3-buckets,LogTargetScaler
1,1,0.6361266649973699,2024-03-08 06:23:33.388777,2024-03-08 06:23:59.259892,0 days 00:00:25.871115,72,510.0,COMPLETE,LGBM,0.6524361889277908,0.9589038194670274,5.0,0.8056914946332872,0.1345582312656642,0.006854968146590408,0.03565649559837851,87.0,112.0,,,,,,,,,,,12,IIDPreprocessor,RevenueQuantileBucketImputer:3-buckets,LogTargetScaler
2,2,0.594566747057233,2024-03-08 06:23:59.261296,2024-03-08 06:24:18.354470,0 days 00:00:19.093174,45,1110.0,COMPLETE,LGBM,0.6524361889277908,0.7169158968279763,7.0,0.7563873875716347,3.4653317151129537,0.0001459672119840784,0.048683044816516474,14.0,126.0,,,,,,,,,,,12,IIDPreprocessor,RevenueQuantileBucketImputer:3-buckets,LogTargetScaler
3,3,0.6203870951671561,2024-03-08 06:24:18.355843,2024-03-08 06:24:24.286783,0 days 00:00:05.930940,87,110.0,COMPLETE,LGBM,0.6524361889277908,0.8717784580810718,4.0,0.8196385085448408,7.681756290341208e-08,4.309165287370243,0.07600194796237937,53.0,112.0,,,,,,,,,,,12,IIDPreprocessor,RevenueQuantileBucketImputer:3-buckets,LogTargetScaler
4,4,0.6016130695524434,2024-03-08 06:24:24.287984,2024-03-08 06:24:35.198184,0 days 00:00:10.910200,51,310.0,COMPLETE,LGBM,0.6524361889277908,0.5911023979391092,7.0,0.7643091687231305,0.007473094722815232,1.2622844166498118e-07,0.011612970319256724,84.0,104.0,,,,,,,,,,,12,IIDPreprocessor,RevenueQuantileBucketImputer:3-buckets,LogTargetScaler
5,5,0.6524361889277908,2024-03-08 06:24:35.199591,2024-03-08 06:25:14.932635,0 days 00:00:39.733044,6,1110.0,COMPLETE,LGBM,0.6524361889277908,0.5982456777105624,7.0,0.9538066626556871,1.7621105758953766e-05,0.00023679632996948086,0.08556730269546828,63.0,52.0,,,,,,,,,,,12,IIDPreprocessor,RevenueQuantileBucketImputer:3-buckets,LogTargetScaler
6,6,0.5832101365257469,2024-03-08 06:25:14.943152,2024-03-08 06:25:22.238062,0 days 00:00:07.294910,6,410.0,COMPLETE,LGBM,0.6524361889277908,0.5780388909513514,2.0,0.7645043371556621,8.260253352020532,2.100018994611613e-07,0.017686467297309532,71.0,20.0,,,,,,,,,,,12,IIDPreprocessor,RevenueQuantileBucketImputer:3-buckets,LogTargetScaler
7,7,0.6006342449435371,2024-03-08 06:25:22.239472,2024-03-08 06:25:39.449500,0 days 00:00:17.210028,69,910.0,COMPLETE,LGBM,0.6524361889277908,0.408988016896657,7.0,0.8954494391831651,0.00023722989938730624,8.454415809580668,0.01212405236138079,97.0,142.0,,,,,,,,,,,12,IIDPreprocessor,RevenueQuantileBucketImputer:3-buckets,LogTargetScaler
8,8,0.6307683219412763,2024-03-08 06:25:39.450582,2024-03-08 06:26:01.145520,0 days 00:00:21.694938,78,310.0,COMPLETE,LGBM,0.6524361889277908,0.9808585442618377,6.0,0.7707602039204842,0.15941337095650282,2.4174886548242784e-07,0.03412164656133665,53.0,160.0,,,,,,,,,,,12,IIDPreprocessor,RevenueQuantileBucketImputer:3-buckets,LogTargetScaler
9,9,0.5565333484767061,2024-03-08 06:26:01.147152,2024-03-08 06:26:01.459386,0 days 00:00:00.312234,3,10.0,COMPLETE,LGBM,0.6524361889277908,0.6935986187133438,3.0,0.5914339367660227,7.614612621493191,0.0019196076252580806,0.03164279452798156,51.0,102.0,,,,,,,,,,,12,IIDPreprocessor,RevenueQuantileBucketImputer:3-buckets,LogTargetScaler
10,10,0.5684324069481715,2024-03-08 06:26:01.460536,2024-03-08 06:26:02.497550,0 days 00:00:01.037014,6,10.0,COMPLETE,LGBM,0.6524361889277908,0.8105712419398436,6.0,0.9910496765513684,0.014025361097629004,6.820763890260081e-05,0.027201771646992758,35.0,175.0,,,,,,,,,,,12,IIDPreprocessor,RevenueQuantileBucketImputer:3-buckets,LogTargetScaler
11,11,0.6482370230919839,2024-03-08 06:26:02.499145,2024-03-08 06:27:01.202559,0 days 00:00:58.703414,81,910.0,COMPLETE,LGBM,0.6524361889277908,0.5118862798609344,4.0,0.5791414944091622,9.453044302541982e-07,8.509361978554508e-05,0.011350186466907152,42.0,238.0,,,,,,,,,,,12,IIDPreprocessor,RevenueQuantileBucketImputer:3-buckets,LogTargetScaler
12,12,0.6295275160696481,2024-03-08 06:27:01.209310,2024-03-08 06:27:13.714344,0 days 00:00:12.505034,81,210.0,COMPLETE,LGBM,0.6524361889277908,0.9832284745650728,5.0,0.8843681809186332,2.3965248439755996e-07,3.8472447486934105e-05,0.2881309233944028,69.0,156.0,,,,,,,,,,,12,IIDPreprocessor,RevenueQuantileBucketImputer:3-buckets,LogTargetScaler
13,13,0.6354520606724967,2024-03-08 06:27:13.715801,2024-03-08 06:27:26.966231,0 days 00:00:13.250430,48,410.0,COMPLETE,LGBM,0.6524361889277908,0.5144941617494495,7.0,0.6723260519206917,0.00013933115199178786,1.487012055821625,0.09059056870752356,54.0,253.0,,,,,,,,,,,12,IIDPreprocessor,RevenueQuantileBucketImputer:3-buckets,LogTargetScaler
14,14,0.6260202105078254,2024-03-08 06:27:26.967954,2024-03-08 06:27:48.976900,0 days 00:00:22.008946,51,410.0,COMPLETE,LGBM,0.6524361889277908,0.8781040334383301,7.0,0.7914521323986465,3.122617513734594e-08,4.610784514478357e-08,0.06075878452955702,82.0,15.0,,,,,,,,,,,12,IIDPreprocessor,RevenueQuantileBucketImputer:3-buckets,LogTargetScaler
15,15,0.6375045634365398,2024-03-08 06:27:48.978187,2024-03-08 06:28:02.756820,0 days 00:00:13.778633,63,310.0,COMPLETE,LGBM,0.6524361889277908,0.7518055560766255,5.0,0.5184695017059597,8.934069590631008e-08,0.05099571832767295,0.04863610408335656,79.0,212.0,,,,,,,,,,,12,IIDPreprocessor,RevenueQuantileBucketImputer:3-buckets,LogTargetScaler
16,16,0.6398305876448251,2024-03-08 06:28:02.758419,2024-03-08 06:28:32.157863,0 days 00:00:29.399444,96,1310.0,COMPLETE,LGBM,0.6524361889277908,0.7010858357827514,6.0,0.9191173809214761,0.13252877350786696,0.020540807153833763,0.08085871563532242,12.0,88.0,,,,,,,,,,,12,IIDPreprocessor,RevenueQuantileBucketImputer:3-buckets,LogTargetScaler
17,17,0.624641364514947,2024-03-08 06:28:32.159097,2024-03-08 06:29:01.353115,0 days 00:00:29.194018,9,810.0,COMPLETE,LGBM,0.6524361889277908,0.9957846212438624,5.0,0.8266990306569242,6.023217867424499e-08,3.9562112222003045e-07,0.1413748575318833,30.0,200.0,,,,,,,,,,,12,IIDPreprocessor,RevenueQuantileBucketImputer:3-buckets,LogTargetScaler
18,18,0.6197965966946442,2024-03-08 06:29:01.354338,2024-03-08 06:29:12.672925,0 days 00:00:11.318587,45,210.0,COMPLETE,LGBM,0.6524361889277908,0.44759851053703287,7.0,0.9949871216376113,0.0003914757463664403,3.4494221755531735e-08,0.061723723337412516,71.0,95.0,,,,,,,,,,,12,IIDPreprocessor,RevenueQuantileBucketImputer:3-buckets,LogTargetScaler
19,19,0.6387319949956904,2024-03-08 06:29:12.674451,2024-03-08 06:29:35.384884,0 days 00:00:22.710433,69,710.0,COMPLETE,LGBM,0.6524361889277908,0.581213417671696,6.0,0.7698961809071723,1.4556590013510496e-05,8.12986344294251e-07,0.13520845541728505,69.0,44.0,,,,,,,,,,,12,IIDPreprocessor,RevenueQuantileBucketImputer:3-buckets,LogTargetScaler
20,20,0.6310761295956983,2024-03-08 06:29:35.386391,2024-03-08 06:30:35.765959,0 days 00:01:00.379568,54,1010.0,COMPLETE,LGBM,0.6524361889277908,0.9623939538843682,1.0,0.9916139428599107,0.00029802989992125714,0.2890029535018168,0.04212403037855339,98.0,251.0,,,,,,,,,,,12,IIDPreprocessor,RevenueQuantileBucketImputer:3-buckets,LogTargetScaler
21,21,0.5590837197105718,2024-03-08 06:30:35.767882,2024-03-08 06:30:36.345901,0 days 00:00:00.578019,87,10.0,COMPLETE,LGBM,0.6524361889277908,0.9504395780452374,2.0,0.9299580120455296,1.8852391052635378,0.21352089783703312,0.011284616709336089,53.0,236.0,,,,,,,,,,,12,IIDPreprocessor,RevenueQuantileBucketImputer:3-buckets,LogTargetScaler
22,22,0.5307623808441205,2024-03-08 06:30:36.347222,2024-03-08 06:30:36.644374,0 days 00:00:00.297152,63,10.0,COMPLETE,LGBM,0.6524361889277908,0.6666850423567736,5.0,0.4291014095743396,3.041800758986876,0.16530981367159908,0.08939093751461935,61.0,186.0,,,,,,,,,,,12,IIDPreprocessor,RevenueQuantileBucketImputer:3-buckets,LogTargetScaler
23,23,0.647487613397225,2024-03-08 06:30:36.645364,2024-03-08 06:31:51.636698,0 days 00:01:14.991334,30,1110.0,COMPLETE,LGBM,0.6524361889277908,0.49960407149283,2.0,0.9710372186028426,0.0008145889644417512,6.822017163753912,0.09841116970521244,9.0,23.0,,,,,,,,,,,12,IIDPreprocessor,RevenueQuantileBucketImputer:3-buckets,LogTargetScaler
24,24,0.6499529866069841,2024-03-08 06:31:51.638377,2024-03-08 06:32:13.006000,0 days 00:00:21.367623,69,510.0,COMPLETE,LGBM,0.6524361889277908,0.5050475326312986,4.0,0.8148106308228663,6.546823074673877e-07,3.83181941331181e-07,0.043167090210367284,77.0,154.0,,,,,,,,,,,12,IIDPreprocessor,RevenueQuantileBucketImputer:3-buckets,LogTargetScaler
25,25,0.6295205643219206,2024-03-08 06:32:13.007631,2024-03-08 06:32:27.372195,0 days 00:00:14.364564,72,1110.0,COMPLETE,LGBM,0.6524361889277908,0.5252502255149616,4.0,0.9278227362926275,0.01994256036482522,0.029522730588969016,0.2837434917393593,36.0,120.0,,,,,,,,,,,12,IIDPreprocessor,RevenueQuantileBucketImputer:3-buckets,LogTargetScaler
26,26,0.6414167340881489,2024-03-08 06:32:27.373478,2024-03-08 06:33:03.825929,0 days 00:00:36.452451,93,1410.0,COMPLETE,LGBM,0.6524361889277908,0.6212065270650611,1.0,0.5046501569162646,0.650538575625123,3.3880781348291613,0.022494296154436717,47.0,185.0,,,,,,,,,,,12,IIDPreprocessor,RevenueQuantileBucketImputer:3-buckets,LogTargetScaler
27,27,0.60347186723265,2024-03-08 06:33:03.827379,2024-03-08 06:33:11.117506,0 days 00:00:07.290127,12,710.0,COMPLETE,LGBM,0.6524361889277908,0.8486029491375114,7.0,0.760231308586073,9.4954531137739,4.301612194978529e-05,0.11142387140719336,17.0,10.0,,,,,,,,,,,12,IIDPreprocessor,RevenueQuantileBucketImputer:3-buckets,LogTargetScaler
28,28,0.6455376445484251,2024-03-08 06:33:11.119104,2024-03-08 06:33:54.322642,0 days 00:00:43.203538,90,1110.0,COMPLETE,LGBM,0.6524361889277908,0.7738398609665178,2.0,0.5104902123313031,0.01756787880646262,8.793291635350646e-07,0.027001339619666696,41.0,210.0,,,,,,,,,,,12,IIDPreprocessor,RevenueQuantileBucketImputer:3-buckets,LogTargetScaler
