,number,value,datetime_start,datetime_complete,duration,params_max_depth,params_n_estimators,state,model,best_value,params_bagging_fraction,params_bagging_freq,params_feature_fraction,params_lambda_l1,params_lambda_l2,params_learning_rate,params_min_child_samples,params_num_leaves,params_alpha,params_booster,params_eta,params_gamma,params_grow_policy,params_lambda,params_normalize_type,params_rate_drop,params_sample_type,params_skip_drop,config_id,preprocessor,imputer,target_scaler
0,0,0.5547619755070988,2024-03-08 07:39:31.345759,2024-03-08 07:40:06.767834,0 days 00:00:35.422075,3,,COMPLETE,XGB,0.6014161120819849,,,,,,,,,0.2234677455013566,dart,0.0007057883350977288,0.06548337316062858,lossguide,0.01123666908521073,forest,3.024437263390975e-05,uniform,1.623371514299489e-05,13,IIDPreprocessor,RevenueQuantileBucketImputer:3-buckets,ArcSinhTargetScaler
1,1,0.5376071170772154,2024-03-08 07:40:06.769579,2024-03-08 07:41:10.779386,0 days 00:01:04.009807,9,,COMPLETE,XGB,0.6014161120819849,,,,,,,,,2.98054219637675e-06,dart,3.6171999231173005e-07,0.003904408043804541,depthwise,0.010311862703056736,tree,7.540460113019607e-05,uniform,0.022278466774907534,13,IIDPreprocessor,RevenueQuantileBucketImputer:3-buckets,ArcSinhTargetScaler
2,2,0.5158033273465785,2024-03-08 07:41:10.780818,2024-03-08 07:42:06.672850,0 days 00:00:55.892032,9,,COMPLETE,XGB,0.6014161120819849,,,,,,,,,0.0011789119914183976,dart,2.99637044352303e-08,0.2511516041107101,depthwise,7.547735602919738e-05,tree,0.2531914949901455,uniform,2.886716671104654e-05,13,IIDPreprocessor,RevenueQuantileBucketImputer:3-buckets,ArcSinhTargetScaler
3,3,0.5307747299244121,2024-03-08 07:42:06.674018,2024-03-08 07:43:11.663176,0 days 00:01:04.989158,9,,COMPLETE,XGB,0.6014161120819849,,,,,,,,,0.0011249042010646033,dart,4.502350372533779e-08,2.0479869634760295e-06,depthwise,0.0002316670512734663,forest,1.9774618369196764e-05,uniform,3.7966777793685083e-07,13,IIDPreprocessor,RevenueQuantileBucketImputer:3-buckets,ArcSinhTargetScaler
4,4,0.5382792879330711,2024-03-08 07:43:11.664689,2024-03-08 07:44:16.237654,0 days 00:01:04.572965,9,,COMPLETE,XGB,0.6014161120819849,,,,,,,,,4.2140901683138216e-05,dart,4.0919621349525745e-05,2.5903500182914076e-08,lossguide,0.02029904303081045,forest,1.997140552373342e-05,weighted,7.2633274908456175e-06,13,IIDPreprocessor,RevenueQuantileBucketImputer:3-buckets,ArcSinhTargetScaler
5,5,0.5866300969177562,2024-03-08 07:44:16.239038,2024-03-08 07:45:08.704257,0 days 00:00:52.465219,6,,COMPLETE,XGB,0.6014161120819849,,,,,,,,,0.0048439459413228214,dart,0.010221520494920835,0.000604340466810936,depthwise,9.614336039127615e-06,tree,1.518101189182207e-05,weighted,0.06886929006195451,13,IIDPreprocessor,RevenueQuantileBucketImputer:3-buckets,ArcSinhTargetScaler
6,6,0.5368847000167567,2024-03-08 07:45:08.705423,2024-03-08 07:45:49.336785,0 days 00:00:40.631362,3,,COMPLETE,XGB,0.6014161120819849,,,,,,,,,1.4641108974006362e-07,dart,1.502184149511225e-08,0.0016699251421352064,depthwise,1.0379215793411936e-08,tree,0.02899297636488557,uniform,0.29091555388582085,13,IIDPreprocessor,RevenueQuantileBucketImputer:3-buckets,ArcSinhTargetScaler
7,7,0.5321387817475381,2024-03-08 07:45:49.340241,2024-03-08 07:46:17.606491,0 days 00:00:28.266250,2,,COMPLETE,XGB,0.6014161120819849,,,,,,,,,2.810960989755365e-07,dart,4.946228949459829e-06,4.52484017716834e-05,lossguide,0.6183896462202493,forest,6.863641092541035e-08,weighted,8.098061497481079e-06,13,IIDPreprocessor,RevenueQuantileBucketImputer:3-buckets,ArcSinhTargetScaler
8,8,0.5210389152424039,2024-03-08 07:46:17.607897,2024-03-08 07:46:52.173629,0 days 00:00:34.565732,7,,COMPLETE,XGB,0.6014161120819849,,,,,,,,,8.26658095291261e-06,dart,0.00032074541470151666,2.0923904991130098e-08,depthwise,1.5043869900562293e-08,tree,0.7684693872920562,uniform,0.005723831900217393,13,IIDPreprocessor,RevenueQuantileBucketImputer:3-buckets,ArcSinhTargetScaler
9,9,0.5464857254454407,2024-03-08 07:46:52.175153,2024-03-08 07:47:47.453534,0 days 00:00:55.278381,7,,COMPLETE,XGB,0.6014161120819849,,,,,,,,,1.895352101529173e-06,dart,0.0006704288171176076,0.2026024279587841,depthwise,0.003737730301409306,forest,0.04101267370947132,weighted,2.607740406622861e-07,13,IIDPreprocessor,RevenueQuantileBucketImputer:3-buckets,ArcSinhTargetScaler
10,10,0.5402189429936115,2024-03-08 07:47:47.454530,2024-03-08 07:48:47.242737,0 days 00:00:59.788207,8,,COMPLETE,XGB,0.6014161120819849,,,,,,,,,0.3149925917834821,dart,1.4936359439813694e-06,0.015535855412239546,lossguide,0.00743281801155473,forest,3.6357476591947543e-07,uniform,0.0005343492278631904,13,IIDPreprocessor,RevenueQuantileBucketImputer:3-buckets,ArcSinhTargetScaler
11,11,0.5428735128698888,2024-03-08 07:48:47.243722,2024-03-08 07:49:27.258167,0 days 00:00:40.014445,4,,COMPLETE,XGB,0.6014161120819849,,,,,,,,,1.4388744136501032e-08,dart,3.579311861687929e-08,0.02279286217388082,lossguide,0.032042505676035705,forest,2.347279556500445e-06,uniform,0.010710596297437492,13,IIDPreprocessor,RevenueQuantileBucketImputer:3-buckets,ArcSinhTargetScaler
12,12,0.46466950053266964,2024-03-08 07:49:27.259209,2024-03-08 07:49:51.829223,0 days 00:00:24.570014,1,,COMPLETE,XGB,0.6014161120819849,,,,,,,,,0.0014399953995779952,dart,4.041296650809699e-07,1.9565207842485743e-08,lossguide,0.19732969470056597,tree,0.00024026497524460197,uniform,7.236610663083403e-06,13,IIDPreprocessor,RevenueQuantileBucketImputer:3-buckets,ArcSinhTargetScaler
13,13,0.5354939182219557,2024-03-08 07:49:51.830274,2024-03-08 07:50:49.553496,0 days 00:00:57.723222,7,,COMPLETE,XGB,0.6014161120819849,,,,,,,,,0.014406043130482733,dart,1.489429520981428e-06,4.488078795292882e-07,depthwise,0.0003086874885575696,tree,0.37287769204042903,uniform,0.31400817107757223,13,IIDPreprocessor,RevenueQuantileBucketImputer:3-buckets,ArcSinhTargetScaler
14,14,0.55530013332541,2024-03-08 07:50:49.556042,2024-03-08 07:51:38.401973,0 days 00:00:48.845931,6,,COMPLETE,XGB,0.6014161120819849,,,,,,,,,2.2428832047065322e-07,dart,0.0005600255716765804,3.0147011749590094e-06,depthwise,1.1284179233543555e-05,forest,5.571870539751986e-08,uniform,5.507647558670186e-06,13,IIDPreprocessor,RevenueQuantileBucketImputer:3-buckets,ArcSinhTargetScaler
15,15,0.5452993014540796,2024-03-08 07:51:38.403666,2024-03-08 07:52:20.087374,0 days 00:00:41.683708,5,,COMPLETE,XGB,0.6014161120819849,,,,,,,,,1.7918711240973366e-06,dart,8.605546952311595e-08,7.261817006695565e-07,depthwise,4.2404280749069996e-06,forest,0.01067519075798828,weighted,2.8862887909353893e-05,13,IIDPreprocessor,RevenueQuantileBucketImputer:3-buckets,ArcSinhTargetScaler
16,16,0.5711495055415273,2024-03-08 07:52:20.089262,2024-03-08 07:52:53.150913,0 days 00:00:33.061651,3,,COMPLETE,XGB,0.6014161120819849,,,,,,,,,0.00046458932929937006,dart,0.020194940858718976,4.844933564165845e-07,lossguide,4.699191889772045e-08,tree,6.191463824832984e-06,weighted,0.9479285492851818,13,IIDPreprocessor,RevenueQuantileBucketImputer:3-buckets,ArcSinhTargetScaler
17,17,0.5640475201502777,2024-03-08 07:52:53.152581,2024-03-08 07:53:47.222060,0 days 00:00:54.069479,7,,COMPLETE,XGB,0.6014161120819849,,,,,,,,,8.123864594586054e-07,dart,0.003546083188243683,0.6801105191728345,depthwise,0.001047174647303997,forest,2.247364868833286e-06,weighted,3.697071782444236e-06,13,IIDPreprocessor,RevenueQuantileBucketImputer:3-buckets,ArcSinhTargetScaler
18,18,0.5660152798842667,2024-03-08 07:53:47.223621,2024-03-08 07:54:32.202782,0 days 00:00:44.979161,5,,COMPLETE,XGB,0.6014161120819849,,,,,,,,,1.7485149023454555e-07,dart,0.0505174885709413,1.633349351188155e-05,lossguide,0.03145755089489514,tree,0.04024010668096539,uniform,6.411203771260494e-07,13,IIDPreprocessor,RevenueQuantileBucketImputer:3-buckets,ArcSinhTargetScaler
19,19,0.5250788658819717,2024-03-08 07:54:32.204325,2024-03-08 07:55:24.665600,0 days 00:00:52.461275,6,,COMPLETE,XGB,0.6014161120819849,,,,,,,,,0.006549783843772035,dart,2.381575168217865e-08,7.890580379011964e-06,depthwise,0.0021122511406578026,forest,3.408869732252777e-08,uniform,5.962368869448074e-08,13,IIDPreprocessor,RevenueQuantileBucketImputer:3-buckets,ArcSinhTargetScaler
20,20,0.5711536790213692,2024-03-08 07:55:24.667978,2024-03-08 07:56:34.298354,0 days 00:01:09.630376,9,,COMPLETE,XGB,0.6014161120819849,,,,,,,,,2.2509901350620573e-05,dart,0.004462562922266183,0.1287033127853597,depthwise,0.005013848336157936,forest,0.010457407942413512,weighted,1.3514524819440813e-07,13,IIDPreprocessor,RevenueQuantileBucketImputer:3-buckets,ArcSinhTargetScaler
21,21,0.592703460033136,2024-03-08 07:56:34.299771,2024-03-08 07:57:09.008410,0 days 00:00:34.708639,3,,COMPLETE,XGB,0.6014161120819849,,,,,,,,,0.5327936375213885,dart,0.09239845547231607,0.006790965601050027,lossguide,0.14051696895812715,forest,6.1037273580049924e-06,weighted,4.3844120082146633e-07,13,IIDPreprocessor,RevenueQuantileBucketImputer:3-buckets,ArcSinhTargetScaler
22,22,0.5354577710503003,2024-03-08 07:57:09.010339,2024-03-08 07:58:01.907157,0 days 00:00:52.896818,8,,COMPLETE,XGB,0.6014161120819849,,,,,,,,,3.676390985560099e-08,dart,0.0009286436885978612,0.0006919337299779428,lossguide,0.01709458516852955,tree,0.9896432999244761,weighted,0.004963033160193295,13,IIDPreprocessor,RevenueQuantileBucketImputer:3-buckets,ArcSinhTargetScaler
23,23,0.5321553543208913,2024-03-08 07:58:01.909408,2024-03-08 07:58:32.471316,0 days 00:00:30.561908,2,,COMPLETE,XGB,0.6014161120819849,,,,,,,,,0.14409276217940428,dart,0.0004143523294000707,2.8246805408099197e-06,depthwise,0.004693779879156941,tree,1.3371092459744753e-05,weighted,0.0007190192294580628,13,IIDPreprocessor,RevenueQuantileBucketImputer:3-buckets,ArcSinhTargetScaler
24,24,0.5307226120384854,2024-03-08 07:58:32.473483,2024-03-08 07:59:29.181540,0 days 00:00:56.708057,7,,COMPLETE,XGB,0.6014161120819849,,,,,,,,,0.006031600277157327,dart,4.1234399627134754e-06,1.3293998377777134e-07,depthwise,3.2436314280087975e-07,forest,1.0211227349815054e-08,uniform,3.153437122031116e-05,13,IIDPreprocessor,RevenueQuantileBucketImputer:3-buckets,ArcSinhTargetScaler
25,25,0.5340290145667925,2024-03-08 07:59:29.183222,2024-03-08 08:00:16.418656,0 days 00:00:47.235434,5,,COMPLETE,XGB,0.6014161120819849,,,,,,,,,1.1933462661239232e-07,dart,2.6620556892551013e-06,0.00037634554872880105,lossguide,0.0020830286958474988,forest,1.913176306759096e-06,weighted,5.862611906458957e-06,13,IIDPreprocessor,RevenueQuantileBucketImputer:3-buckets,ArcSinhTargetScaler
26,26,0.5339282673703215,2024-03-08 08:00:16.420517,2024-03-08 08:01:10.157494,0 days 00:00:53.736977,5,,COMPLETE,XGB,0.6014161120819849,,,,,,,,,5.6712467981692834e-08,dart,8.721331383663409e-07,1.1064690622087285e-06,depthwise,0.00027992023087823793,tree,9.510017156235137e-05,weighted,0.38081910977718436,13,IIDPreprocessor,RevenueQuantileBucketImputer:3-buckets,ArcSinhTargetScaler
27,27,0.5165737858849474,2024-03-08 08:01:10.158773,2024-03-08 08:01:38.717974,0 days 00:00:28.559201,1,,COMPLETE,XGB,0.6014161120819849,,,,,,,,,9.120793103587924e-08,dart,0.025717754692959345,2.6706246980630275e-05,lossguide,0.11531861431155407,forest,1.0926469345121042e-08,uniform,0.00077303748693532,13,IIDPreprocessor,RevenueQuantileBucketImputer:3-buckets,ArcSinhTargetScaler
28,28,0.5630216843089185,2024-03-08 08:01:38.719387,2024-03-08 08:02:27.754665,0 days 00:00:49.035278,5,,COMPLETE,XGB,0.6014161120819849,,,,,,,,,7.596734354914016e-08,dart,0.006720488615254888,0.0004307891733088267,depthwise,3.10742048094544e-06,forest,6.494273395044637e-05,weighted,0.7077575573420978,13,IIDPreprocessor,RevenueQuantileBucketImputer:3-buckets,ArcSinhTargetScaler
29,29,0.5321553543208913,2024-03-08 08:02:27.756271,2024-03-08 08:02:59.981676,0 days 00:00:32.225405,2,,COMPLETE,XGB,0.6014161120819849,,,,,,,,,0.0027182401388589007,dart,0.0003676077959788526,0.6962796825898918,lossguide,1.5534275230809158e-07,forest,1.200911955937606e-08,uniform,4.272849473396077e-05,13,IIDPreprocessor,RevenueQuantileBucketImputer:3-buckets,ArcSinhTargetScaler
30,30,0.5250523346110944,2024-03-08 08:02:59.983574,2024-03-08 08:04:06.273020,0 days 00:01:06.289446,7,,COMPLETE,XGB,0.6014161120819849,,,,,,,,,1.5897085229187204e-08,dart,1.8417852489686892e-07,0.001201714815957434,lossguide,7.618093982168281e-07,tree,0.0033078474621122266,weighted,1.0899852092609575e-06,13,IIDPreprocessor,RevenueQuantileBucketImputer:3-buckets,ArcSinhTargetScaler
31,31,0.5321387817475381,2024-03-08 08:04:06.274549,2024-03-08 08:04:38.265367,0 days 00:00:31.990818,2,,COMPLETE,XGB,0.6014161120819849,,,,,,,,,6.801427021967394e-05,dart,1.6715230344442615e-05,1.4911534215191554e-07,depthwise,0.0025341050193776124,tree,3.482444389960823e-06,uniform,6.27013068373242e-07,13,IIDPreprocessor,RevenueQuantileBucketImputer:3-buckets,ArcSinhTargetScaler
32,32,0.5640900973210144,2024-03-08 08:04:38.266625,2024-03-08 08:05:49.714818,0 days 00:01:11.448193,9,,COMPLETE,XGB,0.6014161120819849,,,,,,,,,2.2763222213534963e-08,dart,0.002453616446735977,3.330214455034784e-08,lossguide,5.298682938990298e-08,tree,2.3669699932802387e-05,weighted,4.496512605177773e-07,13,IIDPreprocessor,RevenueQuantileBucketImputer:3-buckets,ArcSinhTargetScaler
33,33,0.5285146928543883,2024-03-08 08:05:49.723154,2024-03-08 08:06:48.087718,0 days 00:00:58.364564,8,,COMPLETE,XGB,0.6014161120819849,,,,,,,,,4.703008818301012e-07,dart,1.1822003052318094e-05,0.02869797380436233,depthwise,1.7606200422551062e-06,tree,9.515228239871128e-05,weighted,0.0002772063265226181,13,IIDPreprocessor,RevenueQuantileBucketImputer:3-buckets,ArcSinhTargetScaler
34,34,0.5502279690927818,2024-03-08 08:06:48.089291,2024-03-08 08:07:22.186158,0 days 00:00:34.096867,3,,COMPLETE,XGB,0.6014161120819849,,,,,,,,,0.005021201002673375,dart,1.4840744901580882e-06,0.06918762769468698,lossguide,8.625663719200213e-07,tree,3.908833184518085e-07,uniform,9.19809710141079e-06,13,IIDPreprocessor,RevenueQuantileBucketImputer:3-buckets,ArcSinhTargetScaler
35,35,0.6014161120819849,2024-03-08 08:07:22.187969,2024-03-08 08:08:22.095884,0 days 00:00:59.907915,9,,COMPLETE,XGB,0.6014161120819849,,,,,,,,,4.0317840382868385e-07,dart,0.08219279889021106,4.5282405057563376e-05,depthwise,0.00012093886399734635,tree,0.00010588449986145964,weighted,0.5448082139764918,13,IIDPreprocessor,RevenueQuantileBucketImputer:3-buckets,ArcSinhTargetScaler
36,36,0.544263567664063,2024-03-08 08:08:22.097146,2024-03-08 08:09:21.123917,0 days 00:00:59.026771,7,,COMPLETE,XGB,0.6014161120819849,,,,,,,,,5.058034010386042e-07,dart,0.00021890769845764934,1.0513943227327916e-07,lossguide,9.477934674201263e-05,forest,0.0016796113776296575,uniform,0.002502010671148313,13,IIDPreprocessor,RevenueQuantileBucketImputer:3-buckets,ArcSinhTargetScaler
37,37,0.585509271257037,2024-03-08 08:09:21.125488,2024-03-08 08:10:18.011951,0 days 00:00:56.886463,8,,COMPLETE,XGB,0.6014161120819849,,,,,,,,,1.2237637275836978e-07,dart,0.03217726624865227,3.642216395107904e-07,lossguide,0.6733474287089221,forest,0.2927921638907645,weighted,1.8119433663985283e-06,13,IIDPreprocessor,RevenueQuantileBucketImputer:3-buckets,ArcSinhTargetScaler
38,38,0.584858534504553,2024-03-08 08:10:18.013212,2024-03-08 08:11:25.762065,0 days 00:01:07.748853,9,,COMPLETE,XGB,0.6014161120819849,,,,,,,,,0.00026049523852547353,dart,0.02153924206695811,2.3504638390929512e-07,lossguide,0.07462881358444974,tree,9.160605949834253e-08,weighted,0.00010037481096965799,13,IIDPreprocessor,RevenueQuantileBucketImputer:3-buckets,ArcSinhTargetScaler
39,39,0.5339282673703215,2024-03-08 08:11:25.763305,2024-03-08 08:12:12.164193,0 days 00:00:46.400888,5,,COMPLETE,XGB,0.6014161120819849,,,,,,,,,0.0008635270263912745,dart,8.667065841768386e-07,2.7826674513852694e-06,depthwise,0.00015012593614669096,tree,9.577481142882507e-05,uniform,4.334872490383455e-07,13,IIDPreprocessor,RevenueQuantileBucketImputer:3-buckets,ArcSinhTargetScaler
0,0,0.5976132858542744,2024-03-08 08:14:03.582370,2024-03-08 08:14:13.222827,0 days 00:00:09.640457,57,300.0,COMPLETE,RandomForest,0.6221796315930094,,,,,,,,,,,,,,,,,,,14,IIDPreprocessor,RevenueQuantileBucketImputer:3-buckets,DummyTargetScaler
1,1,0.6031650072563527,2024-03-08 08:14:13.223808,2024-03-08 08:14:58.397861,0 days 00:00:45.174053,54,1500.0,COMPLETE,RandomForest,0.6221796315930094,,,,,,,,,,,,,,,,,,,14,IIDPreprocessor,RevenueQuantileBucketImputer:3-buckets,DummyTargetScaler
2,2,0.6145552920470208,2024-03-08 08:14:58.398600,2024-03-08 08:15:30.468307,0 days 00:00:32.069707,93,1000.0,COMPLETE,RandomForest,0.6221796315930094,,,,,,,,,,,,,,,,,,,14,IIDPreprocessor,RevenueQuantileBucketImputer:3-buckets,DummyTargetScaler
3,3,0.5992593917321857,2024-03-08 08:15:30.469010,2024-03-08 08:15:55.212125,0 days 00:00:24.743115,90,800.0,COMPLETE,RandomForest,0.6221796315930094,,,,,,,,,,,,,,,,,,,14,IIDPreprocessor,RevenueQuantileBucketImputer:3-buckets,DummyTargetScaler
4,4,0.6163743297100398,2024-03-08 08:15:55.212872,2024-03-08 08:16:28.587459,0 days 00:00:33.374587,45,1100.0,COMPLETE,RandomForest,0.6221796315930094,,,,,,,,,,,,,,,,,,,14,IIDPreprocessor,RevenueQuantileBucketImputer:3-buckets,DummyTargetScaler
5,5,0.6105036369543447,2024-03-08 08:16:28.588119,2024-03-08 08:17:06.239147,0 days 00:00:37.651028,63,1200.0,COMPLETE,RandomForest,0.6221796315930094,,,,,,,,,,,,,,,,,,,14,IIDPreprocessor,RevenueQuantileBucketImputer:3-buckets,DummyTargetScaler
6,6,0.6084960708360595,2024-03-08 08:17:06.239905,2024-03-08 08:17:49.116564,0 days 00:00:42.876659,42,1400.0,COMPLETE,RandomForest,0.6221796315930094,,,,,,,,,,,,,,,,,,,14,IIDPreprocessor,RevenueQuantileBucketImputer:3-buckets,DummyTargetScaler
7,7,0.6048772451505793,2024-03-08 08:17:49.117438,2024-03-08 08:18:22.453249,0 days 00:00:33.335811,63,1100.0,COMPLETE,RandomForest,0.6221796315930094,,,,,,,,,,,,,,,,,,,14,IIDPreprocessor,RevenueQuantileBucketImputer:3-buckets,DummyTargetScaler
8,8,0.6066987557222817,2024-03-08 08:18:22.454174,2024-03-08 08:18:34.628590,0 days 00:00:12.174416,90,400.0,COMPLETE,RandomForest,0.6221796315930094,,,,,,,,,,,,,,,,,,,14,IIDPreprocessor,RevenueQuantileBucketImputer:3-buckets,DummyTargetScaler
9,9,0.5989386225630696,2024-03-08 08:18:34.629265,2024-03-08 08:19:23.362226,0 days 00:00:48.732961,27,1500.0,COMPLETE,RandomForest,0.6221796315930094,,,,,,,,,,,,,,,,,,,14,IIDPreprocessor,RevenueQuantileBucketImputer:3-buckets,DummyTargetScaler
10,10,0.6089549762911721,2024-03-08 08:19:23.362832,2024-03-08 08:20:05.979965,0 days 00:00:42.617133,63,1300.0,COMPLETE,RandomForest,0.6221796315930094,,,,,,,,,,,,,,,,,,,14,IIDPreprocessor,RevenueQuantileBucketImputer:3-buckets,DummyTargetScaler
11,11,0.6221796315930094,2024-03-08 08:20:05.993515,2024-03-08 08:20:22.446148,0 days 00:00:16.452633,60,500.0,COMPLETE,RandomForest,0.6221796315930094,,,,,,,,,,,,,,,,,,,14,IIDPreprocessor,RevenueQuantileBucketImputer:3-buckets,DummyTargetScaler
12,12,0.6086478699214142,2024-03-08 08:20:22.446995,2024-03-08 08:21:05.625684,0 days 00:00:43.178689,63,1300.0,COMPLETE,RandomForest,0.6221796315930094,,,,,,,,,,,,,,,,,,,14,IIDPreprocessor,RevenueQuantileBucketImputer:3-buckets,DummyTargetScaler
13,13,0.5980403308623624,2024-03-08 08:21:05.626439,2024-03-08 08:21:31.948871,0 days 00:00:26.322432,72,800.0,COMPLETE,RandomForest,0.6221796315930094,,,,,,,,,,,,,,,,,,,14,IIDPreprocessor,RevenueQuantileBucketImputer:3-buckets,DummyTargetScaler
14,14,0.6035420324833153,2024-03-08 08:21:31.949533,2024-03-08 08:21:35.255384,0 days 00:00:03.305851,93,100.0,COMPLETE,RandomForest,0.6221796315930094,,,,,,,,,,,,,,,,,,,14,IIDPreprocessor,RevenueQuantileBucketImputer:3-buckets,DummyTargetScaler
15,15,0.6066356510375647,2024-03-08 08:21:35.256037,2024-03-08 08:21:48.380163,0 days 00:00:13.124126,36,400.0,COMPLETE,RandomForest,0.6221796315930094,,,,,,,,,,,,,,,,,,,14,IIDPreprocessor,RevenueQuantileBucketImputer:3-buckets,DummyTargetScaler
16,16,0.5998225779109562,2024-03-08 08:21:48.380949,2024-03-08 08:22:32.405815,0 days 00:00:44.024866,90,1300.0,COMPLETE,RandomForest,0.6221796315930094,,,,,,,,,,,,,,,,,,,14,IIDPreprocessor,RevenueQuantileBucketImputer:3-buckets,DummyTargetScaler
17,17,0.6037774499556295,2024-03-08 08:22:32.406580,2024-03-08 08:22:44.444842,0 days 00:00:12.038262,15,400.0,COMPLETE,RandomForest,0.6221796315930094,,,,,,,,,,,,,,,,,,,14,IIDPreprocessor,RevenueQuantileBucketImputer:3-buckets,DummyTargetScaler
18,18,0.5916662215757125,2024-03-08 08:22:44.453488,2024-03-08 08:23:01.364587,0 days 00:00:16.911099,45,500.0,COMPLETE,RandomForest,0.6221796315930094,,,,,,,,,,,,,,,,,,,14,IIDPreprocessor,RevenueQuantileBucketImputer:3-buckets,DummyTargetScaler
19,19,0.6030303935398149,2024-03-08 08:23:01.365333,2024-03-08 08:23:32.279966,0 days 00:00:30.914633,60,900.0,COMPLETE,RandomForest,0.6221796315930094,,,,,,,,,,,,,,,,,,,14,IIDPreprocessor,RevenueQuantileBucketImputer:3-buckets,DummyTargetScaler
20,20,0.6053017952558999,2024-03-08 08:23:32.280726,2024-03-08 08:24:23.376020,0 days 00:00:51.095294,84,1500.0,COMPLETE,RandomForest,0.6221796315930094,,,,,,,,,,,,,,,,,,,14,IIDPreprocessor,RevenueQuantileBucketImputer:3-buckets,DummyTargetScaler
21,21,0.6067091914962696,2024-03-08 08:24:23.385440,2024-03-08 08:24:53.938317,0 days 00:00:30.552877,18,1000.0,COMPLETE,RandomForest,0.6221796315930094,,,,,,,,,,,,,,,,,,,14,IIDPreprocessor,RevenueQuantileBucketImputer:3-buckets,DummyTargetScaler
22,22,0.6082821996969581,2024-03-08 08:24:53.953624,2024-03-08 08:25:44.289502,0 days 00:00:50.335878,78,1500.0,COMPLETE,RandomForest,0.6221796315930094,,,,,,,,,,,,,,,,,,,14,IIDPreprocessor,RevenueQuantileBucketImputer:3-buckets,DummyTargetScaler
23,23,0.6110085198746587,2024-03-08 08:25:44.290292,2024-03-08 08:26:09.589900,0 days 00:00:25.299608,27,800.0,COMPLETE,RandomForest,0.6221796315930094,,,,,,,,,,,,,,,,,,,14,IIDPreprocessor,RevenueQuantileBucketImputer:3-buckets,DummyTargetScaler
24,24,0.5894566916401666,2024-03-08 08:26:09.590726,2024-03-08 08:26:21.916711,0 days 00:00:12.325985,72,400.0,COMPLETE,RandomForest,0.6221796315930094,,,,,,,,,,,,,,,,,,,14,IIDPreprocessor,RevenueQuantileBucketImputer:3-buckets,DummyTargetScaler
