,number,value,datetime_start,datetime_complete,duration,params_max_depth,params_n_estimators,state,model,best_value,params_bagging_fraction,params_bagging_freq,params_feature_fraction,params_lambda_l1,params_lambda_l2,params_learning_rate,params_min_child_samples,params_num_leaves,params_alpha,params_booster,params_eta,params_gamma,params_grow_policy,params_lambda,params_normalize_type,params_rate_drop,params_sample_type,params_skip_drop,config_id,preprocessor,imputer,target_scaler
16,16,0.6122840553851,2024-03-08 00:07:20.358482,2024-03-08 00:08:28.471846,0 days 00:01:08.113364,9,,COMPLETE,XGB,0.6701685037427981,,,,,,,,,0.004473202269065791,dart,0.003950011811695189,8.969681899163878e-06,lossguide,0.29982079562027614,forest,0.00032363973886732195,uniform,1.109581173599524e-05,6,BaselinePreprocessor,HybridCategoricalStatisticsImputer,LogTargetScaler
17,17,0.5246162144360128,2024-03-08 00:08:28.473393,2024-03-08 00:08:54.338444,0 days 00:00:25.865051,1,,COMPLETE,XGB,0.6701685037427981,,,,,,,,,4.2850864488731096e-08,dart,6.780641613559937e-08,0.010617285791429986,depthwise,1.7865254758875117e-05,forest,0.004426483455406784,weighted,1.5493658634700743e-08,6,BaselinePreprocessor,HybridCategoricalStatisticsImputer,LogTargetScaler
18,18,0.6497042473459076,2024-03-08 00:08:54.339565,2024-03-08 00:09:46.972835,0 days 00:00:52.633270,6,,COMPLETE,XGB,0.6701685037427981,,,,,,,,,4.398750389130334e-06,dart,0.03429913550442009,0.0003993678571830178,depthwise,0.0008556645292991565,forest,8.02341850679478e-05,uniform,0.00012221453638876478,6,BaselinePreprocessor,HybridCategoricalStatisticsImputer,LogTargetScaler
19,19,0.6033159291008952,2024-03-08 00:09:46.973971,2024-03-08 00:10:52.992906,0 days 00:01:06.018935,8,,COMPLETE,XGB,0.6701685037427981,,,,,,,,,3.150082258148288e-05,dart,8.282885005231274e-06,2.0815657272911688e-05,depthwise,4.7136698232423815e-07,forest,9.217034281906788e-08,weighted,0.0015455116441170532,6,BaselinePreprocessor,HybridCategoricalStatisticsImputer,LogTargetScaler
20,20,0.5593003632494931,2024-03-08 00:10:52.994423,2024-03-08 00:11:54.865008,0 days 00:01:01.870585,7,,COMPLETE,XGB,0.6701685037427981,,,,,,,,,3.234099747991349e-05,dart,1.0970769749110299e-08,3.456112895240866e-07,lossguide,0.2527456008255777,forest,7.791087602931447e-06,weighted,0.005235212641044684,6,BaselinePreprocessor,HybridCategoricalStatisticsImputer,LogTargetScaler
21,21,0.6149431426446178,2024-03-08 00:11:54.866823,2024-03-08 00:12:56.733906,0 days 00:01:01.867083,7,,COMPLETE,XGB,0.6701685037427981,,,,,,,,,5.5247480946167836e-08,dart,5.386737392920956e-05,1.3937892747455283e-06,depthwise,0.010570814155992639,forest,0.01480223136261286,weighted,2.90369157287149e-06,6,BaselinePreprocessor,HybridCategoricalStatisticsImputer,LogTargetScaler
22,22,0.591880659850947,2024-03-08 00:12:56.735568,2024-03-08 00:13:15.168113,0 days 00:00:18.432545,2,,COMPLETE,XGB,0.6701685037427981,,,,,,,,,1.832625694569392e-08,dart,1.1729441484661351e-05,0.19496410829377858,depthwise,0.39796188763861856,tree,0.7268681852319008,uniform,8.90945680337366e-06,6,BaselinePreprocessor,HybridCategoricalStatisticsImputer,LogTargetScaler
23,23,0.6259506425218153,2024-03-08 00:13:15.169926,2024-03-08 00:14:11.885446,0 days 00:00:56.715520,6,,COMPLETE,XGB,0.6701685037427981,,,,,,,,,6.858506407356803e-05,dart,0.00018190623020508678,6.347665201782934e-07,depthwise,4.526456316123704e-07,forest,0.00014570867409227737,uniform,8.794938008872671e-07,6,BaselinePreprocessor,HybridCategoricalStatisticsImputer,LogTargetScaler
24,24,0.5498200459342778,2024-03-08 00:14:11.887230,2024-03-08 00:14:52.961362,0 days 00:00:41.074132,5,,COMPLETE,XGB,0.6701685037427981,,,,,,,,,8.593053169020055e-07,dart,1.0642079333413669e-08,1.5347501218655875e-06,depthwise,0.005982237525845543,tree,0.9389224090139486,weighted,1.0752425223259063e-07,6,BaselinePreprocessor,HybridCategoricalStatisticsImputer,LogTargetScaler
25,25,0.6486849025660177,2024-03-08 00:14:52.962624,2024-03-08 00:15:28.343006,0 days 00:00:35.380382,2,,COMPLETE,XGB,0.6701685037427981,,,,,,,,,0.2980061515132885,dart,0.026199260090929447,2.5160324973030957e-06,lossguide,0.0058120487759789115,tree,3.947844526468322e-06,uniform,3.36500572032052e-05,6,BaselinePreprocessor,HybridCategoricalStatisticsImputer,LogTargetScaler
26,26,0.6302750753091587,2024-03-08 00:15:28.344575,2024-03-08 00:16:11.424174,0 days 00:00:43.079599,4,,COMPLETE,XGB,0.6701685037427981,,,,,,,,,0.4508461532935428,dart,0.0005104443221596356,2.632317917308081e-06,depthwise,0.08158328492221038,tree,1.95351949639624e-07,uniform,1.537531161531936e-08,6,BaselinePreprocessor,HybridCategoricalStatisticsImputer,LogTargetScaler
27,27,0.630176078433573,2024-03-08 00:16:11.425528,2024-03-08 00:16:57.622385,0 days 00:00:46.196857,5,,COMPLETE,XGB,0.6701685037427981,,,,,,,,,0.00046157732847348465,dart,5.631393571515359e-08,0.21874797011536307,depthwise,6.1435247583066115e-06,tree,2.8005294451022068e-08,uniform,0.04418961013164349,6,BaselinePreprocessor,HybridCategoricalStatisticsImputer,LogTargetScaler
28,28,0.603250185789114,2024-03-08 00:16:57.623813,2024-03-08 00:18:05.235512,0 days 00:01:07.611699,8,,COMPLETE,XGB,0.6701685037427981,,,,,,,,,0.0014143611821520726,dart,2.3584106250142717e-06,0.0029665097953962606,lossguide,1.1523848587627666e-06,forest,0.00014764930599532922,uniform,0.015066563010634316,6,BaselinePreprocessor,HybridCategoricalStatisticsImputer,LogTargetScaler
29,29,0.6262011007951894,2024-03-08 00:18:05.237293,2024-03-08 00:18:54.372863,0 days 00:00:49.135570,5,,COMPLETE,XGB,0.6701685037427981,,,,,,,,,0.004947337739656935,dart,3.171967240526636e-05,5.651035022395794e-08,depthwise,1.3487006329948571e-08,tree,0.00022316340238412712,uniform,3.581847254423348e-05,6,BaselinePreprocessor,HybridCategoricalStatisticsImputer,LogTargetScaler
30,30,0.6448062963466621,2024-03-08 00:18:54.374714,2024-03-08 00:19:32.543596,0 days 00:00:38.168882,3,,COMPLETE,XGB,0.6701685037427981,,,,,,,,,2.4114055313545876e-06,dart,2.020373680414067e-07,4.3487375616059495e-07,lossguide,1.2555843856034286e-07,forest,9.702334047955573e-08,weighted,0.0005815273360125889,6,BaselinePreprocessor,HybridCategoricalStatisticsImputer,LogTargetScaler
31,31,0.6141438944465811,2024-03-08 00:19:32.544796,2024-03-08 00:20:28.406511,0 days 00:00:55.861715,6,,COMPLETE,XGB,0.6701685037427981,,,,,,,,,0.019434898077035693,dart,0.00283093345929449,4.1485668995544976e-05,depthwise,0.0004723579326632891,tree,5.934997710159145e-05,weighted,0.00011365901474327006,6,BaselinePreprocessor,HybridCategoricalStatisticsImputer,LogTargetScaler
32,32,0.59368189832422,2024-03-08 00:20:28.417738,2024-03-08 00:21:32.620023,0 days 00:01:04.202285,9,,COMPLETE,XGB,0.6701685037427981,,,,,,,,,0.005785507866950398,dart,4.428312912573702e-06,4.2008394026181664e-08,depthwise,1.322032851413338e-08,forest,0.19621132739793826,weighted,6.9544557885354716e-06,6,BaselinePreprocessor,HybridCategoricalStatisticsImputer,LogTargetScaler
33,33,0.6295456134496933,2024-03-08 00:21:32.621571,2024-03-08 00:22:20.091482,0 days 00:00:47.469911,5,,COMPLETE,XGB,0.6701685037427981,,,,,,,,,0.020134765787325093,dart,3.637174218265735e-05,0.0024834951722533163,lossguide,8.2181229143931e-06,forest,5.6851426254335554e-06,uniform,4.730823625139043e-07,6,BaselinePreprocessor,HybridCategoricalStatisticsImputer,LogTargetScaler
34,34,0.6106027344526139,2024-03-08 00:22:20.092753,2024-03-08 00:23:25.918778,0 days 00:01:05.826025,9,,COMPLETE,XGB,0.6701685037427981,,,,,,,,,0.16382218616894856,dart,0.0011323536385693445,3.590111599120176e-08,depthwise,1.0258607335730669e-07,forest,1.8832348925991696e-08,uniform,0.057383566135326525,6,BaselinePreprocessor,HybridCategoricalStatisticsImputer,LogTargetScaler
35,35,0.6297101817514185,2024-03-08 00:23:25.919964,2024-03-08 00:24:11.622066,0 days 00:00:45.702102,5,,COMPLETE,XGB,0.6701685037427981,,,,,,,,,0.002487257027801732,dart,9.168038173961627e-08,3.96115449527376e-07,lossguide,0.02360146266971704,tree,0.008128638637497902,uniform,5.186735281939048e-05,6,BaselinePreprocessor,HybridCategoricalStatisticsImputer,LogTargetScaler
36,36,0.6275855842522055,2024-03-08 00:24:11.623712,2024-03-08 00:24:55.647408,0 days 00:00:44.023696,5,,COMPLETE,XGB,0.6701685037427981,,,,,,,,,1.7601837064186461e-06,dart,0.001899688690161342,1.181738905033624e-07,depthwise,0.005980883699656865,tree,0.021712343892072463,weighted,1.7315168690067923e-06,6,BaselinePreprocessor,HybridCategoricalStatisticsImputer,LogTargetScaler
37,37,0.6379370410408716,2024-03-08 00:24:55.649436,2024-03-08 00:25:54.626000,0 days 00:00:58.976564,7,,COMPLETE,XGB,0.6701685037427981,,,,,,,,,3.552703331560262e-08,dart,0.004797446960607643,1.8553871740929746e-08,depthwise,8.152561047124433e-05,forest,8.1716792614926e-07,uniform,0.0038957046436901006,6,BaselinePreprocessor,HybridCategoricalStatisticsImputer,LogTargetScaler
38,38,0.6525554200903826,2024-03-08 00:25:54.627970,2024-03-08 00:26:58.274591,0 days 00:01:03.646621,9,,COMPLETE,XGB,0.6701685037427981,,,,,,,,,5.745655200223967e-08,dart,0.03911728730488257,0.36422277310613993,lossguide,3.1457384494300673e-06,forest,3.1777347729539864e-07,uniform,3.915623700541764e-07,6,BaselinePreprocessor,HybridCategoricalStatisticsImputer,LogTargetScaler
39,39,0.6432322318074956,2024-03-08 00:26:58.275805,2024-03-08 00:27:31.822289,0 days 00:00:33.546484,3,,COMPLETE,XGB,0.6701685037427981,,,,,,,,,3.551962050884044e-06,dart,1.6688592483498586e-05,0.003058679179007905,depthwise,0.011006408323496088,tree,0.0006903568353445489,uniform,0.24120422297305288,6,BaselinePreprocessor,HybridCategoricalStatisticsImputer,LogTargetScaler
0,0,0.6650191804567843,2024-03-08 00:39:02.824103,2024-03-08 00:39:05.986136,0 days 00:00:03.162033,90,100.0,COMPLETE,RandomForest,0.6756674150896209,,,,,,,,,,,,,,,,,,,7,BaselinePreprocessor,HybridCategoricalStatisticsImputer,ArcSinhTargetScaler
1,1,0.670295381609984,2024-03-08 00:39:05.987239,2024-03-08 00:39:17.617793,0 days 00:00:11.630554,18,400.0,COMPLETE,RandomForest,0.6756674150896209,,,,,,,,,,,,,,,,,,,7,BaselinePreprocessor,HybridCategoricalStatisticsImputer,ArcSinhTargetScaler
2,2,0.6284199430284709,2024-03-08 00:39:17.618821,2024-03-08 00:39:36.174692,0 days 00:00:18.555871,9,900.0,COMPLETE,RandomForest,0.6756674150896209,,,,,,,,,,,,,,,,,,,7,BaselinePreprocessor,HybridCategoricalStatisticsImputer,ArcSinhTargetScaler
3,3,0.6675628261506302,2024-03-08 00:39:36.175340,2024-03-08 00:40:15.841769,0 days 00:00:39.666429,36,1300.0,COMPLETE,RandomForest,0.6756674150896209,,,,,,,,,,,,,,,,,,,7,BaselinePreprocessor,HybridCategoricalStatisticsImputer,ArcSinhTargetScaler
4,4,0.6680486022806993,2024-03-08 00:40:15.842676,2024-03-08 00:40:40.310462,0 days 00:00:24.467786,81,800.0,COMPLETE,RandomForest,0.6756674150896209,,,,,,,,,,,,,,,,,,,7,BaselinePreprocessor,HybridCategoricalStatisticsImputer,ArcSinhTargetScaler
5,5,0.6691601364941245,2024-03-08 00:40:40.311345,2024-03-08 00:41:07.458812,0 days 00:00:27.147467,57,900.0,COMPLETE,RandomForest,0.6756674150896209,,,,,,,,,,,,,,,,,,,7,BaselinePreprocessor,HybridCategoricalStatisticsImputer,ArcSinhTargetScaler
6,6,0.6670773311164532,2024-03-08 00:41:07.459494,2024-03-08 00:41:50.288043,0 days 00:00:42.828549,69,1400.0,COMPLETE,RandomForest,0.6756674150896209,,,,,,,,,,,,,,,,,,,7,BaselinePreprocessor,HybridCategoricalStatisticsImputer,ArcSinhTargetScaler
7,7,0.6599315822332548,2024-03-08 00:41:50.288699,2024-03-08 00:42:33.464930,0 days 00:00:43.176231,21,1500.0,COMPLETE,RandomForest,0.6756674150896209,,,,,,,,,,,,,,,,,,,7,BaselinePreprocessor,HybridCategoricalStatisticsImputer,ArcSinhTargetScaler
8,8,0.6620501249446885,2024-03-08 00:42:33.465709,2024-03-08 00:42:44.792980,0 days 00:00:11.327271,96,400.0,COMPLETE,RandomForest,0.6756674150896209,,,,,,,,,,,,,,,,,,,7,BaselinePreprocessor,HybridCategoricalStatisticsImputer,ArcSinhTargetScaler
9,9,0.6647677675713548,2024-03-08 00:42:44.793653,2024-03-08 00:42:59.531429,0 days 00:00:14.737776,54,500.0,COMPLETE,RandomForest,0.6756674150896209,,,,,,,,,,,,,,,,,,,7,BaselinePreprocessor,HybridCategoricalStatisticsImputer,ArcSinhTargetScaler
10,10,0.6662366802185323,2024-03-08 00:42:59.532325,2024-03-08 00:43:36.071291,0 days 00:00:36.538966,42,1200.0,COMPLETE,RandomForest,0.6756674150896209,,,,,,,,,,,,,,,,,,,7,BaselinePreprocessor,HybridCategoricalStatisticsImputer,ArcSinhTargetScaler
11,11,0.6750737539678653,2024-03-08 00:43:36.071975,2024-03-08 00:43:50.580226,0 days 00:00:14.508251,30,500.0,COMPLETE,RandomForest,0.6756674150896209,,,,,,,,,,,,,,,,,,,7,BaselinePreprocessor,HybridCategoricalStatisticsImputer,ArcSinhTargetScaler
12,12,0.6451866525588198,2024-03-08 00:43:50.581126,2024-03-08 00:43:53.506344,0 days 00:00:02.925218,54,100.0,COMPLETE,RandomForest,0.6756674150896209,,,,,,,,,,,,,,,,,,,7,BaselinePreprocessor,HybridCategoricalStatisticsImputer,ArcSinhTargetScaler
13,13,0.6607105354287807,2024-03-08 00:43:53.507291,2024-03-08 00:44:18.086829,0 days 00:00:24.579538,60,800.0,COMPLETE,RandomForest,0.6756674150896209,,,,,,,,,,,,,,,,,,,7,BaselinePreprocessor,HybridCategoricalStatisticsImputer,ArcSinhTargetScaler
14,14,0.6558205380645455,2024-03-08 00:44:18.087546,2024-03-08 00:44:23.790270,0 days 00:00:05.702724,63,200.0,COMPLETE,RandomForest,0.6756674150896209,,,,,,,,,,,,,,,,,,,7,BaselinePreprocessor,HybridCategoricalStatisticsImputer,ArcSinhTargetScaler
15,15,0.6673792760652566,2024-03-08 00:44:23.791100,2024-03-08 00:44:41.294569,0 days 00:00:17.503469,42,600.0,COMPLETE,RandomForest,0.6756674150896209,,,,,,,,,,,,,,,,,,,7,BaselinePreprocessor,HybridCategoricalStatisticsImputer,ArcSinhTargetScaler
16,16,0.42577935261205846,2024-03-08 00:44:41.295489,2024-03-08 00:44:47.917753,0 days 00:00:06.622264,3,700.0,COMPLETE,RandomForest,0.6756674150896209,,,,,,,,,,,,,,,,,,,7,BaselinePreprocessor,HybridCategoricalStatisticsImputer,ArcSinhTargetScaler
17,17,0.6408780102477742,2024-03-08 00:44:47.918685,2024-03-08 00:44:50.828804,0 days 00:00:02.910119,81,100.0,COMPLETE,RandomForest,0.6756674150896209,,,,,,,,,,,,,,,,,,,7,BaselinePreprocessor,HybridCategoricalStatisticsImputer,ArcSinhTargetScaler
18,18,0.6694582923109267,2024-03-08 00:44:50.829464,2024-03-08 00:45:25.819180,0 days 00:00:34.989716,45,1100.0,COMPLETE,RandomForest,0.6756674150896209,,,,,,,,,,,,,,,,,,,7,BaselinePreprocessor,HybridCategoricalStatisticsImputer,ArcSinhTargetScaler
19,19,0.6690560584062657,2024-03-08 00:45:25.819841,2024-03-08 00:45:46.826668,0 days 00:00:21.006827,27,700.0,COMPLETE,RandomForest,0.6756674150896209,,,,,,,,,,,,,,,,,,,7,BaselinePreprocessor,HybridCategoricalStatisticsImputer,ArcSinhTargetScaler
20,20,0.6674951390330397,2024-03-08 00:45:46.827684,2024-03-08 00:46:30.298702,0 days 00:00:43.471018,36,1400.0,COMPLETE,RandomForest,0.6756674150896209,,,,,,,,,,,,,,,,,,,7,BaselinePreprocessor,HybridCategoricalStatisticsImputer,ArcSinhTargetScaler
21,21,0.6628840154901757,2024-03-08 00:46:30.299704,2024-03-08 00:47:09.982765,0 days 00:00:39.683061,93,1300.0,COMPLETE,RandomForest,0.6756674150896209,,,,,,,,,,,,,,,,,,,7,BaselinePreprocessor,HybridCategoricalStatisticsImputer,ArcSinhTargetScaler
22,22,0.6724156653660184,2024-03-08 00:47:09.983431,2024-03-08 00:47:35.652034,0 days 00:00:25.668603,21,900.0,COMPLETE,RandomForest,0.6756674150896209,,,,,,,,,,,,,,,,,,,7,BaselinePreprocessor,HybridCategoricalStatisticsImputer,ArcSinhTargetScaler
23,23,0.6673208509543574,2024-03-08 00:47:35.652712,2024-03-08 00:48:15.452704,0 days 00:00:39.799992,39,1300.0,COMPLETE,RandomForest,0.6756674150896209,,,,,,,,,,,,,,,,,,,7,BaselinePreprocessor,HybridCategoricalStatisticsImputer,ArcSinhTargetScaler
24,24,0.6646740384111961,2024-03-08 00:48:15.453637,2024-03-08 00:48:21.505398,0 days 00:00:06.051761,48,200.0,COMPLETE,RandomForest,0.6756674150896209,,,,,,,,,,,,,,,,,,,7,BaselinePreprocessor,HybridCategoricalStatisticsImputer,ArcSinhTargetScaler
25,25,0.6644668026114404,2024-03-08 00:48:21.506043,2024-03-08 00:48:33.588284,0 days 00:00:12.082241,99,400.0,COMPLETE,RandomForest,0.6756674150896209,,,,,,,,,,,,,,,,,,,7,BaselinePreprocessor,HybridCategoricalStatisticsImputer,ArcSinhTargetScaler
26,26,0.6720847692529909,2024-03-08 00:48:33.589033,2024-03-08 00:49:01.699186,0 days 00:00:28.110153,99,900.0,COMPLETE,RandomForest,0.6756674150896209,,,,,,,,,,,,,,,,,,,7,BaselinePreprocessor,HybridCategoricalStatisticsImputer,ArcSinhTargetScaler
27,27,0.662594762278102,2024-03-08 00:49:01.700097,2024-03-08 00:49:30.676225,0 days 00:00:28.976128,36,900.0,COMPLETE,RandomForest,0.6756674150896209,,,,,,,,,,,,,,,,,,,7,BaselinePreprocessor,HybridCategoricalStatisticsImputer,ArcSinhTargetScaler
28,28,0.6675622001023555,2024-03-08 00:49:30.676846,2024-03-08 00:50:05.021181,0 days 00:00:34.344335,90,1100.0,COMPLETE,RandomForest,0.6756674150896209,,,,,,,,,,,,,,,,,,,7,BaselinePreprocessor,HybridCategoricalStatisticsImputer,ArcSinhTargetScaler
29,29,0.6734077054938445,2024-03-08 00:50:05.022111,2024-03-08 00:50:55.489938,0 days 00:00:50.467827,87,1500.0,COMPLETE,RandomForest,0.6756674150896209,,,,,,,,,,,,,,,,,,,7,BaselinePreprocessor,HybridCategoricalStatisticsImputer,ArcSinhTargetScaler
30,30,0.6676982357033951,2024-03-08 00:50:55.490755,2024-03-08 00:51:21.532817,0 days 00:00:26.042062,63,800.0,COMPLETE,RandomForest,0.6756674150896209,,,,,,,,,,,,,,,,,,,7,BaselinePreprocessor,HybridCategoricalStatisticsImputer,ArcSinhTargetScaler
31,31,0.6635800692185242,2024-03-08 00:51:21.533765,2024-03-08 00:51:43.322692,0 days 00:00:21.788927,75,700.0,COMPLETE,RandomForest,0.6756674150896209,,,,,,,,,,,,,,,,,,,7,BaselinePreprocessor,HybridCategoricalStatisticsImputer,ArcSinhTargetScaler
32,32,0.6685890297063218,2024-03-08 00:51:43.323692,2024-03-08 00:51:58.896311,0 days 00:00:15.572619,51,500.0,COMPLETE,RandomForest,0.6756674150896209,,,,,,,,,,,,,,,,,,,7,BaselinePreprocessor,HybridCategoricalStatisticsImputer,ArcSinhTargetScaler
33,33,0.669800011729432,2024-03-08 00:51:58.897130,2024-03-08 00:52:11.298442,0 days 00:00:12.401312,42,400.0,COMPLETE,RandomForest,0.6756674150896209,,,,,,,,,,,,,,,,,,,7,BaselinePreprocessor,HybridCategoricalStatisticsImputer,ArcSinhTargetScaler
34,34,0.6688060787733355,2024-03-08 00:52:11.299129,2024-03-08 00:52:57.797825,0 days 00:00:46.498696,36,1500.0,COMPLETE,RandomForest,0.6756674150896209,,,,,,,,,,,,,,,,,,,7,BaselinePreprocessor,HybridCategoricalStatisticsImputer,ArcSinhTargetScaler
35,35,0.6756674150896209,2024-03-08 00:52:57.798530,2024-03-08 00:53:43.933757,0 days 00:00:46.135227,21,1500.0,COMPLETE,RandomForest,0.6756674150896209,,,,,,,,,,,,,,,,,,,7,BaselinePreprocessor,HybridCategoricalStatisticsImputer,ArcSinhTargetScaler
36,36,0.6519673806043863,2024-03-08 00:53:43.934417,2024-03-08 00:54:16.658126,0 days 00:00:32.723709,12,1200.0,COMPLETE,RandomForest,0.6756674150896209,,,,,,,,,,,,,,,,,,,7,BaselinePreprocessor,HybridCategoricalStatisticsImputer,ArcSinhTargetScaler
37,37,0.6723515877519376,2024-03-08 00:54:16.658981,2024-03-08 00:54:47.451260,0 days 00:00:30.792279,45,1000.0,COMPLETE,RandomForest,0.6756674150896209,,,,,,,,,,,,,,,,,,,7,BaselinePreprocessor,HybridCategoricalStatisticsImputer,ArcSinhTargetScaler
38,38,0.6616832534740685,2024-03-08 00:54:47.451965,2024-03-08 00:54:50.537873,0 days 00:00:03.085908,57,100.0,COMPLETE,RandomForest,0.6756674150896209,,,,,,,,,,,,,,,,,,,7,BaselinePreprocessor,HybridCategoricalStatisticsImputer,ArcSinhTargetScaler
39,39,0.6754722294606282,2024-03-08 00:54:50.538643,2024-03-08 00:55:35.365056,0 days 00:00:44.826413,27,1400.0,COMPLETE,RandomForest,0.6756674150896209,,,,,,,,,,,,,,,,,,,7,BaselinePreprocessor,HybridCategoricalStatisticsImputer,ArcSinhTargetScaler
0,0,0.6697624314294726,2024-03-08 00:56:21.759936,2024-03-08 00:56:28.226229,0 days 00:00:06.466293,60,310.0,COMPLETE,LGBM,0.6832935375286049,0.45957050022544527,3.0,0.5680063938135778,4.502378296797937,2.31319695491857e-06,0.06679014945624165,14.0,143.0,,,,,,,,,,,7,BaselinePreprocessor,HybridCategoricalStatisticsImputer,ArcSinhTargetScaler
1,1,0.6703132378443442,2024-03-08 00:56:28.227558,2024-03-08 00:56:39.118683,0 days 00:00:10.891125,87,510.0,COMPLETE,LGBM,0.6832935375286049,0.9078194075728608,5.0,0.4011817977534272,2.2613137102417373,0.02820381563518122,0.02949028715697297,94.0,171.0,,,,,,,,,,,7,BaselinePreprocessor,HybridCategoricalStatisticsImputer,ArcSinhTargetScaler
2,2,0.6739159645094307,2024-03-08 00:56:39.119928,2024-03-08 00:57:18.435495,0 days 00:00:39.315567,78,1310.0,COMPLETE,LGBM,0.6832935375286049,0.8900654582770123,4.0,0.8338884324873045,1.1881098202836481e-07,0.00032210688416439443,0.08164106800289166,77.0,163.0,,,,,,,,,,,7,BaselinePreprocessor,HybridCategoricalStatisticsImputer,ArcSinhTargetScaler
3,3,0.6774283873193838,2024-03-08 00:57:18.436749,2024-03-08 00:59:05.482846,0 days 00:01:47.046097,75,1310.0,COMPLETE,LGBM,0.6832935375286049,0.9392858629737558,1.0,0.8246514776238135,1.0238289213747348e-07,0.034743398758850956,0.029034783072666534,27.0,67.0,,,,,,,,,,,7,BaselinePreprocessor,HybridCategoricalStatisticsImputer,ArcSinhTargetScaler
4,4,0.6588432469466541,2024-03-08 00:59:05.484072,2024-03-08 00:59:08.154727,0 days 00:00:02.670655,66,110.0,COMPLETE,LGBM,0.6832935375286049,0.8320278508136577,7.0,0.5416459696596555,5.03891323905066e-07,5.551034611532625,0.02138664581559636,84.0,11.0,,,,,,,,,,,7,BaselinePreprocessor,HybridCategoricalStatisticsImputer,ArcSinhTargetScaler
5,5,0.6555268382794472,2024-03-08 00:59:08.155784,2024-03-08 00:59:26.277175,0 days 00:00:18.121391,87,1210.0,COMPLETE,LGBM,0.6832935375286049,0.8019946891397476,4.0,0.9535397584329685,2.8376997535422204,0.0009532034822994156,0.06755016231443108,83.0,231.0,,,,,,,,,,,7,BaselinePreprocessor,HybridCategoricalStatisticsImputer,ArcSinhTargetScaler
6,6,0.6732635706779304,2024-03-08 00:59:26.278796,2024-03-08 00:59:48.862144,0 days 00:00:22.583348,84,1210.0,COMPLETE,LGBM,0.6832935375286049,0.7244069970113243,6.0,0.686747050218026,0.19510073958336682,0.01700398207444963,0.07374169562822515,34.0,59.0,,,,,,,,,,,7,BaselinePreprocessor,HybridCategoricalStatisticsImputer,ArcSinhTargetScaler
