,number,value,datetime_start,datetime_complete,duration,params_max_depth,params_n_estimators,state,model,best_value,params_bagging_fraction,params_bagging_freq,params_feature_fraction,params_lambda_l1,params_lambda_l2,params_learning_rate,params_min_child_samples,params_num_leaves,params_alpha,params_booster,params_eta,params_gamma,params_grow_policy,params_lambda,params_normalize_type,params_rate_drop,params_sample_type,params_skip_drop,config_id,preprocessor,imputer,target_scaler
16,16,0.5695034260882451,2024-03-07 18:41:26.384806,2024-03-07 18:41:55.321488,0 days 00:00:28.936682,4,,COMPLETE,XGB,0.6269481464638257,,,,,,,,,0.006033459277698951,dart,0.02431073997578226,0.04807666178548159,depthwise,1.0359851724565862e-07,tree,0.5140884208140535,uniform,7.12467403890623e-06,1,BaselinePreprocessor,DummyImputer,ArcSinhTargetScaler
17,17,0.37909551319070334,2024-03-07 18:41:55.322947,2024-03-07 18:42:19.918611,0 days 00:00:24.595664,1,,COMPLETE,XGB,0.6269481464638257,,,,,,,,,1.963517237335422e-08,dart,2.019428070883319e-07,0.3755725500055663,lossguide,2.386861929340477e-08,tree,2.4657154223687126e-05,weighted,0.004798013063046909,1,BaselinePreprocessor,DummyImputer,ArcSinhTargetScaler
18,18,0.5864051966689457,2024-03-07 18:42:19.920620,2024-03-07 18:43:08.506953,0 days 00:00:48.586333,5,,COMPLETE,XGB,0.6269481464638257,,,,,,,,,2.3748833416670577e-08,dart,0.017645222345287436,0.016916784514433878,lossguide,1.0697399301795075e-07,forest,0.039313743326829326,uniform,5.574433289117824e-06,1,BaselinePreprocessor,DummyImputer,ArcSinhTargetScaler
19,19,0.5837923251904347,2024-03-07 18:43:08.510070,2024-03-07 18:43:49.346915,0 days 00:00:40.836845,5,,COMPLETE,XGB,0.6269481464638257,,,,,,,,,0.0003798264244512957,dart,0.1908006964574478,1.3228696031246365e-08,depthwise,2.821172793894893e-06,tree,0.06923292725213165,weighted,8.92860383969479e-07,1,BaselinePreprocessor,DummyImputer,ArcSinhTargetScaler
20,20,0.5523150199543417,2024-03-07 18:43:49.348452,2024-03-07 18:44:44.192537,0 days 00:00:54.844085,8,,COMPLETE,XGB,0.6269481464638257,,,,,,,,,2.567520503670916e-06,dart,2.3232913855067328e-07,1.574261998052293e-05,depthwise,2.2798761559004857e-08,tree,7.593341462234546e-06,weighted,4.564267641075774e-06,1,BaselinePreprocessor,DummyImputer,ArcSinhTargetScaler
21,21,0.5542416246847629,2024-03-07 18:44:44.193655,2024-03-07 18:45:40.658776,0 days 00:00:56.465121,6,,COMPLETE,XGB,0.6269481464638257,,,,,,,,,0.0007405318107266183,dart,3.8332524713650396e-07,2.0223019138169595e-05,depthwise,0.00041981696295571603,tree,1.2996252984004616e-06,uniform,7.874399042473006e-05,1,BaselinePreprocessor,DummyImputer,ArcSinhTargetScaler
22,22,0.5480623794644257,2024-03-07 18:45:40.662441,2024-03-07 18:46:39.692801,0 days 00:00:59.030360,8,,COMPLETE,XGB,0.6269481464638257,,,,,,,,,0.04222802749599161,dart,7.652451269312875e-06,0.0001783211726760744,depthwise,1.430139649306719e-07,forest,0.00011953488631620084,uniform,0.00038009035378053083,1,BaselinePreprocessor,DummyImputer,ArcSinhTargetScaler
23,23,0.44473385168618473,2024-03-07 18:46:39.694430,2024-03-07 18:47:10.138769,0 days 00:00:30.444339,1,,COMPLETE,XGB,0.6269481464638257,,,,,,,,,4.2299577350489917e-07,dart,1.3073781799737638e-06,1.0143726086793384e-07,depthwise,1.2965650553803653e-07,forest,1.5177659727147961e-05,weighted,8.386019880084104e-05,1,BaselinePreprocessor,DummyImputer,ArcSinhTargetScaler
24,24,0.547493640898962,2024-03-07 18:47:10.141239,2024-03-07 18:48:04.988931,0 days 00:00:54.847692,8,,COMPLETE,XGB,0.6269481464638257,,,,,,,,,0.00012511204050650796,dart,8.455966934343281e-05,1.3929502203952357e-07,depthwise,0.02637808053357077,tree,3.68349822062957e-08,weighted,0.39778756514757363,1,BaselinePreprocessor,DummyImputer,ArcSinhTargetScaler
25,25,0.5742821323426265,2024-03-07 18:48:04.990102,2024-03-07 18:48:53.569632,0 days 00:00:48.579530,9,,COMPLETE,XGB,0.6269481464638257,,,,,,,,,0.5326239862338089,dart,0.0003408009278518988,0.03887823712214428,lossguide,0.01034163005674256,forest,0.6323679082232088,uniform,0.4412058329240474,1,BaselinePreprocessor,DummyImputer,ArcSinhTargetScaler
26,26,0.5229374616857045,2024-03-07 18:48:53.572973,2024-03-07 18:49:27.141945,0 days 00:00:33.568972,2,,COMPLETE,XGB,0.6269481464638257,,,,,,,,,0.624894287947737,dart,0.00012357745123920346,0.00017534494167229095,lossguide,0.0021045069686949553,forest,0.0019703717302428925,weighted,5.025241630060713e-06,1,BaselinePreprocessor,DummyImputer,ArcSinhTargetScaler
27,27,0.44473385168618473,2024-03-07 18:49:27.143908,2024-03-07 18:49:50.160302,0 days 00:00:23.016394,1,,COMPLETE,XGB,0.6269481464638257,,,,,,,,,0.0005255152969022532,dart,0.00016108912683218535,0.002115337796525671,lossguide,7.241072154014744e-08,forest,0.00010463888794637033,weighted,5.9451072378682163e-08,1,BaselinePreprocessor,DummyImputer,ArcSinhTargetScaler
28,28,0.44753246078593095,2024-03-07 18:49:50.161683,2024-03-07 18:50:16.884795,0 days 00:00:26.723112,1,,COMPLETE,XGB,0.6269481464638257,,,,,,,,,0.004884066787566342,dart,0.0018775212294993087,0.0002357619435297026,lossguide,4.173368516964347e-05,tree,2.658448224020231e-07,uniform,8.404598994161431e-08,1,BaselinePreprocessor,DummyImputer,ArcSinhTargetScaler
29,29,0.5601754238992969,2024-03-07 18:50:16.886572,2024-03-07 18:51:13.185105,0 days 00:00:56.298533,6,,COMPLETE,XGB,0.6269481464638257,,,,,,,,,1.3769102176804257e-05,dart,1.8431351577496691e-07,3.0681341761972405e-08,lossguide,0.09201278432918376,forest,3.76674000173832e-08,weighted,2.504372360996506e-08,1,BaselinePreprocessor,DummyImputer,ArcSinhTargetScaler
30,30,0.5647846850870525,2024-03-07 18:51:13.190020,2024-03-07 18:51:36.816003,0 days 00:00:23.625983,1,,COMPLETE,XGB,0.6269481464638257,,,,,,,,,2.457038730127986e-05,dart,0.08206284805128594,0.26806054297601223,depthwise,0.0004116189453387319,tree,0.0005883421203744432,uniform,0.00029273634052075383,1,BaselinePreprocessor,DummyImputer,ArcSinhTargetScaler
31,31,0.5671378366928808,2024-03-07 18:51:36.817440,2024-03-07 18:52:12.887989,0 days 00:00:36.070549,3,,COMPLETE,XGB,0.6269481464638257,,,,,,,,,1.0980706833646879e-05,dart,5.813926084433287e-07,0.07597881252320195,depthwise,0.372797093717421,tree,1.0157652255656151e-05,uniform,6.786359159434816e-06,1,BaselinePreprocessor,DummyImputer,ArcSinhTargetScaler
32,32,0.5225531350710865,2024-03-07 18:52:12.889471,2024-03-07 18:52:39.417826,0 days 00:00:26.528355,2,,COMPLETE,XGB,0.6269481464638257,,,,,,,,,0.09498076414543209,dart,1.2530526650635591e-05,3.437671667465532e-05,lossguide,2.033006656429757e-05,forest,4.649398065066509e-05,weighted,0.047326752758127276,1,BaselinePreprocessor,DummyImputer,ArcSinhTargetScaler
33,33,0.6126895264967518,2024-03-07 18:52:39.419527,2024-03-07 18:53:23.805307,0 days 00:00:44.385780,6,,COMPLETE,XGB,0.6269481464638257,,,,,,,,,0.000435105733066079,dart,0.3483758136626637,2.4445544251949493e-06,depthwise,0.0005930039357020673,forest,0.0045028959402905275,uniform,3.9845767676854547e-07,1,BaselinePreprocessor,DummyImputer,ArcSinhTargetScaler
34,34,0.5941028138461802,2024-03-07 18:53:23.808465,2024-03-07 18:54:14.586464,0 days 00:00:50.777999,7,,COMPLETE,XGB,0.6269481464638257,,,,,,,,,0.04518417944675509,dart,0.0063167321094428405,0.0020971078434885524,depthwise,0.004125031207741649,tree,0.0002191871037159957,uniform,3.8612905307951816e-05,1,BaselinePreprocessor,DummyImputer,ArcSinhTargetScaler
35,35,0.5467436338372834,2024-03-07 18:54:14.588071,2024-03-07 18:55:10.926984,0 days 00:00:56.338913,8,,COMPLETE,XGB,0.6269481464638257,,,,,,,,,2.7470720698777583e-05,dart,0.00011293588462636198,0.22880392697569182,lossguide,1.8500424892526344e-05,forest,0.1590059117113978,uniform,2.6431095605376036e-08,1,BaselinePreprocessor,DummyImputer,ArcSinhTargetScaler
36,36,0.6192595871503043,2024-03-07 18:55:10.932663,2024-03-07 18:55:57.344473,0 days 00:00:46.411810,8,,COMPLETE,XGB,0.6269481464638257,,,,,,,,,5.7834897369604666e-06,dart,0.1981619206337481,0.020476483661129575,depthwise,3.5491080043634335e-08,tree,3.4009759495346794e-05,weighted,1.7727348260062173e-06,1,BaselinePreprocessor,DummyImputer,ArcSinhTargetScaler
37,37,0.5572879667129367,2024-03-07 18:55:57.345727,2024-03-07 18:56:47.958783,0 days 00:00:50.613056,7,,COMPLETE,XGB,0.6269481464638257,,,,,,,,,0.16970716479847117,dart,1.1913214496562095e-06,0.003466002328800244,lossguide,0.0023214598258023632,tree,1.8468115753760458e-07,uniform,3.598705246685552e-05,1,BaselinePreprocessor,DummyImputer,ArcSinhTargetScaler
38,38,0.5478175584811815,2024-03-07 18:56:47.959990,2024-03-07 18:57:46.891563,0 days 00:00:58.931573,7,,COMPLETE,XGB,0.6269481464638257,,,,,,,,,0.018869518515205685,dart,1.0014571614178799e-07,1.294382155621738e-07,lossguide,0.003055490312955061,forest,2.0612392096078542e-08,uniform,1.812473338085944e-08,1,BaselinePreprocessor,DummyImputer,ArcSinhTargetScaler
39,39,0.5704880376058716,2024-03-07 18:57:46.896072,2024-03-07 18:58:46.952751,0 days 00:01:00.056679,9,,COMPLETE,XGB,0.6269481464638257,,,,,,,,,0.003466496543711814,dart,1.2974138103634604e-05,4.1554978363872334e-07,lossguide,0.09906065294758389,tree,3.705020049425349e-07,uniform,0.23158331928208908,1,BaselinePreprocessor,DummyImputer,ArcSinhTargetScaler
0,0,0.6499595102485126,2024-03-07 19:00:21.430627,2024-03-07 19:00:56.998339,0 days 00:00:35.567712,96,1200.0,COMPLETE,RandomForest,0.6550296443740231,,,,,,,,,,,,,,,,,,,2,BaselinePreprocessor,DummyImputer,DummyTargetScaler
1,1,0.6470774749012628,2024-03-07 19:00:57.016780,2024-03-07 19:01:17.684187,0 days 00:00:20.667407,63,700.0,COMPLETE,RandomForest,0.6550296443740231,,,,,,,,,,,,,,,,,,,2,BaselinePreprocessor,DummyImputer,DummyTargetScaler
2,2,0.6320826248380463,2024-03-07 19:01:17.685504,2024-03-07 19:01:20.349285,0 days 00:00:02.663781,66,100.0,COMPLETE,RandomForest,0.6550296443740231,,,,,,,,,,,,,,,,,,,2,BaselinePreprocessor,DummyImputer,DummyTargetScaler
3,3,0.6457608639353822,2024-03-07 19:01:20.350141,2024-03-07 19:01:49.927663,0 days 00:00:29.577522,87,1100.0,COMPLETE,RandomForest,0.6550296443740231,,,,,,,,,,,,,,,,,,,2,BaselinePreprocessor,DummyImputer,DummyTargetScaler
4,4,0.6293295847523498,2024-03-07 19:01:49.928447,2024-03-07 19:01:55.047684,0 days 00:00:05.119237,27,200.0,COMPLETE,RandomForest,0.6550296443740231,,,,,,,,,,,,,,,,,,,2,BaselinePreprocessor,DummyImputer,DummyTargetScaler
5,5,0.6524183784940963,2024-03-07 19:01:55.048598,2024-03-07 19:02:34.645890,0 days 00:00:39.597292,87,1500.0,COMPLETE,RandomForest,0.6550296443740231,,,,,,,,,,,,,,,,,,,2,BaselinePreprocessor,DummyImputer,DummyTargetScaler
6,6,0.6550296443740231,2024-03-07 19:02:34.646497,2024-03-07 19:03:10.331790,0 days 00:00:35.685293,96,1300.0,COMPLETE,RandomForest,0.6550296443740231,,,,,,,,,,,,,,,,,,,2,BaselinePreprocessor,DummyImputer,DummyTargetScaler
7,7,0.6344789387495469,2024-03-07 19:03:10.332512,2024-03-07 19:03:15.921388,0 days 00:00:05.588876,51,200.0,COMPLETE,RandomForest,0.6550296443740231,,,,,,,,,,,,,,,,,,,2,BaselinePreprocessor,DummyImputer,DummyTargetScaler
8,8,0.645681122792939,2024-03-07 19:03:15.922194,2024-03-07 19:03:57.590653,0 days 00:00:41.668459,75,1500.0,COMPLETE,RandomForest,0.6550296443740231,,,,,,,,,,,,,,,,,,,2,BaselinePreprocessor,DummyImputer,DummyTargetScaler
9,9,0.6377559275492748,2024-03-07 19:03:57.591343,2024-03-07 19:04:14.123358,0 days 00:00:16.532015,81,600.0,COMPLETE,RandomForest,0.6550296443740231,,,,,,,,,,,,,,,,,,,2,BaselinePreprocessor,DummyImputer,DummyTargetScaler
10,10,0.6320457658241121,2024-03-07 19:04:14.124282,2024-03-07 19:04:19.241464,0 days 00:00:05.117182,99,200.0,COMPLETE,RandomForest,0.6550296443740231,,,,,,,,,,,,,,,,,,,2,BaselinePreprocessor,DummyImputer,DummyTargetScaler
11,11,0.6471126467107038,2024-03-07 19:04:19.242125,2024-03-07 19:04:44.010521,0 days 00:00:24.768396,63,900.0,COMPLETE,RandomForest,0.6550296443740231,,,,,,,,,,,,,,,,,,,2,BaselinePreprocessor,DummyImputer,DummyTargetScaler
12,12,0.6534174074194842,2024-03-07 19:04:44.011269,2024-03-07 19:05:10.006873,0 days 00:00:25.995604,42,900.0,COMPLETE,RandomForest,0.6550296443740231,,,,,,,,,,,,,,,,,,,2,BaselinePreprocessor,DummyImputer,DummyTargetScaler
13,13,0.6523512414425041,2024-03-07 19:05:10.011709,2024-03-07 19:05:53.416772,0 days 00:00:43.405063,39,1500.0,COMPLETE,RandomForest,0.6550296443740231,,,,,,,,,,,,,,,,,,,2,BaselinePreprocessor,DummyImputer,DummyTargetScaler
14,14,0.6439215953993113,2024-03-07 19:05:53.417605,2024-03-07 19:06:26.654319,0 days 00:00:33.236714,15,1300.0,COMPLETE,RandomForest,0.6550296443740231,,,,,,,,,,,,,,,,,,,2,BaselinePreprocessor,DummyImputer,DummyTargetScaler
15,15,0.6352223049609853,2024-03-07 19:06:26.655275,2024-03-07 19:06:32.092080,0 days 00:00:05.436805,69,200.0,COMPLETE,RandomForest,0.6550296443740231,,,,,,,,,,,,,,,,,,,2,BaselinePreprocessor,DummyImputer,DummyTargetScaler
16,16,0.6334546022444886,2024-03-07 19:06:32.092868,2024-03-07 19:06:40.102693,0 days 00:00:08.009825,24,300.0,COMPLETE,RandomForest,0.6550296443740231,,,,,,,,,,,,,,,,,,,2,BaselinePreprocessor,DummyImputer,DummyTargetScaler
17,17,0.5661737052066614,2024-03-07 19:06:40.103347,2024-03-07 19:06:42.024708,0 days 00:00:01.921361,9,100.0,COMPLETE,RandomForest,0.6550296443740231,,,,,,,,,,,,,,,,,,,2,BaselinePreprocessor,DummyImputer,DummyTargetScaler
18,18,0.6469994136612313,2024-03-07 19:06:42.025643,2024-03-07 19:07:10.859111,0 days 00:00:28.833468,96,1000.0,COMPLETE,RandomForest,0.6550296443740231,,,,,,,,,,,,,,,,,,,2,BaselinePreprocessor,DummyImputer,DummyTargetScaler
19,19,0.3374210187057762,2024-03-07 19:07:10.860027,2024-03-07 19:07:23.821493,0 days 00:00:12.961466,3,1400.0,COMPLETE,RandomForest,0.6550296443740231,,,,,,,,,,,,,,,,,,,2,BaselinePreprocessor,DummyImputer,DummyTargetScaler
20,20,0.6377480717583682,2024-03-07 19:07:23.822335,2024-03-07 19:07:29.331544,0 days 00:00:05.509209,18,200.0,COMPLETE,RandomForest,0.6550296443740231,,,,,,,,,,,,,,,,,,,2,BaselinePreprocessor,DummyImputer,DummyTargetScaler
21,21,0.6445750740954376,2024-03-07 19:07:29.332318,2024-03-07 19:08:15.285573,0 days 00:00:45.953255,81,1500.0,COMPLETE,RandomForest,0.6550296443740231,,,,,,,,,,,,,,,,,,,2,BaselinePreprocessor,DummyImputer,DummyTargetScaler
22,22,0.6443241104715042,2024-03-07 19:08:15.287291,2024-03-07 19:08:47.425470,0 days 00:00:32.138179,15,1300.0,COMPLETE,RandomForest,0.6550296443740231,,,,,,,,,,,,,,,,,,,2,BaselinePreprocessor,DummyImputer,DummyTargetScaler
23,23,0.618239571160025,2024-03-07 19:08:47.426108,2024-03-07 19:08:49.905790,0 days 00:00:02.479682,81,100.0,COMPLETE,RandomForest,0.6550296443740231,,,,,,,,,,,,,,,,,,,2,BaselinePreprocessor,DummyImputer,DummyTargetScaler
24,24,0.6241304825117181,2024-03-07 19:08:49.906489,2024-03-07 19:08:57.728366,0 days 00:00:07.821877,24,300.0,COMPLETE,RandomForest,0.6550296443740231,,,,,,,,,,,,,,,,,,,2,BaselinePreprocessor,DummyImputer,DummyTargetScaler
25,25,0.6517460833007743,2024-03-07 19:08:57.729027,2024-03-07 19:09:18.830797,0 days 00:00:21.101770,99,800.0,COMPLETE,RandomForest,0.6550296443740231,,,,,,,,,,,,,,,,,,,2,BaselinePreprocessor,DummyImputer,DummyTargetScaler
26,26,0.6255201767803437,2024-03-07 19:09:18.831487,2024-03-07 19:09:23.913776,0 days 00:00:05.082289,75,200.0,COMPLETE,RandomForest,0.6550296443740231,,,,,,,,,,,,,,,,,,,2,BaselinePreprocessor,DummyImputer,DummyTargetScaler
27,27,0.6457143375235461,2024-03-07 19:09:23.914449,2024-03-07 19:09:29.044231,0 days 00:00:05.129782,84,200.0,COMPLETE,RandomForest,0.6550296443740231,,,,,,,,,,,,,,,,,,,2,BaselinePreprocessor,DummyImputer,DummyTargetScaler
28,28,0.6097126885549085,2024-03-07 19:09:29.045045,2024-03-07 19:09:31.669249,0 days 00:00:02.624204,51,100.0,COMPLETE,RandomForest,0.6550296443740231,,,,,,,,,,,,,,,,,,,2,BaselinePreprocessor,DummyImputer,DummyTargetScaler
29,29,0.6444526328215764,2024-03-07 19:09:31.669876,2024-03-07 19:10:07.536966,0 days 00:00:35.867090,72,1300.0,COMPLETE,RandomForest,0.6550296443740231,,,,,,,,,,,,,,,,,,,2,BaselinePreprocessor,DummyImputer,DummyTargetScaler
30,30,0.6539311856273744,2024-03-07 19:10:07.537627,2024-03-07 19:10:42.584240,0 days 00:00:35.046613,39,1400.0,COMPLETE,RandomForest,0.6550296443740231,,,,,,,,,,,,,,,,,,,2,BaselinePreprocessor,DummyImputer,DummyTargetScaler
31,31,0.6457172203473452,2024-03-07 19:10:42.584995,2024-03-07 19:11:16.748542,0 days 00:00:34.163547,36,1300.0,COMPLETE,RandomForest,0.6550296443740231,,,,,,,,,,,,,,,,,,,2,BaselinePreprocessor,DummyImputer,DummyTargetScaler
32,32,0.3351310828389259,2024-03-07 19:11:16.749426,2024-03-07 19:11:22.011804,0 days 00:00:05.262378,3,600.0,COMPLETE,RandomForest,0.6550296443740231,,,,,,,,,,,,,,,,,,,2,BaselinePreprocessor,DummyImputer,DummyTargetScaler
33,33,0.6352175666384674,2024-03-07 19:11:22.012668,2024-03-07 19:11:29.424132,0 days 00:00:07.411464,75,300.0,COMPLETE,RandomForest,0.6550296443740231,,,,,,,,,,,,,,,,,,,2,BaselinePreprocessor,DummyImputer,DummyTargetScaler
34,34,0.6396671424337317,2024-03-07 19:11:29.424809,2024-03-07 19:11:44.743205,0 days 00:00:15.318396,30,600.0,COMPLETE,RandomForest,0.6550296443740231,,,,,,,,,,,,,,,,,,,2,BaselinePreprocessor,DummyImputer,DummyTargetScaler
35,35,0.6361197263016088,2024-03-07 19:11:44.744089,2024-03-07 19:11:52.614481,0 days 00:00:07.870392,21,300.0,COMPLETE,RandomForest,0.6550296443740231,,,,,,,,,,,,,,,,,,,2,BaselinePreprocessor,DummyImputer,DummyTargetScaler
36,36,0.6311374952408112,2024-03-07 19:11:52.615383,2024-03-07 19:11:58.202279,0 days 00:00:05.586896,60,200.0,COMPLETE,RandomForest,0.6550296443740231,,,,,,,,,,,,,,,,,,,2,BaselinePreprocessor,DummyImputer,DummyTargetScaler
37,37,0.6504698468683354,2024-03-07 19:11:58.203104,2024-03-07 19:12:29.510852,0 days 00:00:31.307748,24,1200.0,COMPLETE,RandomForest,0.6550296443740231,,,,,,,,,,,,,,,,,,,2,BaselinePreprocessor,DummyImputer,DummyTargetScaler
38,38,0.6360667108287068,2024-03-07 19:12:29.511747,2024-03-07 19:12:40.285815,0 days 00:00:10.774068,99,400.0,COMPLETE,RandomForest,0.6550296443740231,,,,,,,,,,,,,,,,,,,2,BaselinePreprocessor,DummyImputer,DummyTargetScaler
39,39,0.6226229347295655,2024-03-07 19:12:40.286786,2024-03-07 19:12:42.784336,0 days 00:00:02.497550,18,100.0,COMPLETE,RandomForest,0.6550296443740231,,,,,,,,,,,,,,,,,,,2,BaselinePreprocessor,DummyImputer,DummyTargetScaler
0,0,0.6109839535384098,2024-03-07 19:13:16.886519,2024-03-07 19:13:51.140117,0 days 00:00:34.253598,42,410.0,COMPLETE,LGBM,0.6580418421281218,0.8142843274030755,1.0,0.8796038212841326,1.8621840650340333,7.716329841508642,0.011801511972311069,11.0,230.0,,,,,,,,,,,2,BaselinePreprocessor,DummyImputer,DummyTargetScaler
1,1,0.6166893694633198,2024-03-07 19:13:51.141454,2024-03-07 19:13:55.824436,0 days 00:00:04.682982,6,110.0,COMPLETE,LGBM,0.6580418421281218,0.7097475576712844,6.0,0.6351116826825428,0.010325384619476042,0.0016029937659786367,0.06134793197689813,7.0,11.0,,,,,,,,,,,2,BaselinePreprocessor,DummyImputer,DummyTargetScaler
2,2,0.6255139962725402,2024-03-07 19:13:55.825430,2024-03-07 19:14:04.646522,0 days 00:00:08.821092,78,910.0,COMPLETE,LGBM,0.6580418421281218,0.9983257196420258,5.0,0.5113238767853214,1.2266266275797717,5.3380340092869845e-06,0.2024553988142461,5.0,11.0,,,,,,,,,,,2,BaselinePreprocessor,DummyImputer,DummyTargetScaler
3,3,0.6194620416440217,2024-03-07 19:14:04.647716,2024-03-07 19:14:38.828945,0 days 00:00:34.181229,51,1010.0,COMPLETE,LGBM,0.6580418421281218,0.4325231434717059,1.0,0.7061282464485124,1.5561326229263614e-06,5.473481747586647,0.01392758252719743,30.0,107.0,,,,,,,,,,,2,BaselinePreprocessor,DummyImputer,DummyTargetScaler
4,4,0.6342298836542714,2024-03-07 19:14:38.830083,2024-03-07 19:15:03.445715,0 days 00:00:24.615632,78,910.0,COMPLETE,LGBM,0.6580418421281218,0.4248846255962987,2.0,0.5626483052586664,0.007857468295794817,2.923501380051202e-07,0.02726102106502843,69.0,93.0,,,,,,,,,,,2,BaselinePreprocessor,DummyImputer,DummyTargetScaler
5,5,0.647421787331354,2024-03-07 19:15:03.447476,2024-03-07 19:15:42.751759,0 days 00:00:39.304283,84,1310.0,COMPLETE,LGBM,0.6580418421281218,0.5556321190761631,7.0,0.5273494525087975,0.22280027310087339,0.02253904926812583,0.027045504075912673,14.0,225.0,,,,,,,,,,,2,BaselinePreprocessor,DummyImputer,DummyTargetScaler
6,6,0.6198133905938901,2024-03-07 19:15:42.753413,2024-03-07 19:16:15.990356,0 days 00:00:33.236943,75,510.0,COMPLETE,LGBM,0.6580418421281218,0.551340568263997,7.0,0.47620948422575893,7.403870038828255e-07,9.955784626032453e-08,0.011013776989941793,48.0,239.0,,,,,,,,,,,2,BaselinePreprocessor,DummyImputer,DummyTargetScaler
7,7,0.6333988323854763,2024-03-07 19:16:15.994373,2024-03-07 19:16:51.920226,0 days 00:00:35.925853,12,1110.0,COMPLETE,LGBM,0.6580418421281218,0.6720926939443406,3.0,0.4669559801319162,0.00017228776942843405,0.08477895866120726,0.022826494374433553,91.0,239.0,,,,,,,,,,,2,BaselinePreprocessor,DummyImputer,DummyTargetScaler
8,8,0.5865120881522122,2024-03-07 19:16:51.922130,2024-03-07 19:16:53.424694,0 days 00:00:01.502564,12,10.0,COMPLETE,LGBM,0.6580418421281218,0.4044379458065634,3.0,0.8796826428756824,0.022241022025884367,1.8224483924047763e-05,0.12982757538141715,10.0,41.0,,,,,,,,,,,2,BaselinePreprocessor,DummyImputer,DummyTargetScaler
9,9,0.6070611568910622,2024-03-07 19:16:53.426143,2024-03-07 19:16:55.364222,0 days 00:00:01.938079,93,110.0,COMPLETE,LGBM,0.6580418421281218,0.5989627245265574,7.0,0.4402764970552622,8.918171610167363,2.627163490626327e-05,0.051673146356795305,31.0,98.0,,,,,,,,,,,2,BaselinePreprocessor,DummyImputer,DummyTargetScaler
10,10,0.6049514726164398,2024-03-07 19:16:55.365846,2024-03-07 19:17:03.480485,0 days 00:00:08.114639,78,310.0,COMPLETE,LGBM,0.6580418421281218,0.9382202526808416,7.0,0.48476015793841054,5.203610386420334,0.6275693384216986,0.03434673821571838,96.0,69.0,,,,,,,,,,,2,BaselinePreprocessor,DummyImputer,DummyTargetScaler
11,11,0.6466863798080891,2024-03-07 19:17:03.482635,2024-03-07 19:17:13.308449,0 days 00:00:09.825814,42,110.0,COMPLETE,LGBM,0.6580418421281218,0.8401812210875321,1.0,0.4588028734457288,8.622123113785232e-06,6.494362050310481e-05,0.04323350288044897,38.0,51.0,,,,,,,,,,,2,BaselinePreprocessor,DummyImputer,DummyTargetScaler
