,number,value,datetime_start,datetime_complete,duration,params_max_depth,params_n_estimators,state,model,best_value,params_bagging_fraction,params_bagging_freq,params_feature_fraction,params_lambda_l1,params_lambda_l2,params_learning_rate,params_min_child_samples,params_num_leaves,params_alpha,params_booster,params_eta,params_gamma,params_grow_policy,params_lambda,params_normalize_type,params_rate_drop,params_sample_type,params_skip_drop,config_id,preprocessor,imputer,target_scaler
14,14,0.6718242770119638,2024-03-08 11:36:51.442304,2024-03-08 11:37:49.877999,0 days 00:00:58.435695,42,1210.0,COMPLETE,LGBM,0.6879010206811347,0.7930283061097222,3.0,0.7750294567273703,3.7195047461236136e-08,0.0016303693671000433,0.019739683783708994,91.0,124.0,,,,,,,,,,,16,IIDPreprocessor,HybridCategoricalStatisticsImputer,ArcSinhTargetScaler
15,15,0.6754299374647295,2024-03-08 11:37:49.879616,2024-03-08 11:39:22.878196,0 days 00:01:32.998580,18,1210.0,COMPLETE,LGBM,0.6879010206811347,0.9339855367555342,2.0,0.8544626517064731,2.39177767822833e-05,1.7601197741839732e-07,0.021571699305449152,56.0,111.0,,,,,,,,,,,16,IIDPreprocessor,HybridCategoricalStatisticsImputer,ArcSinhTargetScaler
16,16,0.6816903067587254,2024-03-08 11:39:22.911838,2024-03-08 11:40:45.094957,0 days 00:01:22.183119,66,710.0,COMPLETE,LGBM,0.6879010206811347,0.5975524603498399,4.0,0.9906828405647518,2.998850368194801e-08,4.092292222991879e-06,0.01732946018230803,35.0,152.0,,,,,,,,,,,16,IIDPreprocessor,HybridCategoricalStatisticsImputer,ArcSinhTargetScaler
17,17,0.6754097706148041,2024-03-08 11:40:45.096750,2024-03-08 11:42:08.061688,0 days 00:01:22.964938,69,1410.0,COMPLETE,LGBM,0.6879010206811347,0.5292783289317848,3.0,0.8738072218873361,1.2928152011191652e-07,0.6552745209131252,0.04740258807795212,19.0,171.0,,,,,,,,,,,16,IIDPreprocessor,HybridCategoricalStatisticsImputer,ArcSinhTargetScaler
18,18,0.6719766529545816,2024-03-08 11:42:08.062752,2024-03-08 11:42:41.063326,0 days 00:00:33.000574,84,1310.0,COMPLETE,LGBM,0.6879010206811347,0.8357236135480359,6.0,0.6948305364360725,0.04684081289074671,0.04697431149990661,0.012935546408141776,96.0,7.0,,,,,,,,,,,16,IIDPreprocessor,HybridCategoricalStatisticsImputer,ArcSinhTargetScaler
19,19,0.66766208577829,2024-03-08 11:42:41.064988,2024-03-08 11:42:55.111742,0 days 00:00:14.046754,24,310.0,COMPLETE,LGBM,0.6879010206811347,0.6066492440593997,4.0,0.6682273600230877,0.17933793874623746,3.340031930112227e-06,0.011590406698633492,45.0,73.0,,,,,,,,,,,16,IIDPreprocessor,HybridCategoricalStatisticsImputer,ArcSinhTargetScaler
20,20,0.14719671440391996,2024-03-08 11:42:55.113448,2024-03-08 11:43:08.468594,0 days 00:00:13.355146,66,1410.0,COMPLETE,LGBM,0.6879010206811347,0.44694692806638,4.0,0.9418066822651491,0.0021944762537128766,0.0025616715715614294,0.27674929100945456,40.0,47.0,,,,,,,,,,,16,IIDPreprocessor,HybridCategoricalStatisticsImputer,ArcSinhTargetScaler
21,21,0.6642216644476968,2024-03-08 11:43:08.470511,2024-03-08 11:43:38.993660,0 days 00:00:30.523149,36,810.0,COMPLETE,LGBM,0.6879010206811347,0.805343082060864,2.0,0.7829939287930423,2.8879955170524265e-06,4.906756755376,0.2218229236024772,57.0,251.0,,,,,,,,,,,16,IIDPreprocessor,HybridCategoricalStatisticsImputer,ArcSinhTargetScaler
22,22,0.6707763917962264,2024-03-08 11:43:38.995179,2024-03-08 11:44:15.564795,0 days 00:00:36.569616,30,1310.0,COMPLETE,LGBM,0.6879010206811347,0.5185354520472047,4.0,0.6639796489641123,1.827156448619642e-08,0.02849879770721239,0.15412462514547334,5.0,27.0,,,,,,,,,,,16,IIDPreprocessor,HybridCategoricalStatisticsImputer,ArcSinhTargetScaler
23,23,0.6879010206811347,2024-03-08 11:44:15.566219,2024-03-08 11:44:42.938840,0 days 00:00:27.372621,48,610.0,COMPLETE,LGBM,0.6879010206811347,0.6981049168840717,4.0,0.4416625353356093,1.865567739217487e-06,0.030279179329091643,0.05852198982642879,28.0,151.0,,,,,,,,,,,16,IIDPreprocessor,HybridCategoricalStatisticsImputer,ArcSinhTargetScaler
24,24,0.6385826755480608,2024-03-08 11:44:42.940161,2024-03-08 11:44:45.135894,0 days 00:00:02.195733,45,10.0,COMPLETE,LGBM,0.6879010206811347,0.8397712570994267,7.0,0.9213282544359224,1.9267697973521866e-08,6.273947998410384e-08,0.2635643456982235,24.0,122.0,,,,,,,,,,,16,IIDPreprocessor,HybridCategoricalStatisticsImputer,ArcSinhTargetScaler
25,25,0.13511754650665556,2024-03-08 11:44:45.137856,2024-03-08 11:44:56.622639,0 days 00:00:11.484783,63,1410.0,COMPLETE,LGBM,0.6879010206811347,0.629634829600286,4.0,0.636511425955685,1.1439262171255283e-08,2.52673637754444e-08,0.2962976792028076,92.0,189.0,,,,,,,,,,,16,IIDPreprocessor,HybridCategoricalStatisticsImputer,ArcSinhTargetScaler
26,26,0.67665079654371,2024-03-08 11:44:56.623901,2024-03-08 11:45:36.076470,0 days 00:00:39.452569,96,1110.0,COMPLETE,LGBM,0.6879010206811347,0.686651445361077,3.0,0.6800774411763938,0.10425752494004974,1.086846455420752e-05,0.030378108993106716,54.0,252.0,,,,,,,,,,,16,IIDPreprocessor,HybridCategoricalStatisticsImputer,ArcSinhTargetScaler
27,27,0.66902432548314,2024-03-08 11:45:36.078125,2024-03-08 11:45:54.623105,0 days 00:00:18.544980,24,1210.0,COMPLETE,LGBM,0.6879010206811347,0.8889541797325139,3.0,0.6221672523961446,0.447829735249993,0.003124897682221217,0.07163527952956264,57.0,83.0,,,,,,,,,,,16,IIDPreprocessor,HybridCategoricalStatisticsImputer,ArcSinhTargetScaler
28,28,0.6307294857840658,2024-03-08 11:45:54.624330,2024-03-08 11:45:55.332040,0 days 00:00:00.707710,30,10.0,COMPLETE,LGBM,0.6879010206811347,0.9102403265222969,6.0,0.5535463323043491,8.157547063342519e-08,0.12905530943846322,0.022069633785428106,39.0,195.0,,,,,,,,,,,16,IIDPreprocessor,HybridCategoricalStatisticsImputer,ArcSinhTargetScaler
29,29,0.6866663142691547,2024-03-08 11:45:55.333384,2024-03-08 11:46:24.323263,0 days 00:00:28.989879,54,610.0,COMPLETE,LGBM,0.6879010206811347,0.6183646296371863,7.0,0.6001321192318508,0.4062362896994668,7.041535465522836e-07,0.011812867770998076,32.0,77.0,,,,,,,,,,,16,IIDPreprocessor,HybridCategoricalStatisticsImputer,ArcSinhTargetScaler
30,30,0.6834233306858715,2024-03-08 11:46:24.324555,2024-03-08 11:46:56.305701,0 days 00:00:31.981146,15,510.0,COMPLETE,LGBM,0.6879010206811347,0.5456402748834908,2.0,0.87549505652712,0.025994003363773135,0.05955030611348142,0.04595888678051971,26.0,238.0,,,,,,,,,,,16,IIDPreprocessor,HybridCategoricalStatisticsImputer,ArcSinhTargetScaler
31,31,0.665531172536781,2024-03-08 11:46:56.306621,2024-03-08 11:47:18.806612,0 days 00:00:22.499991,6,710.0,COMPLETE,LGBM,0.6879010206811347,0.6229695447654481,5.0,0.6578748352731949,3.0551970351418675e-08,1.7314440373336296e-06,0.05607694338272686,84.0,76.0,,,,,,,,,,,16,IIDPreprocessor,HybridCategoricalStatisticsImputer,ArcSinhTargetScaler
32,32,0.669132922933978,2024-03-08 11:47:18.808028,2024-03-08 11:47:43.172372,0 days 00:00:24.364344,42,1410.0,COMPLETE,LGBM,0.6879010206811347,0.9354636209191305,7.0,0.6518346860942892,0.0003040183090137857,0.0009663354138798438,0.13452604435195833,95.0,16.0,,,,,,,,,,,16,IIDPreprocessor,HybridCategoricalStatisticsImputer,ArcSinhTargetScaler
33,33,0.6808340520123825,2024-03-08 11:47:43.173540,2024-03-08 11:48:43.059710,0 days 00:00:59.886170,63,910.0,COMPLETE,LGBM,0.6879010206811347,0.4813817971073673,3.0,0.8382855962234397,0.046450917605384986,0.0029647285158828167,0.02035709424686392,18.0,184.0,,,,,,,,,,,16,IIDPreprocessor,HybridCategoricalStatisticsImputer,ArcSinhTargetScaler
34,34,0.67832149258012,2024-03-08 11:48:43.060738,2024-03-08 11:48:57.166594,0 days 00:00:14.105856,72,710.0,COMPLETE,LGBM,0.6879010206811347,0.9222871834067826,2.0,0.4200329995350204,2.710695470540401e-08,1.019171005617403e-08,0.17141328933575714,28.0,117.0,,,,,,,,,,,16,IIDPreprocessor,HybridCategoricalStatisticsImputer,ArcSinhTargetScaler
35,35,0.6648340674964595,2024-03-08 11:48:57.167671,2024-03-08 11:49:13.293821,0 days 00:00:16.126150,48,310.0,COMPLETE,LGBM,0.6879010206811347,0.7258628150739788,7.0,0.8490160684954482,1.1674909067357492e-06,1.9952480021143815,0.010809534154396554,47.0,180.0,,,,,,,,,,,16,IIDPreprocessor,HybridCategoricalStatisticsImputer,ArcSinhTargetScaler
36,36,0.6481638193322357,2024-03-08 11:49:13.295647,2024-03-08 11:49:21.455846,0 days 00:00:08.160199,75,1210.0,COMPLETE,LGBM,0.6879010206811347,0.4407440022747682,2.0,0.8548329168058983,7.91192137916457,0.008078519068438176,0.2847187199751835,11.0,65.0,,,,,,,,,,,16,IIDPreprocessor,HybridCategoricalStatisticsImputer,ArcSinhTargetScaler
37,37,0.03755808068115269,2024-03-08 11:49:21.456936,2024-03-08 11:49:36.641830,0 days 00:00:15.184894,9,1310.0,COMPLETE,LGBM,0.6879010206811347,0.9365952578171574,6.0,0.6163460665975238,0.0001388022494814358,1.6950962110459375e-05,0.21628886660589874,92.0,253.0,,,,,,,,,,,16,IIDPreprocessor,HybridCategoricalStatisticsImputer,ArcSinhTargetScaler
38,38,0.6789930339831413,2024-03-08 11:49:36.642926,2024-03-08 11:50:35.432405,0 days 00:00:58.789479,54,1110.0,COMPLETE,LGBM,0.6879010206811347,0.577498074094405,3.0,0.846678788344642,2.70853682815032e-08,0.19990433126622875,0.052276899808816946,34.0,110.0,,,,,,,,,,,16,IIDPreprocessor,HybridCategoricalStatisticsImputer,ArcSinhTargetScaler
39,39,0.659298681501585,2024-03-08 11:50:35.433605,2024-03-08 11:50:50.177361,0 days 00:00:14.743756,27,1010.0,COMPLETE,LGBM,0.6879010206811347,0.44476493718238963,4.0,0.5027524134167146,0.015769389361012368,4.738651690329719,0.17686881338843383,80.0,193.0,,,,,,,,,,,16,IIDPreprocessor,HybridCategoricalStatisticsImputer,ArcSinhTargetScaler
0,0,0.6399802371095,2024-03-08 11:51:18.545108,2024-03-08 11:51:58.693641,0 days 00:00:40.148533,4,,COMPLETE,XGB,0.6631507755329327,,,,,,,,,0.020292128473201974,dart,0.005962342266376806,0.00031507759477296144,depthwise,1.3126591350614942e-07,tree,1.0793773845177214e-05,uniform,8.321475077363402e-05,16,IIDPreprocessor,HybridCategoricalStatisticsImputer,ArcSinhTargetScaler
1,1,0.5984852694634379,2024-03-08 11:51:58.694991,2024-03-08 11:52:51.229107,0 days 00:00:52.534116,7,,COMPLETE,XGB,0.6631507755329327,,,,,,,,,1.189577728207437e-05,dart,5.305213568662999e-08,1.1023769286778304e-07,depthwise,0.00022470346894972102,forest,0.004032632516628755,weighted,0.2921209480450737,16,IIDPreprocessor,HybridCategoricalStatisticsImputer,ArcSinhTargetScaler
2,2,0.6513806971904571,2024-03-08 11:52:51.230347,2024-03-08 11:53:43.715130,0 days 00:00:52.484783,7,,COMPLETE,XGB,0.6631507755329327,,,,,,,,,0.007623839020898864,dart,0.2881861443526448,5.3764580653703405e-08,lossguide,0.0025305348906328367,tree,0.04029362869719354,weighted,0.001319604688419776,16,IIDPreprocessor,HybridCategoricalStatisticsImputer,ArcSinhTargetScaler
3,3,0.6510062522451342,2024-03-08 11:53:43.716259,2024-03-08 11:54:20.417681,0 days 00:00:36.701422,3,,COMPLETE,XGB,0.6631507755329327,,,,,,,,,1.028450831712897e-07,dart,0.002423972180787687,0.0026651645141124503,lossguide,6.120882372825158e-08,tree,1.8200260103560987e-07,weighted,1.9889058622238285e-05,16,IIDPreprocessor,HybridCategoricalStatisticsImputer,ArcSinhTargetScaler
4,4,0.6282012893021776,2024-03-08 11:54:20.419309,2024-03-08 11:55:20.616019,0 days 00:01:00.196710,7,,COMPLETE,XGB,0.6631507755329327,,,,,,,,,0.0005045263116516222,dart,0.0008760750769554776,0.0001408641644345497,depthwise,7.156990840839179e-07,tree,5.413172116079384e-07,weighted,6.549228493356172e-05,16,IIDPreprocessor,HybridCategoricalStatisticsImputer,ArcSinhTargetScaler
5,5,0.6419238477540163,2024-03-08 11:55:20.617532,2024-03-08 11:56:14.945235,0 days 00:00:54.327703,7,,COMPLETE,XGB,0.6631507755329327,,,,,,,,,3.467004020892399e-08,dart,0.010563492857008245,4.620287120855285e-07,lossguide,0.017180999757750226,tree,1.869529858782901e-08,uniform,8.51378147296881e-08,16,IIDPreprocessor,HybridCategoricalStatisticsImputer,ArcSinhTargetScaler
6,6,0.6068923703579906,2024-03-08 11:56:14.946409,2024-03-08 11:56:38.775206,0 days 00:00:23.828797,1,,COMPLETE,XGB,0.6631507755329327,,,,,,,,,5.6584526055529774e-08,dart,0.031298354159161455,1.4649959284487447e-07,depthwise,0.046709927351682196,tree,0.017976605958775167,uniform,1.0750112993535198e-05,16,IIDPreprocessor,HybridCategoricalStatisticsImputer,ArcSinhTargetScaler
7,7,0.6202139376229174,2024-03-08 11:56:38.776725,2024-03-08 11:57:37.732171,0 days 00:00:58.955446,8,,COMPLETE,XGB,0.6631507755329327,,,,,,,,,0.48796440945963643,dart,3.36561643162922e-07,0.00021806406405731082,lossguide,0.0002049281784956728,tree,1.4692435694842744e-08,weighted,3.477859230671979e-08,16,IIDPreprocessor,HybridCategoricalStatisticsImputer,ArcSinhTargetScaler
8,8,0.6355349787916569,2024-03-08 11:57:37.733352,2024-03-08 11:58:21.732100,0 days 00:00:43.998748,5,,COMPLETE,XGB,0.6631507755329327,,,,,,,,,5.3423238038978265e-05,dart,0.014669799112082799,0.7919260187617353,lossguide,0.0001664372456881136,tree,0.0013654510362357077,uniform,0.01012662515192703,16,IIDPreprocessor,HybridCategoricalStatisticsImputer,ArcSinhTargetScaler
9,9,0.646850574916453,2024-03-08 11:58:21.733282,2024-03-08 11:58:54.900594,0 days 00:00:33.167312,3,,COMPLETE,XGB,0.6631507755329327,,,,,,,,,2.4506518280807047e-08,dart,0.06962392896776876,0.003972598647173661,depthwise,0.23626155414403757,tree,0.21544320821241833,uniform,0.05216879375511035,16,IIDPreprocessor,HybridCategoricalStatisticsImputer,ArcSinhTargetScaler
10,10,0.6516299626073352,2024-03-08 11:58:54.902423,2024-03-08 11:59:51.737693,0 days 00:00:56.835270,7,,COMPLETE,XGB,0.6631507755329327,,,,,,,,,0.0009062663481213705,dart,0.04331421023014805,7.348301654699942e-06,lossguide,0.00036843908330273773,forest,0.020714510946798773,uniform,3.9132619171161326e-06,16,IIDPreprocessor,HybridCategoricalStatisticsImputer,ArcSinhTargetScaler
11,11,0.6263032059816499,2024-03-08 11:59:51.739100,2024-03-08 12:00:58.639450,0 days 00:01:06.900350,6,,COMPLETE,XGB,0.6631507755329327,,,,,,,,,6.56415536123354e-05,dart,0.004038211466780357,0.22138943593269,depthwise,3.212663225102464e-07,tree,2.630666780676574e-07,weighted,9.825883929744084e-07,16,IIDPreprocessor,HybridCategoricalStatisticsImputer,ArcSinhTargetScaler
12,12,0.6297516245040866,2024-03-08 12:00:58.641039,2024-03-08 12:01:45.287392,0 days 00:00:46.646353,4,,COMPLETE,XGB,0.6631507755329327,,,,,,,,,0.007245415119948182,dart,8.369664359199678e-06,1.209901319277225e-07,lossguide,5.841952892529354e-05,forest,1.6564892063052837e-07,weighted,0.000786917950660855,16,IIDPreprocessor,HybridCategoricalStatisticsImputer,ArcSinhTargetScaler
13,13,0.6292652733845873,2024-03-08 12:01:45.288978,2024-03-08 12:02:41.751537,0 days 00:00:56.462559,6,,COMPLETE,XGB,0.6631507755329327,,,,,,,,,5.706777731273778e-08,dart,1.4372678336866821e-05,9.786166273603476e-05,lossguide,0.0006905023982733812,forest,1.1305714478797813e-08,uniform,0.12014636979359833,16,IIDPreprocessor,HybridCategoricalStatisticsImputer,ArcSinhTargetScaler
14,14,0.5915878777759604,2024-03-08 12:02:41.753371,2024-03-08 12:03:14.796362,0 days 00:00:33.042991,2,,COMPLETE,XGB,0.6631507755329327,,,,,,,,,0.008357475616745045,dart,1.129510642404265e-05,3.0173068423464368e-05,lossguide,0.0001783162501382774,forest,0.0036389232596340418,weighted,3.102410871706999e-07,16,IIDPreprocessor,HybridCategoricalStatisticsImputer,ArcSinhTargetScaler
15,15,0.6432322318074956,2024-03-08 12:03:14.797969,2024-03-08 12:03:50.897267,0 days 00:00:36.099298,3,,COMPLETE,XGB,0.6631507755329327,,,,,,,,,0.015031486037521202,dart,7.304455733209601e-07,2.4979604415201914e-07,depthwise,1.5419662717170902e-07,forest,6.551465931499063e-07,weighted,0.007079907722746445,16,IIDPreprocessor,HybridCategoricalStatisticsImputer,ArcSinhTargetScaler
16,16,0.6525653150705073,2024-03-08 12:03:50.898607,2024-03-08 12:04:51.446037,0 days 00:01:00.547430,7,,COMPLETE,XGB,0.6631507755329327,,,,,,,,,0.0001576980839409634,dart,0.06475136093967193,0.00036207666201252376,depthwise,7.88065114628475e-06,tree,0.021328936993815155,weighted,1.1458057878810384e-06,16,IIDPreprocessor,HybridCategoricalStatisticsImputer,ArcSinhTargetScaler
17,17,0.6627143907304627,2024-03-08 12:04:51.447721,2024-03-08 12:05:24.899263,0 days 00:00:33.451542,2,,COMPLETE,XGB,0.6631507755329327,,,,,,,,,2.0719905039345715e-08,dart,0.502201612770364,1.1099875833372722e-07,depthwise,1.669414295219665e-05,tree,3.915776538482891e-07,weighted,8.988711923598645e-06,16,IIDPreprocessor,HybridCategoricalStatisticsImputer,ArcSinhTargetScaler
18,18,0.6540695528710345,2024-03-08 12:05:24.900519,2024-03-08 12:06:04.418577,0 days 00:00:39.518058,8,,COMPLETE,XGB,0.6631507755329327,,,,,,,,,3.3004190325998916e-05,dart,0.6191249412656668,1.0803046610201662e-08,lossguide,3.916535910770213e-05,forest,0.0002529460575197166,weighted,7.23880800895533e-05,16,IIDPreprocessor,HybridCategoricalStatisticsImputer,ArcSinhTargetScaler
19,19,0.6617104733279082,2024-03-08 12:06:04.420011,2024-03-08 12:06:48.571349,0 days 00:00:44.151338,5,,COMPLETE,XGB,0.6631507755329327,,,,,,,,,0.001066169981976616,dart,0.15867932481418073,0.000910828780680731,depthwise,3.651790888236341e-05,forest,8.287013227780647e-06,weighted,2.0521827809445567e-05,16,IIDPreprocessor,HybridCategoricalStatisticsImputer,ArcSinhTargetScaler
20,20,0.6507094038639818,2024-03-08 12:06:48.572674,2024-03-08 12:07:18.074161,0 days 00:00:29.501487,3,,COMPLETE,XGB,0.6631507755329327,,,,,,,,,5.0672222234398475e-06,dart,5.325195867232597e-07,0.21875473556125738,lossguide,0.16206384177698788,tree,0.6040600000812572,weighted,2.635233188193245e-06,16,IIDPreprocessor,HybridCategoricalStatisticsImputer,ArcSinhTargetScaler
21,21,0.5882621658889937,2024-03-08 12:07:18.075707,2024-03-08 12:08:26.189545,0 days 00:01:08.113838,9,,COMPLETE,XGB,0.6631507755329327,,,,,,,,,0.001919305368479625,dart,7.09439673533183e-08,0.23647471092101174,lossguide,0.013884978578206163,forest,1.1405317916317078e-08,uniform,6.693755501489205e-07,16,IIDPreprocessor,HybridCategoricalStatisticsImputer,ArcSinhTargetScaler
22,22,0.5899891194773789,2024-03-08 12:08:26.190742,2024-03-08 12:08:51.177053,0 days 00:00:24.986311,1,,COMPLETE,XGB,0.6631507755329327,,,,,,,,,0.17263606609256157,dart,1.0056974732522153e-07,0.03585220501046427,depthwise,0.003242096354165746,tree,2.6843313207990153e-08,uniform,1.641411036872957e-08,16,IIDPreprocessor,HybridCategoricalStatisticsImputer,ArcSinhTargetScaler
23,23,0.6533569176054838,2024-03-08 12:08:51.178389,2024-03-08 12:09:53.036811,0 days 00:01:01.858422,8,,COMPLETE,XGB,0.6631507755329327,,,,,,,,,9.404187959138054e-06,dart,0.042441643227130614,0.2849465987551601,lossguide,1.2297378313718567e-06,forest,0.017129579473151815,weighted,4.086776896915501e-05,16,IIDPreprocessor,HybridCategoricalStatisticsImputer,ArcSinhTargetScaler
24,24,0.6286149981712552,2024-03-08 12:09:53.038433,2024-03-08 12:10:36.840422,0 days 00:00:43.801989,4,,COMPLETE,XGB,0.6631507755329327,,,,,,,,,0.00021698939077118438,dart,2.890275485949405e-07,0.2180612673864652,lossguide,7.276231620290929e-08,tree,6.095976404824431e-05,weighted,0.0031122552903757174,16,IIDPreprocessor,HybridCategoricalStatisticsImputer,ArcSinhTargetScaler
25,25,0.6432322318074956,2024-03-08 12:10:36.841553,2024-03-08 12:11:14.582721,0 days 00:00:37.741168,3,,COMPLETE,XGB,0.6631507755329327,,,,,,,,,0.017105411342650256,dart,1.9683765999940427e-06,0.00019798273487537285,lossguide,2.157587461011542e-08,tree,0.005105512961119708,weighted,2.322498072927977e-06,16,IIDPreprocessor,HybridCategoricalStatisticsImputer,ArcSinhTargetScaler
26,26,0.6428913776336606,2024-03-08 12:11:14.584349,2024-03-08 12:11:46.852235,0 days 00:00:32.267886,2,,COMPLETE,XGB,0.6631507755329327,,,,,,,,,1.052728303230555e-08,dart,0.021859482177771353,1.0403647451753235e-08,lossguide,6.933495590122032e-05,tree,3.2556008638822925e-08,weighted,4.300631786852875e-05,16,IIDPreprocessor,HybridCategoricalStatisticsImputer,ArcSinhTargetScaler
27,27,0.5747480782555946,2024-03-08 12:11:46.853865,2024-03-08 12:12:42.944084,0 days 00:00:56.090219,6,,COMPLETE,XGB,0.6631507755329327,,,,,,,,,1.7689854964716248e-05,dart,2.4643430305200525e-08,3.82021885842757e-06,lossguide,0.0006113434335035546,forest,6.206981789849219e-06,weighted,0.1091849006595669,16,IIDPreprocessor,HybridCategoricalStatisticsImputer,ArcSinhTargetScaler
28,28,0.6114245477433138,2024-03-08 12:12:42.945492,2024-03-08 12:13:52.064954,0 days 00:01:09.119462,9,,COMPLETE,XGB,0.6631507755329327,,,,,,,,,0.8782826632222963,dart,0.001868826941508327,1.2072879071723006e-08,lossguide,4.9904267740901315e-06,tree,5.143150728769487e-05,weighted,0.00026406592586473233,16,IIDPreprocessor,HybridCategoricalStatisticsImputer,ArcSinhTargetScaler
29,29,0.6236340235346906,2024-03-08 12:13:52.066120,2024-03-08 12:14:49.390656,0 days 00:00:57.324536,6,,COMPLETE,XGB,0.6631507755329327,,,,,,,,,0.09640133036397676,dart,1.7097656582803839e-07,0.1477353876393193,depthwise,4.260550551875865e-07,forest,2.8864456160305607e-08,weighted,4.711394961527799e-06,16,IIDPreprocessor,HybridCategoricalStatisticsImputer,ArcSinhTargetScaler
30,30,0.6631507755329327,2024-03-08 12:14:49.392404,2024-03-08 12:15:59.258502,0 days 00:01:09.866098,9,,COMPLETE,XGB,0.6631507755329327,,,,,,,,,0.0021362732870285226,dart,0.04252758997459928,0.0005438687902268076,lossguide,8.882298057587658e-05,tree,8.38489624191733e-08,uniform,0.10499663230140903,16,IIDPreprocessor,HybridCategoricalStatisticsImputer,ArcSinhTargetScaler
31,31,0.6302484025687561,2024-03-08 12:15:59.259927,2024-03-08 12:16:35.735436,0 days 00:00:36.475509,3,,COMPLETE,XGB,0.6631507755329327,,,,,,,,,0.005141469788373632,dart,1.5221753853698117e-08,3.225011959830182e-06,depthwise,0.7355539217782229,tree,1.0449261701840393e-06,weighted,0.08864727909559347,16,IIDPreprocessor,HybridCategoricalStatisticsImputer,ArcSinhTargetScaler
32,32,0.6004248125991619,2024-03-08 12:16:35.737326,2024-03-08 12:17:46.335360,0 days 00:01:10.598034,9,,COMPLETE,XGB,0.6631507755329327,,,,,,,,,1.547482091220979e-06,dart,6.445035674622432e-06,7.006671137925599e-07,depthwise,0.17545574389800198,forest,0.02774544935530552,uniform,0.00017370346500939003,16,IIDPreprocessor,HybridCategoricalStatisticsImputer,ArcSinhTargetScaler
