,number,value,datetime_start,datetime_complete,duration,params_max_depth,params_n_estimators,state,model,best_value,params_bagging_fraction,params_bagging_freq,params_feature_fraction,params_lambda_l1,params_lambda_l2,params_learning_rate,params_min_child_samples,params_num_leaves,params_alpha,params_booster,params_eta,params_gamma,params_grow_policy,params_lambda,params_normalize_type,params_rate_drop,params_sample_type,params_skip_drop,config_id,preprocessor,imputer,target_scaler
22,22,0.602371697667664,2024-03-08 10:42:27.584019,2024-03-08 10:43:30.528091,0 days 00:01:02.944072,8,,COMPLETE,XGB,0.6661728906082024,,,,,,,,,2.1598134993497885e-05,dart,1.0338274076617643e-07,1.9799550983173465e-05,depthwise,0.00559522336905383,forest,2.2613877493414017e-06,uniform,0.0016675949675728045,15,IIDPreprocessor,HybridCategoricalStatisticsImputer,LogTargetScaler
23,23,0.596129972017397,2024-03-08 10:43:30.530076,2024-03-08 10:44:38.741172,0 days 00:01:08.211096,9,,COMPLETE,XGB,0.6661728906082024,,,,,,,,,4.837503194158085e-08,dart,2.689153008991934e-05,1.2114972866203623e-06,lossguide,0.014912038537707407,tree,0.0002635819591320786,uniform,0.0004818476077681678,15,IIDPreprocessor,HybridCategoricalStatisticsImputer,LogTargetScaler
24,24,0.5977633111833338,2024-03-08 10:44:38.742785,2024-03-08 10:45:37.824410,0 days 00:00:59.081625,7,,COMPLETE,XGB,0.6661728906082024,,,,,,,,,9.395308665431663e-06,dart,3.645744027808006e-08,1.7972584333649704e-05,lossguide,4.11598254126039e-07,forest,3.934525943372984e-07,weighted,0.002239054248447265,15,IIDPreprocessor,HybridCategoricalStatisticsImputer,LogTargetScaler
25,25,0.6443011373036874,2024-03-08 10:45:37.826000,2024-03-08 10:46:09.043155,0 days 00:00:31.217155,2,,COMPLETE,XGB,0.6661728906082024,,,,,,,,,0.00028880232236135186,dart,0.031023133877975645,0.021776921048094647,lossguide,4.666135595600881e-06,forest,0.0018676663391453848,uniform,0.00030983906968714593,15,IIDPreprocessor,HybridCategoricalStatisticsImputer,LogTargetScaler
26,26,0.6353129181556485,2024-03-08 10:46:09.044631,2024-03-08 10:47:00.760735,0 days 00:00:51.716104,7,,COMPLETE,XGB,0.6661728906082024,,,,,,,,,0.0002940151329925836,dart,0.03200907248772658,3.716363606027778e-07,lossguide,2.0131547398531965e-07,tree,0.7474983585497673,weighted,0.08650598544461782,15,IIDPreprocessor,HybridCategoricalStatisticsImputer,LogTargetScaler
27,27,0.6291361268976051,2024-03-08 10:47:00.762267,2024-03-08 10:47:51.558964,0 days 00:00:50.796697,6,,COMPLETE,XGB,0.6661728906082024,,,,,,,,,9.686688558500134e-06,dart,5.0034826567157e-06,5.740777262327724e-06,depthwise,1.4958813142268908e-05,tree,1.7688958734654532e-08,uniform,3.863457868076793e-06,15,IIDPreprocessor,HybridCategoricalStatisticsImputer,LogTargetScaler
28,28,0.6202531052291913,2024-03-08 10:47:51.559955,2024-03-08 10:48:19.840935,0 days 00:00:28.280980,2,,COMPLETE,XGB,0.6661728906082024,,,,,,,,,0.03648471667022491,dart,0.00681994328297119,0.0035415160427431816,depthwise,2.4157119338883833e-05,tree,2.3318147949731414e-05,weighted,4.7476545702278767e-07,15,IIDPreprocessor,HybridCategoricalStatisticsImputer,LogTargetScaler
29,29,0.6275510949296603,2024-03-08 10:48:19.842730,2024-03-08 10:49:00.382390,0 days 00:00:40.539660,4,,COMPLETE,XGB,0.6661728906082024,,,,,,,,,0.00021487677084235655,dart,0.0002792895344177466,1.9413091301336367e-07,depthwise,0.3113667401963615,tree,0.0010457232699906246,weighted,1.465721327515987e-07,15,IIDPreprocessor,HybridCategoricalStatisticsImputer,LogTargetScaler
30,30,0.6647130549460231,2024-03-08 10:49:00.384645,2024-03-08 10:49:45.172462,0 days 00:00:44.787817,5,,COMPLETE,XGB,0.6661728906082024,,,,,,,,,3.2593862862091736e-07,dart,0.1715889418237091,3.172960788128942e-05,depthwise,1.5482507288021963e-07,tree,6.030448206110081e-05,uniform,2.8640582356440587e-05,15,IIDPreprocessor,HybridCategoricalStatisticsImputer,LogTargetScaler
31,31,0.5899891194773789,2024-03-08 10:49:45.174158,2024-03-08 10:50:12.066855,0 days 00:00:26.892697,1,,COMPLETE,XGB,0.6661728906082024,,,,,,,,,0.08443991460764633,dart,6.664939419772056e-07,0.37337633789912106,depthwise,0.00051501830422943,tree,2.343849967572421e-05,uniform,2.7948864579787283e-07,15,IIDPreprocessor,HybridCategoricalStatisticsImputer,LogTargetScaler
32,32,0.5986445295747512,2024-03-08 10:50:12.068742,2024-03-08 10:51:16.630968,0 days 00:01:04.562226,8,,COMPLETE,XGB,0.6661728906082024,,,,,,,,,0.00023943002926824522,dart,2.281194615162556e-05,5.068504498025379e-06,lossguide,8.233174105090781e-05,tree,0.1516476542047452,weighted,0.03995513949013562,15,IIDPreprocessor,HybridCategoricalStatisticsImputer,LogTargetScaler
33,33,0.6291174185034072,2024-03-08 10:51:16.632656,2024-03-08 10:52:06.003284,0 days 00:00:49.370628,6,,COMPLETE,XGB,0.6661728906082024,,,,,,,,,4.656914940466857e-06,dart,6.362333340181796e-05,1.659903284067425e-05,lossguide,5.839464551603402e-06,tree,0.005410928957149281,uniform,5.432208178085999e-05,15,IIDPreprocessor,HybridCategoricalStatisticsImputer,LogTargetScaler
34,34,0.5989294388657148,2024-03-08 10:52:06.004445,2024-03-08 10:53:08.844469,0 days 00:01:02.840024,8,,COMPLETE,XGB,0.6661728906082024,,,,,,,,,2.2951343898966958e-08,dart,2.3580170858375738e-05,0.0004922768647632318,lossguide,1.2753778313930253e-07,forest,2.1929778214486848e-08,weighted,4.690358174292123e-05,15,IIDPreprocessor,HybridCategoricalStatisticsImputer,LogTargetScaler
35,35,0.6493683006631865,2024-03-08 10:53:08.845659,2024-03-08 10:53:43.408776,0 days 00:00:34.563117,3,,COMPLETE,XGB,0.6661728906082024,,,,,,,,,6.319762619194072e-08,dart,0.009076484292873875,0.23214725103216202,depthwise,0.0037817171211257878,tree,0.0022723882131815416,uniform,0.0004842815334773461,15,IIDPreprocessor,HybridCategoricalStatisticsImputer,LogTargetScaler
36,36,0.6481574517970653,2024-03-08 10:53:43.409798,2024-03-08 10:54:41.149976,0 days 00:00:57.740178,7,,COMPLETE,XGB,0.6661728906082024,,,,,,,,,0.0002109040131416783,dart,0.021312731972539155,0.00016687981922431362,lossguide,0.0007392670807127707,forest,0.0032618994501734896,weighted,0.007094133559573559,15,IIDPreprocessor,HybridCategoricalStatisticsImputer,LogTargetScaler
37,37,0.5297968917721729,2024-03-08 10:54:41.152811,2024-03-08 10:55:14.427890,0 days 00:00:33.275079,2,,COMPLETE,XGB,0.6661728906082024,,,,,,,,,9.371822299755879e-08,dart,2.5245831506432726e-08,1.3198873549700218e-08,depthwise,0.0010304109138778346,forest,0.024988163155108423,uniform,0.0004945136507517793,15,IIDPreprocessor,HybridCategoricalStatisticsImputer,LogTargetScaler
38,38,0.5899891194773789,2024-03-08 10:55:14.429018,2024-03-08 10:55:40.211211,0 days 00:00:25.782193,1,,COMPLETE,XGB,0.6661728906082024,,,,,,,,,2.2864904740649918e-05,dart,6.703957920578049e-06,4.506272253528758e-08,lossguide,3.233375082957234e-05,tree,0.0027454647037330323,uniform,0.38740602164334187,15,IIDPreprocessor,HybridCategoricalStatisticsImputer,LogTargetScaler
39,39,0.6482578529488249,2024-03-08 10:55:40.212419,2024-03-08 10:56:24.089754,0 days 00:00:43.877335,6,,COMPLETE,XGB,0.6661728906082024,,,,,,,,,3.414689648575185e-07,dart,0.5518071061238927,0.0872311552865709,depthwise,5.484518087068252e-05,tree,3.095627175129104e-07,weighted,4.177209538621322e-06,15,IIDPreprocessor,HybridCategoricalStatisticsImputer,LogTargetScaler
0,0,0.6655991492032605,2024-03-08 11:13:20.739872,2024-03-08 11:13:27.404084,0 days 00:00:06.664212,51,200.0,COMPLETE,RandomForest,0.6822856916693667,,,,,,,,,,,,,,,,,,,16,IIDPreprocessor,HybridCategoricalStatisticsImputer,ArcSinhTargetScaler
1,1,0.6690336666968153,2024-03-08 11:13:27.404973,2024-03-08 11:13:50.533352,0 days 00:00:23.128379,48,700.0,COMPLETE,RandomForest,0.6822856916693667,,,,,,,,,,,,,,,,,,,16,IIDPreprocessor,HybridCategoricalStatisticsImputer,ArcSinhTargetScaler
2,2,0.6605295352644268,2024-03-08 11:13:50.534342,2024-03-08 11:14:28.823829,0 days 00:00:38.289487,12,1300.0,COMPLETE,RandomForest,0.6822856916693667,,,,,,,,,,,,,,,,,,,16,IIDPreprocessor,HybridCategoricalStatisticsImputer,ArcSinhTargetScaler
3,3,0.6662379277034755,2024-03-08 11:14:28.824725,2024-03-08 11:15:19.162286,0 days 00:00:50.337561,93,1500.0,COMPLETE,RandomForest,0.6822856916693667,,,,,,,,,,,,,,,,,,,16,IIDPreprocessor,HybridCategoricalStatisticsImputer,ArcSinhTargetScaler
4,4,0.6584568847117362,2024-03-08 11:15:19.163239,2024-03-08 11:15:46.358638,0 days 00:00:27.195399,12,1000.0,COMPLETE,RandomForest,0.6822856916693667,,,,,,,,,,,,,,,,,,,16,IIDPreprocessor,HybridCategoricalStatisticsImputer,ArcSinhTargetScaler
5,5,0.4253214797633769,2024-03-08 11:15:46.359531,2024-03-08 11:15:58.262537,0 days 00:00:11.903006,3,1200.0,COMPLETE,RandomForest,0.6822856916693667,,,,,,,,,,,,,,,,,,,16,IIDPreprocessor,HybridCategoricalStatisticsImputer,ArcSinhTargetScaler
6,6,0.6708780547600285,2024-03-08 11:15:58.263261,2024-03-08 11:16:19.870046,0 days 00:00:21.606785,96,700.0,COMPLETE,RandomForest,0.6822856916693667,,,,,,,,,,,,,,,,,,,16,IIDPreprocessor,HybridCategoricalStatisticsImputer,ArcSinhTargetScaler
7,7,0.6626673248465929,2024-03-08 11:16:19.870671,2024-03-08 11:17:03.121158,0 days 00:00:43.250487,48,1400.0,COMPLETE,RandomForest,0.6822856916693667,,,,,,,,,,,,,,,,,,,16,IIDPreprocessor,HybridCategoricalStatisticsImputer,ArcSinhTargetScaler
8,8,0.6601622640378466,2024-03-08 11:17:03.121982,2024-03-08 11:17:24.218766,0 days 00:00:21.096784,30,700.0,COMPLETE,RandomForest,0.6822856916693667,,,,,,,,,,,,,,,,,,,16,IIDPreprocessor,HybridCategoricalStatisticsImputer,ArcSinhTargetScaler
9,9,0.6631962919555261,2024-03-08 11:17:24.219463,2024-03-08 11:17:56.926834,0 days 00:00:32.707371,75,1100.0,COMPLETE,RandomForest,0.6822856916693667,,,,,,,,,,,,,,,,,,,16,IIDPreprocessor,HybridCategoricalStatisticsImputer,ArcSinhTargetScaler
10,10,0.6657105462412721,2024-03-08 11:17:56.927525,2024-03-08 11:18:15.486100,0 days 00:00:18.558575,63,600.0,COMPLETE,RandomForest,0.6822856916693667,,,,,,,,,,,,,,,,,,,16,IIDPreprocessor,HybridCategoricalStatisticsImputer,ArcSinhTargetScaler
11,11,0.6485173779079579,2024-03-08 11:18:15.486908,2024-03-08 11:18:27.451658,0 days 00:00:11.964750,63,400.0,COMPLETE,RandomForest,0.6822856916693667,,,,,,,,,,,,,,,,,,,16,IIDPreprocessor,HybridCategoricalStatisticsImputer,ArcSinhTargetScaler
12,12,0.6623474928495884,2024-03-08 11:18:27.452556,2024-03-08 11:18:42.541899,0 days 00:00:15.089343,51,500.0,COMPLETE,RandomForest,0.6822856916693667,,,,,,,,,,,,,,,,,,,16,IIDPreprocessor,HybridCategoricalStatisticsImputer,ArcSinhTargetScaler
13,13,0.6613423675964087,2024-03-08 11:18:42.542815,2024-03-08 11:19:15.745370,0 days 00:00:33.202555,18,1100.0,COMPLETE,RandomForest,0.6822856916693667,,,,,,,,,,,,,,,,,,,16,IIDPreprocessor,HybridCategoricalStatisticsImputer,ArcSinhTargetScaler
14,14,0.67299768591076,2024-03-08 11:19:15.746025,2024-03-08 11:19:51.709025,0 days 00:00:35.963000,39,1200.0,COMPLETE,RandomForest,0.6822856916693667,,,,,,,,,,,,,,,,,,,16,IIDPreprocessor,HybridCategoricalStatisticsImputer,ArcSinhTargetScaler
15,15,0.6694031972473216,2024-03-08 11:19:51.709663,2024-03-08 11:20:11.753421,0 days 00:00:20.043758,21,600.0,COMPLETE,RandomForest,0.6822856916693667,,,,,,,,,,,,,,,,,,,16,IIDPreprocessor,HybridCategoricalStatisticsImputer,ArcSinhTargetScaler
16,16,0.6700658345972963,2024-03-08 11:20:11.754321,2024-03-08 11:20:56.360327,0 days 00:00:44.606006,96,1400.0,COMPLETE,RandomForest,0.6822856916693667,,,,,,,,,,,,,,,,,,,16,IIDPreprocessor,HybridCategoricalStatisticsImputer,ArcSinhTargetScaler
17,17,0.6566850188174064,2024-03-08 11:20:56.361260,2024-03-08 11:20:59.638962,0 days 00:00:03.277702,99,100.0,COMPLETE,RandomForest,0.6822856916693667,,,,,,,,,,,,,,,,,,,16,IIDPreprocessor,HybridCategoricalStatisticsImputer,ArcSinhTargetScaler
18,18,0.6708948973243649,2024-03-08 11:20:59.639872,2024-03-08 11:21:47.788912,0 days 00:00:48.149040,42,1500.0,COMPLETE,RandomForest,0.6822856916693667,,,,,,,,,,,,,,,,,,,16,IIDPreprocessor,HybridCategoricalStatisticsImputer,ArcSinhTargetScaler
19,19,0.6617075262218798,2024-03-08 11:21:47.789782,2024-03-08 11:22:06.815324,0 days 00:00:19.025542,84,600.0,COMPLETE,RandomForest,0.6822856916693667,,,,,,,,,,,,,,,,,,,16,IIDPreprocessor,HybridCategoricalStatisticsImputer,ArcSinhTargetScaler
20,20,0.6662305337976958,2024-03-08 11:22:06.816028,2024-03-08 11:22:46.884543,0 days 00:00:40.068515,51,1300.0,COMPLETE,RandomForest,0.6822856916693667,,,,,,,,,,,,,,,,,,,16,IIDPreprocessor,HybridCategoricalStatisticsImputer,ArcSinhTargetScaler
21,21,0.6595641091606925,2024-03-08 11:22:46.885427,2024-03-08 11:23:06.369968,0 days 00:00:19.484541,27,600.0,COMPLETE,RandomForest,0.6822856916693667,,,,,,,,,,,,,,,,,,,16,IIDPreprocessor,HybridCategoricalStatisticsImputer,ArcSinhTargetScaler
22,22,0.6647977055688257,2024-03-08 11:23:06.370866,2024-03-08 11:23:15.843299,0 days 00:00:09.472433,42,300.0,COMPLETE,RandomForest,0.6822856916693667,,,,,,,,,,,,,,,,,,,16,IIDPreprocessor,HybridCategoricalStatisticsImputer,ArcSinhTargetScaler
23,23,0.6724322739880981,2024-03-08 11:23:15.843993,2024-03-08 11:23:34.450363,0 days 00:00:18.606370,81,600.0,COMPLETE,RandomForest,0.6822856916693667,,,,,,,,,,,,,,,,,,,16,IIDPreprocessor,HybridCategoricalStatisticsImputer,ArcSinhTargetScaler
24,24,0.6628900059831195,2024-03-08 11:23:34.451127,2024-03-08 11:24:21.833347,0 days 00:00:47.382220,42,1500.0,COMPLETE,RandomForest,0.6822856916693667,,,,,,,,,,,,,,,,,,,16,IIDPreprocessor,HybridCategoricalStatisticsImputer,ArcSinhTargetScaler
25,25,0.6588538903455804,2024-03-08 11:24:21.834270,2024-03-08 11:24:43.451157,0 days 00:00:21.616887,51,700.0,COMPLETE,RandomForest,0.6822856916693667,,,,,,,,,,,,,,,,,,,16,IIDPreprocessor,HybridCategoricalStatisticsImputer,ArcSinhTargetScaler
26,26,0.6822856916693667,2024-03-08 11:24:43.451783,2024-03-08 11:25:30.343244,0 days 00:00:46.891461,60,1500.0,COMPLETE,RandomForest,0.6822856916693667,,,,,,,,,,,,,,,,,,,16,IIDPreprocessor,HybridCategoricalStatisticsImputer,ArcSinhTargetScaler
27,27,0.6691363721803916,2024-03-08 11:25:30.344182,2024-03-08 11:25:39.672728,0 days 00:00:09.328546,75,300.0,COMPLETE,RandomForest,0.6822856916693667,,,,,,,,,,,,,,,,,,,16,IIDPreprocessor,HybridCategoricalStatisticsImputer,ArcSinhTargetScaler
28,28,0.6629331644888179,2024-03-08 11:25:39.673609,2024-03-08 11:25:52.554663,0 days 00:00:12.881054,60,400.0,COMPLETE,RandomForest,0.6822856916693667,,,,,,,,,,,,,,,,,,,16,IIDPreprocessor,HybridCategoricalStatisticsImputer,ArcSinhTargetScaler
29,29,0.6625025991765413,2024-03-08 11:25:52.555578,2024-03-08 11:26:22.939821,0 days 00:00:30.384243,30,1000.0,COMPLETE,RandomForest,0.6822856916693667,,,,,,,,,,,,,,,,,,,16,IIDPreprocessor,HybridCategoricalStatisticsImputer,ArcSinhTargetScaler
30,30,0.6692696321622907,2024-03-08 11:26:22.940730,2024-03-08 11:27:07.526362,0 days 00:00:44.585632,27,1400.0,COMPLETE,RandomForest,0.6822856916693667,,,,,,,,,,,,,,,,,,,16,IIDPreprocessor,HybridCategoricalStatisticsImputer,ArcSinhTargetScaler
31,31,0.6635122143704574,2024-03-08 11:27:07.527318,2024-03-08 11:27:13.905387,0 days 00:00:06.378069,48,200.0,COMPLETE,RandomForest,0.6822856916693667,,,,,,,,,,,,,,,,,,,16,IIDPreprocessor,HybridCategoricalStatisticsImputer,ArcSinhTargetScaler
32,32,0.4340404642930279,2024-03-08 11:27:13.906099,2024-03-08 11:27:16.820817,0 days 00:00:02.914718,3,300.0,COMPLETE,RandomForest,0.6822856916693667,,,,,,,,,,,,,,,,,,,16,IIDPreprocessor,HybridCategoricalStatisticsImputer,ArcSinhTargetScaler
33,33,0.6677520870975141,2024-03-08 11:27:16.821494,2024-03-08 11:27:41.824541,0 days 00:00:25.003047,51,800.0,COMPLETE,RandomForest,0.6822856916693667,,,,,,,,,,,,,,,,,,,16,IIDPreprocessor,HybridCategoricalStatisticsImputer,ArcSinhTargetScaler
34,34,0.6801513265608679,2024-03-08 11:27:41.825348,2024-03-08 11:28:02.967199,0 days 00:00:21.141851,93,700.0,COMPLETE,RandomForest,0.6822856916693667,,,,,,,,,,,,,,,,,,,16,IIDPreprocessor,HybridCategoricalStatisticsImputer,ArcSinhTargetScaler
35,35,0.6671864592477716,2024-03-08 11:28:02.967945,2024-03-08 11:28:26.930987,0 days 00:00:23.963042,51,800.0,COMPLETE,RandomForest,0.6822856916693667,,,,,,,,,,,,,,,,,,,16,IIDPreprocessor,HybridCategoricalStatisticsImputer,ArcSinhTargetScaler
36,36,0.6621866758259409,2024-03-08 11:28:26.931750,2024-03-08 11:29:04.594509,0 days 00:00:37.662759,12,1400.0,COMPLETE,RandomForest,0.6822856916693667,,,,,,,,,,,,,,,,,,,16,IIDPreprocessor,HybridCategoricalStatisticsImputer,ArcSinhTargetScaler
37,37,0.6647802434484376,2024-03-08 11:29:04.595382,2024-03-08 11:29:19.512536,0 days 00:00:14.917154,24,500.0,COMPLETE,RandomForest,0.6822856916693667,,,,,,,,,,,,,,,,,,,16,IIDPreprocessor,HybridCategoricalStatisticsImputer,ArcSinhTargetScaler
38,38,0.6597024583890105,2024-03-08 11:29:19.513179,2024-03-08 11:30:04.253192,0 days 00:00:44.740013,54,1500.0,COMPLETE,RandomForest,0.6822856916693667,,,,,,,,,,,,,,,,,,,16,IIDPreprocessor,HybridCategoricalStatisticsImputer,ArcSinhTargetScaler
39,39,0.6406948308166027,2024-03-08 11:30:04.254185,2024-03-08 11:30:19.021349,0 days 00:00:14.767164,9,600.0,COMPLETE,RandomForest,0.6822856916693667,,,,,,,,,,,,,,,,,,,16,IIDPreprocessor,HybridCategoricalStatisticsImputer,ArcSinhTargetScaler
0,0,0.6705331675620655,2024-03-08 11:31:04.586503,2024-03-08 11:31:40.061960,0 days 00:00:35.475457,96,1210.0,COMPLETE,LGBM,0.6879010206811347,0.4202282325780602,5.0,0.7528700309481173,5.650895218057744e-06,2.0003253204070515e-07,0.037222594924871746,79.0,131.0,,,,,,,,,,,16,IIDPreprocessor,HybridCategoricalStatisticsImputer,ArcSinhTargetScaler
1,1,0.6752883763299211,2024-03-08 11:31:40.063103,2024-03-08 11:32:26.513575,0 days 00:00:46.450472,99,610.0,COMPLETE,LGBM,0.6879010206811347,0.6834660390445516,3.0,0.8157055352966933,2.1361074211595115e-05,3.639133292148997e-07,0.05911567633003488,16.0,214.0,,,,,,,,,,,16,IIDPreprocessor,HybridCategoricalStatisticsImputer,ArcSinhTargetScaler
2,2,0.643793665597017,2024-03-08 11:32:26.514958,2024-03-08 11:32:29.345809,0 days 00:00:02.830851,9,110.0,COMPLETE,LGBM,0.6879010206811347,0.4257897481771435,1.0,0.9245402452842871,0.13890691218861073,3.1293764195861796e-06,0.016715616584172602,85.0,52.0,,,,,,,,,,,16,IIDPreprocessor,HybridCategoricalStatisticsImputer,ArcSinhTargetScaler
3,3,0.6782202588262869,2024-03-08 11:32:29.347826,2024-03-08 11:32:48.356498,0 days 00:00:19.008672,87,310.0,COMPLETE,LGBM,0.6879010206811347,0.7655213420703907,5.0,0.5021203052589591,0.029487903617610865,2.75417954804951e-06,0.02603139197424807,35.0,104.0,,,,,,,,,,,16,IIDPreprocessor,HybridCategoricalStatisticsImputer,ArcSinhTargetScaler
4,4,0.665832294820869,2024-03-08 11:32:48.357702,2024-03-08 11:33:15.718669,0 days 00:00:27.360967,27,1210.0,COMPLETE,LGBM,0.6879010206811347,0.4429553772104616,2.0,0.8072818602392977,0.05632549750272293,3.704364470918555e-06,0.07236477433159379,53.0,132.0,,,,,,,,,,,16,IIDPreprocessor,HybridCategoricalStatisticsImputer,ArcSinhTargetScaler
5,5,0.6767524338719921,2024-03-08 11:33:15.720602,2024-03-08 11:34:03.878629,0 days 00:00:48.158027,27,1010.0,COMPLETE,LGBM,0.6879010206811347,0.6508199932975194,4.0,0.7139151249720709,2.4627569633461414e-08,0.3427928528626125,0.025527844565614084,51.0,167.0,,,,,,,,,,,16,IIDPreprocessor,HybridCategoricalStatisticsImputer,ArcSinhTargetScaler
6,6,0.6727470699437,2024-03-08 11:34:03.880885,2024-03-08 11:34:18.674747,0 days 00:00:14.793862,45,310.0,COMPLETE,LGBM,0.6879010206811347,0.9058849635865438,3.0,0.6872558147874652,0.0025239325291855574,3.089019350517181e-08,0.12873306122382314,25.0,67.0,,,,,,,,,,,16,IIDPreprocessor,HybridCategoricalStatisticsImputer,ArcSinhTargetScaler
7,7,0.6615851487580396,2024-03-08 11:34:18.676647,2024-03-08 11:34:55.124184,0 days 00:00:36.447537,9,1310.0,COMPLETE,LGBM,0.6879010206811347,0.4868766850219913,2.0,0.9471866800419185,4.214820416614899e-07,0.5626411641762147,0.06997326564101837,77.0,130.0,,,,,,,,,,,16,IIDPreprocessor,HybridCategoricalStatisticsImputer,ArcSinhTargetScaler
8,8,0.6652486204424324,2024-03-08 11:34:55.125799,2024-03-08 11:35:14.742798,0 days 00:00:19.616999,84,610.0,COMPLETE,LGBM,0.6879010206811347,0.9730330574956139,6.0,0.8480981271069318,7.565366484946406e-07,5.242506249188454e-05,0.17134414826387467,63.0,7.0,,,,,,,,,,,16,IIDPreprocessor,HybridCategoricalStatisticsImputer,ArcSinhTargetScaler
9,9,0.6630051337304276,2024-03-08 11:35:14.744013,2024-03-08 11:35:24.351846,0 days 00:00:09.607833,24,510.0,COMPLETE,LGBM,0.6879010206811347,0.6868343269839009,6.0,0.5025197049711615,4.704815520606767e-05,2.8086609015735444,0.02188243434047871,94.0,7.0,,,,,,,,,,,16,IIDPreprocessor,HybridCategoricalStatisticsImputer,ArcSinhTargetScaler
10,10,0.6681752689069543,2024-03-08 11:35:24.353101,2024-03-08 11:35:35.358760,0 days 00:00:11.005659,15,610.0,COMPLETE,LGBM,0.6879010206811347,0.472553326756073,4.0,0.4421116287761198,0.021551599827664424,0.0002157553140158547,0.01434892051229875,98.0,68.0,,,,,,,,,,,16,IIDPreprocessor,HybridCategoricalStatisticsImputer,ArcSinhTargetScaler
11,11,0.6776669886716006,2024-03-08 11:35:35.360444,2024-03-08 11:36:28.014837,0 days 00:00:52.654393,81,1310.0,COMPLETE,LGBM,0.6879010206811347,0.8035210908331136,4.0,0.6508546024978852,0.015170596480818562,1.1620717189126325e-05,0.010667658455679165,62.0,13.0,,,,,,,,,,,16,IIDPreprocessor,HybridCategoricalStatisticsImputer,ArcSinhTargetScaler
12,12,0.08157506386387536,2024-03-08 11:36:28.016765,2024-03-08 11:36:40.020761,0 days 00:00:12.003996,3,1010.0,COMPLETE,LGBM,0.6879010206811347,0.451396621225724,5.0,0.8920447647325876,0.004128989249472552,7.82191956176157e-07,0.2224679097753106,39.0,215.0,,,,,,,,,,,16,IIDPreprocessor,HybridCategoricalStatisticsImputer,ArcSinhTargetScaler
13,13,0.6616259588292331,2024-03-08 11:36:40.022026,2024-03-08 11:36:51.441132,0 days 00:00:11.419106,69,510.0,COMPLETE,LGBM,0.6879010206811347,0.6724894560870431,2.0,0.5468804708970906,0.4564813451525798,0.0010702308296975263,0.053338447373532376,87.0,162.0,,,,,,,,,,,16,IIDPreprocessor,HybridCategoricalStatisticsImputer,ArcSinhTargetScaler
