,number,value,datetime_start,datetime_complete,duration,params_max_depth,params_n_estimators,state,model,best_value,params_bagging_fraction,params_bagging_freq,params_feature_fraction,params_lambda_l1,params_lambda_l2,params_learning_rate,params_min_child_samples,params_num_leaves,params_alpha,params_booster,params_eta,params_gamma,params_grow_policy,params_lambda,params_normalize_type,params_rate_drop,params_sample_type,params_skip_drop,config_id,preprocessor,imputer,target_scaler
7,7,0.6430128600908608,2024-03-08 00:59:48.863314,2024-03-08 00:59:49.705999,0 days 00:00:00.842685,81,10.0,COMPLETE,LGBM,0.6832935375286049,0.5949854956930356,2.0,0.7299754456382609,0.0031378162703827755,7.548920387548494e-07,0.2001030872564692,28.0,242.0,,,,,,,,,,,7,BaselinePreprocessor,HybridCategoricalStatisticsImputer,ArcSinhTargetScaler
8,8,0.6618129524430095,2024-03-08 00:59:49.707252,2024-03-08 01:00:04.859864,0 days 00:00:15.152612,9,310.0,COMPLETE,LGBM,0.6832935375286049,0.645919840946254,4.0,0.6802249275671484,8.77150676605417e-06,0.0007753860812885569,0.014557396163213195,66.0,182.0,,,,,,,,,,,7,BaselinePreprocessor,HybridCategoricalStatisticsImputer,ArcSinhTargetScaler
9,9,0.6532871963560682,2024-03-08 01:00:04.861562,2024-03-08 01:00:05.489414,0 days 00:00:00.627852,60,10.0,COMPLETE,LGBM,0.6832935375286049,0.735812692240461,4.0,0.6784768383916842,5.833679616808406e-06,1.940829515390189e-07,0.025517932692823698,62.0,17.0,,,,,,,,,,,7,BaselinePreprocessor,HybridCategoricalStatisticsImputer,ArcSinhTargetScaler
10,10,0.6748714007859433,2024-03-08 01:00:05.490899,2024-03-08 01:00:44.869410,0 days 00:00:39.378511,90,1010.0,COMPLETE,LGBM,0.6832935375286049,0.7432778819635932,3.0,0.8776091106817752,0.06414002043142346,4.808229585353858e-05,0.0513878172690843,35.0,33.0,,,,,,,,,,,7,BaselinePreprocessor,HybridCategoricalStatisticsImputer,ArcSinhTargetScaler
11,11,0.6393568989958598,2024-03-08 01:00:44.870567,2024-03-08 01:00:54.703690,0 days 00:00:09.833123,57,210.0,COMPLETE,LGBM,0.6832935375286049,0.5894963016841048,4.0,0.926181607582138,1.578155746591331e-07,3.4934026180303486e-06,0.1784518526064785,91.0,112.0,,,,,,,,,,,7,BaselinePreprocessor,HybridCategoricalStatisticsImputer,ArcSinhTargetScaler
12,12,0.675367206956354,2024-03-08 01:00:54.705508,2024-03-08 01:01:47.699255,0 days 00:00:52.993747,33,1010.0,COMPLETE,LGBM,0.6832935375286049,0.8484301051232214,6.0,0.5022278405742386,0.00018355549773669188,1.2111704190552886e-07,0.01119214185892393,67.0,184.0,,,,,,,,,,,7,BaselinePreprocessor,HybridCategoricalStatisticsImputer,ArcSinhTargetScaler
13,13,0.6648494811921389,2024-03-08 01:01:47.700748,2024-03-08 01:02:13.843668,0 days 00:00:26.142920,3,1210.0,COMPLETE,LGBM,0.6832935375286049,0.9581241510182559,4.0,0.5911561519787478,4.727386111846778e-05,2.945785753916358,0.11885454114058625,53.0,207.0,,,,,,,,,,,7,BaselinePreprocessor,HybridCategoricalStatisticsImputer,ArcSinhTargetScaler
14,14,0.6710920996790758,2024-03-08 01:02:13.844792,2024-03-08 01:02:43.159633,0 days 00:00:29.314841,21,310.0,COMPLETE,LGBM,0.6832935375286049,0.7112321617383297,5.0,0.8462601422469515,0.00016070296103015336,4.197871442669955e-07,0.055014203205590494,42.0,40.0,,,,,,,,,,,7,BaselinePreprocessor,HybridCategoricalStatisticsImputer,ArcSinhTargetScaler
15,15,0.03206268304390271,2024-03-08 01:02:43.161075,2024-03-08 01:03:02.154381,0 days 00:00:18.993306,99,910.0,COMPLETE,LGBM,0.6832935375286049,0.7530776633389391,3.0,0.7538628077527678,0.000611699921000246,1.997002759311376e-08,0.15652693586290922,100.0,72.0,,,,,,,,,,,7,BaselinePreprocessor,HybridCategoricalStatisticsImputer,ArcSinhTargetScaler
16,16,0.6720098862685147,2024-03-08 01:03:02.156125,2024-03-08 01:03:59.952716,0 days 00:00:57.796591,18,1410.0,COMPLETE,LGBM,0.6832935375286049,0.8844840821842892,2.0,0.9551744965707802,0.05614860134407271,4.6508593668695064e-05,0.03136207527197294,45.0,57.0,,,,,,,,,,,7,BaselinePreprocessor,HybridCategoricalStatisticsImputer,ArcSinhTargetScaler
17,17,0.6595201052970978,2024-03-08 01:03:59.954147,2024-03-08 01:04:25.185447,0 days 00:00:25.231300,90,1210.0,COMPLETE,LGBM,0.6832935375286049,0.4888061914753551,4.0,0.7281542570162838,1.1396219179967054e-05,3.4763691868622235,0.14612083591196284,84.0,214.0,,,,,,,,,,,7,BaselinePreprocessor,HybridCategoricalStatisticsImputer,ArcSinhTargetScaler
18,18,0.6572543478022539,2024-03-08 01:04:25.186523,2024-03-08 01:04:32.714960,0 days 00:00:07.528437,57,110.0,COMPLETE,LGBM,0.6832935375286049,0.5707052512016524,7.0,0.7497479414467314,6.162796516017095e-08,2.5969244202836426,0.27246224629199584,6.0,20.0,,,,,,,,,,,7,BaselinePreprocessor,HybridCategoricalStatisticsImputer,ArcSinhTargetScaler
19,19,0.665023788409406,2024-03-08 01:04:32.716157,2024-03-08 01:05:05.626185,0 days 00:00:32.910028,75,710.0,COMPLETE,LGBM,0.6832935375286049,0.6811605037347306,1.0,0.786882958628081,7.864496043390865e-05,0.23721428484225454,0.031927925422268154,74.0,161.0,,,,,,,,,,,7,BaselinePreprocessor,HybridCategoricalStatisticsImputer,ArcSinhTargetScaler
20,20,0.0901763755799923,2024-03-08 01:05:05.652000,2024-03-08 01:05:21.135035,0 days 00:00:15.483035,36,1210.0,COMPLETE,LGBM,0.6832935375286049,0.5399279439534854,2.0,0.9133976146500252,8.676498043893449e-07,0.00038435002562310194,0.23821873517466785,29.0,26.0,,,,,,,,,,,7,BaselinePreprocessor,HybridCategoricalStatisticsImputer,ArcSinhTargetScaler
21,21,0.6629889571010863,2024-03-08 01:05:21.136706,2024-03-08 01:05:31.117298,0 days 00:00:09.980592,63,810.0,COMPLETE,LGBM,0.6832935375286049,0.9812007508464392,3.0,0.6170465829551429,1.6772712955581097,0.029818110161635207,0.10386999362023085,96.0,192.0,,,,,,,,,,,7,BaselinePreprocessor,HybridCategoricalStatisticsImputer,ArcSinhTargetScaler
22,22,0.672371330039897,2024-03-08 01:05:31.118593,2024-03-08 01:05:50.998062,0 days 00:00:19.879469,18,510.0,COMPLETE,LGBM,0.6832935375286049,0.7248151974251931,4.0,0.6196678759689994,4.379590845838003e-08,0.0005386270928148364,0.09061899175240157,77.0,128.0,,,,,,,,,,,7,BaselinePreprocessor,HybridCategoricalStatisticsImputer,ArcSinhTargetScaler
23,23,0.6363668553446786,2024-03-08 01:05:50.999413,2024-03-08 01:05:51.506904,0 days 00:00:00.507491,18,10.0,COMPLETE,LGBM,0.6832935375286049,0.5376451446387324,5.0,0.7146448446627167,1.8801167658891707e-08,1.6274299804372727e-06,0.02866900218756422,70.0,99.0,,,,,,,,,,,7,BaselinePreprocessor,HybridCategoricalStatisticsImputer,ArcSinhTargetScaler
24,24,0.6692388443110565,2024-03-08 01:05:51.507987,2024-03-08 01:06:17.536599,0 days 00:00:26.028612,93,410.0,COMPLETE,LGBM,0.6832935375286049,0.7817361389459667,4.0,0.7152426733362259,0.0001683531431692626,0.0056346123521118915,0.05411949229404354,56.0,189.0,,,,,,,,,,,7,BaselinePreprocessor,HybridCategoricalStatisticsImputer,ArcSinhTargetScaler
25,25,0.6722268400398592,2024-03-08 01:06:17.537675,2024-03-08 01:06:36.216867,0 days 00:00:18.679192,72,110.0,COMPLETE,LGBM,0.6832935375286049,0.8737250481543268,6.0,0.8674109631083666,0.001801599662966011,0.0024203046534032762,0.08289170510236704,9.0,48.0,,,,,,,,,,,7,BaselinePreprocessor,HybridCategoricalStatisticsImputer,ArcSinhTargetScaler
26,26,0.6566497543041578,2024-03-08 01:06:36.218408,2024-03-08 01:06:40.497105,0 days 00:00:04.278697,96,510.0,COMPLETE,LGBM,0.6832935375286049,0.623800690886235,7.0,0.47115918076692925,2.5351671455958535,2.549257131958864e-08,0.25803847086829484,59.0,183.0,,,,,,,,,,,7,BaselinePreprocessor,HybridCategoricalStatisticsImputer,ArcSinhTargetScaler
27,27,0.6733001377012686,2024-03-08 01:06:40.498524,2024-03-08 01:07:44.187642,0 days 00:01:03.689118,90,1110.0,COMPLETE,LGBM,0.6832935375286049,0.7654900464826688,2.0,0.9251691970274757,0.0008075049685520805,0.0009392402168832492,0.012986738980618112,90.0,172.0,,,,,,,,,,,7,BaselinePreprocessor,HybridCategoricalStatisticsImputer,ArcSinhTargetScaler
28,28,0.6648875166320672,2024-03-08 01:07:44.189361,2024-03-08 01:07:50.802947,0 days 00:00:06.613586,48,310.0,COMPLETE,LGBM,0.6832935375286049,0.8132878766641889,2.0,0.6206228743932894,2.6914643151961797,3.5200384224611685e-07,0.08727519185110756,75.0,105.0,,,,,,,,,,,7,BaselinePreprocessor,HybridCategoricalStatisticsImputer,ArcSinhTargetScaler
29,29,0.6832935375286049,2024-03-08 01:07:50.804672,2024-03-08 01:08:42.635284,0 days 00:00:51.830612,21,1010.0,COMPLETE,LGBM,0.6832935375286049,0.44556057198702176,3.0,0.9154222633083215,0.18006152648090198,1.705978728824726e-08,0.015102477029165564,32.0,62.0,,,,,,,,,,,7,BaselinePreprocessor,HybridCategoricalStatisticsImputer,ArcSinhTargetScaler
30,30,0.6666433083752739,2024-03-08 01:08:42.636559,2024-03-08 01:09:19.512638,0 days 00:00:36.876079,42,1310.0,COMPLETE,LGBM,0.6832935375286049,0.4921623806995907,1.0,0.5110362819567644,1.6290502334524843e-08,1.038713487338128e-05,0.05364109998695227,57.0,44.0,,,,,,,,,,,7,BaselinePreprocessor,HybridCategoricalStatisticsImputer,ArcSinhTargetScaler
31,31,0.6648038514643404,2024-03-08 01:09:19.513658,2024-03-08 01:09:29.387574,0 days 00:00:09.873916,27,310.0,COMPLETE,LGBM,0.6832935375286049,0.47461695767969203,2.0,0.43191999636895473,0.0017818317511301344,2.6393316111120952e-05,0.07391532911271788,52.0,72.0,,,,,,,,,,,7,BaselinePreprocessor,HybridCategoricalStatisticsImputer,ArcSinhTargetScaler
32,32,0.6773374986445921,2024-03-08 01:09:29.388783,2024-03-08 01:10:16.648379,0 days 00:00:47.259596,15,1410.0,COMPLETE,LGBM,0.6832935375286049,0.6191083678030541,3.0,0.7187213764433964,3.5441028757946296e-06,2.9564392419629207e-06,0.049227796759731615,94.0,36.0,,,,,,,,,,,7,BaselinePreprocessor,HybridCategoricalStatisticsImputer,ArcSinhTargetScaler
33,33,0.6681449926624818,2024-03-08 01:10:16.649957,2024-03-08 01:10:56.308860,0 days 00:00:39.658903,81,610.0,COMPLETE,LGBM,0.6832935375286049,0.8055072232307614,5.0,0.5492388370227602,1.2027914959835676e-06,5.828623455058064e-05,0.01950864700079163,52.0,198.0,,,,,,,,,,,7,BaselinePreprocessor,HybridCategoricalStatisticsImputer,ArcSinhTargetScaler
34,34,0.6443935132157071,2024-03-08 01:10:56.310264,2024-03-08 01:11:05.052450,0 days 00:00:08.742186,60,710.0,COMPLETE,LGBM,0.6832935375286049,0.584359350855657,3.0,0.5822513868549459,2.6841365653824782,0.00018514512448359645,0.16268205776763536,70.0,227.0,,,,,,,,,,,7,BaselinePreprocessor,HybridCategoricalStatisticsImputer,ArcSinhTargetScaler
35,35,0.6288054417782942,2024-03-08 01:11:05.053900,2024-03-08 01:11:05.517878,0 days 00:00:00.463978,39,10.0,COMPLETE,LGBM,0.6832935375286049,0.5623411365909354,7.0,0.6657032852336013,4.860665833328626e-07,0.0002638787112524998,0.2917526622694332,80.0,171.0,,,,,,,,,,,7,BaselinePreprocessor,HybridCategoricalStatisticsImputer,ArcSinhTargetScaler
36,36,0.6463277536202066,2024-03-08 01:11:05.519170,2024-03-08 01:11:10.800438,0 days 00:00:05.281268,27,210.0,COMPLETE,LGBM,0.6832935375286049,0.7279221837861809,2.0,0.678312859353271,0.2931167264652687,1.3531893867069589e-05,0.25002956349827415,39.0,198.0,,,,,,,,,,,7,BaselinePreprocessor,HybridCategoricalStatisticsImputer,ArcSinhTargetScaler
37,37,0.0581768559294963,2024-03-08 01:11:10.801563,2024-03-08 01:11:25.901796,0 days 00:00:15.100233,72,510.0,COMPLETE,LGBM,0.6832935375286049,0.775607817618291,6.0,0.9157128317625767,3.788889378237851e-07,2.3195620901627199e-07,0.21338574628018891,26.0,256.0,,,,,,,,,,,7,BaselinePreprocessor,HybridCategoricalStatisticsImputer,ArcSinhTargetScaler
38,38,0.6624719174148948,2024-03-08 01:11:25.902685,2024-03-08 01:11:51.377522,0 days 00:00:25.474837,63,910.0,COMPLETE,LGBM,0.6832935375286049,0.5834404779848843,5.0,0.5420091315336789,1.0789276051164775e-07,0.3182099079597573,0.019069082688852164,55.0,10.0,,,,,,,,,,,7,BaselinePreprocessor,HybridCategoricalStatisticsImputer,ArcSinhTargetScaler
39,39,0.6826918438996793,2024-03-08 01:11:51.379105,2024-03-08 01:12:07.750316,0 days 00:00:16.371211,78,1010.0,COMPLETE,LGBM,0.6832935375286049,0.7970872757806021,4.0,0.7302947143300924,0.13085018985342683,5.2930404519843244e-05,0.1773346942479857,55.0,40.0,,,,,,,,,,,7,BaselinePreprocessor,HybridCategoricalStatisticsImputer,ArcSinhTargetScaler
0,0,0.6013194776709813,2024-03-08 01:12:59.770160,2024-03-08 01:13:58.840186,0 days 00:00:59.070026,8,,COMPLETE,XGB,0.6753870530494209,,,,,,,,,0.0054424352889291296,dart,2.2922617996850298e-07,5.761769619268923e-07,lossguide,0.004198309011087883,forest,0.18367283610127239,uniform,6.281315867932546e-06,7,BaselinePreprocessor,HybridCategoricalStatisticsImputer,ArcSinhTargetScaler
1,1,0.6400665388920846,2024-03-08 01:13:58.841992,2024-03-08 01:14:36.142053,0 days 00:00:37.300061,3,,COMPLETE,XGB,0.6753870530494209,,,,,,,,,2.935072729564238e-07,dart,0.001311531483320833,1.4939249948456942e-06,depthwise,0.08930643011397116,forest,1.284954168984096e-05,weighted,0.0001006159954871217,7,BaselinePreprocessor,HybridCategoricalStatisticsImputer,ArcSinhTargetScaler
2,2,0.6153244728632495,2024-03-08 01:14:36.143516,2024-03-08 01:15:33.113362,0 days 00:00:56.969846,6,,COMPLETE,XGB,0.6753870530494209,,,,,,,,,0.41788612849463025,dart,0.0008676853602391958,0.007193610668850383,lossguide,0.00016258462867909578,tree,2.129551302801458e-07,uniform,3.8647539832263214e-07,7,BaselinePreprocessor,HybridCategoricalStatisticsImputer,ArcSinhTargetScaler
3,3,0.6386479439784143,2024-03-08 01:15:33.114650,2024-03-08 01:15:58.166911,0 days 00:00:25.052261,1,,COMPLETE,XGB,0.6753870530494209,,,,,,,,,5.110397044936108e-06,dart,0.6939695959012638,0.013843478775968011,lossguide,2.3978482897675803e-06,tree,0.014353374809135368,uniform,0.0002459583423979848,7,BaselinePreprocessor,HybridCategoricalStatisticsImputer,ArcSinhTargetScaler
4,4,0.6341900192394485,2024-03-08 01:15:58.168029,2024-03-08 01:16:45.838291,0 days 00:00:47.670262,5,,COMPLETE,XGB,0.6753870530494209,,,,,,,,,1.231844620122962e-07,dart,0.007305765275476383,0.0019819644228543814,lossguide,1.7064206236340405e-05,tree,3.889766340753812e-06,weighted,3.894483531159461e-07,7,BaselinePreprocessor,HybridCategoricalStatisticsImputer,ArcSinhTargetScaler
5,5,0.6582564347802151,2024-03-08 01:16:45.839438,2024-03-08 01:17:29.537905,0 days 00:00:43.698467,4,,COMPLETE,XGB,0.6753870530494209,,,,,,,,,2.087139484741577e-08,dart,0.03125806148266288,6.85595026347298e-08,lossguide,0.017005797432667905,tree,1.9275461251328765e-05,uniform,0.00010607474979692369,7,BaselinePreprocessor,HybridCategoricalStatisticsImputer,ArcSinhTargetScaler
6,6,0.6149431426446178,2024-03-08 01:17:29.539604,2024-03-08 01:18:25.619124,0 days 00:00:56.079520,7,,COMPLETE,XGB,0.6753870530494209,,,,,,,,,0.00782442502016075,dart,5.479690591022922e-05,0.00011291151654763847,lossguide,0.005219274122541915,tree,1.0718431863617909e-06,uniform,4.383484475185637e-05,7,BaselinePreprocessor,HybridCategoricalStatisticsImputer,ArcSinhTargetScaler
7,7,0.6297168889070099,2024-03-08 01:18:25.620702,2024-03-08 01:19:12.680860,0 days 00:00:47.060158,5,,COMPLETE,XGB,0.6753870530494209,,,,,,,,,2.1715182429899782e-07,dart,1.7191557305676115e-06,0.0025086860724262967,lossguide,0.02071910911420957,forest,1.082121288078738e-05,weighted,0.02057854184816126,7,BaselinePreprocessor,HybridCategoricalStatisticsImputer,ArcSinhTargetScaler
8,8,0.6341547809934601,2024-03-08 01:19:12.682292,2024-03-08 01:20:05.556661,0 days 00:00:52.874369,5,,COMPLETE,XGB,0.6753870530494209,,,,,,,,,9.686759564297264e-05,dart,0.013491994249571707,4.0753322102564306e-07,lossguide,5.714733511944769e-08,tree,3.992358794994046e-08,weighted,1.7868322176262894e-07,7,BaselinePreprocessor,HybridCategoricalStatisticsImputer,ArcSinhTargetScaler
9,9,0.6184750737341289,2024-03-08 01:20:05.558568,2024-03-08 01:21:19.943787,0 days 00:01:14.385219,9,,COMPLETE,XGB,0.6753870530494209,,,,,,,,,7.119571315890969e-07,dart,0.0022908330252998555,0.0014140289713863536,depthwise,0.0004014667617754443,forest,0.0686746926140195,uniform,0.0002048470744379411,7,BaselinePreprocessor,HybridCategoricalStatisticsImputer,ArcSinhTargetScaler
10,10,0.6515938780317126,2024-03-08 01:21:19.945230,2024-03-08 01:22:00.170663,0 days 00:00:40.225433,3,,COMPLETE,XGB,0.6753870530494209,,,,,,,,,0.016007474332179212,dart,0.029960003858983977,2.994793243958561e-08,lossguide,0.0003985161478785514,forest,1.1698204962175598e-05,uniform,1.5565719683320624e-08,7,BaselinePreprocessor,HybridCategoricalStatisticsImputer,ArcSinhTargetScaler
11,11,0.6049679004455452,2024-03-08 01:22:00.174484,2024-03-08 01:23:09.747619,0 days 00:01:09.573135,8,,COMPLETE,XGB,0.6753870530494209,,,,,,,,,0.0005944253210100001,dart,3.5187126936098053e-06,0.14115677636879456,depthwise,0.012745085251057407,tree,0.007625441152920186,uniform,4.98754879918599e-06,7,BaselinePreprocessor,HybridCategoricalStatisticsImputer,ArcSinhTargetScaler
12,12,0.630771159757888,2024-03-08 01:23:09.749246,2024-03-08 01:24:07.552349,0 days 00:00:57.803103,6,,COMPLETE,XGB,0.6753870530494209,,,,,,,,,3.854223293726094e-07,dart,1.107982874669173e-06,0.0005106088794342184,depthwise,2.161479084305464e-07,forest,1.8369657541312877e-08,uniform,6.458340952250619e-05,7,BaselinePreprocessor,HybridCategoricalStatisticsImputer,ArcSinhTargetScaler
13,13,0.6481337062556412,2024-03-08 01:24:07.553817,2024-03-08 01:25:06.394175,0 days 00:00:58.840358,8,,COMPLETE,XGB,0.6753870530494209,,,,,,,,,4.876283634376467e-06,dart,0.07605789330191488,9.658070811421385e-05,lossguide,0.001362881532367779,tree,1.056668848054748e-08,uniform,6.997180684922312e-08,7,BaselinePreprocessor,HybridCategoricalStatisticsImputer,ArcSinhTargetScaler
14,14,0.6080852753198335,2024-03-08 01:25:06.395539,2024-03-08 01:25:50.859484,0 days 00:00:44.463945,6,,COMPLETE,XGB,0.6753870530494209,,,,,,,,,1.1398325934590147e-05,dart,1.7820861636699922e-07,8.265004674728102e-05,lossguide,7.696299536199333e-07,tree,0.9042054489918281,weighted,2.3046233815603484e-08,7,BaselinePreprocessor,HybridCategoricalStatisticsImputer,ArcSinhTargetScaler
15,15,0.6564656063927419,2024-03-08 01:25:50.861093,2024-03-08 01:26:31.709607,0 days 00:00:40.848514,5,,COMPLETE,XGB,0.6753870530494209,,,,,,,,,0.03384788154468238,dart,0.08006590436779912,0.009092508595501604,lossguide,0.004258738919179055,forest,0.3904059379323167,weighted,0.01935044924387426,7,BaselinePreprocessor,HybridCategoricalStatisticsImputer,ArcSinhTargetScaler
16,16,0.6215762679478647,2024-03-08 01:26:31.711362,2024-03-08 01:27:27.186266,0 days 00:00:55.474904,6,,COMPLETE,XGB,0.6753870530494209,,,,,,,,,0.018711801835591367,dart,0.002559224318884376,1.4966914950423935e-06,lossguide,0.30102281416347726,tree,0.0028045730226419485,uniform,0.0030346352449232964,7,BaselinePreprocessor,HybridCategoricalStatisticsImputer,ArcSinhTargetScaler
17,17,0.6435525023899422,2024-03-08 01:27:27.187350,2024-03-08 01:27:52.262146,0 days 00:00:25.074796,1,,COMPLETE,XGB,0.6753870530494209,,,,,,,,,0.0014111146325295973,dart,0.30460411256483333,0.03496841004042335,depthwise,0.003651254217756281,tree,0.21201217161843913,uniform,0.6356660775412248,7,BaselinePreprocessor,HybridCategoricalStatisticsImputer,ArcSinhTargetScaler
18,18,0.614333816484778,2024-03-08 01:27:52.263338,2024-03-08 01:28:43.495568,0 days 00:00:51.232230,6,,COMPLETE,XGB,0.6753870530494209,,,,,,,,,0.04776217765316829,dart,0.0020386854718241133,1.4201114570847276e-06,depthwise,0.012844301585383364,forest,1.2714178691430292e-05,weighted,0.0005761765881387498,7,BaselinePreprocessor,HybridCategoricalStatisticsImputer,ArcSinhTargetScaler
19,19,0.6525818300460089,2024-03-08 01:28:43.496604,2024-03-08 01:29:39.263543,0 days 00:00:55.766939,8,,COMPLETE,XGB,0.6753870530494209,,,,,,,,,0.0006515657655946027,dart,0.1515508669573861,0.28607243118290526,lossguide,0.02113838748268341,forest,0.0845600642801708,weighted,2.778161850053837e-08,7,BaselinePreprocessor,HybridCategoricalStatisticsImputer,ArcSinhTargetScaler
20,20,0.6594844194707126,2024-03-08 01:29:39.265144,2024-03-08 01:30:40.109101,0 days 00:01:00.843957,9,,COMPLETE,XGB,0.6753870530494209,,,,,,,,,0.0009389363919017471,dart,0.1501717875612937,5.113204671119765e-05,depthwise,9.221831393429145e-05,forest,0.0025227458179163417,uniform,3.1791587734291796e-07,7,BaselinePreprocessor,HybridCategoricalStatisticsImputer,ArcSinhTargetScaler
21,21,0.6432322318074956,2024-03-08 01:30:40.110231,2024-03-08 01:31:15.666104,0 days 00:00:35.555873,3,,COMPLETE,XGB,0.6753870530494209,,,,,,,,,1.6149590502453254e-07,dart,2.641433559438126e-06,0.34280969259028105,depthwise,1.370081749022299e-08,tree,4.637470318129817e-07,weighted,4.446147343070628e-08,7,BaselinePreprocessor,HybridCategoricalStatisticsImputer,ArcSinhTargetScaler
22,22,0.6297516245040866,2024-03-08 01:31:15.667190,2024-03-08 01:31:59.084829,0 days 00:00:43.417639,4,,COMPLETE,XGB,0.6753870530494209,,,,,,,,,0.0022151214297343458,dart,2.0425515372359753e-05,0.00025120404507389415,lossguide,0.005330641873847998,tree,0.0011973574306562696,weighted,0.0023768556322565446,7,BaselinePreprocessor,HybridCategoricalStatisticsImputer,ArcSinhTargetScaler
23,23,0.5876723445965315,2024-03-08 01:31:59.086980,2024-03-08 01:33:11.926694,0 days 00:01:12.839714,9,,COMPLETE,XGB,0.6753870530494209,,,,,,,,,0.00301659806877082,dart,1.3644211083121707e-05,1.3674055283856553e-05,depthwise,1.2791387652655192e-08,tree,5.373267463945919e-06,uniform,3.2720767326405694e-06,7,BaselinePreprocessor,HybridCategoricalStatisticsImputer,ArcSinhTargetScaler
24,24,0.6312412088923036,2024-03-08 01:33:11.928493,2024-03-08 01:33:39.592114,0 days 00:00:27.663621,1,,COMPLETE,XGB,0.6753870530494209,,,,,,,,,0.013797754106660884,dart,0.030422971863380364,2.8119690754898525e-07,depthwise,0.06106988773213517,tree,2.8808540695877e-06,uniform,0.00013403247307715494,7,BaselinePreprocessor,HybridCategoricalStatisticsImputer,ArcSinhTargetScaler
25,25,0.6207065925084049,2024-03-08 01:33:39.593195,2024-03-08 01:34:42.735772,0 days 00:01:03.142577,7,,COMPLETE,XGB,0.6753870530494209,,,,,,,,,1.2786418834895759e-06,dart,0.0004488755041280523,1.6783500085892764e-07,depthwise,3.3639658673924104e-07,tree,3.6367725146975554e-06,weighted,0.0002417104048526761,7,BaselinePreprocessor,HybridCategoricalStatisticsImputer,ArcSinhTargetScaler
