,number,value,datetime_start,datetime_complete,duration,params_max_depth,params_n_estimators,state,model,best_value,params_bagging_fraction,params_bagging_freq,params_feature_fraction,params_lambda_l1,params_lambda_l2,params_learning_rate,params_min_child_samples,params_num_leaves,params_alpha,params_booster,params_eta,params_gamma,params_grow_policy,params_lambda,params_normalize_type,params_rate_drop,params_sample_type,params_skip_drop,config_id,preprocessor,imputer,target_scaler
25,25,0.5922521775701477,2024-03-08 08:26:21.917468,2024-03-08 08:26:25.029401,0 days 00:00:03.111933,93,100.0,COMPLETE,RandomForest,0.6221796315930094,,,,,,,,,,,,,,,,,,,14,IIDPreprocessor,RevenueQuantileBucketImputer:3-buckets,DummyTargetScaler
26,26,0.6056536560898287,2024-03-08 08:26:25.030137,2024-03-08 08:26:37.156811,0 days 00:00:12.126674,18,400.0,COMPLETE,RandomForest,0.6221796315930094,,,,,,,,,,,,,,,,,,,14,IIDPreprocessor,RevenueQuantileBucketImputer:3-buckets,DummyTargetScaler
27,27,0.599075034009463,2024-03-08 08:26:37.157635,2024-03-08 08:27:06.518760,0 days 00:00:29.361125,15,1000.0,COMPLETE,RandomForest,0.6221796315930094,,,,,,,,,,,,,,,,,,,14,IIDPreprocessor,RevenueQuantileBucketImputer:3-buckets,DummyTargetScaler
28,28,0.33751716436640256,2024-03-08 08:27:06.519542,2024-03-08 08:27:12.383792,0 days 00:00:05.864250,3,600.0,COMPLETE,RandomForest,0.6221796315930094,,,,,,,,,,,,,,,,,,,14,IIDPreprocessor,RevenueQuantileBucketImputer:3-buckets,DummyTargetScaler
29,29,0.3446337162955465,2024-03-08 08:27:12.384394,2024-03-08 08:27:21.698461,0 days 00:00:09.314067,3,1000.0,COMPLETE,RandomForest,0.6221796315930094,,,,,,,,,,,,,,,,,,,14,IIDPreprocessor,RevenueQuantileBucketImputer:3-buckets,DummyTargetScaler
30,30,0.6113984082387467,2024-03-08 08:27:21.699235,2024-03-08 08:27:56.897890,0 days 00:00:35.198655,90,1100.0,COMPLETE,RandomForest,0.6221796315930094,,,,,,,,,,,,,,,,,,,14,IIDPreprocessor,RevenueQuantileBucketImputer:3-buckets,DummyTargetScaler
31,31,0.6038158135301398,2024-03-08 08:27:56.898447,2024-03-08 08:28:12.489041,0 days 00:00:15.590594,72,500.0,COMPLETE,RandomForest,0.6221796315930094,,,,,,,,,,,,,,,,,,,14,IIDPreprocessor,RevenueQuantileBucketImputer:3-buckets,DummyTargetScaler
32,32,0.605682873576707,2024-03-08 08:28:12.489643,2024-03-08 08:28:55.641020,0 days 00:00:43.151377,36,1400.0,COMPLETE,RandomForest,0.6221796315930094,,,,,,,,,,,,,,,,,,,14,IIDPreprocessor,RevenueQuantileBucketImputer:3-buckets,DummyTargetScaler
33,33,0.5978025045173262,2024-03-08 08:28:55.641707,2024-03-08 08:29:21.681084,0 days 00:00:26.039377,15,900.0,COMPLETE,RandomForest,0.6221796315930094,,,,,,,,,,,,,,,,,,,14,IIDPreprocessor,RevenueQuantileBucketImputer:3-buckets,DummyTargetScaler
34,34,0.590448614026884,2024-03-08 08:29:21.681864,2024-03-08 08:29:53.864645,0 days 00:00:32.182781,15,1100.0,COMPLETE,RandomForest,0.6221796315930094,,,,,,,,,,,,,,,,,,,14,IIDPreprocessor,RevenueQuantileBucketImputer:3-buckets,DummyTargetScaler
35,35,0.5977315178618999,2024-03-08 08:29:53.865234,2024-03-08 08:30:42.267671,0 days 00:00:48.402437,42,1500.0,COMPLETE,RandomForest,0.6221796315930094,,,,,,,,,,,,,,,,,,,14,IIDPreprocessor,RevenueQuantileBucketImputer:3-buckets,DummyTargetScaler
36,36,0.6005408642991494,2024-03-08 08:30:42.268249,2024-03-08 08:31:20.937809,0 days 00:00:38.669560,51,1200.0,COMPLETE,RandomForest,0.6221796315930094,,,,,,,,,,,,,,,,,,,14,IIDPreprocessor,RevenueQuantileBucketImputer:3-buckets,DummyTargetScaler
37,37,0.4848404993509879,2024-03-08 08:31:20.938389,2024-03-08 08:31:32.865346,0 days 00:00:11.926957,6,800.0,COMPLETE,RandomForest,0.6221796315930094,,,,,,,,,,,,,,,,,,,14,IIDPreprocessor,RevenueQuantileBucketImputer:3-buckets,DummyTargetScaler
38,38,0.6051054528915436,2024-03-08 08:31:32.865945,2024-03-08 08:31:52.061520,0 days 00:00:19.195575,24,600.0,COMPLETE,RandomForest,0.6221796315930094,,,,,,,,,,,,,,,,,,,14,IIDPreprocessor,RevenueQuantileBucketImputer:3-buckets,DummyTargetScaler
39,39,0.6055555856678846,2024-03-08 08:31:52.062338,2024-03-08 08:32:07.904145,0 days 00:00:15.841807,27,500.0,COMPLETE,RandomForest,0.6221796315930094,,,,,,,,,,,,,,,,,,,14,IIDPreprocessor,RevenueQuantileBucketImputer:3-buckets,DummyTargetScaler
0,0,0.6446515733963483,2024-03-08 08:32:23.865273,2024-03-08 08:33:05.183735,0 days 00:00:41.318462,90,910.0,COMPLETE,LGBM,0.6575300222076724,0.5729045093356536,1.0,0.855284398186233,0.3731259748963348,0.031542827810363876,0.023934646839791157,24.0,24.0,,,,,,,,,,,14,IIDPreprocessor,RevenueQuantileBucketImputer:3-buckets,DummyTargetScaler
1,1,0.6382902123788415,2024-03-08 08:33:05.185369,2024-03-08 08:33:28.794365,0 days 00:00:23.608996,75,410.0,COMPLETE,LGBM,0.6575300222076724,0.5456651545837519,3.0,0.6445345157312304,4.4881428063679097e-07,0.006835999889646463,0.03480574591560645,39.0,197.0,,,,,,,,,,,14,IIDPreprocessor,RevenueQuantileBucketImputer:3-buckets,DummyTargetScaler
2,2,0.636940179652584,2024-03-08 08:33:28.796166,2024-03-08 08:34:42.226972,0 days 00:01:13.430806,81,1210.0,COMPLETE,LGBM,0.6575300222076724,0.7443859229909061,5.0,0.8715784141876359,0.00996055562198088,4.262344024344076e-08,0.01053678320275786,74.0,156.0,,,,,,,,,,,14,IIDPreprocessor,RevenueQuantileBucketImputer:3-buckets,DummyTargetScaler
3,3,0.5822931241367564,2024-03-08 08:34:42.228330,2024-03-08 08:34:45.709638,0 days 00:00:03.481308,15,110.0,COMPLETE,LGBM,0.6575300222076724,0.8393054960018675,7.0,0.9308732051367203,3.689745668941998,1.9800299950133649,0.017986822668737662,85.0,130.0,,,,,,,,,,,14,IIDPreprocessor,RevenueQuantileBucketImputer:3-buckets,DummyTargetScaler
4,4,0.6249688174100247,2024-03-08 08:34:45.711074,2024-03-08 08:35:41.840819,0 days 00:00:56.129745,99,710.0,COMPLETE,LGBM,0.6575300222076724,0.9224928074847626,6.0,0.8749083620546392,0.3250470391003287,4.270428233433976e-08,0.013641063794962476,38.0,82.0,,,,,,,,,,,14,IIDPreprocessor,RevenueQuantileBucketImputer:3-buckets,DummyTargetScaler
5,5,0.6470219965397501,2024-03-08 08:35:41.842281,2024-03-08 08:36:48.984575,0 days 00:01:07.142294,39,1110.0,COMPLETE,LGBM,0.6575300222076724,0.7159289906428488,4.0,0.8508747369078595,0.07441367298262035,7.126346583600013e-05,0.022689193027388376,9.0,52.0,,,,,,,,,,,14,IIDPreprocessor,RevenueQuantileBucketImputer:3-buckets,DummyTargetScaler
6,6,0.6338856123996034,2024-03-08 08:36:48.985570,2024-03-08 08:36:55.018206,0 days 00:00:06.032636,45,210.0,COMPLETE,LGBM,0.6575300222076724,0.4913691855765153,1.0,0.6802631446927929,0.000279304747897268,8.280824260522978e-06,0.06893903332566323,98.0,63.0,,,,,,,,,,,14,IIDPreprocessor,RevenueQuantileBucketImputer:3-buckets,DummyTargetScaler
7,7,0.6517542357364475,2024-03-08 08:36:55.019643,2024-03-08 08:37:46.494083,0 days 00:00:51.474440,66,1210.0,COMPLETE,LGBM,0.6575300222076724,0.6802712855401802,7.0,0.946691841452877,0.8082412784273899,0.00033095923547681364,0.01451907815438918,61.0,48.0,,,,,,,,,,,14,IIDPreprocessor,RevenueQuantileBucketImputer:3-buckets,DummyTargetScaler
8,8,0.6575300222076724,2024-03-08 08:37:46.495378,2024-03-08 08:41:07.762483,0 days 00:03:21.267105,96,1410.0,COMPLETE,LGBM,0.6575300222076724,0.6559616119873282,2.0,0.9500989031661017,9.519095372429446e-05,2.776183770922218e-07,0.012341826621562451,13.0,233.0,,,,,,,,,,,14,IIDPreprocessor,RevenueQuantileBucketImputer:3-buckets,DummyTargetScaler
9,9,0.6390477401535342,2024-03-08 08:41:07.782449,2024-03-08 08:42:51.314240,0 days 00:01:43.531791,90,1310.0,COMPLETE,LGBM,0.6575300222076724,0.65514544112015,6.0,0.9077879495186723,6.29621424728174e-06,3.2983095890247e-08,0.024917952788109817,47.0,168.0,,,,,,,,,,,14,IIDPreprocessor,RevenueQuantileBucketImputer:3-buckets,DummyTargetScaler
10,10,0.5663771277786444,2024-03-08 08:42:51.315616,2024-03-08 08:42:51.878601,0 days 00:00:00.562985,18,10.0,COMPLETE,LGBM,0.6575300222076724,0.9902542577812528,1.0,0.7470662950954325,0.0002771388522938976,8.081651444239043e-05,0.01937208357798825,92.0,96.0,,,,,,,,,,,14,IIDPreprocessor,RevenueQuantileBucketImputer:3-buckets,DummyTargetScaler
11,11,0.5793209230352606,2024-03-08 08:42:51.879961,2024-03-08 08:42:52.306062,0 days 00:00:00.426101,90,10.0,COMPLETE,LGBM,0.6575300222076724,0.6436129737148868,4.0,0.9243023310166886,1.0811430464310434e-07,0.0002749712209787062,0.04434235007477333,92.0,37.0,,,,,,,,,,,14,IIDPreprocessor,RevenueQuantileBucketImputer:3-buckets,DummyTargetScaler
12,12,0.6367494981532188,2024-03-08 08:42:52.307094,2024-03-08 08:43:44.781581,0 days 00:00:52.474487,72,1110.0,COMPLETE,LGBM,0.6575300222076724,0.8535231529341377,5.0,0.511831936941875,9.226503629209411e-06,3.15354514140094e-05,0.03224272519749205,99.0,89.0,,,,,,,,,,,14,IIDPreprocessor,RevenueQuantileBucketImputer:3-buckets,DummyTargetScaler
13,13,0.6423547363982827,2024-03-08 08:43:44.783141,2024-03-08 08:44:13.922901,0 days 00:00:29.139760,87,410.0,COMPLETE,LGBM,0.6575300222076724,0.4945599745145852,1.0,0.6534786688465539,0.0002919799831507226,0.0007354865292563829,0.04810443180412434,28.0,133.0,,,,,,,,,,,14,IIDPreprocessor,RevenueQuantileBucketImputer:3-buckets,DummyTargetScaler
14,14,0.6190402008056656,2024-03-08 08:44:13.924386,2024-03-08 08:44:32.514200,0 days 00:00:18.589814,54,410.0,COMPLETE,LGBM,0.6575300222076724,0.9501058515921692,4.0,0.6226683929797433,0.27676181211385875,1.3760496354042604e-08,0.012334166318350772,88.0,134.0,,,,,,,,,,,14,IIDPreprocessor,RevenueQuantileBucketImputer:3-buckets,DummyTargetScaler
15,15,0.6261226775282804,2024-03-08 08:44:32.515264,2024-03-08 08:44:39.834878,0 days 00:00:07.319614,27,210.0,COMPLETE,LGBM,0.6575300222076724,0.5739647764462328,2.0,0.6177168771868253,0.0013307436583381966,7.720423974308543e-05,0.14800459835492918,83.0,96.0,,,,,,,,,,,14,IIDPreprocessor,RevenueQuantileBucketImputer:3-buckets,DummyTargetScaler
16,16,0.638490082983561,2024-03-08 08:44:39.836355,2024-03-08 08:45:16.761967,0 days 00:00:36.925612,75,1010.0,COMPLETE,LGBM,0.6575300222076724,0.8175628234587563,4.0,0.9082105440667141,3.3306891975443608e-06,3.765808594198203e-05,0.04486254331830514,80.0,8.0,,,,,,,,,,,14,IIDPreprocessor,RevenueQuantileBucketImputer:3-buckets,DummyTargetScaler
17,17,0.6395435977926172,2024-03-08 08:45:16.763476,2024-03-08 08:45:30.029513,0 days 00:00:13.266037,78,310.0,COMPLETE,LGBM,0.6575300222076724,0.6167939076171003,4.0,0.42052109818691286,0.00040919472039721355,3.0390167656307585e-07,0.07533165274472248,45.0,119.0,,,,,,,,,,,14,IIDPreprocessor,RevenueQuantileBucketImputer:3-buckets,DummyTargetScaler
18,18,0.6218104895461882,2024-03-08 08:45:30.031568,2024-03-08 08:46:36.000236,0 days 00:01:05.968668,60,1410.0,COMPLETE,LGBM,0.6575300222076724,0.8944339511291146,5.0,0.9811297394219236,1.651191311813563,0.14811367927189983,0.01177676069841421,15.0,67.0,,,,,,,,,,,14,IIDPreprocessor,RevenueQuantileBucketImputer:3-buckets,DummyTargetScaler
19,19,0.6370295421068392,2024-03-08 08:46:36.001776,2024-03-08 08:46:43.616342,0 days 00:00:07.614566,6,410.0,COMPLETE,LGBM,0.6575300222076724,0.9817310873614116,3.0,0.6862431466574579,0.38618846228999437,1.1067008027425094e-06,0.14445397586396855,29.0,247.0,,,,,,,,,,,14,IIDPreprocessor,RevenueQuantileBucketImputer:3-buckets,DummyTargetScaler
20,20,0.624098145858487,2024-03-08 08:46:43.617618,2024-03-08 08:47:38.659981,0 days 00:00:55.042363,30,1410.0,COMPLETE,LGBM,0.6575300222076724,0.7121347955015094,2.0,0.404259373522154,7.692731309192511e-06,1.4225615560577762,0.2965422645376641,15.0,155.0,,,,,,,,,,,14,IIDPreprocessor,RevenueQuantileBucketImputer:3-buckets,DummyTargetScaler
21,21,0.6331209465667387,2024-03-08 08:47:38.661457,2024-03-08 08:48:34.728441,0 days 00:00:56.066984,66,710.0,COMPLETE,LGBM,0.6575300222076724,0.9340786238213542,6.0,0.6527494746691687,0.0010777050650561358,0.00016356068131735484,0.024027953841456177,52.0,82.0,,,,,,,,,,,14,IIDPreprocessor,RevenueQuantileBucketImputer:3-buckets,DummyTargetScaler
22,22,0.6477913460696466,2024-03-08 08:48:34.729744,2024-03-08 08:49:06.310712,0 days 00:00:31.580968,18,1210.0,COMPLETE,LGBM,0.6575300222076724,0.513519014143187,4.0,0.5284007670222488,0.1687028872387721,5.445561996701784e-08,0.023148639106091398,73.0,67.0,,,,,,,,,,,14,IIDPreprocessor,RevenueQuantileBucketImputer:3-buckets,DummyTargetScaler
23,23,0.6242413932032426,2024-03-08 08:49:06.312484,2024-03-08 08:49:40.876713,0 days 00:00:34.564229,75,810.0,COMPLETE,LGBM,0.6575300222076724,0.48421109974200327,6.0,0.9950516963726689,0.0034606357232172978,0.3511227207270855,0.03277356486092492,63.0,61.0,,,,,,,,,,,14,IIDPreprocessor,RevenueQuantileBucketImputer:3-buckets,DummyTargetScaler
24,24,0.6284942074093678,2024-03-08 08:49:40.878856,2024-03-08 08:51:40.641797,0 days 00:01:59.762941,60,1110.0,COMPLETE,LGBM,0.6575300222076724,0.8448393187959388,2.0,0.7729710317440603,4.489881472042669e-06,2.266762331923967e-08,0.015584216327157344,46.0,52.0,,,,,,,,,,,14,IIDPreprocessor,RevenueQuantileBucketImputer:3-buckets,DummyTargetScaler
25,25,0.6267048577511962,2024-03-08 08:51:40.643576,2024-03-08 08:51:58.247917,0 days 00:00:17.604341,78,610.0,COMPLETE,LGBM,0.6575300222076724,0.9659738441670186,5.0,0.8728187817583495,5.76703370044306e-06,1.0138713387804752e-07,0.25144287386341896,84.0,159.0,,,,,,,,,,,14,IIDPreprocessor,RevenueQuantileBucketImputer:3-buckets,DummyTargetScaler
26,26,0.6258940541294716,2024-03-08 08:51:58.249868,2024-03-08 08:52:06.994166,0 days 00:00:08.744298,54,110.0,COMPLETE,LGBM,0.6575300222076724,0.5109028571213367,7.0,0.8239002976476215,3.7187706327798366e-06,0.03136516144264313,0.04073220211616014,36.0,59.0,,,,,,,,,,,14,IIDPreprocessor,RevenueQuantileBucketImputer:3-buckets,DummyTargetScaler
27,27,0.6384839529105114,2024-03-08 08:52:06.995593,2024-03-08 08:53:20.108500,0 days 00:01:13.112907,87,510.0,COMPLETE,LGBM,0.6575300222076724,0.5960789306421231,3.0,0.9822927108062831,0.002540788759715103,1.1006714812551353e-05,0.011302333015795247,18.0,106.0,,,,,,,,,,,14,IIDPreprocessor,RevenueQuantileBucketImputer:3-buckets,DummyTargetScaler
28,28,0.6399360396310901,2024-03-08 08:53:20.109680,2024-03-08 08:54:32.136792,0 days 00:01:12.027112,51,1410.0,COMPLETE,LGBM,0.6575300222076724,0.7487989568511687,4.0,0.7413725238554147,2.8760544926300096e-08,1.8971824114355086e-08,0.030917563574832264,81.0,235.0,,,,,,,,,,,14,IIDPreprocessor,RevenueQuantileBucketImputer:3-buckets,DummyTargetScaler
29,29,0.6492153553312184,2024-03-08 08:54:32.138352,2024-03-08 08:55:31.262633,0 days 00:00:59.124281,6,1110.0,COMPLETE,LGBM,0.6575300222076724,0.5981029148440361,3.0,0.6893448463786461,9.257399093471252e-06,0.04146173076870187,0.010189406762077557,18.0,159.0,,,,,,,,,,,14,IIDPreprocessor,RevenueQuantileBucketImputer:3-buckets,DummyTargetScaler
30,30,0.6190766128301057,2024-03-08 08:55:31.264299,2024-03-08 08:55:43.811512,0 days 00:00:12.547213,87,110.0,COMPLETE,LGBM,0.6575300222076724,0.966257639962779,4.0,0.7757525832391607,0.3792512204561853,0.00017565554354135552,0.056727964026445074,7.0,226.0,,,,,,,,,,,14,IIDPreprocessor,RevenueQuantileBucketImputer:3-buckets,DummyTargetScaler
31,31,0.6401642360822581,2024-03-08 08:55:43.812885,2024-03-08 08:56:46.436274,0 days 00:01:02.623389,81,1110.0,COMPLETE,LGBM,0.6575300222076724,0.9429870790029805,3.0,0.4317692605403928,1.5361922380135953e-08,2.1255862444477057e-07,0.02510743947180823,47.0,189.0,,,,,,,,,,,14,IIDPreprocessor,RevenueQuantileBucketImputer:3-buckets,DummyTargetScaler
32,32,0.6368026485009628,2024-03-08 08:56:46.437459,2024-03-08 08:57:53.841755,0 days 00:01:07.404296,69,1210.0,COMPLETE,LGBM,0.6575300222076724,0.920889606518287,5.0,0.7407296841987734,3.717826447009938e-05,0.681766449251454,0.10252169489104601,37.0,205.0,,,,,,,,,,,14,IIDPreprocessor,RevenueQuantileBucketImputer:3-buckets,DummyTargetScaler
33,33,0.6333045927006371,2024-03-08 08:57:53.843251,2024-03-08 08:58:20.525422,0 days 00:00:26.682171,12,710.0,COMPLETE,LGBM,0.6575300222076724,0.4109189156479655,4.0,0.8195519358613741,1.8872885145163781e-06,2.7615475368586744e-07,0.06105157873821717,70.0,228.0,,,,,,,,,,,14,IIDPreprocessor,RevenueQuantileBucketImputer:3-buckets,DummyTargetScaler
34,34,0.6180950058814535,2024-03-08 08:58:20.526837,2024-03-08 08:58:37.330782,0 days 00:00:16.803945,30,710.0,COMPLETE,LGBM,0.6575300222076724,0.8470480051053307,6.0,0.7464647253896068,2.145110970440115,3.033875054240284e-06,0.05176966463466216,9.0,98.0,,,,,,,,,,,14,IIDPreprocessor,RevenueQuantileBucketImputer:3-buckets,DummyTargetScaler
35,35,0.6390115641794089,2024-03-08 08:58:37.332068,2024-03-08 08:58:55.741697,0 days 00:00:18.409629,75,910.0,COMPLETE,LGBM,0.6575300222076724,0.593938737579119,3.0,0.4181603499824498,0.8314913794578167,7.438815051610693e-08,0.01539024233270632,76.0,205.0,,,,,,,,,,,14,IIDPreprocessor,RevenueQuantileBucketImputer:3-buckets,DummyTargetScaler
36,36,0.6125373660453249,2024-03-08 08:58:55.742791,2024-03-08 08:59:24.058062,0 days 00:00:28.315271,54,210.0,COMPLETE,LGBM,0.6575300222076724,0.8896116928343454,7.0,0.8432057033838287,1.3281270574172463e-08,1.1804168598357464e-08,0.014480867803675235,41.0,185.0,,,,,,,,,,,14,IIDPreprocessor,RevenueQuantileBucketImputer:3-buckets,DummyTargetScaler
37,37,0.5515013593914124,2024-03-08 08:59:24.059687,2024-03-08 08:59:24.469570,0 days 00:00:00.409883,57,10.0,COMPLETE,LGBM,0.6575300222076724,0.6710946872842449,6.0,0.4961471706265679,0.0013666765901416272,1.2114571348998424,0.21080526628093738,59.0,198.0,,,,,,,,,,,14,IIDPreprocessor,RevenueQuantileBucketImputer:3-buckets,DummyTargetScaler
38,38,0.6490889829759143,2024-03-08 08:59:24.470643,2024-03-08 09:00:09.133970,0 days 00:00:44.663327,42,1310.0,COMPLETE,LGBM,0.6575300222076724,0.6163634463480947,7.0,0.9390683407211723,0.008858958056508147,4.985176525570837e-05,0.058993669603323924,65.0,247.0,,,,,,,,,,,14,IIDPreprocessor,RevenueQuantileBucketImputer:3-buckets,DummyTargetScaler
39,39,0.6296910087242288,2024-03-08 09:00:09.135564,2024-03-08 09:00:28.876201,0 days 00:00:19.740637,87,310.0,COMPLETE,LGBM,0.6575300222076724,0.8252635980261407,7.0,0.9959811040076283,0.8411658853880546,4.794122510094582e-08,0.03119343399767256,82.0,83.0,,,,,,,,,,,14,IIDPreprocessor,RevenueQuantileBucketImputer:3-buckets,DummyTargetScaler
0,0,0.5321387817475381,2024-03-08 09:04:06.381803,2024-03-08 09:04:40.943792,0 days 00:00:34.561989,2,,COMPLETE,XGB,0.6119687521565602,,,,,,,,,0.0019336488699869903,dart,2.5615329269557015e-05,0.1749612548280975,lossguide,8.73671117849741e-06,tree,1.0075109146408209e-05,uniform,0.00011924180454509891,14,IIDPreprocessor,RevenueQuantileBucketImputer:3-buckets,DummyTargetScaler
1,1,0.5384041652018979,2024-03-08 09:04:40.945584,2024-03-08 09:05:20.376452,0 days 00:00:39.430868,3,,COMPLETE,XGB,0.6119687521565602,,,,,,,,,4.5011686369452154e-06,dart,2.328650698453195e-08,0.11141059536464358,lossguide,1.520443970403978e-07,forest,1.4400344455481469e-06,weighted,0.07527072265170984,14,IIDPreprocessor,RevenueQuantileBucketImputer:3-buckets,DummyTargetScaler
2,2,0.5413112496769494,2024-03-08 09:05:20.378510,2024-03-08 09:06:07.336703,0 days 00:00:46.958193,5,,COMPLETE,XGB,0.6119687521565602,,,,,,,,,0.0128486346579005,dart,2.05252317885937e-05,1.107474977287181e-05,lossguide,5.315641467793443e-06,tree,0.0007267523507040241,weighted,0.07089353261738636,14,IIDPreprocessor,RevenueQuantileBucketImputer:3-buckets,DummyTargetScaler
3,3,0.5368847000167567,2024-03-08 09:06:07.338263,2024-03-08 09:06:43.373228,0 days 00:00:36.034965,3,,COMPLETE,XGB,0.6119687521565602,,,,,,,,,1.0646844180036558e-08,dart,1.452153275346407e-08,0.17547172016450582,depthwise,2.174025437624961e-05,forest,0.00017534035788743205,weighted,0.00047333093475918693,14,IIDPreprocessor,RevenueQuantileBucketImputer:3-buckets,DummyTargetScaler
4,4,0.6060321768159558,2024-03-08 09:06:43.374926,2024-03-08 09:07:39.808940,0 days 00:00:56.434014,7,,COMPLETE,XGB,0.6119687521565602,,,,,,,,,0.9323306100944501,dart,0.06175506708406084,1.1999029030889518e-07,lossguide,2.1600147632017355e-08,tree,1.5236406583583282e-06,weighted,0.4464234605379805,14,IIDPreprocessor,RevenueQuantileBucketImputer:3-buckets,DummyTargetScaler
5,5,0.48030401807525175,2024-03-08 09:07:39.810462,2024-03-08 09:08:11.488497,0 days 00:00:31.678035,2,,COMPLETE,XGB,0.6119687521565602,,,,,,,,,0.0019717290571495487,dart,8.906562955603298e-08,9.670406757562479e-08,lossguide,2.8390450342095634e-07,forest,1.6654211974422007e-08,uniform,0.003649361780107802,14,IIDPreprocessor,RevenueQuantileBucketImputer:3-buckets,DummyTargetScaler
6,6,0.46466950053266964,2024-03-08 09:08:11.489725,2024-03-08 09:08:36.089482,0 days 00:00:24.599757,1,,COMPLETE,XGB,0.6119687521565602,,,,,,,,,0.0012473489227744492,dart,2.2460945762018558e-05,0.00031135875768150605,lossguide,0.1430665346342159,forest,1.0964217829260455e-06,uniform,1.7000182525595347e-08,14,IIDPreprocessor,RevenueQuantileBucketImputer:3-buckets,DummyTargetScaler
7,7,0.46466950053266964,2024-03-08 09:08:36.090693,2024-03-08 09:09:03.715885,0 days 00:00:27.625192,1,,COMPLETE,XGB,0.6119687521565602,,,,,,,,,0.0011854770824367322,dart,7.162699708725262e-05,1.07476287080747e-06,depthwise,7.356239142068904e-05,forest,4.956138572858611e-05,uniform,0.005467275466195775,14,IIDPreprocessor,RevenueQuantileBucketImputer:3-buckets,DummyTargetScaler
8,8,0.6119687521565602,2024-03-08 09:09:03.717350,2024-03-08 09:10:04.183980,0 days 00:01:00.466630,8,,COMPLETE,XGB,0.6119687521565602,,,,,,,,,2.4588381355402836e-07,dart,0.09171525827316197,0.0242249779224852,lossguide,4.244498607906657e-07,forest,4.226524818416678e-08,uniform,0.00014993616790643575,14,IIDPreprocessor,RevenueQuantileBucketImputer:3-buckets,DummyTargetScaler
9,9,0.46466950053266964,2024-03-08 09:10:04.185670,2024-03-08 09:10:34.837915,0 days 00:00:30.652245,1,,COMPLETE,XGB,0.6119687521565602,,,,,,,,,6.685915085262165e-08,dart,9.00224751636915e-06,0.0032153629386226495,depthwise,0.004344856535984269,forest,7.771677236045954e-05,weighted,0.052145431698057076,14,IIDPreprocessor,RevenueQuantileBucketImputer:3-buckets,DummyTargetScaler
