,number,value,datetime_start,datetime_complete,duration,params_max_depth,params_n_estimators,state,model,best_value,params_bagging_fraction,params_bagging_freq,params_feature_fraction,params_lambda_l1,params_lambda_l2,params_learning_rate,params_min_child_samples,params_num_leaves,params_alpha,params_booster,params_eta,params_gamma,params_grow_policy,params_lambda,params_normalize_type,params_rate_drop,params_sample_type,params_skip_drop,config_id,preprocessor,imputer,target_scaler
36,36,0.6405321655494097,2024-03-07 21:36:51.697968,2024-03-07 21:37:14.197991,0 days 00:00:22.500023,78,810.0,COMPLETE,LGBM,0.6501127851716584,0.5332155612846247,6.0,0.7744559217828602,2.3621486292000874e-08,2.390218600814776e-07,0.1534557001070321,81.0,223.0,,,,,,,,,,,4,BaselinePreprocessor,RevenueQuantileBucketImputer:3-buckets,ArcSinhTargetScaler
37,37,0.6120999869561213,2024-03-07 21:37:14.199320,2024-03-07 21:37:21.315791,0 days 00:00:07.116471,42,210.0,COMPLETE,LGBM,0.6501127851716584,0.7297334931100783,2.0,0.9725137679722204,2.6279551847512606,0.0016733990478796955,0.04070946572001795,89.0,93.0,,,,,,,,,,,4,BaselinePreprocessor,RevenueQuantileBucketImputer:3-buckets,ArcSinhTargetScaler
38,38,0.63324888813705,2024-03-07 21:37:21.317371,2024-03-07 21:37:55.893013,0 days 00:00:34.575642,30,1410.0,COMPLETE,LGBM,0.6501127851716584,0.8712158343247314,3.0,0.8825443111017776,2.3064675501452816e-08,3.164390865953172e-05,0.16786504716717657,72.0,191.0,,,,,,,,,,,4,BaselinePreprocessor,RevenueQuantileBucketImputer:3-buckets,ArcSinhTargetScaler
39,39,0.6191921630309749,2024-03-07 21:37:55.896543,2024-03-07 21:38:06.633005,0 days 00:00:10.736462,27,910.0,COMPLETE,LGBM,0.6501127851716584,0.48292789927419616,1.0,0.8989417599850253,7.565504657851555,5.573022952480334e-07,0.04234642298590407,81.0,168.0,,,,,,,,,,,4,BaselinePreprocessor,RevenueQuantileBucketImputer:3-buckets,ArcSinhTargetScaler
0,0,0.5697034040736679,2024-03-07 21:38:49.376482,2024-03-07 21:39:20.211519,0 days 00:00:30.835037,3,,COMPLETE,XGB,0.6093427956604714,,,,,,,,,4.991934310631909e-06,dart,0.02079239108404614,0.02135331017609577,lossguide,0.021407632095994496,forest,0.02835518062701804,weighted,1.2776944500596992e-08,4,BaselinePreprocessor,RevenueQuantileBucketImputer:3-buckets,ArcSinhTargetScaler
1,1,0.5897325125855956,2024-03-07 21:39:20.212902,2024-03-07 21:40:10.913501,0 days 00:00:50.700599,6,,COMPLETE,XGB,0.6093427956604714,,,,,,,,,9.304809102937902e-05,dart,0.30478595727051216,1.9669878549771295e-08,lossguide,0.0005366183926226318,tree,0.04503889162830264,weighted,1.1867010561791185e-06,4,BaselinePreprocessor,RevenueQuantileBucketImputer:3-buckets,ArcSinhTargetScaler
2,2,0.578166554709813,2024-03-07 21:40:10.917531,2024-03-07 21:40:54.919717,0 days 00:00:44.002186,6,,COMPLETE,XGB,0.6093427956604714,,,,,,,,,2.252290845565286e-08,dart,0.02297987523474634,5.437393082424189e-05,depthwise,0.001617366342997207,forest,0.11986678930762248,weighted,0.0055010260152683135,4,BaselinePreprocessor,RevenueQuantileBucketImputer:3-buckets,ArcSinhTargetScaler
3,3,0.5735718417303541,2024-03-07 21:40:54.921148,2024-03-07 21:41:31.547878,0 days 00:00:36.626730,3,,COMPLETE,XGB,0.6093427956604714,,,,,,,,,7.760886868976704e-07,dart,0.008599349001267902,1.6300590982095101e-06,depthwise,0.8222928193048338,tree,4.14141893571545e-08,uniform,5.95068474438242e-08,4,BaselinePreprocessor,RevenueQuantileBucketImputer:3-buckets,ArcSinhTargetScaler
4,4,0.6024032300360812,2024-03-07 21:41:31.549171,2024-03-07 21:42:02.478786,0 days 00:00:30.929615,2,,COMPLETE,XGB,0.6093427956604714,,,,,,,,,0.00017255179680405357,dart,0.27129249246590237,0.0005882571519592823,lossguide,3.573185317566769e-08,tree,0.0016285664349111808,weighted,8.86249785101003e-06,4,BaselinePreprocessor,RevenueQuantileBucketImputer:3-buckets,ArcSinhTargetScaler
5,5,0.5591939853534117,2024-03-07 21:42:02.481254,2024-03-07 21:42:39.867222,0 days 00:00:37.385968,3,,COMPLETE,XGB,0.6093427956604714,,,,,,,,,0.0007667191008583367,dart,6.233877787712858e-08,8.305036002151183e-05,depthwise,4.3552366252218545e-06,tree,1.0829486211620369e-05,uniform,7.258660340439779e-06,4,BaselinePreprocessor,RevenueQuantileBucketImputer:3-buckets,ArcSinhTargetScaler
6,6,0.5592583606729441,2024-03-07 21:42:39.868813,2024-03-07 21:43:13.714945,0 days 00:00:33.846132,3,,COMPLETE,XGB,0.6093427956604714,,,,,,,,,1.4446370598510044e-05,dart,0.0036104782334270905,2.015245624810411e-06,depthwise,4.065151698096115e-05,tree,1.2792940062759925e-08,weighted,0.0003227500357092751,4,BaselinePreprocessor,RevenueQuantileBucketImputer:3-buckets,ArcSinhTargetScaler
7,7,0.58555482803505,2024-03-07 21:43:13.716414,2024-03-07 21:43:44.494336,0 days 00:00:30.777922,2,,COMPLETE,XGB,0.6093427956604714,,,,,,,,,0.0002995990939096736,dart,0.26917535416372557,5.437076100486364e-07,depthwise,0.03469978667191141,forest,0.0021849466217779595,uniform,6.39401711044442e-08,4,BaselinePreprocessor,RevenueQuantileBucketImputer:3-buckets,ArcSinhTargetScaler
8,8,0.5594148025011809,2024-03-07 21:43:44.497840,2024-03-07 21:44:19.013565,0 days 00:00:34.515725,4,,COMPLETE,XGB,0.6093427956604714,,,,,,,,,3.563054409437955e-06,dart,0.0008477517522088935,1.4333311492483297e-07,lossguide,5.870061522979021e-05,forest,6.994293959356452e-05,weighted,0.00015739611671161885,4,BaselinePreprocessor,RevenueQuantileBucketImputer:3-buckets,ArcSinhTargetScaler
9,9,0.5939013464969358,2024-03-07 21:44:19.014764,2024-03-07 21:45:10.301902,0 days 00:00:51.287138,7,,COMPLETE,XGB,0.6093427956604714,,,,,,,,,0.0017624511385741944,dart,0.04422648406899391,2.3456166853301544e-05,depthwise,8.718755996656015e-06,forest,1.786964453817799e-05,weighted,0.0001714369587749686,4,BaselinePreprocessor,RevenueQuantileBucketImputer:3-buckets,ArcSinhTargetScaler
10,10,0.5319793942913745,2024-03-07 21:45:10.303546,2024-03-07 21:45:58.487830,0 days 00:00:48.184284,5,,COMPLETE,XGB,0.6093427956604714,,,,,,,,,0.00015275773275891347,dart,1.2502997529588881e-08,0.890465779218671,depthwise,0.3532931601064687,tree,1.7482568905932023e-06,uniform,2.0286607146106418e-07,4,BaselinePreprocessor,RevenueQuantileBucketImputer:3-buckets,ArcSinhTargetScaler
11,11,0.5901571589109096,2024-03-07 21:45:58.491300,2024-03-07 21:46:48.915219,0 days 00:00:50.423919,8,,COMPLETE,XGB,0.6093427956604714,,,,,,,,,0.0020028531763891287,dart,0.6648234242839652,8.821387256527363e-06,depthwise,9.679480328737296e-05,tree,0.39505215092606677,uniform,0.303278405275563,4,BaselinePreprocessor,RevenueQuantileBucketImputer:3-buckets,ArcSinhTargetScaler
12,12,0.5351581833013136,2024-03-07 21:46:48.916672,2024-03-07 21:47:52.147805,0 days 00:01:03.231133,9,,COMPLETE,XGB,0.6093427956604714,,,,,,,,,1.3406796274282965e-08,dart,2.0359628411201337e-06,0.0008248908165964612,depthwise,0.0032412160745254946,forest,0.26289365744929605,weighted,0.015976711092486537,4,BaselinePreprocessor,RevenueQuantileBucketImputer:3-buckets,ArcSinhTargetScaler
13,13,0.555182738225769,2024-03-07 21:47:52.150725,2024-03-07 21:48:20.756043,0 days 00:00:28.605318,2,,COMPLETE,XGB,0.6093427956604714,,,,,,,,,1.9650551351007242e-05,dart,0.010948418517000727,0.003250744733168022,lossguide,1.2691028313993107e-07,forest,1.245924416210286e-05,uniform,0.0012251874812258773,4,BaselinePreprocessor,RevenueQuantileBucketImputer:3-buckets,ArcSinhTargetScaler
14,14,0.5495703414059757,2024-03-07 21:48:20.757722,2024-03-07 21:49:17.220544,0 days 00:00:56.462822,8,,COMPLETE,XGB,0.6093427956604714,,,,,,,,,0.00022191054075134555,dart,3.775648470431717e-05,5.6062706161575354e-05,depthwise,0.008682719950849491,forest,0.00579957448321751,uniform,0.00010653532829227129,4,BaselinePreprocessor,RevenueQuantileBucketImputer:3-buckets,ArcSinhTargetScaler
15,15,0.6086937956036449,2024-03-07 21:49:17.222235,2024-03-07 21:50:02.452796,0 days 00:00:45.230561,6,,COMPLETE,XGB,0.6093427956604714,,,,,,,,,1.9937946608450982e-07,dart,0.5196821535935222,1.7304590283370718e-05,lossguide,0.03053417862182757,tree,0.000331857286279531,weighted,0.07752189824613819,4,BaselinePreprocessor,RevenueQuantileBucketImputer:3-buckets,ArcSinhTargetScaler
16,16,0.5321387817475381,2024-03-07 21:50:02.457607,2024-03-07 21:50:29.127606,0 days 00:00:26.669999,2,,COMPLETE,XGB,0.6093427956604714,,,,,,,,,0.00016450869872043636,dart,0.005012716028278811,9.709899167794318e-07,lossguide,0.0004875372503756426,tree,0.4791141987559881,weighted,0.0023445847742190862,4,BaselinePreprocessor,RevenueQuantileBucketImputer:3-buckets,ArcSinhTargetScaler
17,17,0.5576922335530149,2024-03-07 21:50:29.129115,2024-03-07 21:51:25.116718,0 days 00:00:55.987603,6,,COMPLETE,XGB,0.6093427956604714,,,,,,,,,0.6828830821028362,dart,4.088796412996055e-05,3.4552923001290093e-06,lossguide,0.5144227762377774,tree,0.0027897722427134555,uniform,0.03675041008904288,4,BaselinePreprocessor,RevenueQuantileBucketImputer:3-buckets,ArcSinhTargetScaler
18,18,0.5388937172254908,2024-03-07 21:51:25.135301,2024-03-07 21:52:10.223962,0 days 00:00:45.088661,6,,COMPLETE,XGB,0.6093427956604714,,,,,,,,,7.911279083825354e-05,dart,3.210221219342785e-07,4.467695035049303e-05,lossguide,0.00020821044417516888,tree,1.1175548885772142e-08,uniform,6.556482596842826e-08,4,BaselinePreprocessor,RevenueQuantileBucketImputer:3-buckets,ArcSinhTargetScaler
19,19,0.5491877817099852,2024-03-07 21:52:10.225159,2024-03-07 21:52:37.091120,0 days 00:00:26.865961,3,,COMPLETE,XGB,0.6093427956604714,,,,,,,,,1.0294754158869132e-07,dart,0.00016458771490557777,6.220236766085448e-08,depthwise,2.0140102207627887e-06,tree,0.2161431405721781,weighted,0.01739633548510022,4,BaselinePreprocessor,RevenueQuantileBucketImputer:3-buckets,ArcSinhTargetScaler
20,20,0.5337342334765953,2024-03-07 21:52:37.092424,2024-03-07 21:53:40.316133,0 days 00:01:03.223709,9,,COMPLETE,XGB,0.6093427956604714,,,,,,,,,0.0001551563677550064,dart,1.4776393875191879e-06,0.1035315420824084,lossguide,1.3599176094467856e-07,forest,8.531225796824977e-07,weighted,0.0026261091177305607,4,BaselinePreprocessor,RevenueQuantileBucketImputer:3-buckets,ArcSinhTargetScaler
21,21,0.5403953766024464,2024-03-07 21:53:40.320004,2024-03-07 21:54:18.601433,0 days 00:00:38.281429,4,,COMPLETE,XGB,0.6093427956604714,,,,,,,,,2.5879532996824045e-05,dart,6.197307831504428e-07,4.8246842837433004e-08,lossguide,8.895435042536713e-07,tree,0.018766792781648115,uniform,5.515126235820429e-06,4,BaselinePreprocessor,RevenueQuantileBucketImputer:3-buckets,ArcSinhTargetScaler
22,22,0.2989589387185411,2024-03-07 21:54:18.602860,2024-03-07 21:54:37.186189,0 days 00:00:18.583329,1,,COMPLETE,XGB,0.6093427956604714,,,,,,,,,0.029214004151795023,dart,6.573340405358383e-08,0.049908238590706366,depthwise,0.0006734787470953017,tree,0.5798341349381873,weighted,3.029114800340964e-05,4,BaselinePreprocessor,RevenueQuantileBucketImputer:3-buckets,ArcSinhTargetScaler
23,23,0.5510426823096211,2024-03-07 21:54:37.187843,2024-03-07 21:55:31.318921,0 days 00:00:54.131078,6,,COMPLETE,XGB,0.6093427956604714,,,,,,,,,0.28835485731579424,dart,1.0760877634682729e-07,6.94547416606132e-08,lossguide,0.00016317899288451708,tree,1.4829612036835999e-08,uniform,4.0550124739114094e-05,4,BaselinePreprocessor,RevenueQuantileBucketImputer:3-buckets,ArcSinhTargetScaler
24,24,0.5322037527431532,2024-03-07 21:55:31.322336,2024-03-07 21:55:58.131477,0 days 00:00:26.809141,2,,COMPLETE,XGB,0.6093427956604714,,,,,,,,,0.7339297180454317,dart,0.00025503056606613516,2.361777409091419e-08,depthwise,7.443599966332467e-08,forest,0.0014527024191137408,weighted,0.09893504147461878,4,BaselinePreprocessor,RevenueQuantileBucketImputer:3-buckets,ArcSinhTargetScaler
25,25,0.5973903199272802,2024-03-07 21:55:58.132998,2024-03-07 21:56:45.274695,0 days 00:00:47.141697,7,,COMPLETE,XGB,0.6093427956604714,,,,,,,,,6.402158138755312e-05,dart,0.050581631832070276,1.7377147396903523e-07,depthwise,2.5508772004809276e-07,forest,0.00236972660000525,uniform,0.04753282322909443,4,BaselinePreprocessor,RevenueQuantileBucketImputer:3-buckets,ArcSinhTargetScaler
26,26,0.560244142599834,2024-03-07 21:56:45.276493,2024-03-07 21:57:25.447699,0 days 00:00:40.171206,5,,COMPLETE,XGB,0.6093427956604714,,,,,,,,,0.012355974726572638,dart,0.016546397627986428,0.41689395125993267,depthwise,3.5270933398869966e-08,forest,3.2035894101199085e-05,uniform,0.014564482942264189,4,BaselinePreprocessor,RevenueQuantileBucketImputer:3-buckets,ArcSinhTargetScaler
27,27,0.5342348381163112,2024-03-07 21:57:25.449253,2024-03-07 21:58:13.327860,0 days 00:00:47.878607,5,,COMPLETE,XGB,0.6093427956604714,,,,,,,,,2.0853915183847292e-07,dart,2.8801220828766897e-06,0.09385453438005723,depthwise,1.064345336384094e-08,forest,9.663428704599103e-05,weighted,1.1495869878821012e-08,4,BaselinePreprocessor,RevenueQuantileBucketImputer:3-buckets,ArcSinhTargetScaler
28,28,0.5226769601852487,2024-03-07 21:58:13.331696,2024-03-07 21:58:50.968685,0 days 00:00:37.636989,4,,COMPLETE,XGB,0.6093427956604714,,,,,,,,,0.00021624433372438896,dart,1.2439892895423344e-08,2.2003396696014466e-08,lossguide,0.00011331621733193222,forest,1.574368232839442e-07,weighted,0.002352460055338439,4,BaselinePreprocessor,RevenueQuantileBucketImputer:3-buckets,ArcSinhTargetScaler
29,29,0.5854595208674561,2024-03-07 21:58:50.970026,2024-03-07 21:59:25.256898,0 days 00:00:34.286872,3,,COMPLETE,XGB,0.6093427956604714,,,,,,,,,3.4054317536840224e-08,dart,0.10007253308887112,0.4707912118112935,lossguide,5.003541212398067e-05,tree,8.09338186761237e-06,uniform,6.160184068445888e-07,4,BaselinePreprocessor,RevenueQuantileBucketImputer:3-buckets,ArcSinhTargetScaler
30,30,0.5345523804558412,2024-03-07 21:59:25.258453,2024-03-07 22:00:20.267250,0 days 00:00:55.008797,6,,COMPLETE,XGB,0.6093427956604714,,,,,,,,,0.12571033348134739,dart,2.532246277984369e-08,6.11268129808236e-06,depthwise,7.024580972051757e-05,forest,0.029238281022325185,weighted,0.0028002179959467285,4,BaselinePreprocessor,RevenueQuantileBucketImputer:3-buckets,ArcSinhTargetScaler
31,31,0.11345534395490572,2024-03-07 22:00:20.270778,2024-03-07 22:00:43.828932,0 days 00:00:23.558154,1,,COMPLETE,XGB,0.6093427956604714,,,,,,,,,8.644180191019391e-08,dart,1.2373328181661801e-08,0.0036537669651464646,lossguide,0.02271068020258448,forest,3.2598833340421154e-08,weighted,0.027763443600611257,4,BaselinePreprocessor,RevenueQuantileBucketImputer:3-buckets,ArcSinhTargetScaler
32,32,0.6093427956604714,2024-03-07 22:00:43.829968,2024-03-07 22:01:22.922564,0 days 00:00:39.092596,5,,COMPLETE,XGB,0.6093427956604714,,,,,,,,,1.7051846145320923e-08,dart,0.20814384386878254,1.5500180711929962e-05,depthwise,0.00025717226913349355,forest,0.1367057640602412,weighted,0.00013235216056481602,4,BaselinePreprocessor,RevenueQuantileBucketImputer:3-buckets,ArcSinhTargetScaler
33,33,0.46466950053266964,2024-03-07 22:01:22.924239,2024-03-07 22:01:46.927339,0 days 00:00:24.003100,1,,COMPLETE,XGB,0.6093427956604714,,,,,,,,,0.04327078617794225,dart,9.409178619231146e-07,0.0035554591160552045,depthwise,0.004622710452953739,tree,1.7332067906792693e-07,weighted,0.007068895984063956,4,BaselinePreprocessor,RevenueQuantileBucketImputer:3-buckets,ArcSinhTargetScaler
34,34,0.5405067387913475,2024-03-07 22:01:46.928311,2024-03-07 22:02:27.667518,0 days 00:00:40.739207,4,,COMPLETE,XGB,0.6093427956604714,,,,,,,,,0.004162452965529321,dart,2.244181780276306e-06,0.001146843568177872,depthwise,0.001338554576583922,forest,0.006227541234818243,uniform,5.2289535777306136e-08,4,BaselinePreprocessor,RevenueQuantileBucketImputer:3-buckets,ArcSinhTargetScaler
35,35,0.5274281246118747,2024-03-07 22:02:27.668698,2024-03-07 22:02:54.765871,0 days 00:00:27.097173,2,,COMPLETE,XGB,0.6093427956604714,,,,,,,,,0.07872564560109853,dart,0.0019130804257083249,0.19482892822268782,depthwise,0.04855566986710573,tree,0.001923718187981294,weighted,1.3293777403349242e-07,4,BaselinePreprocessor,RevenueQuantileBucketImputer:3-buckets,ArcSinhTargetScaler
36,36,0.5672554835119172,2024-03-07 22:02:54.767487,2024-03-07 22:03:30.573595,0 days 00:00:35.806108,3,,COMPLETE,XGB,0.6093427956604714,,,,,,,,,6.84941728134164e-05,dart,0.0173441355691612,0.055406477231572666,lossguide,2.8259630598589732e-05,forest,0.02725061049568724,weighted,1.0649553589433493e-06,4,BaselinePreprocessor,RevenueQuantileBucketImputer:3-buckets,ArcSinhTargetScaler
37,37,0.5792277505229559,2024-03-07 22:03:30.575567,2024-03-07 22:04:23.860727,0 days 00:00:53.285160,6,,COMPLETE,XGB,0.6093427956604714,,,,,,,,,1.4009668220221785e-05,dart,0.009196768916968018,4.032672857798855e-07,depthwise,1.758827733023975e-08,tree,1.1640465681658674e-08,uniform,1.8033175190490628e-06,4,BaselinePreprocessor,RevenueQuantileBucketImputer:3-buckets,ArcSinhTargetScaler
38,38,0.5542216819849208,2024-03-07 22:04:23.863517,2024-03-07 22:05:05.825194,0 days 00:00:41.961677,5,,COMPLETE,XGB,0.6093427956604714,,,,,,,,,4.116549793453131e-05,dart,0.00036609801998888493,0.001292232933849238,depthwise,0.0004880371160181825,tree,0.0012812706496450334,uniform,2.9524584128891067e-05,4,BaselinePreprocessor,RevenueQuantileBucketImputer:3-buckets,ArcSinhTargetScaler
39,39,0.5416152381639798,2024-03-07 22:05:05.826759,2024-03-07 22:05:59.596369,0 days 00:00:53.769610,7,,COMPLETE,XGB,0.6093427956604714,,,,,,,,,7.665531856656172e-05,dart,0.0013367714187038832,0.00027290785723101547,lossguide,8.670304362155463e-07,tree,1.0633007265148333e-05,uniform,6.031795552492278e-08,4,BaselinePreprocessor,RevenueQuantileBucketImputer:3-buckets,ArcSinhTargetScaler
0,0,0.3412986110163092,2024-03-07 22:07:17.683742,2024-03-07 22:07:29.520812,0 days 00:00:11.837070,3,1300.0,COMPLETE,RandomForest,0.6209955491997573,,,,,,,,,,,,,,,,,,,5,BaselinePreprocessor,RevenueQuantileBucketImputer:3-buckets,DummyTargetScaler
1,1,0.6091697758519403,2024-03-07 22:07:29.522342,2024-03-07 22:08:04.870527,0 days 00:00:35.348185,72,1000.0,COMPLETE,RandomForest,0.6209955491997573,,,,,,,,,,,,,,,,,,,5,BaselinePreprocessor,RevenueQuantileBucketImputer:3-buckets,DummyTargetScaler
2,2,0.6209955491997573,2024-03-07 22:08:04.872603,2024-03-07 22:08:34.631635,0 days 00:00:29.759032,60,1100.0,COMPLETE,RandomForest,0.6209955491997573,,,,,,,,,,,,,,,,,,,5,BaselinePreprocessor,RevenueQuantileBucketImputer:3-buckets,DummyTargetScaler
3,3,0.35752500331228626,2024-03-07 22:08:34.632254,2024-03-07 22:08:43.293641,0 days 00:00:08.661387,3,1000.0,COMPLETE,RandomForest,0.6209955491997573,,,,,,,,,,,,,,,,,,,5,BaselinePreprocessor,RevenueQuantileBucketImputer:3-buckets,DummyTargetScaler
4,4,0.5909883900343793,2024-03-07 22:08:43.294301,2024-03-07 22:08:54.145637,0 days 00:00:10.851336,66,400.0,COMPLETE,RandomForest,0.6209955491997573,,,,,,,,,,,,,,,,,,,5,BaselinePreprocessor,RevenueQuantileBucketImputer:3-buckets,DummyTargetScaler
5,5,0.6021875950893345,2024-03-07 22:08:54.146266,2024-03-07 22:09:03.005140,0 days 00:00:08.858874,57,300.0,COMPLETE,RandomForest,0.6209955491997573,,,,,,,,,,,,,,,,,,,5,BaselinePreprocessor,RevenueQuantileBucketImputer:3-buckets,DummyTargetScaler
6,6,0.6076435073302757,2024-03-07 22:09:03.006036,2024-03-07 22:09:32.138691,0 days 00:00:29.132655,96,1100.0,COMPLETE,RandomForest,0.6209955491997573,,,,,,,,,,,,,,,,,,,5,BaselinePreprocessor,RevenueQuantileBucketImputer:3-buckets,DummyTargetScaler
7,7,0.5998603400424853,2024-03-07 22:09:32.139333,2024-03-07 22:09:34.897363,0 days 00:00:02.758030,51,100.0,COMPLETE,RandomForest,0.6209955491997573,,,,,,,,,,,,,,,,,,,5,BaselinePreprocessor,RevenueQuantileBucketImputer:3-buckets,DummyTargetScaler
8,8,0.6023876824806608,2024-03-07 22:09:34.898105,2024-03-07 22:10:22.888081,0 days 00:00:47.989976,69,1500.0,COMPLETE,RandomForest,0.6209955491997573,,,,,,,,,,,,,,,,,,,5,BaselinePreprocessor,RevenueQuantileBucketImputer:3-buckets,DummyTargetScaler
9,9,0.5969369177875194,2024-03-07 22:10:22.889721,2024-03-07 22:10:43.727509,0 days 00:00:20.837788,99,700.0,COMPLETE,RandomForest,0.6209955491997573,,,,,,,,,,,,,,,,,,,5,BaselinePreprocessor,RevenueQuantileBucketImputer:3-buckets,DummyTargetScaler
10,10,0.5960861327961592,2024-03-07 22:10:43.728278,2024-03-07 22:11:16.780581,0 days 00:00:33.052303,81,1100.0,COMPLETE,RandomForest,0.6209955491997573,,,,,,,,,,,,,,,,,,,5,BaselinePreprocessor,RevenueQuantileBucketImputer:3-buckets,DummyTargetScaler
11,11,0.6051560847517168,2024-03-07 22:11:16.781351,2024-03-07 22:11:49.068032,0 days 00:00:32.286681,90,1100.0,COMPLETE,RandomForest,0.6209955491997573,,,,,,,,,,,,,,,,,,,5,BaselinePreprocessor,RevenueQuantileBucketImputer:3-buckets,DummyTargetScaler
12,12,0.6023161580698245,2024-03-07 22:11:49.068841,2024-03-07 22:12:18.465359,0 days 00:00:29.396518,27,900.0,COMPLETE,RandomForest,0.6209955491997573,,,,,,,,,,,,,,,,,,,5,BaselinePreprocessor,RevenueQuantileBucketImputer:3-buckets,DummyTargetScaler
13,13,0.5993322502858845,2024-03-07 22:12:18.466274,2024-03-07 22:12:35.196195,0 days 00:00:16.729921,45,500.0,COMPLETE,RandomForest,0.6209955491997573,,,,,,,,,,,,,,,,,,,5,BaselinePreprocessor,RevenueQuantileBucketImputer:3-buckets,DummyTargetScaler
14,14,0.6091978070179538,2024-03-07 22:12:35.197150,2024-03-07 22:12:44.566501,0 days 00:00:09.369351,90,300.0,COMPLETE,RandomForest,0.6209955491997573,,,,,,,,,,,,,,,,,,,5,BaselinePreprocessor,RevenueQuantileBucketImputer:3-buckets,DummyTargetScaler
15,15,0.604718424996624,2024-03-07 22:12:44.567354,2024-03-07 22:13:23.919655,0 days 00:00:39.352301,87,1200.0,COMPLETE,RandomForest,0.6209955491997573,,,,,,,,,,,,,,,,,,,5,BaselinePreprocessor,RevenueQuantileBucketImputer:3-buckets,DummyTargetScaler
16,16,0.6006161899728747,2024-03-07 22:13:23.920522,2024-03-07 22:13:53.080190,0 days 00:00:29.159668,18,900.0,COMPLETE,RandomForest,0.6209955491997573,,,,,,,,,,,,,,,,,,,5,BaselinePreprocessor,RevenueQuantileBucketImputer:3-buckets,DummyTargetScaler
17,17,0.6024738002142346,2024-03-07 22:13:53.080996,2024-03-07 22:14:08.635157,0 days 00:00:15.554161,24,500.0,COMPLETE,RandomForest,0.6209955491997573,,,,,,,,,,,,,,,,,,,5,BaselinePreprocessor,RevenueQuantileBucketImputer:3-buckets,DummyTargetScaler
