,number,value,datetime_start,datetime_complete,duration,params_max_depth,params_n_estimators,state,model,best_value,params_bagging_fraction,params_bagging_freq,params_feature_fraction,params_lambda_l1,params_lambda_l2,params_learning_rate,params_min_child_samples,params_num_leaves,params_alpha,params_booster,params_eta,params_gamma,params_grow_policy,params_lambda,params_normalize_type,params_rate_drop,params_sample_type,params_skip_drop,config_id,preprocessor,imputer,target_scaler
1,1,0.6668422566345664,2024-03-08 10:06:42.348450,2024-03-08 10:06:57.136684,0 days 00:00:14.788234,75,210.0,COMPLETE,LGBM,0.6896382851305164,0.8274471816941416,7.0,0.7476791292318974,4.636391991924513e-08,0.5887998246975513,0.18105182135411405,13.0,20.0,,,,,,,,,,,15,IIDPreprocessor,HybridCategoricalStatisticsImputer,LogTargetScaler
2,2,0.6614765175329103,2024-03-08 10:06:57.137851,2024-03-08 10:07:03.787371,0 days 00:00:06.649520,42,210.0,COMPLETE,LGBM,0.6896382851305164,0.44298878449762213,7.0,0.8961254230639029,3.57787735092979,1.0957204410949134e-07,0.0255541160944904,39.0,137.0,,,,,,,,,,,15,IIDPreprocessor,HybridCategoricalStatisticsImputer,LogTargetScaler
3,3,0.6774234603925845,2024-03-08 10:07:03.788581,2024-03-08 10:07:24.775882,0 days 00:00:20.987301,3,1410.0,COMPLETE,LGBM,0.6896382851305164,0.984417514262703,6.0,0.4889960786616108,7.702835438253699e-08,0.07899208640556112,0.10460379493319603,88.0,192.0,,,,,,,,,,,15,IIDPreprocessor,HybridCategoricalStatisticsImputer,LogTargetScaler
4,4,0.626324904110419,2024-03-08 10:07:24.777395,2024-03-08 10:07:25.145773,0 days 00:00:00.368378,75,10.0,COMPLETE,LGBM,0.6896382851305164,0.4962952528883274,4.0,0.7015796451845602,0.010806295454033511,4.6977893635302145e-06,0.010323735743591822,87.0,156.0,,,,,,,,,,,15,IIDPreprocessor,HybridCategoricalStatisticsImputer,LogTargetScaler
5,5,0.6896382851305164,2024-03-08 10:07:25.147231,2024-03-08 10:07:48.470250,0 days 00:00:23.323019,12,310.0,COMPLETE,LGBM,0.6896382851305164,0.7480241888305525,2.0,0.7528219607689914,0.0004925192885576252,4.616326637668083e-07,0.09409190516439574,15.0,31.0,,,,,,,,,,,15,IIDPreprocessor,HybridCategoricalStatisticsImputer,LogTargetScaler
6,6,0.6699058103578348,2024-03-08 10:07:48.472215,2024-03-08 10:09:11.736311,0 days 00:01:23.264096,30,1310.0,COMPLETE,LGBM,0.6896382851305164,0.6437857259442034,7.0,0.7901173152878552,1.0719090807475902e-08,0.00033907584000037215,0.013449439879745274,59.0,179.0,,,,,,,,,,,15,IIDPreprocessor,HybridCategoricalStatisticsImputer,LogTargetScaler
7,7,0.640333889843749,2024-03-08 10:09:11.738012,2024-03-08 10:09:19.294204,0 days 00:00:07.556192,33,610.0,COMPLETE,LGBM,0.6896382851305164,0.6098414945573197,3.0,0.7122271813977966,1.2418745932395223,0.02308467601443849,0.2267077295189546,95.0,213.0,,,,,,,,,,,15,IIDPreprocessor,HybridCategoricalStatisticsImputer,LogTargetScaler
8,8,0.6676406199518878,2024-03-08 10:09:19.295575,2024-03-08 10:09:37.431657,0 days 00:00:18.136082,3,1210.0,COMPLETE,LGBM,0.6896382851305164,0.7312854171190155,1.0,0.46959337852709626,0.0009160480150966308,1.7649722409524989e-06,0.017197128115823072,54.0,59.0,,,,,,,,,,,15,IIDPreprocessor,HybridCategoricalStatisticsImputer,LogTargetScaler
9,9,0.6697385633745173,2024-03-08 10:09:37.433293,2024-03-08 10:10:24.375526,0 days 00:00:46.942233,18,910.0,COMPLETE,LGBM,0.6896382851305164,0.5869623654241553,6.0,0.7325398436846281,8.312546200093458e-05,2.5704571377676716e-05,0.020146866227098822,65.0,92.0,,,,,,,,,,,15,IIDPreprocessor,HybridCategoricalStatisticsImputer,LogTargetScaler
10,10,0.6670378557262835,2024-03-08 10:10:24.377035,2024-03-08 10:10:50.901106,0 days 00:00:26.524071,33,1210.0,COMPLETE,LGBM,0.6896382851305164,0.43495329138959044,5.0,0.6960272393898596,0.22274367908355489,1.1636531218999124e-07,0.05091706138724985,43.0,234.0,,,,,,,,,,,15,IIDPreprocessor,HybridCategoricalStatisticsImputer,LogTargetScaler
11,11,0.650846764459697,2024-03-08 10:10:50.902530,2024-03-08 10:10:56.254471,0 days 00:00:05.351941,72,610.0,COMPLETE,LGBM,0.6896382851305164,0.42809380269063957,2.0,0.7644658730459418,6.479451143481854,0.0005630240900700048,0.19138497150786937,24.0,175.0,,,,,,,,,,,15,IIDPreprocessor,HybridCategoricalStatisticsImputer,LogTargetScaler
12,12,0.6729192021677889,2024-03-08 10:10:56.255925,2024-03-08 10:11:28.634142,0 days 00:00:32.378217,27,310.0,COMPLETE,LGBM,0.6896382851305164,0.7891201749731329,1.0,0.8533038272705626,0.0007657360279867434,7.816720809167126,0.14633163569692306,11.0,176.0,,,,,,,,,,,15,IIDPreprocessor,HybridCategoricalStatisticsImputer,LogTargetScaler
13,13,0.6623153707589379,2024-03-08 10:11:28.635524,2024-03-08 10:11:38.828692,0 days 00:00:10.193168,81,110.0,COMPLETE,LGBM,0.6896382851305164,0.9132731692451805,7.0,0.8764875578966398,1.7025521838726872e-08,1.5029245917681536e-06,0.07870113155367749,70.0,53.0,,,,,,,,,,,15,IIDPreprocessor,HybridCategoricalStatisticsImputer,LogTargetScaler
14,14,0.6743327246484516,2024-03-08 10:11:38.830114,2024-03-08 10:12:00.830479,0 days 00:00:22.000365,93,810.0,COMPLETE,LGBM,0.6896382851305164,0.81461573458085,1.0,0.5000454792968912,0.09192266996069223,2.036701897774289e-08,0.050596895643071536,74.0,14.0,,,,,,,,,,,15,IIDPreprocessor,HybridCategoricalStatisticsImputer,LogTargetScaler
15,15,0.6637408380552261,2024-03-08 10:12:00.832407,2024-03-08 10:12:34.521090,0 days 00:00:33.688683,63,1310.0,COMPLETE,LGBM,0.6896382851305164,0.42239200241237673,1.0,0.750041026755484,2.3669157335960642e-08,4.08347319500765,0.08295066537073814,53.0,246.0,,,,,,,,,,,15,IIDPreprocessor,HybridCategoricalStatisticsImputer,LogTargetScaler
16,16,0.6533852658353951,2024-03-08 10:12:34.522437,2024-03-08 10:12:43.067887,0 days 00:00:08.545450,27,210.0,COMPLETE,LGBM,0.6896382851305164,0.902130757831913,4.0,0.8777743499171968,4.391520071242652,2.8890667486909647e-06,0.022194307228359696,57.0,34.0,,,,,,,,,,,15,IIDPreprocessor,HybridCategoricalStatisticsImputer,LogTargetScaler
17,17,0.6722190009645768,2024-03-08 10:12:43.069469,2024-03-08 10:12:50.846208,0 days 00:00:07.776739,3,310.0,COMPLETE,LGBM,0.6896382851305164,0.6426613995371986,4.0,0.8073245188551373,1.6385372775260971e-06,1.9192722850410113e-07,0.047152134174214023,22.0,226.0,,,,,,,,,,,15,IIDPreprocessor,HybridCategoricalStatisticsImputer,LogTargetScaler
18,18,0.6772901851474133,2024-03-08 10:12:50.847581,2024-03-08 10:13:37.172554,0 days 00:00:46.324973,24,1410.0,COMPLETE,LGBM,0.6896382851305164,0.7440818639948166,6.0,0.5998831838923651,3.369764907827613e-05,0.06026983296549044,0.06334085868905803,85.0,182.0,,,,,,,,,,,15,IIDPreprocessor,HybridCategoricalStatisticsImputer,LogTargetScaler
19,19,0.672896372793113,2024-03-08 10:13:37.173837,2024-03-08 10:13:47.928057,0 days 00:00:10.754220,51,110.0,COMPLETE,LGBM,0.6896382851305164,0.9708462249309929,7.0,0.9800262703486311,1.553412068757476e-05,0.0020672693430082174,0.16139409494178378,67.0,185.0,,,,,,,,,,,15,IIDPreprocessor,HybridCategoricalStatisticsImputer,LogTargetScaler
20,20,0.6712194881197013,2024-03-08 10:13:47.929460,2024-03-08 10:13:57.722646,0 days 00:00:09.793186,39,210.0,COMPLETE,LGBM,0.6896382851305164,0.9288375154159701,7.0,0.6015464458530888,1.1842437691687953e-05,0.022809926571429693,0.2615603925535903,54.0,138.0,,,,,,,,,,,15,IIDPreprocessor,HybridCategoricalStatisticsImputer,LogTargetScaler
21,21,0.6583453806528007,2024-03-08 10:13:57.724659,2024-03-08 10:13:58.804047,0 days 00:00:01.079388,42,10.0,COMPLETE,LGBM,0.6896382851305164,0.8375744459905965,1.0,0.7846028795542168,7.187025883560612e-08,1.2120727760835818e-05,0.0355594823877058,37.0,172.0,,,,,,,,,,,15,IIDPreprocessor,HybridCategoricalStatisticsImputer,LogTargetScaler
22,22,0.6720992885338785,2024-03-08 10:13:58.805038,2024-03-08 10:14:29.000947,0 days 00:00:30.195909,42,1410.0,COMPLETE,LGBM,0.6896382851305164,0.4924823712739913,7.0,0.4645504763169159,5.0418510635758054e-05,1.5051062437889812e-06,0.01906458388792346,99.0,225.0,,,,,,,,,,,15,IIDPreprocessor,HybridCategoricalStatisticsImputer,LogTargetScaler
23,23,0.6702647771429877,2024-03-08 10:14:29.002102,2024-03-08 10:15:05.603019,0 days 00:00:36.600917,60,1310.0,COMPLETE,LGBM,0.6896382851305164,0.9988558131111114,3.0,0.4624904993989368,0.38653781116420743,1.2971311090406634e-07,0.01880588772147934,24.0,137.0,,,,,,,,,,,15,IIDPreprocessor,HybridCategoricalStatisticsImputer,LogTargetScaler
24,24,0.6689638096035208,2024-03-08 10:15:05.628054,2024-03-08 10:15:16.725193,0 days 00:00:11.097139,12,810.0,COMPLETE,LGBM,0.6896382851305164,0.5976493134882773,4.0,0.7546342996600459,1.7678494125453863,4.075366806283143,0.2678820799787074,11.0,122.0,,,,,,,,,,,15,IIDPreprocessor,HybridCategoricalStatisticsImputer,LogTargetScaler
25,25,0.6705688317893487,2024-03-08 10:15:16.726508,2024-03-08 10:15:40.035192,0 days 00:00:23.308684,15,610.0,COMPLETE,LGBM,0.6896382851305164,0.8585976422955759,6.0,0.645309414607602,2.113947771656777,0.0022334846670034277,0.018354414544957214,36.0,240.0,,,,,,,,,,,15,IIDPreprocessor,HybridCategoricalStatisticsImputer,LogTargetScaler
26,26,0.6740710979629577,2024-03-08 10:15:40.036471,2024-03-08 10:16:08.508659,0 days 00:00:28.472188,21,610.0,COMPLETE,LGBM,0.6896382851305164,0.9668155745073747,5.0,0.95043418717557,2.504444639226662e-08,0.00861896291724476,0.18983651964115858,9.0,28.0,,,,,,,,,,,15,IIDPreprocessor,HybridCategoricalStatisticsImputer,LogTargetScaler
27,27,0.6755617288072769,2024-03-08 10:16:08.509825,2024-03-08 10:16:14.130843,0 days 00:00:05.621018,6,110.0,COMPLETE,LGBM,0.6896382851305164,0.5556817724908809,1.0,0.9532049863501744,0.08761216687223036,1.4195335216440212e-05,0.12469263821243672,40.0,36.0,,,,,,,,,,,15,IIDPreprocessor,HybridCategoricalStatisticsImputer,LogTargetScaler
28,28,0.07405956763390226,2024-03-08 10:16:14.132668,2024-03-08 10:16:29.024327,0 days 00:00:14.891659,63,1010.0,COMPLETE,LGBM,0.6896382851305164,0.5860496146045738,6.0,0.7054261257583374,2.8727285057746665e-05,0.0004561815974483973,0.170612160799922,31.0,199.0,,,,,,,,,,,15,IIDPreprocessor,HybridCategoricalStatisticsImputer,LogTargetScaler
29,29,0.6682980215899477,2024-03-08 10:16:29.025388,2024-03-08 10:16:35.944521,0 days 00:00:06.919133,3,510.0,COMPLETE,LGBM,0.6896382851305164,0.9099282885989004,5.0,0.4066607918626397,0.4495091005916899,0.0017092308342435865,0.03914022955452012,94.0,176.0,,,,,,,,,,,15,IIDPreprocessor,HybridCategoricalStatisticsImputer,LogTargetScaler
30,30,0.6736651336803283,2024-03-08 10:16:35.960895,2024-03-08 10:19:02.444788,0 days 00:02:26.483893,12,1310.0,COMPLETE,LGBM,0.6896382851305164,0.9049324363669863,5.0,0.9373475283326623,0.0003981330978091836,7.576760235870253e-05,0.01908643856839263,12.0,63.0,,,,,,,,,,,15,IIDPreprocessor,HybridCategoricalStatisticsImputer,LogTargetScaler
31,31,0.6630480630642908,2024-03-08 10:19:02.447963,2024-03-08 10:19:32.628624,0 days 00:00:30.180661,96,610.0,COMPLETE,LGBM,0.6896382851305164,0.8293461269580265,1.0,0.7972253287486095,0.00196856116901634,2.6152536433795917e-08,0.013181149488027162,100.0,75.0,,,,,,,,,,,15,IIDPreprocessor,HybridCategoricalStatisticsImputer,LogTargetScaler
32,32,0.1602734527618886,2024-03-08 10:19:32.629855,2024-03-08 10:19:51.416303,0 days 00:00:18.786448,21,1210.0,COMPLETE,LGBM,0.6896382851305164,0.623001917756835,5.0,0.8925524978080703,2.1694388085323778e-07,1.0616393079872297e-07,0.19661015159944906,5.0,164.0,,,,,,,,,,,15,IIDPreprocessor,HybridCategoricalStatisticsImputer,LogTargetScaler
33,33,0.6460110300277897,2024-03-08 10:19:51.417421,2024-03-08 10:20:10.213699,0 days 00:00:18.796278,96,1210.0,COMPLETE,LGBM,0.6896382851305164,0.44790747378804746,4.0,0.9762990047905814,0.12872172703634235,6.03842869792386e-08,0.20750775708719663,88.0,151.0,,,,,,,,,,,15,IIDPreprocessor,HybridCategoricalStatisticsImputer,LogTargetScaler
34,34,0.6740001450435659,2024-03-08 10:20:10.215301,2024-03-08 10:20:24.996861,0 days 00:00:14.781560,33,910.0,COMPLETE,LGBM,0.6896382851305164,0.8526018146675162,2.0,0.7252149291314978,1.4979995985678258e-05,3.8391285520244176e-07,0.2477446614153551,91.0,76.0,,,,,,,,,,,15,IIDPreprocessor,HybridCategoricalStatisticsImputer,LogTargetScaler
35,35,0.6717585208508092,2024-03-08 10:20:24.998076,2024-03-08 10:20:57.937852,0 days 00:00:32.939776,15,710.0,COMPLETE,LGBM,0.6896382851305164,0.4502105492540005,3.0,0.8845358923790441,3.5415408995025056e-08,0.0002175102633731762,0.03531192049274478,62.0,244.0,,,,,,,,,,,15,IIDPreprocessor,HybridCategoricalStatisticsImputer,LogTargetScaler
36,36,0.675071808512639,2024-03-08 10:20:57.939087,2024-03-08 10:23:10.437687,0 days 00:02:12.498600,96,610.0,COMPLETE,LGBM,0.6896382851305164,0.9583656596466572,5.0,0.8467150837562966,3.443539778694659e-06,1.7996892787411936e-05,0.010103599561876184,16.0,189.0,,,,,,,,,,,15,IIDPreprocessor,HybridCategoricalStatisticsImputer,LogTargetScaler
37,37,0.6508255924277888,2024-03-08 10:23:10.439554,2024-03-08 10:23:15.010816,0 days 00:00:04.571262,63,110.0,COMPLETE,LGBM,0.6896382851305164,0.624456307167877,5.0,0.541724496382284,0.0012629652190928192,0.012182004477943011,0.018430711642220685,62.0,226.0,,,,,,,,,,,15,IIDPreprocessor,HybridCategoricalStatisticsImputer,LogTargetScaler
38,38,0.6708568215754056,2024-03-08 10:23:15.012051,2024-03-08 10:23:41.566432,0 days 00:00:26.554381,48,910.0,COMPLETE,LGBM,0.6896382851305164,0.9934997341475714,6.0,0.7271543200930537,1.7963443177538548e-08,5.039325171099845e-08,0.2175872359061231,35.0,201.0,,,,,,,,,,,15,IIDPreprocessor,HybridCategoricalStatisticsImputer,LogTargetScaler
39,39,0.6350398235671811,2024-03-08 10:23:41.568189,2024-03-08 10:23:42.055013,0 days 00:00:00.486824,87,10.0,COMPLETE,LGBM,0.6896382851305164,0.8950811700327663,2.0,0.6338177030605238,1.5119154342940937,2.423905873800916e-07,0.05412299766349355,54.0,72.0,,,,,,,,,,,15,IIDPreprocessor,HybridCategoricalStatisticsImputer,LogTargetScaler
0,0,0.6297516245040866,2024-03-08 10:24:10.597318,2024-03-08 10:24:50.496137,0 days 00:00:39.898819,4,,COMPLETE,XGB,0.6661728906082024,,,,,,,,,0.0006921919101520857,dart,7.541735294789611e-06,0.14411236037360198,depthwise,4.846432703213564e-05,forest,2.1922683942188045e-05,weighted,1.5130681493347785e-08,15,IIDPreprocessor,HybridCategoricalStatisticsImputer,LogTargetScaler
1,1,0.6110842850172644,2024-03-08 10:24:50.497888,2024-03-08 10:25:42.204859,0 days 00:00:51.706971,5,,COMPLETE,XGB,0.6661728906082024,,,,,,,,,0.04402346975159891,dart,3.132922233917868e-07,7.752449087182607e-06,lossguide,0.5108546857785634,forest,0.018332684302940633,weighted,5.611857506087915e-08,15,IIDPreprocessor,HybridCategoricalStatisticsImputer,LogTargetScaler
2,2,0.6247987323670822,2024-03-08 10:25:42.206223,2024-03-08 10:26:32.493521,0 days 00:00:50.287298,5,,COMPLETE,XGB,0.6661728906082024,,,,,,,,,0.0039287877367371144,dart,0.006083164818992551,0.005627282412032571,lossguide,0.0012116426313671,tree,0.07471564341790765,weighted,1.4431871517251746e-06,15,IIDPreprocessor,HybridCategoricalStatisticsImputer,LogTargetScaler
3,3,0.60854753603422,2024-03-08 10:26:32.497943,2024-03-08 10:27:01.681344,0 days 00:00:29.183401,2,,COMPLETE,XGB,0.6661728906082024,,,,,,,,,3.176009697518793e-07,dart,0.00033041135342217316,0.02427870051494692,lossguide,2.512871988523201e-06,tree,0.00025371880826335647,uniform,1.9158559422868055e-08,15,IIDPreprocessor,HybridCategoricalStatisticsImputer,LogTargetScaler
4,4,0.6330701111901733,2024-03-08 10:27:01.682698,2024-03-08 10:27:29.860923,0 days 00:00:28.178225,2,,COMPLETE,XGB,0.6661728906082024,,,,,,,,,0.00784437131925058,dart,0.9654991455191069,0.038457169108233616,lossguide,0.002538573741730026,tree,0.02437567519489996,uniform,1.9194198916144538e-07,15,IIDPreprocessor,HybridCategoricalStatisticsImputer,LogTargetScaler
5,5,0.6208521905608527,2024-03-08 10:27:29.862538,2024-03-08 10:28:19.887888,0 days 00:00:50.025350,6,,COMPLETE,XGB,0.6661728906082024,,,,,,,,,0.0005749473621341788,dart,7.295856352156034e-06,0.001973993280000234,lossguide,0.8853331751273767,forest,0.0019155956131514966,uniform,0.002502946240808883,15,IIDPreprocessor,HybridCategoricalStatisticsImputer,LogTargetScaler
6,6,0.6661728906082024,2024-03-08 10:28:19.889457,2024-03-08 10:28:54.048296,0 days 00:00:34.158839,3,,COMPLETE,XGB,0.6661728906082024,,,,,,,,,2.3349312807995744e-06,dart,0.33371182270275207,0.1924699889053948,depthwise,0.7817313402420422,forest,4.215543457794547e-05,uniform,1.7342134787698236e-05,15,IIDPreprocessor,HybridCategoricalStatisticsImputer,LogTargetScaler
7,7,0.6276103289109404,2024-03-08 10:28:54.049636,2024-03-08 10:29:38.173055,0 days 00:00:44.123419,4,,COMPLETE,XGB,0.6661728906082024,,,,,,,,,0.0530781505476026,dart,3.278831608338663e-06,0.0018161732075233838,lossguide,0.23754095836619546,tree,2.1950664559237037e-08,uniform,1.3385151235126213e-05,15,IIDPreprocessor,HybridCategoricalStatisticsImputer,LogTargetScaler
8,8,0.6557082785394316,2024-03-08 10:29:38.174560,2024-03-08 10:30:36.798724,0 days 00:00:58.624164,7,,COMPLETE,XGB,0.6661728906082024,,,,,,,,,1.7616872968859526e-08,dart,0.1863770865020434,0.24722015937991376,lossguide,1.107266065137388e-08,forest,0.003856129865016828,uniform,7.41510453055257e-05,15,IIDPreprocessor,HybridCategoricalStatisticsImputer,LogTargetScaler
9,9,0.5299431674631284,2024-03-08 10:30:36.800412,2024-03-08 10:31:47.614564,0 days 00:01:10.814152,8,,COMPLETE,XGB,0.6661728906082024,,,,,,,,,9.466037009686196e-06,dart,1.1289283376729446e-08,0.00104797018873226,lossguide,3.063451453133204e-07,forest,8.059786081704661e-06,uniform,5.849338483208861e-06,15,IIDPreprocessor,HybridCategoricalStatisticsImputer,LogTargetScaler
10,10,0.5663735838668318,2024-03-08 10:31:47.618595,2024-03-08 10:32:32.041669,0 days 00:00:44.423074,4,,COMPLETE,XGB,0.6661728906082024,,,,,,,,,3.230594604242637e-05,dart,1.2626665007315347e-08,2.3102245944077888e-06,lossguide,0.09049879555789454,tree,0.0028124711159935698,uniform,0.0007790733012932698,15,IIDPreprocessor,HybridCategoricalStatisticsImputer,LogTargetScaler
11,11,0.6480878065267047,2024-03-08 10:32:32.043233,2024-03-08 10:33:13.258916,0 days 00:00:41.215683,3,,COMPLETE,XGB,0.6661728906082024,,,,,,,,,2.2929698685251597e-08,dart,0.00396372712667097,4.488725906488747e-06,depthwise,0.22607054672497517,forest,2.9205513004699485e-08,weighted,3.0405000948021337e-07,15,IIDPreprocessor,HybridCategoricalStatisticsImputer,LogTargetScaler
12,12,0.6250180171316685,2024-03-08 10:33:13.263187,2024-03-08 10:33:55.896698,0 days 00:00:42.633511,4,,COMPLETE,XGB,0.6661728906082024,,,,,,,,,0.642896536546219,dart,3.365395715959672e-05,2.4835973626956636e-07,lossguide,0.012918403491290982,forest,4.10383054344923e-06,uniform,8.673565146987454e-08,15,IIDPreprocessor,HybridCategoricalStatisticsImputer,LogTargetScaler
13,13,0.6165165372157743,2024-03-08 10:33:55.898706,2024-03-08 10:34:52.275682,0 days 00:00:56.376976,6,,COMPLETE,XGB,0.6661728906082024,,,,,,,,,0.28988652305338725,dart,1.6138052963071113e-06,0.04809944225145431,depthwise,2.197206167538631e-08,tree,8.040682568239668e-08,uniform,3.907351718824857e-08,15,IIDPreprocessor,HybridCategoricalStatisticsImputer,LogTargetScaler
14,14,0.6658837206260493,2024-03-08 10:34:52.277371,2024-03-08 10:35:42.723163,0 days 00:00:50.445792,5,,COMPLETE,XGB,0.6661728906082024,,,,,,,,,1.2961183677786664e-08,dart,0.4189079077650768,0.2971914831535915,depthwise,0.029840574737003727,forest,0.00021018906663860287,weighted,0.6853650378173799,15,IIDPreprocessor,HybridCategoricalStatisticsImputer,LogTargetScaler
15,15,0.6098041643655253,2024-03-08 10:35:42.727261,2024-03-08 10:36:34.476742,0 days 00:00:51.749481,6,,COMPLETE,XGB,0.6661728906082024,,,,,,,,,0.2582374431379327,dart,6.396938068160946e-08,5.0421460250406525e-06,lossguide,2.9900944714490053e-07,forest,6.5082866559078546e-06,weighted,0.00973730217283034,15,IIDPreprocessor,HybridCategoricalStatisticsImputer,LogTargetScaler
16,16,0.5907644292963898,2024-03-08 10:36:34.478683,2024-03-08 10:37:46.103789,0 days 00:01:11.625106,9,,COMPLETE,XGB,0.6661728906082024,,,,,,,,,2.8200856884054094e-05,dart,5.422142575977683e-06,0.003652244929720463,depthwise,1.5407444945082064e-05,forest,9.333670479547162e-06,uniform,9.585008435511525e-06,15,IIDPreprocessor,HybridCategoricalStatisticsImputer,LogTargetScaler
17,17,0.587336202217245,2024-03-08 10:37:46.107499,2024-03-08 10:38:58.526341,0 days 00:01:12.418842,9,,COMPLETE,XGB,0.6661728906082024,,,,,,,,,0.001427144912096571,dart,2.3742031775172473e-05,6.09726722158569e-08,depthwise,2.2341521035866123e-05,tree,1.3934216735080882e-05,weighted,1.0820014418380762e-06,15,IIDPreprocessor,HybridCategoricalStatisticsImputer,LogTargetScaler
18,18,0.6462407973156682,2024-03-08 10:38:58.528186,2024-03-08 10:39:41.310504,0 days 00:00:42.782318,3,,COMPLETE,XGB,0.6661728906082024,,,,,,,,,0.2804599153984659,dart,2.6545870922405183e-07,0.010783977717541407,lossguide,0.008126149406351195,forest,0.018753734755572387,uniform,0.3688371721162948,15,IIDPreprocessor,HybridCategoricalStatisticsImputer,LogTargetScaler
19,19,0.6089362329927676,2024-03-08 10:39:41.315271,2024-03-08 10:40:35.342959,0 days 00:00:54.027688,7,,COMPLETE,XGB,0.6661728906082024,,,,,,,,,9.38331801806915e-06,dart,2.330179115006371e-05,0.038354883407533756,lossguide,0.0013760085922355355,tree,0.39262251678962257,weighted,0.0020487925274771507,15,IIDPreprocessor,HybridCategoricalStatisticsImputer,LogTargetScaler
20,20,0.6490405397156053,2024-03-08 10:40:35.344069,2024-03-08 10:41:36.843111,0 days 00:01:01.499042,8,,COMPLETE,XGB,0.6661728906082024,,,,,,,,,0.0008869957283033586,dart,0.02499586648400582,0.09951810150490724,depthwise,0.005002758144136195,tree,2.788628839102452e-08,weighted,0.0010020827902754198,15,IIDPreprocessor,HybridCategoricalStatisticsImputer,LogTargetScaler
21,21,0.6292253714068051,2024-03-08 10:41:36.844600,2024-03-08 10:42:27.582968,0 days 00:00:50.738368,6,,COMPLETE,XGB,0.6661728906082024,,,,,,,,,0.0019966484476835584,dart,2.710247888295703e-06,0.46450388929534075,lossguide,7.664250826214872e-06,tree,0.00014429133775553858,uniform,5.132660793881498e-07,15,IIDPreprocessor,HybridCategoricalStatisticsImputer,LogTargetScaler
